,id,session_labels,title,label,description,live_status,legacy_alias,user_id,created_date,date,updated_date,video_id,video_url,category_id,category_label,doc_id,doc_url,categories,documents
0,234,"[3, 6, 17, 19]",City Council Work Session and Meeting of the URA 01-13-2016,City Council Work Session and Meeting of the URA 01-13-2016,,0,shows/city-council-work-session-and-meeting-ura-01-13-2016,134.0,2016-01-13,2016-01-13,2017-03-20,23MR2A_fSPA,https://www.youtube.com/watch?v=23MR2A_fSPA,20.0,City Council,121.0,https://ompnetwork.s3-us-west-2.amazonaws.com/sites/134/documents/agenda_11.pdf,"[{u'livestream': u'1', u'position': u'-10', u'user_id': u'134', u'id': u'20', u'label': u'City Council'}]","[{u'user_id': u'134', u'type_id': u'1', u'url': u'https://ompnetwork.s3-us-west-2.amazonaws.com/sites/134/documents/agenda_11.pdf', u'storage': u'attachment', u'session_id': u'234', u'label': None, u'file_id': u'191', u'provider': u'generic', u'agenda_provider_agenda_id': None, u'session_title': u'City Council Work Session and Meeting of the URA 01-13-2016', u'type': u'Agenda', u'id': u'121', u'agenda_provider_id': None}, {u'user_id': u'134', u'type_id': u'4', u'url': u'https://ompnetwork.s3-us-west-2.amazonaws.com/sites/134/documents/minutes_20.pdf', u'storage': u'attachment', u'session_id': u'234', u'label': None, u'file_id': u'192', u'provider': u'generic', u'agenda_provider_agenda_id': None, u'session_title': u'City Council Work Session and Meeting of the URA 01-13-2016', u'type': u'Minutes', u'id': u'122', u'agenda_provider_id': None}]"
1,574,"[3, 8, 17]",Planning Commission  10-27-2014,Planning Commission  10-27-2014,,0,shows/planning-commission-10-27-2014,134.0,2014-10-27,2014-10-27,2017-03-20,N1MQnm-E0NM,https://www.youtube.com/watch?v=N1MQnm-E0NM,22.0,Planning Commission,724.0,https://ompnetwork.s3-us-west-2.amazonaws.com/sites/134/documents/agenda_packet_104_0.pdf,"[{u'livestream': u'1', u'position': u'-9', u'user_id': u'134', u'id': u'22', u'label': u'Planning Commission'}]","[{u'user_id': u'134', u'type_id': u'1', u'url': u'https://ompnetwork.s3-us-west-2.amazonaws.com/sites/134/documents/agenda_packet_104_0.pdf', u'storage': u'attachment', u'session_id': u'574', u'label': None, u'file_id': u'795', u'provider': u'generic', u'agenda_provider_agenda_id': None, u'session_title': u'Planning Commission  10-27-2014', u'type': u'Agenda', u'id': u'724', u'agenda_provider_id': None}]"
2,281,"[12, 18]",City Council Work Session 05-20-2015,City Council Work Session 05-20-2015,,0,shows/city-council-work-session-05-20-2015,134.0,2015-05-20,2015-05-20,2017-03-20,IXhaAkI0zes,https://www.youtube.com/watch?v=IXhaAkI0zes,20.0,City Council,209.0,https://ompnetwork.s3-us-west-2.amazonaws.com/sites/134/documents/agenda_packet_99.pdf,"[{u'livestream': u'1', u'position': u'-10', u'user_id': u'134', u'id': u'20', u'label': u'City Council'}]","[{u'user_id': u'134', u'type_id': u'1', u'url': u'https://ompnetwork.s3-us-west-2.amazonaws.com/sites/134/documents/agenda_packet_99.pdf', u'storage': u'attachment', u'session_id': u'281', u'label': None, u'file_id': u'279', u'provider': u'generic', u'agenda_provider_agenda_id': None, u'session_title': u'City Council Work Session 05-20-2015', u'type': u'Agenda', u'id': u'209', u'agenda_provider_id': None}, {u'user_id': u'134', u'type_id': u'4', u'url': u'https://ompnetwork.s3-us-west-2.amazonaws.com/sites/134/documents/minutes_63.pdf', u'storage': u'attachment', u'session_id': u'281', u'label': None, u'file_id': u'280', u'provider': u'generic', u'agenda_provider_agenda_id': None, u'session_title': u'City Council Work Session 05-20-2015', u'type': u'Minutes', u'id': u'210', u'agenda_provider_id': None}]"
3,853,"[0, 2, 4, 11, 12, 13, 15, 16, 19]",City Council Meeting 07-12-2010,City Council Meeting 07-12-2010,,0,shows/city-council-meeting-07-12-2010,134.0,2010-07-12,2010-07-12,2017-03-20,y8-gH_759Fk,https://www.youtube.com/watch?v=y8-gH_759Fk,20.0,City Council,1153.0,https://ompnetwork.s3-us-west-2.amazonaws.com/sites/134/documents/agenda_222.pdf,"[{u'livestream': u'1', u'position': u'-10', u'user_id': u'134', u'id': u'20', u'label': u'City Council'}]","[{u'user_id': u'134', u'type_id': u'1', u'url': u'https://ompnetwork.s3-us-west-2.amazonaws.com/sites/134/documents/agenda_222.pdf', u'storage': u'attachment', u'session_id': u'853', u'label': None, u'file_id': u'1224', u'provider': u'generic', u'agenda_provider_agenda_id': None, u'session_title': u'City Council Meeting 07-12-2010', u'type': u'Agenda', u'id': u'1153', u'agenda_provider_id': None}, {u'user_id': u'134', u'type_id': u'4', u'url': u'https://ompnetwork.s3-us-west-2.amazonaws.com/sites/134/documents/minutes_279.pdf', u'storage': u'attachment', u'session_id': u'853', u'label': None, u'file_id': u'1225', u'provider': u'generic', u'agenda_provider_agenda_id': None, u'session_title': u'City Council Meeting 07-12-2010', u'type': u'Minutes', u'id': u'1154', u'agenda_provider_id': None}]"
4,204,"[3, 4, 19]",City Council Work Session 05-23-2016,City Council Work Session 05-23-2016,,0,shows/city-council-work-session-05-23-2016,134.0,2016-05-23,2016-05-23,2017-03-20,WKDH_6A5xYY,https://www.youtube.com/watch?v=WKDH_6A5xYY,20.0,City Council,66.0,https://ompnetwork.s3-us-west-2.amazonaws.com/sites/134/documents/agenda_packet_6_0.pdf,"[{u'livestream': u'1', u'position': u'-10', u'user_id': u'134', u'id': u'20', u'label': u'City Council'}]","[{u'user_id': u'134', u'type_id': u'1', u'url': u'https://ompnetwork.s3-us-west-2.amazonaws.com/sites/134/documents/agenda_packet_6_0.pdf', u'storage': u'attachment', u'session_id': u'204', u'label': None, u'file_id': u'136', u'provider': u'generic', u'agenda_provider_agenda_id': None, u'session_title': u'City Council Work Session 05-23-2016', u'type': u'Agenda', u'id': u'66', u'agenda_provider_id': None}, {u'user_id': u'134', u'type_id': u'4', u'url': u'https://ompnetwork.s3-us-west-2.amazonaws.com/sites/134/documents/minutes_2_0.pdf', u'storage': u'attachment', u'session_id': u'204', u'label': None, u'file_id': u'137', u'provider': u'generic', u'agenda_provider_agenda_id': None, u'session_title': u'City Council Work Session 05-23-2016', u'type': u'Minutes', u'id': u'67', u'agenda_provider_id': None}]"
5,3683,"[2, 12]","Thornton360 - March 1, 2017","Thornton360 - March 1, 2017","<p>Thornton360 is produced by the city of Thornton after each city council meeting, recapping the latest meeting and keeping residents informed about important news, issues and events happening in our community.</p>

<p><a href=""http://www.cityofthornton.tv/"" style=""color: rgb(51, 149, 210);"">www.cityofthornton.tv</a></p>
",0,,186.0,2017-03-01,2017-03-01,2017-07-11,5YUQSSsrxyY,https://www.youtube.com/watch?v=5YUQSSsrxyY,59.0,Thornton360,,,"[{u'livestream': u'0', u'position': u'-9', u'user_id': u'186', u'id': u'59', u'label': u'Thornton360'}]",
6,236,"[3, 16, 18]",City Council Work Session 01-11-2016,City Council Work Session 01-11-2016,,0,shows/city-council-work-session-01-11-2016,134.0,2016-01-11,2016-01-11,2017-03-20,Sa5C9hR-Qxs,https://www.youtube.com/watch?v=Sa5C9hR-Qxs,20.0,City Council,125.0,https://ompnetwork.s3-us-west-2.amazonaws.com/sites/134/documents/agenda_packet_48.pdf,"[{u'livestream': u'1', u'position': u'-10', u'user_id': u'134', u'id': u'20', u'label': u'City Council'}]","[{u'user_id': u'134', u'type_id': u'1', u'url': u'https://ompnetwork.s3-us-west-2.amazonaws.com/sites/134/documents/agenda_packet_48.pdf', u'storage': u'attachment', u'session_id': u'236', u'label': None, u'file_id': u'195', u'provider': u'generic', u'agenda_provider_agenda_id': None, u'session_title': u'City Council Work Session 01-11-2016', u'type': u'Agenda', u'id': u'125', u'agenda_provider_id': None}, {u'user_id': u'134', u'type_id': u'4', u'url': u'https://ompnetwork.s3-us-west-2.amazonaws.com/sites/134/documents/minutes_22.pdf', u'storage': u'attachment', u'session_id': u'236', u'label': None, u'file_id': u'196', u'provider': u'generic', u'agenda_provider_agenda_id': None, u'session_title': u'City Council Work Session 01-11-2016', u'type': u'Minutes', u'id': u'126', u'agenda_provider_id': None}]"
7,8438,"[3, 6, 7, 11]",Planning Commission  Special Study Session  - 07/23/12,Planning Commission  Special Study Session  - 07/23/12,,0,,199.0,2012-07-23,2012-07-23,2017-08-01,-Ai5cDgrJhA,https://www.youtube.com/watch?v=-Ai5cDgrJhA,70.0,Planning,2725.0,https://ompnetwork.s3-us-west-2.amazonaws.com/sites/199/granicus_files/891_calendar_1343023200.html,"[{u'livestream': u'1', u'position': u'0', u'user_id': u'199', u'id': u'70', u'label': u'Planning'}]","[{u'user_id': u'199', u'type_id': u'3', u'url': u'https://ompnetwork.s3-us-west-2.amazonaws.com/sites/199/granicus_files/891_calendar_1343023200.html', u'storage': u'external', u'session_id': u'8438', u'label': None, u'file_id': None, u'provider': u'generic', u'agenda_provider_agenda_id': None, u'session_title': u'Planning Commission  Special Study Session  - 07/23/12', u'type': u'Calendar', u'id': u'2725', u'agenda_provider_id': None}]"
8,580,"[0, 7, 12, 16, 18, 19]",City Council Public Hearing and Meeting of the URA 05-21-2012,City Council Public Hearing and Meeting of the URA 05-21-2012,,0,shows/city-council-public-hearing-and-meeting-ura-05-21-2012,134.0,2012-05-21,2012-05-21,2017-03-20,6aG92JSWdBc,https://www.youtube.com/watch?v=6aG92JSWdBc,20.0,City Council,732.0,https://ompnetwork.s3-us-west-2.amazonaws.com/sites/134/documents/agenda_108.pdf,"[{u'livestream': u'1', u'position': u'-10', u'user_id': u'134', u'id': u'20', u'label': u'City Council'}]","[{u'user_id': u'134', u'type_id': u'1', u'url': u'https://ompnetwork.s3-us-west-2.amazonaws.com/sites/134/documents/agenda_108.pdf', u'storage': u'attachment', u'session_id': u'580', u'label': None, u'file_id': u'803', u'provider': u'generic', u'agenda_provider_agenda_id': None, u'session_title': u'City Council Public Hearing and Meeting of the URA 05-21-2012', u'type': u'Agenda', u'id': u'732', u'agenda_provider_id': None}, {u'user_id': u'134', u'type_id': u'4', u'url': u'https://ompnetwork.s3-us-west-2.amazonaws.com/sites/134/documents/minutes_91_0.pdf', u'storage': u'attachment', u'session_id': u'580', u'label': None, u'file_id': u'804', u'provider': u'generic', u'agenda_provider_agenda_id': None, u'session_title': u'City Council Public Hearing and Meeting of the URA 05-21-2012', u'type': u'Minutes', u'id': u'733', u'agenda_provider_id': None}]"
9,710,"[3, 5, 16, 18]",Planning Commission  03-18-2013,Planning Commission  03-18-2013,,0,shows/planning-commission-03-18-2013,134.0,2013-03-18,2013-03-18,2017-03-20,xmtIf0yvg7U,https://www.youtube.com/watch?v=xmtIf0yvg7U,22.0,Planning Commission,933.0,https://ompnetwork.s3-us-west-2.amazonaws.com/sites/134/documents/agenda_packet_164_0.pdf,"[{u'livestream': u'1', u'position': u'-9', u'user_id': u'134', u'id': u'22', u'label': u'Planning Commission'}]","[{u'user_id': u'134', u'type_id': u'1', u'url': u'https://ompnetwork.s3-us-west-2.amazonaws.com/sites/134/documents/agenda_packet_164_0.pdf', u'storage': u'attachment', u'session_id': u'710', u'label': None, u'file_id': u'1004', u'provider': u'generic', u'agenda_provider_agenda_id': None, u'session_title': u'Planning Commission  03-18-2013', u'type': u'Agenda', u'id': u'933', u'agenda_provider_id': None}]"
10,556,"[3, 8, 18]",Planning Commission 03-30-2015,Planning Commission 03-30-2015,,0,shows/planning-commission-03-30-2015,134.0,2015-03-30,2015-03-30,2017-03-20,zfgpepQ8X9U,https://www.youtube.com/watch?v=zfgpepQ8X9U,22.0,Planning Commission,696.0,https://ompnetwork.s3-us-west-2.amazonaws.com/sites/134/documents/agenda_packet_95_0.pdf,"[{u'livestream': u'1', u'position': u'-9', u'user_id': u'134', u'id': u'22', u'label': u'Planning Commission'}]","[{u'user_id': u'134', u'type_id': u'1', u'url': u'https://ompnetwork.s3-us-west-2.amazonaws.com/sites/134/documents/agenda_packet_95_0.pdf', u'storage': u'attachment', u'session_id': u'556', u'label': None, u'file_id': u'767', u'provider': u'generic', u'agenda_provider_agenda_id': None, u'session_title': u'Planning Commission 03-30-2015', u'type': u'Agenda', u'id': u'696', u'agenda_provider_id': None}]"
11,3881,"[2, 12, 13]","Eugene Police Commission Meeting October 13, 2016","Eugene Police Commission Meeting October 13, 2016",,0,,134.0,2017-07-17,2016-10-13,2017-07-17,QQ0iUAafLEc,https://youtu.be/QQ0iUAafLEc,45.0,Police Commission,1663.0,https://ompnetwork.s3-us-west-2.amazonaws.com/sites/134/documents/packet_oct_2016.pdf,"[{u'livestream': u'0', u'position': u'0', u'user_id': u'134', u'id': u'45', u'label': u'Police Commission'}]","[{u'user_id': u'134', u'type_id': u'1', u'url': u'https://ompnetwork.s3-us-west-2.amazonaws.com/sites/134/documents/packet_oct_2016.pdf', u'storage': u'attachment', u'session_id': u'3881', u'label': None, u'file_id': u'1820', u'provider': u'generic', u'agenda_provider_agenda_id': None, u'session_title': u'Eugene Police Commission Meeting October 13, 2016', u'type': u'Agenda', u'id': u'1663', u'agenda_provider_id': None}]"
12,15792,[2],Grand Opening of Pete Mirelez Human Services Center,Grand Opening of Pete Mirelez Human Services Center,,0,,272.0,2017-10-30,2017-10-05,2017-10-30,JVdpJSltWTc,https://www.youtube.com/watch?v=JVdpJSltWTc,143.0,County Resources,,,"[{u'livestream': u'0', u'position': u'0', u'user_id': u'272', u'id': u'143', u'label': u'County Resources'}]",
13,24001,[16],Basalt Council 12/12/17,Basalt Council 12/12/17,,0,,296.0,2017-12-12,2017-12-12,2018-01-17,yds0Bdw8XSo,https://www.youtube.com/watch?v=yds0Bdw8XSo,197.0,Town Council,5044.0,https://ompnetwork.s3-us-west-2.amazonaws.com/sites/296/documents/tob_tc_agenda_amended_2017_12-12.pdf?yI06TAKG2ID0xIyW4aQClphxTCGA.XFJ,"[{u'livestream': u'1', u'position': u'0', u'user_id': u'296', u'id': u'197', u'label': u'Town Council'}]","[{u'user_id': u'296', u'type_id': u'1', u'url': u'https://ompnetwork.s3-us-west-2.amazonaws.com/sites/296/documents/tob_tc_agenda_amended_2017_12-12.pdf?yI06TAKG2ID0xIyW4aQClphxTCGA.XFJ', u'storage': u'attachment', u'session_id': u'24001', u'label': None, u'file_id': u'4458', u'provider': u'generic', u'agenda_provider_agenda_id': None, u'session_title': u'Basalt Council 12/12/17', u'type': u'Agenda', u'id': u'5044', u'agenda_provider_id': None}]"
14,8447,"[5, 17]",Planning Commission Regular Meeting  - 02/13/12,Planning Commission Regular Meeting  - 02/13/12,,0,,199.0,2012-02-13,2012-02-13,2017-08-01,P39POvRIavc,https://www.youtube.com/watch?v=P39POvRIavc,70.0,Planning,2734.0,https://ompnetwork.s3-us-west-2.amazonaws.com/sites/199/granicus_files/812_calendar_1329116400.html,"[{u'livestream': u'1', u'position': u'0', u'user_id': u'199', u'id': u'70', u'label': u'Planning'}]","[{u'user_id': u'199', u'type_id': u'3', u'url': u'https://ompnetwork.s3-us-west-2.amazonaws.com/sites/199/granicus_files/812_calendar_1329116400.html', u'storage': u'external', u'session_id': u'8447', u'label': None, u'file_id': None, u'provider': u'generic', u'agenda_provider_agenda_id': None, u'session_title': u'Planning Commission Regular Meeting  - 02/13/12', u'type': u'Calendar', u'id': u'2734', u'agenda_provider_id': None}]"
15,553,"[3, 11, 16]",Planning Commission 04-27-2015,Planning Commission 04-27-2015,,0,shows/planning-commission-04-27-2015,134.0,2015-04-27,2015-04-27,2017-03-20,h8S17BLj1Gs,https://www.youtube.com/watch?v=h8S17BLj1Gs,22.0,Planning Commission,692.0,https://ompnetwork.s3-us-west-2.amazonaws.com/sites/134/documents/agenda_packet_93.pdf,"[{u'livestream': u'1', u'position': u'-9', u'user_id': u'134', u'id': u'22', u'label': u'Planning Commission'}]","[{u'user_id': u'134', u'type_id': u'1', u'url': u'https://ompnetwork.s3-us-west-2.amazonaws.com/sites/134/documents/agenda_packet_93.pdf', u'storage': u'attachment', u'session_id': u'553', u'label': None, u'file_id': u'763', u'provider': u'generic', u'agenda_provider_agenda_id': None, u'session_title': u'Planning Commission 04-27-2015', u'type': u'Agenda', u'id': u'692', u'agenda_provider_id': None}]"
16,193,"[11, 12, 15, 19]",City Council Work Session 07-13-2016,City Council Work Session 07-13-2016,,0,shows/city-council-work-session-07-13-2016,134.0,2016-07-13,2016-07-13,2017-03-20,DU1TO40dNmc,https://www.youtube.com/watch?v=DU1TO40dNmc,20.0,City Council,44.0,https://ompnetwork.s3-us-west-2.amazonaws.com/sites/134/documents/agenda_packet_2.pdf,"[{u'livestream': u'1', u'position': u'-10', u'user_id': u'134', u'id': u'20', u'label': u'City Council'}]","[{u'user_id': u'134', u'type_id': u'1', u'url': u'https://ompnetwork.s3-us-west-2.amazonaws.com/sites/134/documents/agenda_packet_2.pdf', u'storage': u'attachment', u'session_id': u'193', u'label': None, u'file_id': u'114', u'provider': u'generic', u'agenda_provider_agenda_id': None, u'session_title': u'City Council Work Session 07-13-2016', u'type': u'Agenda', u'id': u'44', u'agenda_provider_id': None}, {u'user_id': u'134', u'type_id': u'4', u'url': u'https://ompnetwork.s3-us-west-2.amazonaws.com/sites/134/documents/minutes_0_0.pdf', u'storage': u'attachment', u'session_id': u'193', u'label': None, u'file_id': u'115', u'provider': u'generic', u'agenda_provider_agenda_id': None, u'session_title': u'City Council Work Session 07-13-2016', u'type': u'Minutes', u'id': u'45', u'agenda_provider_id': None}]"
17,622,"[6, 7, 11, 15, 16]",Planning Commission  02-03-2014,Planning Commission  02-03-2014,,0,shows/planning-commission-02-03-2014,134.0,2014-02-03,2014-02-03,2017-03-20,B81LYiG_dCY,https://www.youtube.com/watch?v=B81LYiG_dCY,22.0,Planning Commission,798.0,https://ompnetwork.s3-us-west-2.amazonaws.com/sites/134/documents/agenda_packet_127_0.pdf,"[{u'livestream': u'1', u'position': u'-9', u'user_id': u'134', u'id': u'22', u'label': u'Planning Commission'}]","[{u'user_id': u'134', u'type_id': u'1', u'url': u'https://ompnetwork.s3-us-west-2.amazonaws.com/sites/134/documents/agenda_packet_127_0.pdf', u'storage': u'attachment', u'session_id': u'622', u'label': None, u'file_id': u'869', u'provider': u'generic', u'agenda_provider_agenda_id': None, u'session_title': u'Planning Commission  02-03-2014', u'type': u'Agenda', u'id': u'798', u'agenda_provider_id': None}]"
18,573,"[0, 10, 15, 17, 19]",City Council Meeting 05-29-2012,City Council Meeting 05-29-2012,,0,shows/city-council-meeting-05-29-2012,134.0,2012-05-29,2012-05-29,2017-03-20,k_Q0Sw5rDG4,https://www.youtube.com/watch?v=k_Q0Sw5rDG4,20.0,City Council,722.0,https://ompnetwork.s3-us-west-2.amazonaws.com/sites/134/documents/agenda_105.pdf,"[{u'livestream': u'1', u'position': u'-10', u'user_id': u'134', u'id': u'20', u'label': u'City Council'}]","[{u'user_id': u'134', u'type_id': u'1', u'url': u'https://ompnetwork.s3-us-west-2.amazonaws.com/sites/134/documents/agenda_105.pdf', u'storage': u'attachment', u'session_id': u'573', u'label': None, u'file_id': u'793', u'provider': u'generic', u'agenda_provider_agenda_id': None, u'session_title': u'City Council Meeting 05-29-2012', u'type': u'Agenda', u'id': u'722', u'agenda_provider_id': None}, {u'user_id': u'134', u'type_id': u'4', u'url': u'https://ompnetwork.s3-us-west-2.amazonaws.com/sites/134/documents/minutes_88_0.pdf', u'storage': u'attachment', u'session_id': u'573', u'label': None, u'file_id': u'794', u'provider': u'generic', u'agenda_provider_agenda_id': None, u'session_title': u'City Council Meeting 05-29-2012', u'type': u'Minutes', u'id': u'723', u'agenda_provider_id': None}]"
19,312,"[0, 10, 11, 12, 14]",City Council Work Session 12-08-2014,City Council Work Session 12-08-2014,,0,shows/city-council-work-session-12-08-2014,134.0,2014-12-08,2014-12-08,2017-03-20,PpfeQIVNAMU,https://www.youtube.com/watch?v=PpfeQIVNAMU,20.0,City Council,267.0,https://ompnetwork.s3-us-west-2.amazonaws.com/sites/134/documents/agenda_packet_144.pdf,"[{u'livestream': u'1', u'position': u'-10', u'user_id': u'134', u'id': u'20', u'label': u'City Council'}]","[{u'user_id': u'134', u'type_id': u'1', u'url': u'https://ompnetwork.s3-us-west-2.amazonaws.com/sites/134/documents/agenda_packet_144.pdf', u'storage': u'attachment', u'session_id': u'312', u'label': None, u'file_id': u'337', u'provider': u'generic', u'agenda_provider_agenda_id': None, u'session_title': u'City Council Work Session 12-08-2014', u'type': u'Agenda', u'id': u'267', u'agenda_provider_id': None}, {u'user_id': u'134', u'type_id': u'4', u'url': u'https://ompnetwork.s3-us-west-2.amazonaws.com/sites/134/documents/minutes_84.pdf', u'storage': u'attachment', u'session_id': u'312', u'label': None, u'file_id': u'338', u'provider': u'generic', u'agenda_provider_agenda_id': None, u'session_title': u'City Council Work Session 12-08-2014', u'type': u'Minutes', u'id': u'268', u'agenda_provider_id': None}]"
20,17113,"[1, 19]",BOCC Work Session with Rep. Scott Tipton - 12/06/13,BOCC Work Session with Rep. Scott Tipton - 12/06/13,,0,,273.0,2013-12-06,2013-12-06,2017-10-30,1UQL-hAQUg8,https://www.youtube.com/watch?v=1UQL-hAQUg8,146.0,2013,4370.0,https://ompnetwork.s3-us-west-2.amazonaws.com/sites/273/granicus_files/479_calendar_1386313200.html,"[{u'livestream': u'0', u'position': u'-5', u'user_id': u'273', u'id': u'146', u'label': u'2013'}]","[{u'user_id': u'273', u'type_id': u'3', u'url': u'https://ompnetwork.s3-us-west-2.amazonaws.com/sites/273/granicus_files/479_calendar_1386313200.html', u'storage': u'external', u'session_id': u'17113', u'label': None, u'file_id': None, u'provider': u'generic', u'agenda_provider_agenda_id': None, u'session_title': u'BOCC Work Session with Rep. Scott Tipton - 12/06/13', u'type': u'Calendar', u'id': u'4370', u'agenda_provider_id': None}]"
21,20419,"[13, 18]","Eugene Police Commission Meeting: November 9, 2017","Eugene Police Commission Meeting: November 9, 2017",,0,,134.0,2017-11-15,2017-11-09,2017-12-19,awQtOSZ322A,https://www.youtube.com/watch?v=awQtOSZ322A&feature=youtu.be,45.0,Police Commission,4875.0,https://ompnetwork.s3-us-west-2.amazonaws.com/sites/134/documents/packet_1.pdf?_s4SPM6qwarbI43RM_ltDMSBvecEQifb,"[{u'livestream': u'0', u'position': u'0', u'user_id': u'134', u'id': u'45', u'label': u'Police Commission'}]","[{u'user_id': u'134', u'type_id': u'1', u'url': u'https://ompnetwork.s3-us-west-2.amazonaws.com/sites/134/documents/packet_1.pdf?_s4SPM6qwarbI43RM_ltDMSBvecEQifb', u'storage': u'attachment', u'session_id': u'20419', u'label': None, u'file_id': u'4248', u'provider': u'generic', u'agenda_provider_agenda_id': None, u'session_title': u'Eugene Police Commission Meeting: November 9, 2017', u'type': u'Agenda', u'id': u'4875', u'agenda_provider_id': None}]"
22,24028,[6],Basalt Council 01/09/18,Basalt Council 01/09/18,,0,,296.0,2018-01-09,2018-01-09,2018-01-17,ohrt_mmgBSo,https://www.youtube.com/watch?v=ohrt_mmgBSo,197.0,Town Council,5045.0,https://ompnetwork.s3-us-west-2.amazonaws.com/sites/296/documents/01-09-18_council_meeting.pdf.pdf?vWyzww2CFqHYl.JWaIr_bII6ZCnI6s9n,"[{u'livestream': u'1', u'position': u'0', u'user_id': u'296', u'id': u'197', u'label': u'Town Council'}]","[{u'user_id': u'296', u'type_id': u'1', u'url': u'https://ompnetwork.s3-us-west-2.amazonaws.com/sites/296/documents/01-09-18_council_meeting.pdf.pdf?vWyzww2CFqHYl.JWaIr_bII6ZCnI6s9n', u'storage': u'attachment', u'session_id': u'24028', u'label': None, u'file_id': u'4459', u'provider': u'generic', u'agenda_provider_agenda_id': None, u'session_title': u'Basalt Council 01/09/18', u'type': u'Agenda', u'id': u'5045', u'agenda_provider_id': None}]"
23,8445,"[3, 5, 7]",Planning Commission Regular Meeting  - 03/26/12,Planning Commission Regular Meeting  - 03/26/12,,0,,199.0,2012-03-26,2012-03-26,2017-08-01,TUShXnL8RSA,https://www.youtube.com/watch?v=TUShXnL8RSA,70.0,Planning,2732.0,https://ompnetwork.s3-us-west-2.amazonaws.com/sites/199/granicus_files/830_calendar_1332741600.html,"[{u'livestream': u'1', u'position': u'0', u'user_id': u'199', u'id': u'70', u'label': u'Planning'}]","[{u'user_id': u'199', u'type_id': u'3', u'url': u'https://ompnetwork.s3-us-west-2.amazonaws.com/sites/199/granicus_files/830_calendar_1332741600.html', u'storage': u'external', u'session_id': u'8445', u'label': None, u'file_id': None, u'provider': u'generic', u'agenda_provider_agenda_id': None, u'session_title': u'Planning Commission Regular Meeting  - 03/26/12', u'type': u'Calendar', u'id': u'2732', u'agenda_provider_id': None}]"
24,9749,"[0, 6, 13, 15, 16]",City Council Study Session - 10/6/2015,City Council Study Session - 10/6/2015,,0,,199.0,2015-10-06,2015-10-06,2017-08-02,SQSt3lV82_4,https://www.youtube.com/watch?v=SQSt3lV82_4,69.0,Council,3183.0,https://ompnetwork.s3-us-west-2.amazonaws.com/sites/199/documents/10-06-2015_study_session_cc.pdf?8v3w2WmQBFLR7jt6QoSsexeHYGECSb.M,"[{u'livestream': u'1', u'position': u'0', u'user_id': u'199', u'id': u'69', u'label': u'Council'}]","[{u'user_id': u'199', u'type_id': u'1', u'url': u'https://ompnetwork.s3-us-west-2.amazonaws.com/sites/199/documents/10-06-2015_study_session_cc.pdf?8v3w2WmQBFLR7jt6QoSsexeHYGECSb.M', u'storage': u'attachment', u'session_id': u'9749', u'label': None, u'file_id': u'2899', u'provider': u'generic', u'agenda_provider_agenda_id': None, u'session_title': u'City Council Study Session - 10/6/2015', u'type': u'Agenda', u'id': u'3183', u'agenda_provider_id': None}, {u'user_id': u'199', u'type_id': u'3', u'url': u'https://ompnetwork.s3-us-west-2.amazonaws.com/sites/199/granicus_files/1542_calendar_1444111200.pdf', u'storage': u'external', u'session_id': u'9749', u'label': None, u'file_id': None, u'provider': u'generic', u'agenda_provider_agenda_id': None, u'session_title': u'City Council Study Session - 10/6/2015', u'type': u'Calendar', u'id': u'3184', u'agenda_provider_id': None}]"
25,702,"[11, 16, 18]",City Council Work Session 07-20-2011,City Council Work Session 07-20-2011,,0,shows/city-council-work-session-07-20-2011,134.0,2011-07-20,2011-07-20,2017-03-20,VG0JIoTWmIM,https://www.youtube.com/watch?v=VG0JIoTWmIM,20.0,City Council,920.0,https://ompnetwork.s3-us-west-2.amazonaws.com/sites/134/documents/agenda_146.pdf,"[{u'livestream': u'1', u'position': u'-10', u'user_id': u'134', u'id': u'20', u'label': u'City Council'}]","[{u'user_id': u'134', u'type_id': u'1', u'url': u'https://ompnetwork.s3-us-west-2.amazonaws.com/sites/134/documents/agenda_146.pdf', u'storage': u'attachment', u'session_id': u'702', u'label': None, u'file_id': u'991', u'provider': u'generic', u'agenda_provider_agenda_id': None, u'session_title': u'City Council Work Session 07-20-2011', u'type': u'Agenda', u'id': u'920', u'agenda_provider_id': None}, {u'user_id': u'134', u'type_id': u'4', u'url': u'https://ompnetwork.s3-us-west-2.amazonaws.com/sites/134/documents/minutes_203_0.pdf', u'storage': u'attachment', u'session_id': u'702', u'label': None, u'file_id': u'992', u'provider': u'generic', u'agenda_provider_agenda_id': None, u'session_title': u'City Council Work Session 07-20-2011', u'type': u'Minutes', u'id': u'921', u'agenda_provider_id': None}]"
26,3359,"[0, 2, 4, 8, 18]","Thornton360 - May 13, 2015","Thornton360 - May 13, 2015","<p>Thornton360 is produced by the city of Thornton after each city council meeting, recapping the latest meeting and keeping residents informed about important news, issues and events happening in our community.</p>

<p><a href=""http://www.cityofthornton.tv/"" style=""color: rgb(51, 149, 210);"">www.cityofthornton.tv</a></p>
",0,,186.0,2015-05-13,2015-05-13,2017-07-11,HogC0lIk3-0,https://www.youtube.com/watch?v=HogC0lIk3-0,59.0,Thornton360,,,"[{u'livestream': u'0', u'position': u'-9', u'user_id': u'186', u'id': u'59', u'label': u'Thornton360'}]",
27,3320,[2],Shop Thornton First - Back To School 2015,Shop Thornton First - Back To School 2015,"<p>This PSA ws created as part of a campaign asking Thornton residents to shop locally this back to school season.</p>

<p>www.shopthorntonfirst.com</p>
",0,,186.0,2014-07-01,2014-07-01,2017-07-11,BQrKUxEDzto,https://www.youtube.com/watch?feature=player_detailpage&v=BQrKUxEDzto,62.0,PSAs,,,"[{u'livestream': u'0', u'position': u'-5', u'user_id': u'186', u'id': u'62', u'label': u'PSAs'}]",
28,5602,"[1, 2, 12, 13]","Thornton360 - July 12, 2017","Thornton360 - July 12, 2017","<p>Thornton360 is produced by the city of Thornton after each city council meeting, recapping the latest meeting and keeping residents informed about important news, issues and events happening in our community.</p>

<p>www.cityofthornton.tv</p>
",0,,186.0,2017-07-27,2017-07-12,2017-07-27,Oc25nMpOqcE,https://www.youtube.com/watch?v=Oc25nMpOqcE,59.0,Thornton360,,,"[{u'livestream': u'0', u'position': u'-9', u'user_id': u'186', u'id': u'59', u'label': u'Thornton360'}]",[False]
29,8488,"[5, 13]",Planning Commission Special Study Session - 11/22/10,Planning Commission Special Study Session - 11/22/10,,0,,199.0,2010-11-22,2010-11-22,2017-08-01,s_blr3TvCHk,https://www.youtube.com/watch?v=s_blr3TvCHk,70.0,Planning,2761.0,https://ompnetwork.s3-us-west-2.amazonaws.com/sites/199/granicus_files/566_calendar_1290409200.html,"[{u'livestream': u'1', u'position': u'0', u'user_id': u'199', u'id': u'70', u'label': u'Planning'}]","[{u'user_id': u'199', u'type_id': u'3', u'url': u'https://ompnetwork.s3-us-west-2.amazonaws.com/sites/199/granicus_files/566_calendar_1290409200.html', u'storage': u'external', u'session_id': u'8488', u'label': None, u'file_id': None, u'provider': u'generic', u'agenda_provider_agenda_id': None, u'session_title': u'Planning Commission Special Study Session - 11/22/10', u'type': u'Calendar', u'id': u'2761', u'agenda_provider_id': None}]"
30,575,"[4, 5, 14, 18]",City Council Work Session 05-29-2012,City Council Work Session 05-29-2012,,0,shows/city-council-work-session-05-29-2012,134.0,2012-05-29,2012-05-29,2017-03-20,zmSVO-3sGBk,https://www.youtube.com/watch?v=zmSVO-3sGBk,20.0,City Council,725.0,https://ompnetwork.s3-us-west-2.amazonaws.com/sites/134/documents/agenda_106.pdf,"[{u'livestream': u'1', u'position': u'-10', u'user_id': u'134', u'id': u'20', u'label': u'City Council'}]","[{u'user_id': u'134', u'type_id': u'1', u'url': u'https://ompnetwork.s3-us-west-2.amazonaws.com/sites/134/documents/agenda_106.pdf', u'storage': u'attachment', u'session_id': u'575', u'label': None, u'file_id': u'796', u'provider': u'generic', u'agenda_provider_agenda_id': None, u'session_title': u'City Council Work Session 05-29-2012', u'type': u'Agenda', u'id': u'725', u'agenda_provider_id': None}, {u'user_id': u'134', u'type_id': u'4', u'url': u'https://ompnetwork.s3-us-west-2.amazonaws.com/sites/134/documents/minutes_89_0.pdf', u'storage': u'attachment', u'session_id': u'575', u'label': None, u'file_id': u'797', u'provider': u'generic', u'agenda_provider_agenda_id': None, u'session_title': u'City Council Work Session 05-29-2012', u'type': u'Minutes', u'id': u'726', u'agenda_provider_id': None}]"
31,8877,"[6, 13, 16]",Licensing Authority - 04/08/09,Licensing Authority - 04/08/09,,0,,199.0,2009-04-08,2009-04-08,2017-08-01,D-4SjR4zV9w,https://www.youtube.com/watch?v=D-4SjR4zV9w,71.0,Licensing,2974.0,https://ompnetwork.s3-us-west-2.amazonaws.com/sites/199/documents/lla_agenda_04-08-2009.pdf?Bl.Uvx8EjedY3BOXFTZIADGPwjkd2eOG,"[{u'livestream': u'1', u'position': u'0', u'user_id': u'199', u'id': u'71', u'label': u'Licensing'}]","[{u'user_id': u'199', u'type_id': u'1', u'url': u'https://ompnetwork.s3-us-west-2.amazonaws.com/sites/199/documents/lla_agenda_04-08-2009.pdf?Bl.Uvx8EjedY3BOXFTZIADGPwjkd2eOG', u'storage': u'attachment', u'session_id': u'8877', u'label': None, u'file_id': u'2754', u'provider': u'generic', u'agenda_provider_agenda_id': None, u'session_title': u'Licensing Authority - 04/08/09', u'type': u'Agenda', u'id': u'2974', u'agenda_provider_id': None}, {u'user_id': u'199', u'type_id': u'3', u'url': u'https://ompnetwork.s3-us-west-2.amazonaws.com/sites/199/granicus_files/188_calendar_1239170400.html', u'storage': u'external', u'session_id': u'8877', u'label': None, u'file_id': None, u'provider': u'generic', u'agenda_provider_agenda_id': None, u'session_title': u'Licensing Authority - 04/08/09', u'type': u'Calendar', u'id': u'2975', u'agenda_provider_id': None}, {u'user_id': u'199', u'type_id': u'2', u'url': u'https://ompnetwork.s3-us-west-2.amazonaws.com/sites/199/documents/lla_journal_04-08-2009.pdf?gGLYLjZlR4iZk0Hsba9WJhao_PfTu3xc', u'storage': u'attachment', u'session_id': u'8877', u'label': None, u'file_id': u'2755', u'provider': u'generic', u'agenda_provider_agenda_id': None, u'session_title': u'Licensing Authority - 04/08/09', u'type': u'Journal', u'id': u'2976', u'agenda_provider_id': None}, {u'user_id': u'199', u'type_id': u'5', u'url': u'https://ompnetwork.s3-us-west-2.amazonaws.com/sites/199/documents/lla_packet_04-08-2009.pdf?XULxTbjafWZV5LLLM1KIByUdBKCYvW44', u'storage': u'attachment', u'session_id': u'8877', u'label': None, u'file_id': u'2756', u'provider': u'generic', u'agenda_provider_agenda_id': None, u'session_title': u'Licensing Authority - 04/08/09', u'type': u'Packet', u'id': u'2977', u'agenda_provider_id': None}]"
32,3159,[16],"Toxics Board Meeting: November 20, 2014","Toxics Board Meeting: November 20, 2014",,0,,134.0,2017-07-07,2014-11-20,2017-07-20,433vS7VQCHE,https://youtu.be/433vS7VQCHE,46.0,Toxics Board,1782.0,https://ompnetwork.s3-us-west-2.amazonaws.com/sites/134/documents/archive.aspxadid3421?pMmExu7sTneAkfCXDHgISK0q906cD_jn,"[{u'livestream': u'0', u'position': u'0', u'user_id': u'134', u'id': u'46', u'label': u'Toxics Board'}]","[{u'user_id': u'134', u'type_id': u'1', u'url': u'https://ompnetwork.s3-us-west-2.amazonaws.com/sites/134/documents/archive.aspxadid3421?pMmExu7sTneAkfCXDHgISK0q906cD_jn', u'storage': u'attachment', u'session_id': u'3159', u'label': None, u'file_id': u'1920', u'provider': u'generic', u'agenda_provider_agenda_id': None, u'session_title': u'Toxics Board Meeting: November 20, 2014', u'type': u'Agenda', u'id': u'1782', u'agenda_provider_id': None}]"
33,547,"[3, 8, 17, 18]",Planning Commission 06-08-2015,Planning Commission 06-08-2015,,0,shows/planning-commission-06-08-2015,134.0,2015-06-08,2015-06-08,2017-03-20,SHMoLTmV7G4,https://www.youtube.com/watch?v=SHMoLTmV7G4,22.0,Planning Commission,683.0,https://ompnetwork.s3-us-west-2.amazonaws.com/sites/134/documents/agenda_packet_92_0.pdf,"[{u'livestream': u'1', u'position': u'-9', u'user_id': u'134', u'id': u'22', u'label': u'Planning Commission'}]","[{u'user_id': u'134', u'type_id': u'1', u'url': u'https://ompnetwork.s3-us-west-2.amazonaws.com/sites/134/documents/agenda_packet_92_0.pdf', u'storage': u'attachment', u'session_id': u'547', u'label': None, u'file_id': u'754', u'provider': u'generic', u'agenda_provider_agenda_id': None, u'session_title': u'Planning Commission 06-08-2015', u'type': u'Agenda', u'id': u'683', u'agenda_provider_id': None}]"
34,2531,"[0, 12]","Board of Commissioners Morning Meeting: April 14, 2015","Board of Commissioners Morning Meeting: April 14, 2015",,0,,143.0,2017-05-10,2015-04-14,2017-05-10,SCwYgrJrstQ,https://www.youtube.com/watch?v=SCwYgrJrstQ,25.0,Board of County Commissioners,,,"[{u'livestream': u'1', u'position': u'0', u'user_id': u'143', u'id': u'25', u'label': u'Board of County Commissioners'}]",
35,3654,"[1, 2, 11, 17]","Thornton360 - January 25, 2017","Thornton360 - January 25, 2017","<p>Thornton360 is produced by the city of Thornton after each city council meeting, recapping the latest meeting and keeping residents informed about important news, issues and events happening in our community.</p>

<p><a href=""http://www.cityofthornton.tv/"" style=""color: rgb(51, 149, 210);"">www.cityofthornton.tv</a></p>
",0,,186.0,2017-01-25,2017-01-25,2017-07-11,SaUt4AAl6b0,https://www.youtube.com/watch?v=SaUt4AAl6b0,59.0,Thornton360,,,"[{u'livestream': u'0', u'position': u'-9', u'user_id': u'186', u'id': u'59', u'label': u'Thornton360'}]",
36,20109,"[0, 1, 2, 5, 10, 15, 16, 17]",11/7/17 Planning Commission,11/7/17 Planning Commission,,0,,172.0,2017-11-08,2017-11-07,2017-11-08,-4ObkNPZCxg,https://youtu.be/-4ObkNPZCxg,116.0,Planning Commission,4716.0,https://ompnetwork.s3-us-west-2.amazonaws.com/sites/172/documents/11.07.17.agenda.pdf?spw.xHIQh1X7RtoQkLvF3ijTDzqnXOay,"[{u'livestream': u'0', u'position': u'0', u'user_id': u'172', u'id': u'116', u'label': u'Planning Commission'}]","[{u'user_id': u'172', u'type_id': u'1', u'url': u'https://ompnetwork.s3-us-west-2.amazonaws.com/sites/172/documents/11.07.17.agenda.pdf?spw.xHIQh1X7RtoQkLvF3ijTDzqnXOay', u'storage': u'attachment', u'session_id': u'20109', u'label': None, u'file_id': u'4044', u'provider': u'generic', u'agenda_provider_agenda_id': None, u'session_title': u'11/7/17 Planning Commission', u'type': u'Agenda', u'id': u'4716', u'agenda_provider_id': None}]"
37,9798,"[0, 13, 16, 17]",Historical Preservation Board - 11/16/2015,Historical Preservation Board - 11/16/2015,,0,,199.0,2015-11-16,2015-11-16,2017-08-02,WlRZybKhrPE,https://www.youtube.com/watch?v=WlRZybKhrPE,72.0,HPB,3197.0,https://ompnetwork.s3-us-west-2.amazonaws.com/sites/199/granicus_files/1575_calendar_1447657200.pdf,"[{u'livestream': u'1', u'position': u'0', u'user_id': u'199', u'id': u'72', u'label': u'HPB'}]","[{u'user_id': u'199', u'type_id': u'3', u'url': u'https://ompnetwork.s3-us-west-2.amazonaws.com/sites/199/granicus_files/1575_calendar_1447657200.pdf', u'storage': u'external', u'session_id': u'9798', u'label': None, u'file_id': None, u'provider': u'generic', u'agenda_provider_agenda_id': None, u'session_title': u'Historical Preservation Board - 11/16/2015', u'type': u'Calendar', u'id': u'3197', u'agenda_provider_id': None}, {u'user_id': u'199', u'type_id': u'2', u'url': u'https://ompnetwork.s3-us-west-2.amazonaws.com/sites/199/documents/hpb_meetingjournal_111615.pdf?rgCY1IqSbHsWmXTN5094.iNb5VQdHlMj', u'storage': u'attachment', u'session_id': u'9798', u'label': None, u'file_id': u'2906', u'provider': u'generic', u'agenda_provider_agenda_id': None, u'session_title': u'Historical Preservation Board - 11/16/2015', u'type': u'Journal', u'id': u'3198', u'agenda_provider_id': None}]"
38,5477,"[3, 6, 12, 17]",City Council Regular Meeting - 03/05/13,City Council Regular Meeting - 03/05/13,,0,,199.0,2013-03-05,2013-03-05,2017-07-25,fVjMRQeJBC0,https://www.youtube.com/watch?v=fVjMRQeJBC0,69.0,Council,2110.0,https://ompnetwork.s3-us-west-2.amazonaws.com/sites/199/documents/cc_agenda_03-05-2013.pdf?hL2pp7dgLj28G0H3IuodOsW9U.hNUyyv,"[{u'livestream': u'1', u'position': u'0', u'user_id': u'199', u'id': u'69', u'label': u'Council'}]","[{u'user_id': u'199', u'type_id': u'1', u'url': u'https://ompnetwork.s3-us-west-2.amazonaws.com/sites/199/documents/cc_agenda_03-05-2013.pdf?hL2pp7dgLj28G0H3IuodOsW9U.hNUyyv', u'storage': u'attachment', u'session_id': u'5477', u'label': None, u'file_id': u'2229', u'provider': u'generic', u'agenda_provider_agenda_id': None, u'session_title': u'City Council Regular Meeting - 03/05/13', u'type': u'Agenda', u'id': u'2110', u'agenda_provider_id': None}, {u'user_id': u'199', u'type_id': u'3', u'url': u'https://ompnetwork.s3-us-west-2.amazonaws.com/sites/199/granicus_files/1007_calendar_1362466800.html', u'storage': u'external', u'session_id': u'5477', u'label': None, u'file_id': None, u'provider': u'generic', u'agenda_provider_agenda_id': None, u'session_title': u'City Council Regular Meeting - 03/05/13', u'type': u'Calendar', u'id': u'2111', u'agenda_provider_id': None}, {u'user_id': u'199', u'type_id': u'2', u'url': u'https://ompnetwork.s3-us-west-2.amazonaws.com/sites/199/documents/cc_minutes_03-05-2013.pdf?xxllhIRr31URgmqgRXZYCRc7cxH5I8J8', u'storage': u'attachment', u'session_id': u'5477', u'label': None, u'file_id': u'2230', u'provider': u'generic', u'agenda_provider_agenda_id': None, u'session_title': u'City Council Regular Meeting - 03/05/13', u'type': u'Journal', u'id': u'2112', u'agenda_provider_id': None}, {u'user_id': u'199', u'type_id': u'5', u'url': u'https://ompnetwork.s3-us-west-2.amazonaws.com/sites/199/documents/cc_packet_03-05-2013.pdf?jpobxqFxu_tShWfkK1rO7QeY.ggkACHm', u'storage': u'attachment', u'session_id': u'5477', u'label': None, u'file_id': u'2231', u'provider': u'generic', u'agenda_provider_agenda_id': None, u'session_title': u'City Council Regular Meeting - 03/05/13', u'type': u'Packet', u'id': u'2113', u'agenda_provider_id': None}]"
39,3554,"[2, 19]","Thornton360 - October 12, 2016","Thornton360 - October 12, 2016","<p>Thornton360 is produced by the city of Thornton after each city council meeting, recapping the latest meeting and keeping residents informed about important news, issues and events happening in our community.</p>

<p><a href=""http://www.cityofthornton.tv/"" style=""color: rgb(51, 149, 210);"">www.cityofthornton.tv</a></p>
",0,,186.0,2016-10-12,2016-10-12,2017-07-11,9baKwC6P1z8,https://www.youtube.com/watch?v=9baKwC6P1z8,59.0,Thornton360,,,"[{u'livestream': u'0', u'position': u'-9', u'user_id': u'186', u'id': u'59', u'label': u'Thornton360'}]",
40,459,"[4, 7, 13, 16]",City Council Work Session 04-24-2013,City Council Work Session 04-24-2013,,0,shows/city-council-work-session-04-24-2013,134.0,2013-04-24,2013-04-24,2017-03-20,VPpc4ER-anQ,https://www.youtube.com/watch?v=VPpc4ER-anQ,20.0,City Council,543.0,https://ompnetwork.s3-us-west-2.amazonaws.com/sites/134/documents/agenda_20.pdf,"[{u'livestream': u'1', u'position': u'-10', u'user_id': u'134', u'id': u'20', u'label': u'City Council'}]","[{u'user_id': u'134', u'type_id': u'1', u'url': u'https://ompnetwork.s3-us-west-2.amazonaws.com/sites/134/documents/agenda_20.pdf', u'storage': u'attachment', u'session_id': u'459', u'label': None, u'file_id': u'613', u'provider': u'generic', u'agenda_provider_agenda_id': None, u'session_title': u'City Council Work Session 04-24-2013', u'type': u'Agenda', u'id': u'543', u'agenda_provider_id': None}, {u'user_id': u'134', u'type_id': u'4', u'url': u'https://ompnetwork.s3-us-west-2.amazonaws.com/sites/134/documents/minutes_19_0.pdf', u'storage': u'attachment', u'session_id': u'459', u'label': None, u'file_id': u'614', u'provider': u'generic', u'agenda_provider_agenda_id': None, u'session_title': u'City Council Work Session 04-24-2013', u'type': u'Minutes', u'id': u'544', u'agenda_provider_id': None}]"
41,16452,"[0, 16, 19]",BOCC Special Meeting - 12/15/14,BOCC Special Meeting - 12/15/14,,0,,273.0,2014-12-15,2014-12-15,2017-10-30,0J8re39xSC4,https://www.youtube.com/watch?v=0J8re39xSC4,147.0,2014,4304.0,https://ompnetwork.s3-us-west-2.amazonaws.com/sites/273/granicus_files/594_calendar_1418626800.html,"[{u'livestream': u'0', u'position': u'-6', u'user_id': u'273', u'id': u'147', u'label': u'2014'}]","[{u'user_id': u'273', u'type_id': u'3', u'url': u'https://ompnetwork.s3-us-west-2.amazonaws.com/sites/273/granicus_files/594_calendar_1418626800.html', u'storage': u'external', u'session_id': u'16452', u'label': None, u'file_id': None, u'provider': u'generic', u'agenda_provider_agenda_id': None, u'session_title': u'BOCC Special Meeting - 12/15/14', u'type': u'Calendar', u'id': u'4304', u'agenda_provider_id': None}]"
42,3617,"[2, 9, 12, 18]","Thornton360 - December 7, 2016","Thornton360 - December 7, 2016","<p>Thornton360 is produced by the city of Thornton after each city council meeting, recapping the latest meeting and keeping residents informed about important news, issues and events happening in our community.</p>

<p><a href=""http://www.cityofthornton.tv/"" style=""color: rgb(51, 149, 210);"">www.cityofthornton.tv</a></p>
",0,,186.0,2016-12-07,2016-12-07,2017-07-11,Pkp7eV3vpzE,https://www.youtube.com/watch?v=Pkp7eV3vpzE,59.0,Thornton360,,,"[{u'livestream': u'0', u'position': u'-9', u'user_id': u'186', u'id': u'59', u'label': u'Thornton360'}]",
43,597,"[4, 8, 16, 18]",City Council Work Session 04-18-2012,City Council Work Session 04-18-2012,,0,shows/city-council-work-session-04-18-2012,134.0,2012-04-18,2012-04-18,2017-03-20,bPQAqMArhmw,https://www.youtube.com/watch?v=bPQAqMArhmw,20.0,City Council,759.0,https://ompnetwork.s3-us-west-2.amazonaws.com/sites/134/documents/agenda_117.pdf,"[{u'livestream': u'1', u'position': u'-10', u'user_id': u'134', u'id': u'20', u'label': u'City Council'}]","[{u'user_id': u'134', u'type_id': u'1', u'url': u'https://ompnetwork.s3-us-west-2.amazonaws.com/sites/134/documents/agenda_117.pdf', u'storage': u'attachment', u'session_id': u'597', u'label': None, u'file_id': u'830', u'provider': u'generic', u'agenda_provider_agenda_id': None, u'session_title': u'City Council Work Session 04-18-2012', u'type': u'Agenda', u'id': u'759', u'agenda_provider_id': None}, {u'user_id': u'134', u'type_id': u'4', u'url': u'https://ompnetwork.s3-us-west-2.amazonaws.com/sites/134/documents/minutes_99_0.pdf', u'storage': u'attachment', u'session_id': u'597', u'label': None, u'file_id': u'831', u'provider': u'generic', u'agenda_provider_agenda_id': None, u'session_title': u'City Council Work Session 04-18-2012', u'type': u'Minutes', u'id': u'760', u'agenda_provider_id': None}]"
44,3603,"[0, 2, 12]","Thornton360 - November 30, 2016","Thornton360 - November 30, 2016","<p>Thornton360 is produced by the city of Thornton after each city council meeting, recapping the latest meeting and keeping residents informed about important news, issues and events happening in our community.</p>

<p><a href=""http://www.cityofthornton.tv/"" style=""color: rgb(51, 149, 210);"">www.cityofthornton.tv</a></p>
",0,,186.0,2016-11-30,2016-11-30,2017-07-11,41gHg_K-cvQ,https://www.youtube.com/watch?v=41gHg_K-cvQ,59.0,Thornton360,,,"[{u'livestream': u'0', u'position': u'-9', u'user_id': u'186', u'id': u'59', u'label': u'Thornton360'}]",
45,272,"[4, 10, 12, 13]",City Council Work Session 06-24-2015,City Council Work Session 06-24-2015,,0,shows/city-council-work-session-06-24-2015,134.0,2015-06-24,2015-06-24,2017-03-20,pPrIPj3eMXE,https://www.youtube.com/watch?v=pPrIPj3eMXE,20.0,City Council,193.0,https://ompnetwork.s3-us-west-2.amazonaws.com/sites/134/documents/agenda_packet_85.pdf,"[{u'livestream': u'1', u'position': u'-10', u'user_id': u'134', u'id': u'20', u'label': u'City Council'}]","[{u'user_id': u'134', u'type_id': u'1', u'url': u'https://ompnetwork.s3-us-west-2.amazonaws.com/sites/134/documents/agenda_packet_85.pdf', u'storage': u'attachment', u'session_id': u'272', u'label': None, u'file_id': u'263', u'provider': u'generic', u'agenda_provider_agenda_id': None, u'session_title': u'City Council Work Session 06-24-2015', u'type': u'Agenda', u'id': u'193', u'agenda_provider_id': None}, {u'user_id': u'134', u'type_id': u'4', u'url': u'https://ompnetwork.s3-us-west-2.amazonaws.com/sites/134/documents/minutes_55.pdf', u'storage': u'attachment', u'session_id': u'272', u'label': None, u'file_id': u'264', u'provider': u'generic', u'agenda_provider_agenda_id': None, u'session_title': u'City Council Work Session 06-24-2015', u'type': u'Minutes', u'id': u'194', u'agenda_provider_id': None}]"
46,251,"[3, 5, 8]",City Council Work Session 10-21-2015,City Council Work Session 10-21-2015,,0,shows/city-council-work-session-10-21-2015,134.0,2015-10-21,2015-10-21,2017-03-20,KJGsauGIu34,https://www.youtube.com/watch?v=KJGsauGIu34,20.0,City Council,153.0,https://ompnetwork.s3-us-west-2.amazonaws.com/sites/134/documents/agenda_packet_43.pdf,"[{u'livestream': u'1', u'position': u'-10', u'user_id': u'134', u'id': u'20', u'label': u'City Council'}]","[{u'user_id': u'134', u'type_id': u'1', u'url': u'https://ompnetwork.s3-us-west-2.amazonaws.com/sites/134/documents/agenda_packet_43.pdf', u'storage': u'attachment', u'session_id': u'251', u'label': None, u'file_id': u'223', u'provider': u'generic', u'agenda_provider_agenda_id': None, u'session_title': u'City Council Work Session 10-21-2015', u'type': u'Agenda', u'id': u'153', u'agenda_provider_id': None}, {u'user_id': u'134', u'type_id': u'4', u'url': u'https://ompnetwork.s3-us-west-2.amazonaws.com/sites/134/documents/minutes_35.pdf', u'storage': u'attachment', u'session_id': u'251', u'label': None, u'file_id': u'224', u'provider': u'generic', u'agenda_provider_agenda_id': None, u'session_title': u'City Council Work Session 10-21-2015', u'type': u'Minutes', u'id': u'154', u'agenda_provider_id': None}]"
47,5959,"[7, 16]",City Council - Regular Meeting - 07/17/12,City Council - Regular Meeting - 07/17/12,,0,,199.0,2012-07-17,2012-07-17,2017-08-01,y2scKq6xgR0,https://www.youtube.com/watch?v=y2scKq6xgR0,69.0,Council,2200.0,https://ompnetwork.s3-us-west-2.amazonaws.com/sites/199/documents/cc_agenda_07-17-2012.pdf?J_65TxyCiBLAt5nsaIRgqgeXuZzabUeI,"[{u'livestream': u'1', u'position': u'0', u'user_id': u'199', u'id': u'69', u'label': u'Council'}]","[{u'user_id': u'199', u'type_id': u'1', u'url': u'https://ompnetwork.s3-us-west-2.amazonaws.com/sites/199/documents/cc_agenda_07-17-2012.pdf?J_65TxyCiBLAt5nsaIRgqgeXuZzabUeI', u'storage': u'attachment', u'session_id': u'5959', u'label': None, u'file_id': u'2288', u'provider': u'generic', u'agenda_provider_agenda_id': None, u'session_title': u'City Council - Regular Meeting - 07/17/12', u'type': u'Agenda', u'id': u'2200', u'agenda_provider_id': None}, {u'user_id': u'199', u'type_id': u'3', u'url': u'https://ompnetwork.s3-us-west-2.amazonaws.com/sites/199/granicus_files/890_calendar_1342504800.html', u'storage': u'external', u'session_id': u'5959', u'label': None, u'file_id': None, u'provider': u'generic', u'agenda_provider_agenda_id': None, u'session_title': u'City Council - Regular Meeting - 07/17/12', u'type': u'Calendar', u'id': u'2201', u'agenda_provider_id': None}, {u'user_id': u'199', u'type_id': u'2', u'url': u'https://ompnetwork.s3-us-west-2.amazonaws.com/sites/199/documents/cc_minutes_07-17-2012.pdf?xYEe8tdjxN8h0C.Cs59z8keProOxdizV', u'storage': u'attachment', u'session_id': u'5959', u'label': None, u'file_id': u'2289', u'provider': u'generic', u'agenda_provider_agenda_id': None, u'session_title': u'City Council - Regular Meeting - 07/17/12', u'type': u'Journal', u'id': u'2202', u'agenda_provider_id': None}, {u'user_id': u'199', u'type_id': u'5', u'url': u'https://ompnetwork.s3-us-west-2.amazonaws.com/sites/199/documents/cc_packet_07-17-2012.pdf?x8ktOXNO_7PvYU2fMf9ZY6ZXbopKnYUz', u'storage': u'attachment', u'session_id': u'5959', u'label': None, u'file_id': u'2290', u'provider': u'generic', u'agenda_provider_agenda_id': None, u'session_title': u'City Council - Regular Meeting - 07/17/12', u'type': u'Packet', u'id': u'2203', u'agenda_provider_id': None}]"
48,288,"[0, 2, 11, 12, 13, 16, 19]",City Council Meeting 04-27-2015,City Council Meeting 04-27-2015,,0,shows/city-council-meeting-04-27-2015,134.0,2015-04-27,2015-04-27,2017-03-20,sjgO3A0TfhM,https://www.youtube.com/watch?v=sjgO3A0TfhM,20.0,City Council,221.0,https://ompnetwork.s3-us-west-2.amazonaws.com/sites/134/documents/agenda_packet_105.pdf,"[{u'livestream': u'1', u'position': u'-10', u'user_id': u'134', u'id': u'20', u'label': u'City Council'}]","[{u'user_id': u'134', u'type_id': u'1', u'url': u'https://ompnetwork.s3-us-west-2.amazonaws.com/sites/134/documents/agenda_packet_105.pdf', u'storage': u'attachment', u'session_id': u'288', u'label': None, u'file_id': u'291', u'provider': u'generic', u'agenda_provider_agenda_id': None, u'session_title': u'City Council Meeting 04-27-2015', u'type': u'Agenda', u'id': u'221', u'agenda_provider_id': None}, {u'user_id': u'134', u'type_id': u'4', u'url': u'https://ompnetwork.s3-us-west-2.amazonaws.com/sites/134/documents/minutes_67.pdf', u'storage': u'attachment', u'session_id': u'288', u'label': None, u'file_id': u'292', u'provider': u'generic', u'agenda_provider_agenda_id': None, u'session_title': u'City Council Meeting 04-27-2015', u'type': u'Minutes', u'id': u'222', u'agenda_provider_id': None}]"
49,3316,"[2, 4, 11]","Thornton360 - July 9, 2014","Thornton360 - July 9, 2014","<p>Thornton360 is produced by the city of Thornton after each city council meeting, recapping the latest meeting and keeping residents informed about important news, issues and events happening in our community.</p>

<p><a href=""http://www.cityofthornton.tv/"" style=""color: rgb(51, 149, 210);"">www.cityofthornton.tv</a></p>

<p>&nbsp;</p>
",0,,186.0,2014-07-09,2014-07-09,2017-07-11,upOILj5wMEA,https://www.youtube.com/watch?feature=player_detailpage&v=upOILj5wMEA,59.0,Thornton360,,,"[{u'livestream': u'0', u'position': u'-9', u'user_id': u'186', u'id': u'59', u'label': u'Thornton360'}]",
50,832,"[5, 11, 13, 14, 16]",City Council Meeting 10-25-2010,City Council Meeting 10-25-2010,,0,shows/city-council-meeting-10-25-2010,134.0,2010-10-25,2010-10-25,2017-03-20,bpYF_LbFGYk,https://www.youtube.com/watch?v=bpYF_LbFGYk,20.0,City Council,1112.0,https://ompnetwork.s3-us-west-2.amazonaws.com/sites/134/documents/agenda_201.pdf,"[{u'livestream': u'1', u'position': u'-10', u'user_id': u'134', u'id': u'20', u'label': u'City Council'}]","[{u'user_id': u'134', u'type_id': u'1', u'url': u'https://ompnetwork.s3-us-west-2.amazonaws.com/sites/134/documents/agenda_201.pdf', u'storage': u'attachment', u'session_id': u'832', u'label': None, u'file_id': u'1183', u'provider': u'generic', u'agenda_provider_agenda_id': None, u'session_title': u'City Council Meeting 10-25-2010', u'type': u'Agenda', u'id': u'1112', u'agenda_provider_id': None}, {u'user_id': u'134', u'type_id': u'4', u'url': u'https://ompnetwork.s3-us-west-2.amazonaws.com/sites/134/documents/minutes_259.pdf', u'storage': u'attachment', u'session_id': u'832', u'label': None, u'file_id': u'1184', u'provider': u'generic', u'agenda_provider_agenda_id': None, u'session_title': u'City Council Meeting 10-25-2010', u'type': u'Minutes', u'id': u'1113', u'agenda_provider_id': None}]"
51,739,"[2, 3, 5, 7, 12, 14, 17]",City Council Public Hearing 05-16-2011,City Council Public Hearing 05-16-2011,,0,shows/city-council-public-hearing-05-16-2011,134.0,2011-05-16,2011-05-16,2017-03-20,CWB19i7R3i0,https://www.youtube.com/watch?v=CWB19i7R3i0,20.0,City Council,977.0,https://ompnetwork.s3-us-west-2.amazonaws.com/sites/134/documents/agenda_163.pdf,"[{u'livestream': u'1', u'position': u'-10', u'user_id': u'134', u'id': u'20', u'label': u'City Council'}]","[{u'user_id': u'134', u'type_id': u'1', u'url': u'https://ompnetwork.s3-us-west-2.amazonaws.com/sites/134/documents/agenda_163.pdf', u'storage': u'attachment', u'session_id': u'739', u'label': None, u'file_id': u'1048', u'provider': u'generic', u'agenda_provider_agenda_id': None, u'session_title': u'City Council Public Hearing 05-16-2011', u'type': u'Agenda', u'id': u'977', u'agenda_provider_id': None}, {u'user_id': u'134', u'type_id': u'4', u'url': u'https://ompnetwork.s3-us-west-2.amazonaws.com/sites/134/documents/minutes_221.pdf', u'storage': u'attachment', u'session_id': u'739', u'label': None, u'file_id': u'1049', u'provider': u'generic', u'agenda_provider_agenda_id': None, u'session_title': u'City Council Public Hearing 05-16-2011', u'type': u'Minutes', u'id': u'978', u'agenda_provider_id': None}]"
52,207,"[3, 8, 12, 18]",City Council Work Session 05-11-2016,City Council Work Session 05-11-2016,,0,shows/city-council-work-session-05-11-2016,134.0,2016-05-11,2016-05-11,2017-03-20,cELmv0pLRSY,https://www.youtube.com/watch?v=cELmv0pLRSY,20.0,City Council,72.0,https://ompnetwork.s3-us-west-2.amazonaws.com/sites/134/documents/agenda_packet_12.pdf,"[{u'livestream': u'1', u'position': u'-10', u'user_id': u'134', u'id': u'20', u'label': u'City Council'}]","[{u'user_id': u'134', u'type_id': u'1', u'url': u'https://ompnetwork.s3-us-west-2.amazonaws.com/sites/134/documents/agenda_packet_12.pdf', u'storage': u'attachment', u'session_id': u'207', u'label': None, u'file_id': u'142', u'provider': u'generic', u'agenda_provider_agenda_id': None, u'session_title': u'City Council Work Session 05-11-2016', u'type': u'Agenda', u'id': u'72', u'agenda_provider_id': None}, {u'user_id': u'134', u'type_id': u'4', u'url': u'https://ompnetwork.s3-us-west-2.amazonaws.com/sites/134/documents/minutes_9.pdf', u'storage': u'attachment', u'session_id': u'207', u'label': None, u'file_id': u'143', u'provider': u'generic', u'agenda_provider_agenda_id': None, u'session_title': u'City Council Work Session 05-11-2016', u'type': u'Minutes', u'id': u'73', u'agenda_provider_id': None}]"
53,823,"[3, 6, 7]",Planning Commission Public Hearing 04-05-2011,Planning Commission Public Hearing 04-05-2011,,0,shows/planning-commission-public-hearing-04-05-2011,134.0,2011-04-05,2011-04-05,2017-03-20,EBvx1nB8LSM,https://www.youtube.com/watch?v=EBvx1nB8LSM,22.0,Planning Commission,1097.0,https://ompnetwork.s3-us-west-2.amazonaws.com/sites/134/documents/agenda_41_0.pdf,"[{u'livestream': u'1', u'position': u'-9', u'user_id': u'134', u'id': u'22', u'label': u'Planning Commission'}]","[{u'user_id': u'134', u'type_id': u'1', u'url': u'https://ompnetwork.s3-us-west-2.amazonaws.com/sites/134/documents/agenda_41_0.pdf', u'storage': u'attachment', u'session_id': u'823', u'label': None, u'file_id': u'1168', u'provider': u'generic', u'agenda_provider_agenda_id': None, u'session_title': u'Planning Commission Public Hearing 04-05-2011', u'type': u'Agenda', u'id': u'1097', u'agenda_provider_id': None}]"
54,4017,"[2, 6, 11, 16, 17]",ecConnect Training Management System,ecConnect Training Management System,,0,,197.0,2017-07-21,2017-07-21,2017-07-25,z9DdkYm2Shk,https://www.youtube.com/watch?v=z9DdkYm2Shk,64.0,Trainings,1809.0,https://docs.google.com/document/d/1aloJOeBG1lM9BzmCZ2ePq1CTGRifCVqdGCjXQBsbrTk/edit?ts=5972584f#,"[{u'livestream': u'1', u'position': u'0', u'user_id': u'197', u'id': u'64', u'label': u'Trainings'}]","[{u'user_id': u'197', u'type_id': u'1', u'url': u'https://docs.google.com/document/d/1aloJOeBG1lM9BzmCZ2ePq1CTGRifCVqdGCjXQBsbrTk/edit?ts=5972584f#', u'storage': u'external', u'session_id': u'4017', u'label': None, u'file_id': None, u'provider': u'om_googledrive', u'agenda_provider_agenda_id': None, u'session_title': u'ecConnect Training Management System', u'type': u'Agenda', u'id': u'1809', u'agenda_provider_id': None}]"
55,14748,"[0, 3]","Thornton City Council Special Meeting - September 19, 2017","Thornton City Council Special Meeting - September 19, 2017","To access the closed caption information associated with this video, click the CC icon in the lower right corner of the video player.

View more information on Thornton's City Council&nbsp;<a href=""http://www.cityofthornton.net/government/city-council/Pages/default.aspx"">here.</a>
",0,,186.0,2017-09-19,2017-09-19,2017-09-26,vTcgH5FK2NU,https://youtu.be/vTcgH5FK2NU,58.0,City Council Meeting,4007.0,https://docs.google.com/document/d/e/2PACX-1vQAFm7fhYrvtfM_srd9a5YfumOIyyByCEH_MV_dgf2bEOrSv6lIK68zEJdaSayD6l9e5Qkn3Q407CVY/pub,"[{u'livestream': u'1', u'position': u'-10', u'user_id': u'186', u'id': u'58', u'label': u'City Council Meeting'}]","[{u'user_id': u'186', u'type_id': u'1', u'url': u'https://docs.google.com/document/d/e/2PACX-1vQAFm7fhYrvtfM_srd9a5YfumOIyyByCEH_MV_dgf2bEOrSv6lIK68zEJdaSayD6l9e5Qkn3Q407CVY/pub', u'storage': u'external', u'session_id': u'14748', u'label': None, u'file_id': None, u'provider': u'om_googledrive', u'agenda_provider_agenda_id': None, u'session_title': u'Thornton City Council Special Meeting - September 19, 2017', u'type': u'Agenda', u'id': u'4007', u'agenda_provider_id': None}]"
56,8441,[16],Planning Commission Regular Meeting  - 06/11/12,Planning Commission Regular Meeting  - 06/11/12,,0,,199.0,2012-06-11,2012-06-11,2017-08-01,qUyvnYRDmcw,https://www.youtube.com/watch?v=qUyvnYRDmcw,70.0,Planning,2728.0,https://ompnetwork.s3-us-west-2.amazonaws.com/sites/199/granicus_files/864_calendar_1339394400.html,"[{u'livestream': u'1', u'position': u'0', u'user_id': u'199', u'id': u'70', u'label': u'Planning'}]","[{u'user_id': u'199', u'type_id': u'3', u'url': u'https://ompnetwork.s3-us-west-2.amazonaws.com/sites/199/granicus_files/864_calendar_1339394400.html', u'storage': u'external', u'session_id': u'8441', u'label': None, u'file_id': None, u'provider': u'generic', u'agenda_provider_agenda_id': None, u'session_title': u'Planning Commission Regular Meeting  - 06/11/12', u'type': u'Calendar', u'id': u'2728', u'agenda_provider_id': None}]"
57,20195,"[8, 11, 14, 19]",11/13/17 Town Board Work Session,11/13/17 Town Board Work Session,,0,,198.0,2017-11-13,2017-11-13,2017-11-14,kxSsUB-vi34,https://www.youtube.com/watch?v=kxSsUB-vi34,67.0,Town Board,4732.0,https://ompnetwork.s3-us-west-2.amazonaws.com/sites/198/documents/11.13.17_wks_agenda.pdf?t6ev9NN.PbzLIhvQePE09bCaoe3.UL06,"[{u'livestream': u'1', u'position': u'0', u'user_id': u'198', u'id': u'67', u'label': u'Town Board'}]","[{u'user_id': u'198', u'type_id': u'1', u'url': u'https://ompnetwork.s3-us-west-2.amazonaws.com/sites/198/documents/11.13.17_wks_agenda.pdf?t6ev9NN.PbzLIhvQePE09bCaoe3.UL06', u'storage': u'attachment', u'session_id': u'20195', u'label': None, u'file_id': u'4067', u'provider': u'generic', u'agenda_provider_agenda_id': None, u'session_title': u'11/13/17 Town Board Work Session', u'type': u'Agenda', u'id': u'4732', u'agenda_provider_id': None}, {u'user_id': u'198', u'type_id': u'5', u'url': u'https://ompnetwork.s3-us-west-2.amazonaws.com/sites/198/documents/11.13.17_wks_packet.pdf?0M306pA7dPO7fqCgsAuakbhk5OXjZfZO', u'storage': u'attachment', u'session_id': u'20195', u'label': None, u'file_id': u'4068', u'provider': u'generic', u'agenda_provider_agenda_id': None, u'session_title': u'11/13/17 Town Board Work Session', u'type': u'Packet', u'id': u'4733', u'agenda_provider_id': None}]"
58,16172,"[0, 10, 16, 19]",Board of County Commissioners Regular Meeting - 05/13/15,Board of County Commissioners Regular Meeting - 05/13/15,,0,,273.0,2015-05-13,2015-05-13,2017-10-30,bQshOJ6I1xE,https://www.youtube.com/watch?v=bQshOJ6I1xE,148.0,2015,4276.0,https://ompnetwork.s3-us-west-2.amazonaws.com/sites/273/granicus_files/630_calendar_1431496800.html,"[{u'livestream': u'0', u'position': u'-7', u'user_id': u'273', u'id': u'148', u'label': u'2015'}]","[{u'user_id': u'273', u'type_id': u'3', u'url': u'https://ompnetwork.s3-us-west-2.amazonaws.com/sites/273/granicus_files/630_calendar_1431496800.html', u'storage': u'external', u'session_id': u'16172', u'label': None, u'file_id': None, u'provider': u'generic', u'agenda_provider_agenda_id': None, u'session_title': u'Board of County Commissioners Regular Meeting - 05/13/15', u'type': u'Calendar', u'id': u'4276', u'agenda_provider_id': None}]"
59,19426,"[0, 12, 16, 18]",BOCC Work Session 6/20/17,BOCC Work Session 6/20/17,,0,,273.0,2017-06-20,2017-06-20,2017-10-31,L9bir-ic6BY,https://www.youtube.com/watch?v=L9bir-ic6BY,150.0,2017,4648.0,https://ompnetwork.s3-us-west-2.amazonaws.com/sites/273/documents/june_20_6.pdf?_mRnpNKk8vEIQH3bJhPf6y7iMFg4boeY,"[{u'livestream': u'0', u'position': u'-9', u'user_id': u'273', u'id': u'150', u'label': u'2017'}]","[{u'user_id': u'273', u'type_id': u'1', u'url': u'https://ompnetwork.s3-us-west-2.amazonaws.com/sites/273/documents/june_20_6.pdf?_mRnpNKk8vEIQH3bJhPf6y7iMFg4boeY', u'storage': u'attachment', u'session_id': u'19426', u'label': None, u'file_id': u'3929', u'provider': u'generic', u'agenda_provider_agenda_id': None, u'session_title': u'BOCC Work Session 6/20/17', u'type': u'Agenda', u'id': u'4648', u'agenda_provider_id': None}]"
60,212,[19],Budget Committee 05-11-2016,Budget Committee 05-11-2016,,0,shows/budget-committee-05-11-2016,134.0,2016-05-11,2016-05-11,2017-03-20,Jc7gDjmTvQg,https://www.youtube.com/watch?v=Jc7gDjmTvQg,21.0,Budget Committee,81.0,https://ompnetwork.s3-us-west-2.amazonaws.com/sites/134/documents/agenda_packet_11.pdf,"[{u'livestream': u'1', u'position': u'-8', u'user_id': u'134', u'id': u'21', u'label': u'Budget Committee'}]","[{u'user_id': u'134', u'type_id': u'1', u'url': u'https://ompnetwork.s3-us-west-2.amazonaws.com/sites/134/documents/agenda_packet_11.pdf', u'storage': u'attachment', u'session_id': u'212', u'label': None, u'file_id': u'151', u'provider': u'generic', u'agenda_provider_agenda_id': None, u'session_title': u'Budget Committee 05-11-2016', u'type': u'Agenda', u'id': u'81', u'agenda_provider_id': None}, {u'user_id': u'134', u'type_id': u'4', u'url': u'https://ompnetwork.s3-us-west-2.amazonaws.com/sites/134/documents/minutes_18.pdf', u'storage': u'attachment', u'session_id': u'212', u'label': None, u'file_id': u'152', u'provider': u'generic', u'agenda_provider_agenda_id': None, u'session_title': u'Budget Committee 05-11-2016', u'type': u'Minutes', u'id': u'82', u'agenda_provider_id': None}]"
61,21519,"[1, 3, 5, 6, 7, 18]",BOCC Regular Meeting 12/20/17,BOCC Regular Meeting 12/20/17,,0,,273.0,2017-12-15,2017-12-20,2017-12-28,oHAOR80M1p0,https://www.youtube.com/watch?v=oHAOR80M1p0,150.0,2017,4868.0,https://ompnetwork.s3-us-west-2.amazonaws.com/sites/273/documents/abbrev_agenda_12.20.17.pdf?haePt07qA1EBZDrdpsjTmJJo29diAbSP,"[{u'livestream': u'0', u'position': u'-9', u'user_id': u'273', u'id': u'150', u'label': u'2017'}]","[{u'user_id': u'273', u'type_id': u'1', u'url': u'https://ompnetwork.s3-us-west-2.amazonaws.com/sites/273/documents/abbrev_agenda_12.20.17.pdf?haePt07qA1EBZDrdpsjTmJJo29diAbSP', u'storage': u'attachment', u'session_id': u'21519', u'label': None, u'file_id': u'4242', u'provider': u'generic', u'agenda_provider_agenda_id': None, u'session_title': u'BOCC Regular Meeting 12/20/17', u'type': u'Agenda', u'id': u'4868', u'agenda_provider_id': None}]"
62,8887,"[6, 19]",Licensing Authority - 03/11/09,Licensing Authority - 03/11/09,,0,,199.0,2009-03-11,2009-03-11,2017-08-01,F5GOl56J7Ro,https://www.youtube.com/watch?v=F5GOl56J7Ro,71.0,Licensing,2978.0,https://ompnetwork.s3-us-west-2.amazonaws.com/sites/199/documents/lla_agenda_03-11-2009.pdf?nfiQdQAUg0OeRGiLFR50eceXjW5Y75o6,"[{u'livestream': u'1', u'position': u'0', u'user_id': u'199', u'id': u'71', u'label': u'Licensing'}]","[{u'user_id': u'199', u'type_id': u'1', u'url': u'https://ompnetwork.s3-us-west-2.amazonaws.com/sites/199/documents/lla_agenda_03-11-2009.pdf?nfiQdQAUg0OeRGiLFR50eceXjW5Y75o6', u'storage': u'attachment', u'session_id': u'8887', u'label': None, u'file_id': u'2757', u'provider': u'generic', u'agenda_provider_agenda_id': None, u'session_title': u'Licensing Authority - 03/11/09', u'type': u'Agenda', u'id': u'2978', u'agenda_provider_id': None}, {u'user_id': u'199', u'type_id': u'3', u'url': u'https://ompnetwork.s3-us-west-2.amazonaws.com/sites/199/granicus_files/176_calendar_1236751200.html', u'storage': u'external', u'session_id': u'8887', u'label': None, u'file_id': None, u'provider': u'generic', u'agenda_provider_agenda_id': None, u'session_title': u'Licensing Authority - 03/11/09', u'type': u'Calendar', u'id': u'2979', u'agenda_provider_id': None}, {u'user_id': u'199', u'type_id': u'2', u'url': u'https://ompnetwork.s3-us-west-2.amazonaws.com/sites/199/documents/lla_journal_03-11-2009.pdf?UH_85Dyp00NdAb71sqblT4MazuTN2yen', u'storage': u'attachment', u'session_id': u'8887', u'label': None, u'file_id': u'2758', u'provider': u'generic', u'agenda_provider_agenda_id': None, u'session_title': u'Licensing Authority - 03/11/09', u'type': u'Journal', u'id': u'2980', u'agenda_provider_id': None}, {u'user_id': u'199', u'type_id': u'5', u'url': u'https://ompnetwork.s3-us-west-2.amazonaws.com/sites/199/documents/lla_packet_03-11-2009.pdf?NIrrJqPEh9kPgzQPL4yKWVpd44RjCLRV', u'storage': u'attachment', u'session_id': u'8887', u'label': None, u'file_id': u'2759', u'provider': u'generic', u'agenda_provider_agenda_id': None, u'session_title': u'Licensing Authority - 03/11/09', u'type': u'Packet', u'id': u'2981', u'agenda_provider_id': None}]"
63,5068,"[6, 16]",City Council Regular Meeting  - 10/01/2013,City Council Regular Meeting  - 10/01/2013,,0,,199.0,2013-10-01,2013-10-01,2017-07-25,ESGb5RJlp0o,https://www.youtube.com/watch?v=ESGb5RJlp0o,69.0,Council,2018.0,https://ompnetwork.s3-us-west-2.amazonaws.com/sites/199/documents/cc_agenda_10-01-2013.pdf?5_wLw4gpoxuSow8A5nieT4Crw7kyuuwe,"[{u'livestream': u'1', u'position': u'0', u'user_id': u'199', u'id': u'69', u'label': u'Council'}]","[{u'user_id': u'199', u'type_id': u'1', u'url': u'https://ompnetwork.s3-us-west-2.amazonaws.com/sites/199/documents/cc_agenda_10-01-2013.pdf?5_wLw4gpoxuSow8A5nieT4Crw7kyuuwe', u'storage': u'attachment', u'session_id': u'5068', u'label': None, u'file_id': u'2163', u'provider': u'generic', u'agenda_provider_agenda_id': None, u'session_title': u'City Council Regular Meeting  - 10/01/2013', u'type': u'Agenda', u'id': u'2018', u'agenda_provider_id': None}, {u'user_id': u'199', u'type_id': u'3', u'url': u'https://ompnetwork.s3-us-west-2.amazonaws.com/sites/199/granicus_files/1140_calendar_1380607200.html', u'storage': u'external', u'session_id': u'5068', u'label': None, u'file_id': None, u'provider': u'generic', u'agenda_provider_agenda_id': None, u'session_title': u'City Council Regular Meeting  - 10/01/2013', u'type': u'Calendar', u'id': u'2019', u'agenda_provider_id': None}, {u'user_id': u'199', u'type_id': u'2', u'url': u'https://ompnetwork.s3-us-west-2.amazonaws.com/sites/199/documents/cc_minutes_10-01-2013.pdf?tvBiNlzeob2hWq.DEOrjye3K7eKubcHL', u'storage': u'attachment', u'session_id': u'5068', u'label': None, u'file_id': u'2164', u'provider': u'generic', u'agenda_provider_agenda_id': None, u'session_title': u'City Council Regular Meeting  - 10/01/2013', u'type': u'Journal', u'id': u'2020', u'agenda_provider_id': None}, {u'user_id': u'199', u'type_id': u'5', u'url': u'https://ompnetwork.s3-us-west-2.amazonaws.com/sites/199/documents/cc_packet_10-01-2013.pdf?yxEiFuCiBkoJUpqaGbANssaJQ2OYK4Lm', u'storage': u'attachment', u'session_id': u'5068', u'label': None, u'file_id': u'2165', u'provider': u'generic', u'agenda_provider_agenda_id': None, u'session_title': u'City Council Regular Meeting  - 10/01/2013', u'type': u'Packet', u'id': u'2021', u'agenda_provider_id': None}]"
64,3566,"[2, 3, 5, 18]","Thornton360 - October 26, 2016","Thornton360 - October 26, 2016","<p>Thornton360 is produced by the city of Thornton after each city council meeting, recapping the latest meeting and keeping residents informed about important news, issues and events happening in our community.</p>

<p><a href=""http://www.cityofthornton.tv/"" style=""color: rgb(51, 149, 210);"">www.cityofthornton.tv</a></p>
",0,,186.0,2016-10-26,2016-10-26,2017-07-11,zP_f9u5MnBg,https://www.youtube.com/watch?v=zP_f9u5MnBg,59.0,Thornton360,,,"[{u'livestream': u'0', u'position': u'-9', u'user_id': u'186', u'id': u'59', u'label': u'Thornton360'}]",
65,22192,"[2, 9, 12, 13, 16]","Thornton360 - January 10, 2018","Thornton360 - January 10, 2018","<p>Thornton360 is produced by the city of Thornton after each city council meeting, recapping the latest meeting and keeping residents informed about important news, issues and events happening in our community.</p>

<p>http://www.cityofthornton.tv</p>
",0,,186.0,2018-01-12,2018-01-10,2018-01-12,_yYSece87SA,https://www.youtube.com/watch?v=_yYSece87SA,59.0,Thornton360,,,"[{u'livestream': u'0', u'position': u'-9', u'user_id': u'186', u'id': u'59', u'label': u'Thornton360'}]",
66,4985,"[0, 3, 5, 6, 10]",City Council Regular Meeting  - 11/19/2013,City Council Regular Meeting  - 11/19/2013,,0,,199.0,2013-11-19,2013-11-19,2017-07-25,WV6d-9taxMA,https://www.youtube.com/watch?v=WV6d-9taxMA,69.0,Council,1999.0,https://ompnetwork.s3-us-west-2.amazonaws.com/sites/199/documents/cc_agenda_11-19-2013.pdf?si.yRVmupRQSfPetsE34q9NwyNMNtxYB,"[{u'livestream': u'1', u'position': u'0', u'user_id': u'199', u'id': u'69', u'label': u'Council'}]","[{u'user_id': u'199', u'type_id': u'1', u'url': u'https://ompnetwork.s3-us-west-2.amazonaws.com/sites/199/documents/cc_agenda_11-19-2013.pdf?si.yRVmupRQSfPetsE34q9NwyNMNtxYB', u'storage': u'attachment', u'session_id': u'4985', u'label': None, u'file_id': u'2150', u'provider': u'generic', u'agenda_provider_agenda_id': None, u'session_title': u'City Council Regular Meeting  - 11/19/2013', u'type': u'Agenda', u'id': u'1999', u'agenda_provider_id': None}, {u'user_id': u'199', u'type_id': u'3', u'url': u'https://ompnetwork.s3-us-west-2.amazonaws.com/sites/199/granicus_files/1175_calendar_1384844400.html', u'storage': u'external', u'session_id': u'4985', u'label': None, u'file_id': None, u'provider': u'generic', u'agenda_provider_agenda_id': None, u'session_title': u'City Council Regular Meeting  - 11/19/2013', u'type': u'Calendar', u'id': u'2000', u'agenda_provider_id': None}, {u'user_id': u'199', u'type_id': u'2', u'url': u'https://ompnetwork.s3-us-west-2.amazonaws.com/sites/199/documents/cc_minutes_11-19-2013.pdf?biW67TUGeTomUAKNLsDUXiLGbUqkic7.', u'storage': u'attachment', u'session_id': u'4985', u'label': None, u'file_id': u'2151', u'provider': u'generic', u'agenda_provider_agenda_id': None, u'session_title': u'City Council Regular Meeting  - 11/19/2013', u'type': u'Journal', u'id': u'2001', u'agenda_provider_id': None}, {u'user_id': u'199', u'type_id': u'5', u'url': u'https://ompnetwork.s3-us-west-2.amazonaws.com/sites/199/documents/cc_packet_11-19-2013.pdf?jloakjuRMwoskFUY6PXKavhq9AHqGCZD', u'storage': u'attachment', u'session_id': u'4985', u'label': None, u'file_id': u'2152', u'provider': u'generic', u'agenda_provider_agenda_id': None, u'session_title': u'City Council Regular Meeting  - 11/19/2013', u'type': u'Packet', u'id': u'2002', u'agenda_provider_id': None}]"
67,14329,"[0, 19]","Thornton City Council Meeting - August 22, 2017","Thornton City Council Meeting - August 22, 2017","To access the closed caption information associated with this video, click the CC icon in the lower right corner of the video player.

View more information on Thornton's City Council&nbsp;<a href=""http://www.cityofthornton.net/government/city-council/Pages/default.aspx"">here.</a>
",0,,186.0,2017-08-22,2017-08-22,2017-08-23,CGzzQop1j4c,https://www.youtube.com/watch?v=CGzzQop1j4c,58.0,City Council Meeting,3836.0,https://docs.google.com/document/d/e/2PACX-1vRCrpSOUd_jeBcvLku6-qiNsplau_EKrEZ7CYhAoVfxdtqpJs4AeUNj8uCp8Rnfh1bJLLDqNVkfLRh3/pub,"[{u'livestream': u'1', u'position': u'-10', u'user_id': u'186', u'id': u'58', u'label': u'City Council Meeting'}]","[{u'user_id': u'186', u'type_id': u'1', u'url': u'https://docs.google.com/document/d/e/2PACX-1vRCrpSOUd_jeBcvLku6-qiNsplau_EKrEZ7CYhAoVfxdtqpJs4AeUNj8uCp8Rnfh1bJLLDqNVkfLRh3/pub', u'storage': u'external', u'session_id': u'14329', u'label': None, u'file_id': None, u'provider': u'om_googledrive', u'agenda_provider_agenda_id': None, u'session_title': u'Thornton City Council Meeting - August 22, 2017', u'type': u'Agenda', u'id': u'3836', u'agenda_provider_id': None}]"
68,295,"[3, 4, 11, 16, 19]",City Council Work Session 03-09-2015,City Council Work Session 03-09-2015,,0,shows/city-council-work-session-03-09-2015,134.0,2015-03-09,2015-03-09,2017-03-20,iFuyn_le-Xg,https://www.youtube.com/watch?v=iFuyn_le-Xg,20.0,City Council,235.0,https://ompnetwork.s3-us-west-2.amazonaws.com/sites/134/documents/agenda_packet_117.pdf,"[{u'livestream': u'1', u'position': u'-10', u'user_id': u'134', u'id': u'20', u'label': u'City Council'}]","[{u'user_id': u'134', u'type_id': u'1', u'url': u'https://ompnetwork.s3-us-west-2.amazonaws.com/sites/134/documents/agenda_packet_117.pdf', u'storage': u'attachment', u'session_id': u'295', u'label': None, u'file_id': u'305', u'provider': u'generic', u'agenda_provider_agenda_id': None, u'session_title': u'City Council Work Session 03-09-2015', u'type': u'Agenda', u'id': u'235', u'agenda_provider_id': None}, {u'user_id': u'134', u'type_id': u'4', u'url': u'https://ompnetwork.s3-us-west-2.amazonaws.com/sites/134/documents/minutes_73.pdf', u'storage': u'attachment', u'session_id': u'295', u'label': None, u'file_id': u'306', u'provider': u'generic', u'agenda_provider_agenda_id': None, u'session_title': u'City Council Work Session 03-09-2015', u'type': u'Minutes', u'id': u'236', u'agenda_provider_id': None}]"
69,8456,"[0, 5, 9, 11, 16, 18]",Planning Commission Special Study Session - 01/09/12,Planning Commission Special Study Session - 01/09/12,,0,,199.0,2012-01-09,2012-01-09,2017-08-01,3joa6p99MoE,https://www.youtube.com/watch?v=3joa6p99MoE,70.0,Planning,2736.0,https://ompnetwork.s3-us-west-2.amazonaws.com/sites/199/granicus_files/796_calendar_1326092400.html,"[{u'livestream': u'1', u'position': u'0', u'user_id': u'199', u'id': u'70', u'label': u'Planning'}]","[{u'user_id': u'199', u'type_id': u'3', u'url': u'https://ompnetwork.s3-us-west-2.amazonaws.com/sites/199/granicus_files/796_calendar_1326092400.html', u'storage': u'external', u'session_id': u'8456', u'label': None, u'file_id': None, u'provider': u'generic', u'agenda_provider_agenda_id': None, u'session_title': u'Planning Commission Special Study Session - 01/09/12', u'type': u'Calendar', u'id': u'2736', u'agenda_provider_id': None}]"
70,508,"[11, 16, 19]",City Council Work Session 11-26-2012,City Council Work Session 11-26-2012,,0,shows/city-council-work-session-11-26-2012,134.0,2012-11-26,2012-11-26,2017-03-20,D1Ck1XhLV94,https://www.youtube.com/watch?v=D1Ck1XhLV94,20.0,City Council,623.0,https://ompnetwork.s3-us-west-2.amazonaws.com/sites/134/documents/agenda_59.pdf,"[{u'livestream': u'1', u'position': u'-10', u'user_id': u'134', u'id': u'20', u'label': u'City Council'}]","[{u'user_id': u'134', u'type_id': u'1', u'url': u'https://ompnetwork.s3-us-west-2.amazonaws.com/sites/134/documents/agenda_59.pdf', u'storage': u'attachment', u'session_id': u'508', u'label': None, u'file_id': u'693', u'provider': u'generic', u'agenda_provider_agenda_id': None, u'session_title': u'City Council Work Session 11-26-2012', u'type': u'Agenda', u'id': u'623', u'agenda_provider_id': None}, {u'user_id': u'134', u'type_id': u'4', u'url': u'https://ompnetwork.s3-us-west-2.amazonaws.com/sites/134/documents/minutes_53_0.pdf', u'storage': u'attachment', u'session_id': u'508', u'label': None, u'file_id': u'694', u'provider': u'generic', u'agenda_provider_agenda_id': None, u'session_title': u'City Council Work Session 11-26-2012', u'type': u'Minutes', u'id': u'624', u'agenda_provider_id': None}]"
71,196,[18],City Council Work Session 06-27-2016,City Council Work Session 06-27-2016,,0,shows/city-council-work-session-06-27-2016,134.0,2016-06-27,2016-06-27,2017-03-20,6mDzrXmJOuk,https://www.youtube.com/watch?v=6mDzrXmJOuk,20.0,City Council,50.0,https://ompnetwork.s3-us-west-2.amazonaws.com/sites/134/documents/agenda_packet_0_0.pdf,"[{u'livestream': u'1', u'position': u'-10', u'user_id': u'134', u'id': u'20', u'label': u'City Council'}]","[{u'user_id': u'134', u'type_id': u'1', u'url': u'https://ompnetwork.s3-us-west-2.amazonaws.com/sites/134/documents/agenda_packet_0_0.pdf', u'storage': u'attachment', u'session_id': u'196', u'label': None, u'file_id': u'120', u'provider': u'generic', u'agenda_provider_agenda_id': None, u'session_title': u'City Council Work Session 06-27-2016', u'type': u'Agenda', u'id': u'50', u'agenda_provider_id': None}, {u'user_id': u'134', u'type_id': u'4', u'url': u'https://ompnetwork.s3-us-west-2.amazonaws.com/sites/134/documents/minutes_3.pdf', u'storage': u'attachment', u'session_id': u'196', u'label': None, u'file_id': u'121', u'provider': u'generic', u'agenda_provider_agenda_id': None, u'session_title': u'City Council Work Session 06-27-2016', u'type': u'Minutes', u'id': u'51', u'agenda_provider_id': None}]"
72,403,"[3, 8, 16]",City Council Work Session 11-18-2013,City Council Work Session 11-18-2013,,0,shows/city-council-work-session-11-18-2013,134.0,2013-11-18,2013-11-18,2017-03-20,F3FLQsx9K5Y,https://www.youtube.com/watch?v=F3FLQsx9K5Y,20.0,City Council,437.0,https://ompnetwork.s3-us-west-2.amazonaws.com/sites/134/documents/agenda_packet_215.pdf,"[{u'livestream': u'1', u'position': u'-10', u'user_id': u'134', u'id': u'20', u'label': u'City Council'}]","[{u'user_id': u'134', u'type_id': u'1', u'url': u'https://ompnetwork.s3-us-west-2.amazonaws.com/sites/134/documents/agenda_packet_215.pdf', u'storage': u'attachment', u'session_id': u'403', u'label': None, u'file_id': u'507', u'provider': u'generic', u'agenda_provider_agenda_id': None, u'session_title': u'City Council Work Session 11-18-2013', u'type': u'Agenda', u'id': u'437', u'agenda_provider_id': None}, {u'user_id': u'134', u'type_id': u'4', u'url': u'https://ompnetwork.s3-us-west-2.amazonaws.com/sites/134/documents/minutes_169.pdf', u'storage': u'attachment', u'session_id': u'403', u'label': None, u'file_id': u'508', u'provider': u'generic', u'agenda_provider_agenda_id': None, u'session_title': u'City Council Work Session 11-18-2013', u'type': u'Minutes', u'id': u'438', u'agenda_provider_id': None}]"
73,3816,"[2, 7, 13, 17, 18]","Thornton360 - June 28, 2017","Thornton360 - June 28, 2017","<p>Thornton360 is produced by the city of Thornton after each city council meeting, recapping the latest meeting and keeping residents informed about important news, issues and events happening in our community.</p>

<p>www.cityofthornton.tv</p>
",0,,186.0,2017-06-28,2017-06-28,2017-07-27,4Cl5gLzWxBA,https://www.youtube.com/watch?v=4Cl5gLzWxBA,59.0,Thornton360,,,"[{u'livestream': u'0', u'position': u'-9', u'user_id': u'186', u'id': u'59', u'label': u'Thornton360'}]",
74,3386,"[0, 2]","Thornton360 - December 2, 2015","Thornton360 - December 2, 2015","<p>Thornton360 is produced by the city of Thornton after each city council meeting, recapping the latest meeting and keeping residents informed about important news, issues and events happening in our community.</p>

<p><a href=""http://www.cityofthornton.tv/"" style=""color: rgb(51, 149, 210);"">www.cityofthornton.tv</a></p>
",0,,186.0,2015-12-02,2015-12-02,2017-07-11,w2vVxAmLXQg,https://youtu.be/w2vVxAmLXQg,59.0,Thornton360,,,"[{u'livestream': u'0', u'position': u'-9', u'user_id': u'186', u'id': u'59', u'label': u'Thornton360'}]",
75,455,"[3, 5, 18]",City Council Work Session 05-15-2013,City Council Work Session 05-15-2013,,0,shows/city-council-work-session-05-15-2013,134.0,2013-05-15,2013-05-15,2017-03-20,qMf9VJdYQao,https://www.youtube.com/watch?v=qMf9VJdYQao,20.0,City Council,535.0,https://ompnetwork.s3-us-west-2.amazonaws.com/sites/134/documents/agenda_packet_277.pdf,"[{u'livestream': u'1', u'position': u'-10', u'user_id': u'134', u'id': u'20', u'label': u'City Council'}]","[{u'user_id': u'134', u'type_id': u'1', u'url': u'https://ompnetwork.s3-us-west-2.amazonaws.com/sites/134/documents/agenda_packet_277.pdf', u'storage': u'attachment', u'session_id': u'455', u'label': None, u'file_id': u'605', u'provider': u'generic', u'agenda_provider_agenda_id': None, u'session_title': u'City Council Work Session 05-15-2013', u'type': u'Agenda', u'id': u'535', u'agenda_provider_id': None}, {u'user_id': u'134', u'type_id': u'4', u'url': u'https://ompnetwork.s3-us-west-2.amazonaws.com/sites/134/documents/minutes_209.pdf', u'storage': u'attachment', u'session_id': u'455', u'label': None, u'file_id': u'606', u'provider': u'generic', u'agenda_provider_agenda_id': None, u'session_title': u'City Council Work Session 05-15-2013', u'type': u'Minutes', u'id': u'536', u'agenda_provider_id': None}]"
76,544,"[11, 16, 18]",Planning Commission 06-22-2015,Planning Commission 06-22-2015,,0,shows/planning-commission-06-22-2015,134.0,2015-06-22,2015-06-22,2017-03-20,NdrCPlFljQ8,https://www.youtube.com/watch?v=NdrCPlFljQ8,22.0,Planning Commission,679.0,https://ompnetwork.s3-us-west-2.amazonaws.com/sites/134/documents/agenda_packet_90_0.pdf,"[{u'livestream': u'1', u'position': u'-9', u'user_id': u'134', u'id': u'22', u'label': u'Planning Commission'}]","[{u'user_id': u'134', u'type_id': u'1', u'url': u'https://ompnetwork.s3-us-west-2.amazonaws.com/sites/134/documents/agenda_packet_90_0.pdf', u'storage': u'attachment', u'session_id': u'544', u'label': None, u'file_id': u'750', u'provider': u'generic', u'agenda_provider_agenda_id': None, u'session_title': u'Planning Commission 06-22-2015', u'type': u'Agenda', u'id': u'679', u'agenda_provider_id': None}]"
77,8489,"[3, 5]",Planning Commission Special Study Session - 11/08/10,Planning Commission Special Study Session - 11/08/10,,0,,199.0,2010-11-08,2010-11-08,2017-08-01,mE1cQXk3FPk,https://www.youtube.com/watch?v=mE1cQXk3FPk,70.0,Planning,2762.0,https://ompnetwork.s3-us-west-2.amazonaws.com/sites/199/granicus_files/559_calendar_1289199600.html,"[{u'livestream': u'1', u'position': u'0', u'user_id': u'199', u'id': u'70', u'label': u'Planning'}]","[{u'user_id': u'199', u'type_id': u'3', u'url': u'https://ompnetwork.s3-us-west-2.amazonaws.com/sites/199/granicus_files/559_calendar_1289199600.html', u'storage': u'external', u'session_id': u'8489', u'label': None, u'file_id': None, u'provider': u'generic', u'agenda_provider_agenda_id': None, u'session_title': u'Planning Commission Special Study Session - 11/08/10', u'type': u'Calendar', u'id': u'2762', u'agenda_provider_id': None}]"
78,19380,"[8, 11, 12, 16]",BOCC Work Session 5/23/17,BOCC Work Session 5/23/17,,0,,273.0,2017-05-23,2017-05-23,2017-10-31,DXqpkb-WW94,https://www.youtube.com/watch?v=DXqpkb-WW94,150.0,2017,4644.0,https://ompnetwork.s3-us-west-2.amazonaws.com/sites/273/documents/open_media_agenda_5_23_17.pdf?gxNys55EkjiWk3ui89WYB2tvO3h6dar9,"[{u'livestream': u'0', u'position': u'-9', u'user_id': u'273', u'id': u'150', u'label': u'2017'}]","[{u'user_id': u'273', u'type_id': u'1', u'url': u'https://ompnetwork.s3-us-west-2.amazonaws.com/sites/273/documents/open_media_agenda_5_23_17.pdf?gxNys55EkjiWk3ui89WYB2tvO3h6dar9', u'storage': u'attachment', u'session_id': u'19380', u'label': None, u'file_id': u'3925', u'provider': u'generic', u'agenda_provider_agenda_id': None, u'session_title': u'BOCC Work Session 5/23/17', u'type': u'Agenda', u'id': u'4644', u'agenda_provider_id': None}]"
79,200,"[3, 11, 16, 19]",City Council Work Session 06-13-2016,City Council Work Session 06-13-2016,,0,shows/city-council-work-session-06-13-2016,134.0,2016-06-13,2016-06-13,2017-03-20,r2BE5HrnUPA,https://www.youtube.com/watch?v=r2BE5HrnUPA,20.0,City Council,58.0,https://ompnetwork.s3-us-west-2.amazonaws.com/sites/134/documents/agenda_3.pdf,"[{u'livestream': u'1', u'position': u'-10', u'user_id': u'134', u'id': u'20', u'label': u'City Council'}]","[{u'user_id': u'134', u'type_id': u'1', u'url': u'https://ompnetwork.s3-us-west-2.amazonaws.com/sites/134/documents/agenda_3.pdf', u'storage': u'attachment', u'session_id': u'200', u'label': None, u'file_id': u'128', u'provider': u'generic', u'agenda_provider_agenda_id': None, u'session_title': u'City Council Work Session 06-13-2016', u'type': u'Agenda', u'id': u'58', u'agenda_provider_id': None}, {u'user_id': u'134', u'type_id': u'4', u'url': u'https://ompnetwork.s3-us-west-2.amazonaws.com/sites/134/documents/minutes_8.pdf', u'storage': u'attachment', u'session_id': u'200', u'label': None, u'file_id': u'129', u'provider': u'generic', u'agenda_provider_agenda_id': None, u'session_title': u'City Council Work Session 06-13-2016', u'type': u'Minutes', u'id': u'59', u'agenda_provider_id': None}]"
80,8457,"[5, 6, 13]",Planning Commission Regular Meeting  - 12/12/11,Planning Commission Regular Meeting  - 12/12/11,,0,,199.0,2011-12-12,2011-12-12,2017-08-01,yGFrQq0fFs0,https://www.youtube.com/watch?v=yGFrQq0fFs0,70.0,Planning,2737.0,https://ompnetwork.s3-us-west-2.amazonaws.com/sites/199/granicus_files/781_calendar_1323673200.html,"[{u'livestream': u'1', u'position': u'0', u'user_id': u'199', u'id': u'70', u'label': u'Planning'}]","[{u'user_id': u'199', u'type_id': u'3', u'url': u'https://ompnetwork.s3-us-west-2.amazonaws.com/sites/199/granicus_files/781_calendar_1323673200.html', u'storage': u'external', u'session_id': u'8457', u'label': None, u'file_id': None, u'provider': u'generic', u'agenda_provider_agenda_id': None, u'session_title': u'Planning Commission Regular Meeting  - 12/12/11', u'type': u'Calendar', u'id': u'2737', u'agenda_provider_id': None}]"
81,3851,[16],"Toxics Board Meeting October 24, 2012","Toxics Board Meeting October 24, 2012",,0,,134.0,2017-07-15,2012-10-24,2017-07-20,wx-WDmWoDTc,https://youtu.be/wx-WDmWoDTc,46.0,Toxics Board,1794.0,https://ompnetwork.s3-us-west-2.amazonaws.com/sites/134/documents/archive.aspxadid1967?2ynRrz0.ZddExlhwhzLBuQuelRyk_41b,"[{u'livestream': u'0', u'position': u'0', u'user_id': u'134', u'id': u'46', u'label': u'Toxics Board'}]","[{u'user_id': u'134', u'type_id': u'1', u'url': u'https://ompnetwork.s3-us-west-2.amazonaws.com/sites/134/documents/archive.aspxadid1967?2ynRrz0.ZddExlhwhzLBuQuelRyk_41b', u'storage': u'attachment', u'session_id': u'3851', u'label': None, u'file_id': u'1932', u'provider': u'generic', u'agenda_provider_agenda_id': None, u'session_title': u'Toxics Board Meeting October 24, 2012', u'type': u'Agenda', u'id': u'1794', u'agenda_provider_id': None}]"
82,2527,"[0, 18]","Board of Commissioners Morning Meeting: March 17, 2015","Board of Commissioners Morning Meeting: March 17, 2015",,0,,143.0,2017-05-10,2015-03-17,2017-05-10,OMlzZwJGaxA,https://www.youtube.com/watch?v=OMlzZwJGaxA,25.0,Board of County Commissioners,,,"[{u'livestream': u'1', u'position': u'0', u'user_id': u'143', u'id': u'25', u'label': u'Board of County Commissioners'}]",
83,9908,"[0, 1, 6, 7, 13, 16]",LIFT - 1/8/2015,LIFT - 1/8/2015,,0,,199.0,2015-01-08,2015-01-08,2017-08-02,FX3U9ajI-c8,https://www.youtube.com/watch?v=FX3U9ajI-c8,73.0,LIFT,3267.0,https://ompnetwork.s3-us-west-2.amazonaws.com/sites/199/granicus_files/1388_calendar_1420700400.pdf,"[{u'livestream': u'0', u'position': u'0', u'user_id': u'199', u'id': u'73', u'label': u'LIFT'}]","[{u'user_id': u'199', u'type_id': u'3', u'url': u'https://ompnetwork.s3-us-west-2.amazonaws.com/sites/199/granicus_files/1388_calendar_1420700400.pdf', u'storage': u'external', u'session_id': u'9908', u'label': None, u'file_id': None, u'provider': u'generic', u'agenda_provider_agenda_id': None, u'session_title': u'LIFT - 1/8/2015', u'type': u'Calendar', u'id': u'3267', u'agenda_provider_id': None}]"
84,7972,"[3, 5, 16, 17]",City Council - Special Meeting - 10/13/09,City Council - Special Meeting - 10/13/09,,0,,199.0,2009-10-13,2009-10-13,2017-08-01,DwWhTLTrMkg,https://www.youtube.com/watch?v=DwWhTLTrMkg,69.0,Council,2600.0,https://ompnetwork.s3-us-west-2.amazonaws.com/sites/199/documents/cc_agenda_10-13-2009.pdf?wxk5vvEg6l5y1RhBeQEsLpno7q8lZBxk,"[{u'livestream': u'1', u'position': u'0', u'user_id': u'199', u'id': u'69', u'label': u'Council'}]","[{u'user_id': u'199', u'type_id': u'1', u'url': u'https://ompnetwork.s3-us-west-2.amazonaws.com/sites/199/documents/cc_agenda_10-13-2009.pdf?wxk5vvEg6l5y1RhBeQEsLpno7q8lZBxk', u'storage': u'attachment', u'session_id': u'7972', u'label': None, u'file_id': u'2561', u'provider': u'generic', u'agenda_provider_agenda_id': None, u'session_title': u'City Council - Special Meeting - 10/13/09', u'type': u'Agenda', u'id': u'2600', u'agenda_provider_id': None}, {u'user_id': u'199', u'type_id': u'3', u'url': u'https://ompnetwork.s3-us-west-2.amazonaws.com/sites/199/granicus_files/335_calendar_1255413600.html', u'storage': u'external', u'session_id': u'7972', u'label': None, u'file_id': None, u'provider': u'generic', u'agenda_provider_agenda_id': None, u'session_title': u'City Council - Special Meeting - 10/13/09', u'type': u'Calendar', u'id': u'2601', u'agenda_provider_id': None}, {u'user_id': u'199', u'type_id': u'2', u'url': u'https://ompnetwork.s3-us-west-2.amazonaws.com/sites/199/documents/cc_minutes_10-13-2009.pdf?hm4Pb5cxXWDphS.lTAfrkeUzWDb3yvxZ', u'storage': u'attachment', u'session_id': u'7972', u'label': None, u'file_id': u'2562', u'provider': u'generic', u'agenda_provider_agenda_id': None, u'session_title': u'City Council - Special Meeting - 10/13/09', u'type': u'Journal', u'id': u'2602', u'agenda_provider_id': None}, {u'user_id': u'199', u'type_id': u'5', u'url': u'https://ompnetwork.s3-us-west-2.amazonaws.com/sites/199/documents/cc_packet_10-13-2009.pdf?ArFOqmXORDDTkX6jQT4aEn26ljuJEBEC', u'storage': u'attachment', u'session_id': u'7972', u'label': None, u'file_id': u'2563', u'provider': u'generic', u'agenda_provider_agenda_id': None, u'session_title': u'City Council - Special Meeting - 10/13/09', u'type': u'Packet', u'id': u'2603', u'agenda_provider_id': None}]"
85,491,"[6, 12, 13]",City Council Work Session 01-16-2013,City Council Work Session 01-16-2013,,0,shows/city-council-work-session-01-16-2013,134.0,2013-01-16,2013-01-16,2017-03-20,9pNWIiWD1ck,https://www.youtube.com/watch?v=9pNWIiWD1ck,20.0,City Council,599.0,https://ompnetwork.s3-us-west-2.amazonaws.com/sites/134/documents/agenda_45.pdf,"[{u'livestream': u'1', u'position': u'-10', u'user_id': u'134', u'id': u'20', u'label': u'City Council'}]","[{u'user_id': u'134', u'type_id': u'1', u'url': u'https://ompnetwork.s3-us-west-2.amazonaws.com/sites/134/documents/agenda_45.pdf', u'storage': u'attachment', u'session_id': u'491', u'label': None, u'file_id': u'669', u'provider': u'generic', u'agenda_provider_agenda_id': None, u'session_title': u'City Council Work Session 01-16-2013', u'type': u'Agenda', u'id': u'599', u'agenda_provider_id': None}, {u'user_id': u'134', u'type_id': u'4', u'url': u'https://ompnetwork.s3-us-west-2.amazonaws.com/sites/134/documents/minutes_42_0.pdf', u'storage': u'attachment', u'session_id': u'491', u'label': None, u'file_id': u'670', u'provider': u'generic', u'agenda_provider_agenda_id': None, u'session_title': u'City Council Work Session 01-16-2013', u'type': u'Minutes', u'id': u'600', u'agenda_provider_id': None}]"
86,2534,"[4, 12]","Board of Commissioners Morning Meeting: April 22, 2015","Board of Commissioners Morning Meeting: April 22, 2015",,0,,143.0,2017-05-10,2015-04-22,2017-05-10,KFzRLpKwKF0,https://www.youtube.com/watch?v=KFzRLpKwKF0,25.0,Board of County Commissioners,,,"[{u'livestream': u'1', u'position': u'0', u'user_id': u'143', u'id': u'25', u'label': u'Board of County Commissioners'}]",
87,3889,"[0, 12, 13, 16]","Eugene Police Commission Meeting April 10, 2014","Eugene Police Commission Meeting April 10, 2014",,0,,134.0,2017-07-17,2014-04-10,2017-07-17,5njXdYKJrzg,https://youtu.be/5njXdYKJrzg,45.0,Police Commission,1680.0,https://ompnetwork.s3-us-west-2.amazonaws.com/sites/134/documents/2014_04_10_pc_rn3054_1.pdf,"[{u'livestream': u'0', u'position': u'0', u'user_id': u'134', u'id': u'45', u'label': u'Police Commission'}]","[{u'user_id': u'134', u'type_id': u'1', u'url': u'https://ompnetwork.s3-us-west-2.amazonaws.com/sites/134/documents/2014_04_10_pc_rn3054_1.pdf', u'storage': u'attachment', u'session_id': u'3889', u'label': None, u'file_id': u'1836', u'provider': u'generic', u'agenda_provider_agenda_id': None, u'session_title': u'Eugene Police Commission Meeting April 10, 2014', u'type': u'Agenda', u'id': u'1680', u'agenda_provider_id': None}]"
88,663,"[8, 18]",City Council Work Session 11-16-2011,City Council Work Session 11-16-2011,,0,shows/city-council-work-session-11-16-2011,134.0,2011-11-16,2011-11-16,2017-03-20,NCAuUWDoGyA,https://www.youtube.com/watch?v=NCAuUWDoGyA,20.0,City Council,859.0,https://ompnetwork.s3-us-west-2.amazonaws.com/sites/134/documents/agenda_57.pdf,"[{u'livestream': u'1', u'position': u'-10', u'user_id': u'134', u'id': u'20', u'label': u'City Council'}]","[{u'user_id': u'134', u'type_id': u'1', u'url': u'https://ompnetwork.s3-us-west-2.amazonaws.com/sites/134/documents/agenda_57.pdf', u'storage': u'attachment', u'session_id': u'663', u'label': None, u'file_id': u'930', u'provider': u'generic', u'agenda_provider_agenda_id': None, u'session_title': u'City Council Work Session 11-16-2011', u'type': u'Agenda', u'id': u'859', u'agenda_provider_id': None}, {u'user_id': u'134', u'type_id': u'4', u'url': u'https://ompnetwork.s3-us-west-2.amazonaws.com/sites/134/documents/minutes_180_0.pdf', u'storage': u'attachment', u'session_id': u'663', u'label': None, u'file_id': u'931', u'provider': u'generic', u'agenda_provider_agenda_id': None, u'session_title': u'City Council Work Session 11-16-2011', u'type': u'Minutes', u'id': u'860', u'agenda_provider_id': None}]"
89,646,"[7, 13, 16]",Emergency Work Session 12-20-2011,Emergency Work Session 12-20-2011,,0,shows/emergency-work-session-12-20-2011,134.0,2011-12-20,2011-12-20,2017-03-20,lRuIqSdDWHY,https://www.youtube.com/watch?v=lRuIqSdDWHY,20.0,City Council,833.0,https://ompnetwork.s3-us-west-2.amazonaws.com/sites/134/documents/agenda_32.pdf,"[{u'livestream': u'1', u'position': u'-10', u'user_id': u'134', u'id': u'20', u'label': u'City Council'}]","[{u'user_id': u'134', u'type_id': u'1', u'url': u'https://ompnetwork.s3-us-west-2.amazonaws.com/sites/134/documents/agenda_32.pdf', u'storage': u'attachment', u'session_id': u'646', u'label': None, u'file_id': u'904', u'provider': u'generic', u'agenda_provider_agenda_id': None, u'session_title': u'Emergency Work Session 12-20-2011', u'type': u'Agenda', u'id': u'833', u'agenda_provider_id': None}, {u'user_id': u'134', u'type_id': u'4', u'url': u'https://ompnetwork.s3-us-west-2.amazonaws.com/sites/134/documents/minutes_171_0.pdf', u'storage': u'attachment', u'session_id': u'646', u'label': None, u'file_id': u'905', u'provider': u'generic', u'agenda_provider_agenda_id': None, u'session_title': u'Emergency Work Session 12-20-2011', u'type': u'Minutes', u'id': u'834', u'agenda_provider_id': None}]"
90,20164,"[2, 13, 17]",11/7/17 Board Meeting,11/7/17 Board Meeting,,0,,172.0,2017-11-09,2017-11-07,2017-11-09,cA5-xy9ll0U,https://youtu.be/cA5-xy9ll0U,101.0,Board of Trustees,4724.0,https://ompnetwork.s3-us-west-2.amazonaws.com/sites/172/documents/11.07.17agenda.pdf?sAKLQPPweyTFUfoQIM1DVUvSN8g0m3fP,"[{u'livestream': u'0', u'position': u'0', u'user_id': u'172', u'id': u'101', u'label': u'Board of Trustees'}]","[{u'user_id': u'172', u'type_id': u'1', u'url': u'https://ompnetwork.s3-us-west-2.amazonaws.com/sites/172/documents/11.07.17agenda.pdf?sAKLQPPweyTFUfoQIM1DVUvSN8g0m3fP', u'storage': u'attachment', u'session_id': u'20164', u'label': None, u'file_id': u'4056', u'provider': u'generic', u'agenda_provider_agenda_id': None, u'session_title': u'11/7/17 Board Meeting', u'type': u'Agenda', u'id': u'4724', u'agenda_provider_id': None}]"
91,2547,"[12, 16, 18, 19]","Budget Committee Meeting: May 5, 2015","Budget Committee Meeting: May 5, 2015",,0,,143.0,2017-05-10,2015-05-05,2017-05-10,7HBFcm8U8s0,https://www.youtube.com/watch?v=7HBFcm8U8s0,28.0,Budget Committee,,,"[{u'livestream': u'1', u'position': u'0', u'user_id': u'143', u'id': u'28', u'label': u'Budget Committee'}]",
92,3314,[],Water Conservation 2014 PSA - Soggy Situation,Water Conservation 2014 PSA - Soggy Situation,"<p>The city of Thornton's Water Conservation 2014 PSA - Soggy Situation</p>

<p>For more information be sure to visit <a href=""http://www.thorntonwater.com"">www.thorntonwater.com</a></p>
",0,,186.0,2014-06-30,2014-06-30,2017-07-11,7U_225vRBmM,https://www.youtube.com/watch?feature=player_detailpage&v=7U_225vRBmM,62.0,PSAs,,,"[{u'livestream': u'0', u'position': u'-5', u'user_id': u'186', u'id': u'62', u'label': u'PSAs'}]",
93,2541,"[12, 13, 18, 19]","Budget Committee Meeting: May 14, 2015","Budget Committee Meeting: May 14, 2015",,0,,143.0,2017-05-10,2015-05-14,2017-05-10,CBMuXO4VA58,https://www.youtube.com/watch?v=CBMuXO4VA58,28.0,Budget Committee,,,"[{u'livestream': u'1', u'position': u'0', u'user_id': u'143', u'id': u'28', u'label': u'Budget Committee'}]",
94,824,"[0, 10, 16]",City Council Work Session 11-17-2010,City Council Work Session 11-17-2010,,0,shows/city-council-work-session-11-17-2010,134.0,2010-11-17,2010-11-17,2017-03-20,YZgckO0eIzs,https://www.youtube.com/watch?v=YZgckO0eIzs,20.0,City Council,1098.0,https://ompnetwork.s3-us-west-2.amazonaws.com/sites/134/documents/agenda_195.pdf,"[{u'livestream': u'1', u'position': u'-10', u'user_id': u'134', u'id': u'20', u'label': u'City Council'}]","[{u'user_id': u'134', u'type_id': u'1', u'url': u'https://ompnetwork.s3-us-west-2.amazonaws.com/sites/134/documents/agenda_195.pdf', u'storage': u'attachment', u'session_id': u'824', u'label': None, u'file_id': u'1169', u'provider': u'generic', u'agenda_provider_agenda_id': None, u'session_title': u'City Council Work Session 11-17-2010', u'type': u'Agenda', u'id': u'1098', u'agenda_provider_id': None}, {u'user_id': u'134', u'type_id': u'4', u'url': u'https://ompnetwork.s3-us-west-2.amazonaws.com/sites/134/documents/minutes_253.pdf', u'storage': u'attachment', u'session_id': u'824', u'label': None, u'file_id': u'1170', u'provider': u'generic', u'agenda_provider_agenda_id': None, u'session_title': u'City Council Work Session 11-17-2010', u'type': u'Minutes', u'id': u'1099', u'agenda_provider_id': None}]"
95,2546,"[3, 6, 7]","Board of Commissioners Afternoon Meeting: May 5, 2015","Board of Commissioners Afternoon Meeting: May 5, 2015",,0,,143.0,2017-05-10,2015-05-05,2017-05-10,ZXVmDgvekkE,https://www.youtube.com/watch?v=ZXVmDgvekkE,25.0,Board of County Commissioners,,,"[{u'livestream': u'1', u'position': u'0', u'user_id': u'143', u'id': u'25', u'label': u'Board of County Commissioners'}]",
96,2538,"[0, 2, 3, 7]","Board of Commissioners Afternoon Meeting: May 12, 2015","Board of Commissioners Afternoon Meeting: May 12, 2015",,0,,143.0,2017-05-10,2015-05-12,2017-05-10,gVWYFRBe2HI,https://www.youtube.com/watch?v=gVWYFRBe2HI,25.0,Board of County Commissioners,,,"[{u'livestream': u'1', u'position': u'0', u'user_id': u'143', u'id': u'25', u'label': u'Board of County Commissioners'}]",
97,2552,"[1, 7, 18]","Board of Commissioners Afternoon Meeting: June 23, 2015","Board of Commissioners Afternoon Meeting: June 23, 2015",,0,,143.0,2017-05-10,2015-06-23,2017-05-10,9GZk7GjE7-0,https://www.youtube.com/watch?v=9GZk7GjE7-0,25.0,Board of County Commissioners,,,"[{u'livestream': u'1', u'position': u'0', u'user_id': u'143', u'id': u'25', u'label': u'Board of County Commissioners'}]",
98,20942,"[3, 5]",Regular City Council Meeting,Regular City Council Meeting,,0,,246.0,2017-12-05,2017-12-05,2017-12-06,fHMUa5D9IX8,https://youtu.be/fHMUa5D9IX8,104.0,City Council Meetings,4807.0,https://ompnetwork.s3-us-west-2.amazonaws.com/sites/246/documents/120517_regular_meeting_novusagenda.pdf?WsmlmrdORAV8wBCB_9Xvk0mwzsezNyEW,"[{u'livestream': u'1', u'position': u'0', u'user_id': u'246', u'id': u'104', u'label': u'City Council Meetings'}]","[{u'user_id': u'246', u'type_id': u'1', u'url': u'https://ompnetwork.s3-us-west-2.amazonaws.com/sites/246/documents/120517_regular_meeting_novusagenda.pdf?WsmlmrdORAV8wBCB_9Xvk0mwzsezNyEW', u'storage': u'attachment', u'session_id': u'20942', u'label': None, u'file_id': u'4160', u'provider': u'generic', u'agenda_provider_agenda_id': None, u'session_title': u'Regular City Council Meeting', u'type': u'Agenda', u'id': u'4807', u'agenda_provider_id': None}]"
99,19819,"[0, 5]",Town of New Castle Zoning Board Meeting  10/25/147,Town of New Castle Zoning Board Meeting  10/25/147,,0,,281.0,2017-11-01,2017-10-25,2017-11-01,wzz7fTltDYs,https://youtu.be/wzz7fTltDYs,157.0,Town of New Castle Zoning Board Meetings,4683.0,https://ompnetwork.s3-us-west-2.amazonaws.com/sites/281/documents/october_25_2017.rev_.eg_.pdf?e.mcha8UckMOLFethBsu_Qu84EjZfISX,"[{u'livestream': u'0', u'position': u'-7', u'user_id': u'281', u'id': u'157', u'label': u'Town of New Castle Zoning Board Meetings'}]","[{u'user_id': u'281', u'type_id': u'1', u'url': u'https://ompnetwork.s3-us-west-2.amazonaws.com/sites/281/documents/october_25_2017.rev_.eg_.pdf?e.mcha8UckMOLFethBsu_Qu84EjZfISX', u'storage': u'attachment', u'session_id': u'19819', u'label': None, u'file_id': u'3981', u'provider': u'generic', u'agenda_provider_agenda_id': None, u'session_title': u'Town of New Castle Zoning Board Meeting  10/25/147', u'type': u'Agenda', u'id': u'4683', u'agenda_provider_id': None}]"
100,2554,"[4, 12, 16]","Board of Commissioners Afternoon Meeting: June 2, 2015","Board of Commissioners Afternoon Meeting: June 2, 2015",,0,,143.0,2017-05-10,2015-06-02,2017-05-10,Zg4tZUsgEIo,https://www.youtube.com/watch?v=Zg4tZUsgEIo,25.0,Board of County Commissioners,,,"[{u'livestream': u'1', u'position': u'0', u'user_id': u'143', u'id': u'25', u'label': u'Board of County Commissioners'}]",
101,2526,"[0, 11, 12, 18]","Board of Commissioners Morning Meeting: March 10, 2015","Board of Commissioners Morning Meeting: March 10, 2015",,0,,143.0,2017-05-10,2015-03-10,2017-05-10,jXFor2m3MTk,https://www.youtube.com/watch?v=jXFor2m3MTk,25.0,Board of County Commissioners,,,"[{u'livestream': u'1', u'position': u'0', u'user_id': u'143', u'id': u'25', u'label': u'Board of County Commissioners'}]",
102,2578,"[8, 11]","Board of Commissioners Morning Meeting: September 1, 2015","Board of Commissioners Morning Meeting: September 1, 2015",,0,,143.0,2017-05-10,2015-09-01,2017-05-10,5XnnDXP8KDw,https://www.youtube.com/watch?v=5XnnDXP8KDw,25.0,Board of County Commissioners,,,"[{u'livestream': u'1', u'position': u'0', u'user_id': u'143', u'id': u'25', u'label': u'Board of County Commissioners'}]",
103,2542,"[7, 9, 18]","Board of Commissioners Morning Meeting: May 19, 2015","Board of Commissioners Morning Meeting: May 19, 2015",,0,,143.0,2017-05-10,2015-05-19,2017-05-10,L0lk9pRtnz8,https://www.youtube.com/watch?v=L0lk9pRtnz8,25.0,Board of County Commissioners,,,"[{u'livestream': u'1', u'position': u'0', u'user_id': u'143', u'id': u'25', u'label': u'Board of County Commissioners'}]",
104,2551,"[6, 12, 15]","Board of Commissioners Morning Meeting: June 23, 2015","Board of Commissioners Morning Meeting: June 23, 2015",,0,,143.0,2017-05-10,2015-06-23,2017-05-10,5Eda9eVlioU,https://www.youtube.com/watch?v=5Eda9eVlioU,25.0,Board of County Commissioners,,,"[{u'livestream': u'1', u'position': u'0', u'user_id': u'143', u'id': u'25', u'label': u'Board of County Commissioners'}]",
105,385,"[0, 7, 15, 16]",City Council Work Session 01-29-2014,City Council Work Session 01-29-2014,,0,shows/city-council-work-session-01-29-2014,134.0,2014-01-29,2014-01-29,2017-03-20,k5EfgBhu0yE,https://www.youtube.com/watch?v=k5EfgBhu0yE,20.0,City Council,403.0,https://ompnetwork.s3-us-west-2.amazonaws.com/sites/134/documents/agenda_packet_203.pdf,"[{u'livestream': u'1', u'position': u'-10', u'user_id': u'134', u'id': u'20', u'label': u'City Council'}]","[{u'user_id': u'134', u'type_id': u'1', u'url': u'https://ompnetwork.s3-us-west-2.amazonaws.com/sites/134/documents/agenda_packet_203.pdf', u'storage': u'attachment', u'session_id': u'385', u'label': None, u'file_id': u'473', u'provider': u'generic', u'agenda_provider_agenda_id': None, u'session_title': u'City Council Work Session 01-29-2014', u'type': u'Agenda', u'id': u'403', u'agenda_provider_id': None}, {u'user_id': u'134', u'type_id': u'4', u'url': u'https://ompnetwork.s3-us-west-2.amazonaws.com/sites/134/documents/minutes_158.pdf', u'storage': u'attachment', u'session_id': u'385', u'label': None, u'file_id': u'474', u'provider': u'generic', u'agenda_provider_agenda_id': None, u'session_title': u'City Council Work Session 01-29-2014', u'type': u'Minutes', u'id': u'404', u'agenda_provider_id': None}]"
106,23686,"[6, 11]",AFTER 05/09/17 - BASALT COUNCIL,AFTER 05/09/17 - BASALT COUNCIL,,0,,296.0,2017-05-09,2017-05-09,2018-01-17,OfyAoB89fKs,https://www.youtube.com/watch?v=OfyAoB89fKs,197.0,Town Council,,,"[{u'livestream': u'1', u'position': u'0', u'user_id': u'296', u'id': u'197', u'label': u'Town Council'}]",
107,2529,[9],"Board of Commissioners Morning Meeting: March 31, 2015","Board of Commissioners Morning Meeting: March 31, 2015",,0,,143.0,2017-05-10,2015-03-31,2017-05-10,m2S1lAi2j-k,https://www.youtube.com/watch?v=m2S1lAi2j-k,25.0,Board of County Commissioners,,,"[{u'livestream': u'1', u'position': u'0', u'user_id': u'143', u'id': u'25', u'label': u'Board of County Commissioners'}]",
108,20730,"[2, 5, 6, 17]",Town of New Castle Zoning Board Meeting 11/29/17,Town of New Castle Zoning Board Meeting 11/29/17,,0,,281.0,2017-11-28,2017-11-29,2017-11-30,JbDoPg1n5yI,https://youtu.be/JbDoPg1n5yI,157.0,Town of New Castle Zoning Board Meetings,4776.0,https://ompnetwork.s3-us-west-2.amazonaws.com/sites/281/documents/november_29_2017.rev_.eg_.pdf?L.iG.0Ky6CqCNd3XUk.NsaTJsHlKMIuL,"[{u'livestream': u'0', u'position': u'-7', u'user_id': u'281', u'id': u'157', u'label': u'Town of New Castle Zoning Board Meetings'}]","[{u'user_id': u'281', u'type_id': u'1', u'url': u'https://ompnetwork.s3-us-west-2.amazonaws.com/sites/281/documents/november_29_2017.rev_.eg_.pdf?L.iG.0Ky6CqCNd3XUk.NsaTJsHlKMIuL', u'storage': u'attachment', u'session_id': u'20730', u'label': None, u'file_id': u'4127', u'provider': u'generic', u'agenda_provider_agenda_id': None, u'session_title': u'Town of New Castle Zoning Board Meeting 11/29/17', u'type': u'Agenda', u'id': u'4776', u'agenda_provider_id': None}]"
109,744,[16],City Council Work Session 05-09-2011,City Council Work Session 05-09-2011,,0,shows/city-council-work-session-05-09-2011,134.0,2011-05-09,2011-05-09,2017-03-20,JI9BRUw4hBU,https://www.youtube.com/watch?v=JI9BRUw4hBU,20.0,City Council,985.0,https://ompnetwork.s3-us-west-2.amazonaws.com/sites/134/documents/agenda_166.pdf,"[{u'livestream': u'1', u'position': u'-10', u'user_id': u'134', u'id': u'20', u'label': u'City Council'}]","[{u'user_id': u'134', u'type_id': u'1', u'url': u'https://ompnetwork.s3-us-west-2.amazonaws.com/sites/134/documents/agenda_166.pdf', u'storage': u'attachment', u'session_id': u'744', u'label': None, u'file_id': u'1056', u'provider': u'generic', u'agenda_provider_agenda_id': None, u'session_title': u'City Council Work Session 05-09-2011', u'type': u'Agenda', u'id': u'985', u'agenda_provider_id': None}, {u'user_id': u'134', u'type_id': u'4', u'url': u'https://ompnetwork.s3-us-west-2.amazonaws.com/sites/134/documents/minutes_224.pdf', u'storage': u'attachment', u'session_id': u'744', u'label': None, u'file_id': u'1057', u'provider': u'generic', u'agenda_provider_agenda_id': None, u'session_title': u'City Council Work Session 05-09-2011', u'type': u'Minutes', u'id': u'986', u'agenda_provider_id': None}]"
110,2583,"[6, 7, 10, 12]","Board of Commissioners Afternoon Meeting: October 20, 2015","Board of Commissioners Afternoon Meeting: October 20, 2015",,0,,143.0,2017-05-11,2015-10-20,2017-05-11,5qNG-dhH6qY,https://www.youtube.com/watch?v=5qNG-dhH6qY,25.0,Board of County Commissioners,,,"[{u'livestream': u'1', u'position': u'0', u'user_id': u'143', u'id': u'25', u'label': u'Board of County Commissioners'}]",
111,2579,"[8, 10, 12, 18]","Board of Commissioners Afternoon Meeting: September 15, 2015","Board of Commissioners Afternoon Meeting: September 15, 2015",,0,,143.0,2017-05-10,2015-09-15,2017-05-10,l3pZZ5r7-Q0,https://www.youtube.com/watch?v=l3pZZ5r7-Q0,25.0,Board of County Commissioners,,,"[{u'livestream': u'1', u'position': u'0', u'user_id': u'143', u'id': u'25', u'label': u'Board of County Commissioners'}]",
112,20944,"[0, 3, 12, 18]","Thornton City Council Meeting - December 5, 2017","Thornton City Council Meeting - December 5, 2017","To access the closed caption information associated with this video, click the CC icon in the lower right corner of the video player.

View more information on Thornton's City Council&nbsp;<a href=""http://www.cityofthornton.net/government/city-council/Pages/default.aspx"">here.</a>
",0,,186.0,2017-12-05,2017-12-05,2017-12-06,1SUsOtCPp1Y,https://www.youtube.com/watch?v=1SUsOtCPp1Y,58.0,City Council Meeting,4809.0,https://docs.google.com/document/d/e/2PACX-1vTI7OQY1hvcYruNeqN-H_xIWVpmZtYu9f595dYFpOG_Xp99UMeWZeQZN7yu32MKQ5MOl8sUQGgAu7lz/pub,"[{u'livestream': u'1', u'position': u'-10', u'user_id': u'186', u'id': u'58', u'label': u'City Council Meeting'}]","[{u'user_id': u'186', u'type_id': u'1', u'url': u'https://docs.google.com/document/d/e/2PACX-1vTI7OQY1hvcYruNeqN-H_xIWVpmZtYu9f595dYFpOG_Xp99UMeWZeQZN7yu32MKQ5MOl8sUQGgAu7lz/pub', u'storage': u'external', u'session_id': u'20944', u'label': None, u'file_id': None, u'provider': u'om_googledrive', u'agenda_provider_agenda_id': None, u'session_title': u'Thornton City Council Meeting - December 5, 2017', u'type': u'Agenda', u'id': u'4809', u'agenda_provider_id': None}]"
113,2582,"[1, 12, 14, 17]","Board of Commissioners Morning Meeting: October 20, 2015","Board of Commissioners Morning Meeting: October 20, 2015",,0,,143.0,2017-05-11,2015-10-20,2017-05-11,HSVyScygmkk,https://www.youtube.com/watch?v=HSVyScygmkk,25.0,Board of County Commissioners,,,"[{u'livestream': u'1', u'position': u'0', u'user_id': u'143', u'id': u'25', u'label': u'Board of County Commissioners'}]",
114,2584,"[1, 12, 18]","Board of Commissioners Morning Meeting: October 21, 2015","Board of Commissioners Morning Meeting: October 21, 2015",,0,,143.0,2017-05-11,2015-10-21,2017-05-11,LE5EhhtL8iE,https://www.youtube.com/watch?v=LE5EhhtL8iE,25.0,Board of County Commissioners,,,"[{u'livestream': u'1', u'position': u'0', u'user_id': u'143', u'id': u'25', u'label': u'Board of County Commissioners'}]",
115,2597,"[11, 12, 13]","Board of Commissioners Morning Meeting: December 15, 2015","Board of Commissioners Morning Meeting: December 15, 2015",,0,,143.0,2017-05-11,2015-12-15,2017-05-11,1QoGlEEMJEY,https://www.youtube.com/watch?v=1QoGlEEMJEY,25.0,Board of County Commissioners,,,"[{u'livestream': u'1', u'position': u'0', u'user_id': u'143', u'id': u'25', u'label': u'Board of County Commissioners'}]",
116,2537,"[0, 12, 17]","Board of Commissioners Morning Meeting: May 12, 2015","Board of Commissioners Morning Meeting: May 12, 2015",,0,,143.0,2017-05-10,2015-05-12,2017-05-10,kggrQ-J-y_U,https://www.youtube.com/watch?v=kggrQ-J-y_U,25.0,Board of County Commissioners,,,"[{u'livestream': u'1', u'position': u'0', u'user_id': u'143', u'id': u'25', u'label': u'Board of County Commissioners'}]",
117,746,"[3, 7, 11]",Planning Commission  11-05-2012,Planning Commission  11-05-2012,,0,shows/planning-commission-11-05-2012,134.0,2012-11-05,2012-11-05,2017-03-20,ehqraS6BuaI,https://www.youtube.com/watch?v=ehqraS6BuaI,22.0,Planning Commission,988.0,https://ompnetwork.s3-us-west-2.amazonaws.com/sites/134/documents/agenda_packet_180.pdf,"[{u'livestream': u'1', u'position': u'-9', u'user_id': u'134', u'id': u'22', u'label': u'Planning Commission'}]","[{u'user_id': u'134', u'type_id': u'1', u'url': u'https://ompnetwork.s3-us-west-2.amazonaws.com/sites/134/documents/agenda_packet_180.pdf', u'storage': u'attachment', u'session_id': u'746', u'label': None, u'file_id': u'1059', u'provider': u'generic', u'agenda_provider_agenda_id': None, u'session_title': u'Planning Commission  11-05-2012', u'type': u'Agenda', u'id': u'988', u'agenda_provider_id': None}]"
118,890,"[16, 19]",Council Work Session 03-08-2010,Council Work Session 03-08-2010,,0,shows/council-work-session-03-08-2010,134.0,2010-03-08,2010-03-08,2017-03-20,ofuwQe9g63c,https://www.youtube.com/watch?v=ofuwQe9g63c,20.0,City Council,1226.0,https://ompnetwork.s3-us-west-2.amazonaws.com/sites/134/documents/agenda_249.pdf,"[{u'livestream': u'1', u'position': u'-10', u'user_id': u'134', u'id': u'20', u'label': u'City Council'}]","[{u'user_id': u'134', u'type_id': u'1', u'url': u'https://ompnetwork.s3-us-west-2.amazonaws.com/sites/134/documents/agenda_249.pdf', u'storage': u'attachment', u'session_id': u'890', u'label': None, u'file_id': u'1297', u'provider': u'generic', u'agenda_provider_agenda_id': None, u'session_title': u'Council Work Session 03-08-2010', u'type': u'Agenda', u'id': u'1226', u'agenda_provider_id': None}, {u'user_id': u'134', u'type_id': u'4', u'url': u'https://ompnetwork.s3-us-west-2.amazonaws.com/sites/134/documents/minutes_307.pdf', u'storage': u'attachment', u'session_id': u'890', u'label': None, u'file_id': u'1298', u'provider': u'generic', u'agenda_provider_agenda_id': None, u'session_title': u'Council Work Session 03-08-2010', u'type': u'Minutes', u'id': u'1227', u'agenda_provider_id': None}]"
119,23630,"[5, 6, 11, 16, 19]",Basalt Council 05/09/17,Basalt Council 05/09/17,,0,,296.0,2017-05-09,2017-05-09,2018-01-17,F6ESPSmGl-c,https://www.youtube.com/watch?v=F6ESPSmGl-c,197.0,Town Council,5027.0,https://ompnetwork.s3-us-west-2.amazonaws.com/sites/296/documents/btc_05-09-17_council_agenda.pdf?QKIq0YFKLB8fDR4QLaayN_VIJZTiOpO5,"[{u'livestream': u'1', u'position': u'0', u'user_id': u'296', u'id': u'197', u'label': u'Town Council'}]","[{u'user_id': u'296', u'type_id': u'1', u'url': u'https://ompnetwork.s3-us-west-2.amazonaws.com/sites/296/documents/btc_05-09-17_council_agenda.pdf?QKIq0YFKLB8fDR4QLaayN_VIJZTiOpO5', u'storage': u'attachment', u'session_id': u'23630', u'label': None, u'file_id': u'4441', u'provider': u'generic', u'agenda_provider_agenda_id': None, u'session_title': u'Basalt Council 05/09/17', u'type': u'Agenda', u'id': u'5027', u'agenda_provider_id': None}]"
120,2592,"[12, 18, 19]","Board of Commissioners Morning Meeting: December 1, 2015","Board of Commissioners Morning Meeting: December 1, 2015",,0,,143.0,2017-05-11,2015-12-01,2017-05-11,zgnbNrVwgu0,https://www.youtube.com/watch?v=zgnbNrVwgu0,25.0,Board of County Commissioners,,,"[{u'livestream': u'1', u'position': u'0', u'user_id': u'143', u'id': u'25', u'label': u'Board of County Commissioners'}]",
121,2532,"[0, 13, 18, 19]","Board of Commissioners Morning Meeting: April 21, 2015","Board of Commissioners Morning Meeting: April 21, 2015",,0,,143.0,2017-05-10,2015-04-14,2017-05-10,MJCBtC3VGAQ,https://www.youtube.com/watch?v=MJCBtC3VGAQ,25.0,Board of County Commissioners,,,"[{u'livestream': u'1', u'position': u'0', u'user_id': u'143', u'id': u'25', u'label': u'Board of County Commissioners'}]",
122,2585,"[12, 18]","Board of Commissioners Morning Meeting: October 27, 2015","Board of Commissioners Morning Meeting: October 27, 2015",,0,,143.0,2017-05-11,2015-10-27,2017-05-11,yVUizHC-euo,https://www.youtube.com/watch?v=yVUizHC-euo,25.0,Board of County Commissioners,,,"[{u'livestream': u'1', u'position': u'0', u'user_id': u'143', u'id': u'25', u'label': u'Board of County Commissioners'}]",
123,2528,"[3, 6, 7]","Board of Commissioners Afternoon Meeting: March 17, 2015","Board of Commissioners Afternoon Meeting: March 17, 2015",,0,,143.0,2017-05-10,2015-03-17,2017-05-10,WgeC8kllmOA,https://www.youtube.com/watch?v=WgeC8kllmOA,25.0,Board of County Commissioners,,,"[{u'livestream': u'1', u'position': u'0', u'user_id': u'143', u'id': u'25', u'label': u'Board of County Commissioners'}]",
124,15067,[0],"Thornton City Council Special Meeting - October 3, 2017","Thornton City Council Special Meeting - October 3, 2017","To access the closed caption information associated with this video, click the CC icon in the lower right corner of the video player.

View more information on Thornton's City Council&nbsp;<a href=""http://www.cityofthornton.net/government/city-council/Pages/default.aspx"">here.</a>
",0,,186.0,2017-10-02,2017-10-03,2017-10-05,CJ3rCZ860bc,https://www.youtube.com/watch?v=CJ3rCZ860bc,58.0,City Council Meeting,4092.0,https://docs.google.com/document/d/e/2PACX-1vTNqjeULXG5L0_QEMo2wurlE4IEPoySKuiZcZzuD3wS-VNgjO-FuTLv3phOOhguCdHGzfPg1VoTR_EO/pub,"[{u'livestream': u'1', u'position': u'-10', u'user_id': u'186', u'id': u'58', u'label': u'City Council Meeting'}]","[{u'user_id': u'186', u'type_id': u'1', u'url': u'https://docs.google.com/document/d/e/2PACX-1vTNqjeULXG5L0_QEMo2wurlE4IEPoySKuiZcZzuD3wS-VNgjO-FuTLv3phOOhguCdHGzfPg1VoTR_EO/pub', u'storage': u'external', u'session_id': u'15067', u'label': None, u'file_id': None, u'provider': u'om_googledrive', u'agenda_provider_agenda_id': None, u'session_title': u'Thornton City Council Special Meeting - October 3, 2017', u'type': u'Agenda', u'id': u'4092', u'agenda_provider_id': None}]"
125,2567,[0],"Board of Commissioners Morning Meeting: August 4, 2015","Board of Commissioners Morning Meeting: August 4, 2015",,0,,143.0,2017-05-10,2015-08-04,2017-05-10,E0dHjijV2Fc,https://www.youtube.com/watch?v=E0dHjijV2Fc,25.0,Board of County Commissioners,,,"[{u'livestream': u'1', u'position': u'0', u'user_id': u'143', u'id': u'25', u'label': u'Board of County Commissioners'}]",
126,14625,"[0, 3]","Thornton City Council Meeting - September 12, 2017","Thornton City Council Meeting - September 12, 2017","To access the closed caption information associated with this video, click the CC icon in the lower right corner of the video player.

View more information on Thornton's City Council&nbsp;<a href=""http://www.cityofthornton.net/government/city-council/Pages/default.aspx"">here.</a>
",0,,186.0,2017-09-12,2017-09-12,2017-09-13,eYXTxLtcRHg,https://www.youtube.com/watch?v=eYXTxLtcRHg,58.0,City Council Meeting,3962.0,https://docs.google.com/document/d/e/2PACX-1vTl3gkY7PggcKa2gEb-fZtiUekJVBK_STKYyoI_1vk3madJcPuZiC1kiADkPp1jHGSx-3jPSU3kIxpa/pub,"[{u'livestream': u'1', u'position': u'-10', u'user_id': u'186', u'id': u'58', u'label': u'City Council Meeting'}]","[{u'user_id': u'186', u'type_id': u'1', u'url': u'https://docs.google.com/document/d/e/2PACX-1vTl3gkY7PggcKa2gEb-fZtiUekJVBK_STKYyoI_1vk3madJcPuZiC1kiADkPp1jHGSx-3jPSU3kIxpa/pub', u'storage': u'external', u'session_id': u'14625', u'label': None, u'file_id': None, u'provider': u'om_googledrive', u'agenda_provider_agenda_id': None, u'session_title': u'Thornton City Council Meeting - September 12, 2017', u'type': u'Agenda', u'id': u'3962', u'agenda_provider_id': None}]"
127,2575,"[13, 18]","Board of Commissioners Afternoon Meeting: September 22, 2015","Board of Commissioners Afternoon Meeting: September 22, 2015",,0,,143.0,2017-05-10,2015-09-22,2017-05-10,84o_iScvnkw,https://www.youtube.com/watch?v=84o_iScvnkw,25.0,Board of County Commissioners,,,"[{u'livestream': u'1', u'position': u'0', u'user_id': u'143', u'id': u'25', u'label': u'Board of County Commissioners'}]",
128,5754,"[12, 13, 14, 18]",City Council Study Session - 11/13/12,City Council Study Session - 11/13/12,,0,,199.0,2012-11-13,2012-11-13,2017-08-01,JhRqx7kcVoc,https://www.youtube.com/watch?v=JhRqx7kcVoc,69.0,Council,2156.0,https://ompnetwork.s3-us-west-2.amazonaws.com/sites/199/documents/cc_agenda_11-13-2012.pdf?aBQ5rsdOGLbxkkrd8n1pEtT_ch_vLElP,"[{u'livestream': u'1', u'position': u'0', u'user_id': u'199', u'id': u'69', u'label': u'Council'}]","[{u'user_id': u'199', u'type_id': u'1', u'url': u'https://ompnetwork.s3-us-west-2.amazonaws.com/sites/199/documents/cc_agenda_11-13-2012.pdf?aBQ5rsdOGLbxkkrd8n1pEtT_ch_vLElP', u'storage': u'attachment', u'session_id': u'5754', u'label': None, u'file_id': u'2259', u'provider': u'generic', u'agenda_provider_agenda_id': None, u'session_title': u'City Council Study Session - 11/13/12', u'type': u'Agenda', u'id': u'2156', u'agenda_provider_id': None}, {u'user_id': u'199', u'type_id': u'3', u'url': u'https://ompnetwork.s3-us-west-2.amazonaws.com/sites/199/granicus_files/954_calendar_1352790000.html', u'storage': u'external', u'session_id': u'5754', u'label': None, u'file_id': None, u'provider': u'generic', u'agenda_provider_agenda_id': None, u'session_title': u'City Council Study Session - 11/13/12', u'type': u'Calendar', u'id': u'2157', u'agenda_provider_id': None}, {u'user_id': u'199', u'type_id': u'2', u'url': u'https://ompnetwork.s3-us-west-2.amazonaws.com/sites/199/documents/cc_minutes_11-13-2012.pdf?Uca6TEpFNfB.lzB54NhjtbclzLasHpE.', u'storage': u'attachment', u'session_id': u'5754', u'label': None, u'file_id': u'2260', u'provider': u'generic', u'agenda_provider_agenda_id': None, u'session_title': u'City Council Study Session - 11/13/12', u'type': u'Journal', u'id': u'2158', u'agenda_provider_id': None}, {u'user_id': u'199', u'type_id': u'5', u'url': u'https://ompnetwork.s3-us-west-2.amazonaws.com/sites/199/documents/cc_packet_11-13-2012.pdf?UOHjUKDJgbsMMTDoU0BSQpQAj92jfOvs', u'storage': u'attachment', u'session_id': u'5754', u'label': None, u'file_id': u'2261', u'provider': u'generic', u'agenda_provider_agenda_id': None, u'session_title': u'City Council Study Session - 11/13/12', u'type': u'Packet', u'id': u'2159', u'agenda_provider_id': None}]"
129,2590,"[3, 8]","Board of Commissioners Afternoon Meeting: November 3, 2015","Board of Commissioners Afternoon Meeting: November 3, 2015",,0,,143.0,2017-05-11,2015-11-03,2017-05-11,rJrJWULfaRU,https://www.youtube.com/watch?v=rJrJWULfaRU,25.0,Board of County Commissioners,,,"[{u'livestream': u'1', u'position': u'0', u'user_id': u'143', u'id': u'25', u'label': u'Board of County Commissioners'}]",
130,8642,"[12, 13, 14, 18]",Licensing Authority  - 11/14/12,Licensing Authority  - 11/14/12,,0,,199.0,2012-11-14,2012-11-14,2017-08-01,JhRqx7kcVoc,https://www.youtube.com/watch?v=JhRqx7kcVoc,71.0,Licensing,2854.0,https://ompnetwork.s3-us-west-2.amazonaws.com/sites/199/documents/lla_agenda_11-14-2012.pdf?iGNxUXGnB8_rwli7Iczku0w.D9fsPnbY,"[{u'livestream': u'1', u'position': u'0', u'user_id': u'199', u'id': u'71', u'label': u'Licensing'}]","[{u'user_id': u'199', u'type_id': u'1', u'url': u'https://ompnetwork.s3-us-west-2.amazonaws.com/sites/199/documents/lla_agenda_11-14-2012.pdf?iGNxUXGnB8_rwli7Iczku0w.D9fsPnbY', u'storage': u'attachment', u'session_id': u'8642', u'label': None, u'file_id': u'2665', u'provider': u'generic', u'agenda_provider_agenda_id': None, u'session_title': u'Licensing Authority  - 11/14/12', u'type': u'Agenda', u'id': u'2854', u'agenda_provider_id': None}, {u'user_id': u'199', u'type_id': u'3', u'url': u'https://ompnetwork.s3-us-west-2.amazonaws.com/sites/199/granicus_files/958_calendar_1352876400.html', u'storage': u'external', u'session_id': u'8642', u'label': None, u'file_id': None, u'provider': u'generic', u'agenda_provider_agenda_id': None, u'session_title': u'Licensing Authority  - 11/14/12', u'type': u'Calendar', u'id': u'2855', u'agenda_provider_id': None}, {u'user_id': u'199', u'type_id': u'2', u'url': u'https://ompnetwork.s3-us-west-2.amazonaws.com/sites/199/documents/lla_journal_11-14-2012.pdf?wccMBr3EjWlmfF8zVBpAU_oOgTrjmBfe', u'storage': u'attachment', u'session_id': u'8642', u'label': None, u'file_id': u'2666', u'provider': u'generic', u'agenda_provider_agenda_id': None, u'session_title': u'Licensing Authority  - 11/14/12', u'type': u'Journal', u'id': u'2856', u'agenda_provider_id': None}, {u'user_id': u'199', u'type_id': u'5', u'url': u'https://ompnetwork.s3-us-west-2.amazonaws.com/sites/199/documents/lla_packet_11-14-2012.pdf?sb0l_n26FS96XfI49fShID57HhhBSos3', u'storage': u'attachment', u'session_id': u'8642', u'label': None, u'file_id': u'2667', u'provider': u'generic', u'agenda_provider_agenda_id': None, u'session_title': u'Licensing Authority  - 11/14/12', u'type': u'Packet', u'id': u'2857', u'agenda_provider_id': None}]"
131,2577,"[8, 18, 19]","Board of Commissioners Morning Meeting: September 2, 2015","Board of Commissioners Morning Meeting: September 2, 2015",,0,,143.0,2017-05-10,2015-09-02,2017-05-10,c9fvCnZtg80,https://www.youtube.com/watch?v=c9fvCnZtg80,25.0,Board of County Commissioners,,,"[{u'livestream': u'1', u'position': u'0', u'user_id': u'143', u'id': u'25', u'label': u'Board of County Commissioners'}]",
132,2545,"[12, 15, 18]","Board of Commissioners Morning Meeting: May 5, 2015","Board of Commissioners Morning Meeting: May 5, 2015",,0,,143.0,2017-05-10,2015-05-05,2017-05-10,nwvfYnaCRsA,https://www.youtube.com/watch?v=nwvfYnaCRsA,25.0,Board of County Commissioners,,,"[{u'livestream': u'1', u'position': u'0', u'user_id': u'143', u'id': u'25', u'label': u'Board of County Commissioners'}]",
133,23127,"[2, 11, 17, 19]",Basalt Council Special Meeting 08/02/16,Basalt Council Special Meeting 08/02/16,,0,,296.0,2016-08-02,2016-08-02,2018-01-17,7XmAPDvcS0Y,https://www.youtube.com/watch?v=7XmAPDvcS0Y,197.0,Town Council,4999.0,https://ompnetwork.s3-us-west-2.amazonaws.com/sites/296/documents/08-02-16_council_agenda.pdf?TQutNeadfD2W.bxrE6qEuHSFGGIEh_my,"[{u'livestream': u'1', u'position': u'0', u'user_id': u'296', u'id': u'197', u'label': u'Town Council'}]","[{u'user_id': u'296', u'type_id': u'1', u'url': u'https://ompnetwork.s3-us-west-2.amazonaws.com/sites/296/documents/08-02-16_council_agenda.pdf?TQutNeadfD2W.bxrE6qEuHSFGGIEh_my', u'storage': u'attachment', u'session_id': u'23127', u'label': None, u'file_id': u'4413', u'provider': u'generic', u'agenda_provider_agenda_id': None, u'session_title': u'Basalt Council Special Meeting 08/02/16', u'type': u'Agenda', u'id': u'4999', u'agenda_provider_id': None}]"
134,2525,"[9, 18]","Board of Commissioners Morning Meeting: February 3, 2015","Board of Commissioners Morning Meeting: February 3, 2015",,0,,143.0,2017-05-10,2015-02-03,2017-05-10,uQqZq-DrErQ,https://www.youtube.com/watch?v=uQqZq-DrErQ,25.0,Board of County Commissioners,,,"[{u'livestream': u'1', u'position': u'0', u'user_id': u'143', u'id': u'25', u'label': u'Board of County Commissioners'}]",
135,2593,[3],"Board of Commissioners Afternoon Meeting: December 1, 2015","Board of Commissioners Afternoon Meeting: December 1, 2015",,0,,143.0,2017-05-11,2015-12-01,2017-05-11,0loruhr03DE,https://www.youtube.com/watch?v=0loruhr03DE,25.0,Board of County Commissioners,,,"[{u'livestream': u'1', u'position': u'0', u'user_id': u'143', u'id': u'25', u'label': u'Board of County Commissioners'}]",
136,2591,"[0, 12]","Board of Commissioners Morning Meeting: November 3, 2015","Board of Commissioners Morning Meeting: November 3, 2015",,0,,143.0,2017-05-11,2015-11-03,2017-05-11,60pIj98hpuE,https://www.youtube.com/watch?v=60pIj98hpuE,25.0,Board of County Commissioners,,,"[{u'livestream': u'1', u'position': u'0', u'user_id': u'143', u'id': u'25', u'label': u'Board of County Commissioners'}]",
137,2550,"[0, 10, 15]","Board of Commissioners Afternoon Meeting: June 16, 2015","Board of Commissioners Afternoon Meeting: June 16, 2015",,0,,143.0,2017-05-10,2015-06-16,2017-05-10,OqYXwUbG2xU,https://www.youtube.com/watch?v=OqYXwUbG2xU,25.0,Board of County Commissioners,,,"[{u'livestream': u'1', u'position': u'0', u'user_id': u'143', u'id': u'25', u'label': u'Board of County Commissioners'}]",
138,278,"[3, 13, 16, 18]",City Council Meeting 06-08-2015,City Council Meeting 06-08-2015,,0,shows/city-council-meeting-06-08-2015,134.0,2015-06-08,2015-06-08,2017-03-20,VyLq6gTsaE4,https://www.youtube.com/watch?v=VyLq6gTsaE4,20.0,City Council,203.0,https://ompnetwork.s3-us-west-2.amazonaws.com/sites/134/documents/agenda_packet_94.pdf,"[{u'livestream': u'1', u'position': u'-10', u'user_id': u'134', u'id': u'20', u'label': u'City Council'}]","[{u'user_id': u'134', u'type_id': u'1', u'url': u'https://ompnetwork.s3-us-west-2.amazonaws.com/sites/134/documents/agenda_packet_94.pdf', u'storage': u'attachment', u'session_id': u'278', u'label': None, u'file_id': u'273', u'provider': u'generic', u'agenda_provider_agenda_id': None, u'session_title': u'City Council Meeting 06-08-2015', u'type': u'Agenda', u'id': u'203', u'agenda_provider_id': None}, {u'user_id': u'134', u'type_id': u'4', u'url': u'https://ompnetwork.s3-us-west-2.amazonaws.com/sites/134/documents/minutes_60.pdf', u'storage': u'attachment', u'session_id': u'278', u'label': None, u'file_id': u'274', u'provider': u'generic', u'agenda_provider_agenda_id': None, u'session_title': u'City Council Meeting 06-08-2015', u'type': u'Minutes', u'id': u'204', u'agenda_provider_id': None}]"
139,2598,[6],"Board of Commissioners Afternoon Meeting: December 15, 2015","Board of Commissioners Afternoon Meeting: December 15, 2015",,0,,143.0,2017-05-11,2015-12-15,2017-05-11,9PNupSW102s,https://www.youtube.com/watch?v=9PNupSW102s,25.0,Board of County Commissioners,,,"[{u'livestream': u'1', u'position': u'0', u'user_id': u'143', u'id': u'25', u'label': u'Board of County Commissioners'}]",
140,3257,[],Fireworks are Illegal in Thornton/ 4th of July 2013 PSA ,Fireworks are Illegal in Thornton/ 4th of July 2013 PSA ,"<p>Fireworks are illegal in Thornton, more info <a href=""http://www.cityofthornton.net/Departments/FireDepartment/Documents/BuckforBangFlyer%202012-eng.pdf"">here.</a></p>

<p>This Fourth of July, Leave it to the professionals.</p>
",0,,186.0,2013-06-26,2013-06-26,2017-07-11,7_rXWfUpoqQ,http://www.youtube.com/watch?feature=player_detailpage&v=7_rXWfUpoqQ,62.0,PSAs,,,"[{u'livestream': u'0', u'position': u'-5', u'user_id': u'186', u'id': u'62', u'label': u'PSAs'}]",
141,23570,"[0, 3, 8, 11, 17, 19]",Basalt Council 04/11/17,Basalt Council 04/11/17,,0,,296.0,2017-04-11,2017-04-11,2018-01-17,AJoq7GCMN7s,https://www.youtube.com/watch?v=AJoq7GCMN7s&t=25s,197.0,Town Council,5025.0,https://ompnetwork.s3-us-west-2.amazonaws.com/sites/296/documents/btc_04-11-17_council_agenda.pdf?56nT3V7UNwbLbjovVNogXJgqVFQKsCBw,"[{u'livestream': u'1', u'position': u'0', u'user_id': u'296', u'id': u'197', u'label': u'Town Council'}]","[{u'user_id': u'296', u'type_id': u'1', u'url': u'https://ompnetwork.s3-us-west-2.amazonaws.com/sites/296/documents/btc_04-11-17_council_agenda.pdf?56nT3V7UNwbLbjovVNogXJgqVFQKsCBw', u'storage': u'attachment', u'session_id': u'23570', u'label': None, u'file_id': u'4439', u'provider': u'generic', u'agenda_provider_agenda_id': None, u'session_title': u'Basalt Council 04/11/17', u'type': u'Agenda', u'id': u'5025', u'agenda_provider_id': None}]"
142,20611,"[0, 4, 5, 16]",Town Board of New Castle Work Session 11/21/17,Town Board of New Castle Work Session 11/21/17,,0,,281.0,2017-11-22,2017-11-21,2017-11-22,i9hA8aaRN2E,https://youtu.be/i9hA8aaRN2E,159.0,Town Board of New Castle Work Sessions,4760.0,https://ompnetwork.s3-us-west-2.amazonaws.com/sites/281/documents/town_board_work_session_11.21.17.pdf?DVbI0G3sR8to.pdyo4013iqBjm56g2sb,"[{u'livestream': u'0', u'position': u'-9', u'user_id': u'281', u'id': u'159', u'label': u'Town Board of New Castle Work Sessions'}]","[{u'user_id': u'281', u'type_id': u'1', u'url': u'https://ompnetwork.s3-us-west-2.amazonaws.com/sites/281/documents/town_board_work_session_11.21.17.pdf?DVbI0G3sR8to.pdyo4013iqBjm56g2sb', u'storage': u'attachment', u'session_id': u'20611', u'label': None, u'file_id': u'4100', u'provider': u'generic', u'agenda_provider_agenda_id': None, u'session_title': u'Town Board of New Castle Work Session 11/21/17', u'type': u'Agenda', u'id': u'4760', u'agenda_provider_id': None}]"
143,21030,"[16, 17]",Town Board of New Castle Work Session 12/5/17,Town Board of New Castle Work Session 12/5/17,,0,,281.0,2017-12-05,2017-12-05,2017-12-06,jZi25b79kT4,https://youtu.be/jZi25b79kT4,159.0,Town Board of New Castle Work Sessions,4813.0,https://ompnetwork.s3-us-west-2.amazonaws.com/sites/281/documents/town_board_work_session_12.05.17.pdf?BthRd3HOy0qcNTxKyjNI6P61d8enArCJ,"[{u'livestream': u'0', u'position': u'-9', u'user_id': u'281', u'id': u'159', u'label': u'Town Board of New Castle Work Sessions'}]","[{u'user_id': u'281', u'type_id': u'1', u'url': u'https://ompnetwork.s3-us-west-2.amazonaws.com/sites/281/documents/town_board_work_session_12.05.17.pdf?BthRd3HOy0qcNTxKyjNI6P61d8enArCJ', u'storage': u'attachment', u'session_id': u'21030', u'label': None, u'file_id': u'4165', u'provider': u'generic', u'agenda_provider_agenda_id': None, u'session_title': u'Town Board of New Castle Work Session 12/5/17', u'type': u'Agenda', u'id': u'4813', u'agenda_provider_id': None}]"
144,3291,"[2, 9]",Thornton Fire Department - Ice Safety,Thornton Fire Department - Ice Safety,"<p>This public service announcement reminds residents to stay off of frozen lakes and ponds.</p>
",0,,186.0,2013-12-18,2013-12-18,2017-07-11,go_lkMp0pKQ,https://www.youtube.com/watch?feature=player_embedded&v=go_lkMp0pKQ,62.0,PSAs,,,"[{u'livestream': u'0', u'position': u'-5', u'user_id': u'186', u'id': u'62', u'label': u'PSAs'}]",
145,3292,"[2, 9]",Thornton Fire Department - Ice Safety,Thornton Fire Department - Ice Safety,"<p>This public service announcement reminds residents to stay off of frozen lakes and ponds.</p>
",0,,186.0,2013-12-18,2013-12-18,2017-07-11,go_lkMp0pKQ,https://www.youtube.com/watch?feature=player_embedded&v=go_lkMp0pKQ,61.0,Health and Safety,,,"[{u'livestream': u'0', u'position': u'-7', u'user_id': u'186', u'id': u'61', u'label': u'Health and Safety'}]",
146,888,"[11, 16, 17, 19]",Council Work Session 03-10-2010,Council Work Session 03-10-2010,,0,shows/council-work-session-03-10-2010,134.0,2010-03-10,2010-03-10,2017-03-20,W0Xaa3t4mcI,https://www.youtube.com/watch?v=W0Xaa3t4mcI,20.0,City Council,1222.0,https://ompnetwork.s3-us-west-2.amazonaws.com/sites/134/documents/agenda_247.pdf,"[{u'livestream': u'1', u'position': u'-10', u'user_id': u'134', u'id': u'20', u'label': u'City Council'}]","[{u'user_id': u'134', u'type_id': u'1', u'url': u'https://ompnetwork.s3-us-west-2.amazonaws.com/sites/134/documents/agenda_247.pdf', u'storage': u'attachment', u'session_id': u'888', u'label': None, u'file_id': u'1293', u'provider': u'generic', u'agenda_provider_agenda_id': None, u'session_title': u'Council Work Session 03-10-2010', u'type': u'Agenda', u'id': u'1222', u'agenda_provider_id': None}, {u'user_id': u'134', u'type_id': u'4', u'url': u'https://ompnetwork.s3-us-west-2.amazonaws.com/sites/134/documents/minutes_305.pdf', u'storage': u'attachment', u'session_id': u'888', u'label': None, u'file_id': u'1294', u'provider': u'generic', u'agenda_provider_agenda_id': None, u'session_title': u'Council Work Session 03-10-2010', u'type': u'Minutes', u'id': u'1223', u'agenda_provider_id': None}]"
147,21717,"[4, 5, 6]",Town of New Castle Zoning Board Meeting 12/20/17,Town of New Castle Zoning Board Meeting 12/20/17,,0,,281.0,2017-12-20,2017-12-20,2017-12-21,fOObGMfslcw,https://youtu.be/fOObGMfslcw,157.0,Town of New Castle Zoning Board Meetings,4878.0,https://ompnetwork.s3-us-west-2.amazonaws.com/sites/281/documents/december_20_2017.pdf?ZYq1ctX5aAFd0wm8AfVezVZrGJvH8gjH,"[{u'livestream': u'0', u'position': u'-7', u'user_id': u'281', u'id': u'157', u'label': u'Town of New Castle Zoning Board Meetings'}]","[{u'user_id': u'281', u'type_id': u'1', u'url': u'https://ompnetwork.s3-us-west-2.amazonaws.com/sites/281/documents/december_20_2017.pdf?ZYq1ctX5aAFd0wm8AfVezVZrGJvH8gjH', u'storage': u'attachment', u'session_id': u'21717', u'label': None, u'file_id': u'4256', u'provider': u'generic', u'agenda_provider_agenda_id': None, u'session_title': u'Town of New Castle Zoning Board Meeting 12/20/17', u'type': u'Agenda', u'id': u'4878', u'agenda_provider_id': None}]"
148,3959,"[0, 4, 13, 16]","Eugene Police Commission Bias Police Hearing April 10, 2014","Eugene Police Commission Bias Police Hearing April 10, 2014",,0,,134.0,2017-07-19,2014-04-10,2017-07-19,bspBeuwqTt8,https://youtu.be/bspBeuwqTt8,45.0,Police Commission,,,"[{u'livestream': u'0', u'position': u'0', u'user_id': u'134', u'id': u'45', u'label': u'Police Commission'}]",
149,3391,[18],Shop Thornton First Holiday 2015,Shop Thornton First Holiday 2015,"<p>This PSA ws created as part of a campaign asking Thornton residents to shop locally this holiday season.</p>

<p>www.shopthorntonfirst.com</p>
",0,,186.0,2014-12-01,2014-12-01,2017-07-11,jGX874ul6iM,https://www.youtube.com/watch?v=jGX874ul6iM,62.0,PSAs,,,"[{u'livestream': u'0', u'position': u'-5', u'user_id': u'186', u'id': u'62', u'label': u'PSAs'}]",
150,4309,"[4, 13, 16, 18, 19]",11/14/16 Work Session,11/14/16 Work Session,,0,,198.0,2016-11-14,2016-11-14,2017-07-24,OSgLwalxZwc,https://www.youtube.com/watch?v=OSgLwalxZwc,67.0,Town Board,1866.0,https://ompnetwork.s3-us-west-2.amazonaws.com/sites/198/documents/wks_agenda_11.14.16.pdf?nj0okfzqOJsyTXLdUEYsqQ3.C1IT8o1J,"[{u'livestream': u'1', u'position': u'0', u'user_id': u'198', u'id': u'67', u'label': u'Town Board'}]","[{u'user_id': u'198', u'type_id': u'1', u'url': u'https://ompnetwork.s3-us-west-2.amazonaws.com/sites/198/documents/wks_agenda_11.14.16.pdf?nj0okfzqOJsyTXLdUEYsqQ3.C1IT8o1J', u'storage': u'attachment', u'session_id': u'4309', u'label': None, u'file_id': u'2007', u'provider': u'generic', u'agenda_provider_agenda_id': None, u'session_title': u'11/14/16 Work Session', u'type': u'Agenda', u'id': u'1866', u'agenda_provider_id': None}, {u'user_id': u'198', u'type_id': u'5', u'url': u'https://ompnetwork.s3-us-west-2.amazonaws.com/sites/198/documents/11.14.16_wks_packet.pdf?i4_eV5r7eptimyQmPr6bRNvRpdtjqK.n', u'storage': u'attachment', u'session_id': u'4309', u'label': None, u'file_id': u'2008', u'provider': u'generic', u'agenda_provider_agenda_id': None, u'session_title': u'11/14/16 Work Session', u'type': u'Packet', u'id': u'1867', u'agenda_provider_id': None}]"
151,3288,[18],Shop Thornton First Holiday 2013,Shop Thornton First Holiday 2013,"<p>This PSA ws created as part of a campaign asking Thornton residents to shop locally this holiday season.</p>

<p>www.shopthorntonfirst.com</p>
",0,,186.0,2013-12-04,2013-12-04,2017-07-11,NQFKVwq9PnE,http://youtu.be/NQFKVwq9PnE,62.0,PSAs,,,"[{u'livestream': u'0', u'position': u'-5', u'user_id': u'186', u'id': u'62', u'label': u'PSAs'}]",
152,6362,"[0, 1, 8, 16, 17]",City Council - Regular Meeting - 11/15/11,City Council - Regular Meeting - 11/15/11,,0,,199.0,2011-11-15,2011-11-15,2017-08-01,hd_HcwqRS9g,https://www.youtube.com/watch?v=hd_HcwqRS9g,69.0,Council,2282.0,https://ompnetwork.s3-us-west-2.amazonaws.com/sites/199/documents/cc_agenda_11-15-2011.pdf?R81g2QMkhSZ79nD_gmqDf1OQs7dsz5M1,"[{u'livestream': u'1', u'position': u'0', u'user_id': u'199', u'id': u'69', u'label': u'Council'}]","[{u'user_id': u'199', u'type_id': u'1', u'url': u'https://ompnetwork.s3-us-west-2.amazonaws.com/sites/199/documents/cc_agenda_11-15-2011.pdf?R81g2QMkhSZ79nD_gmqDf1OQs7dsz5M1', u'storage': u'attachment', u'session_id': u'6362', u'label': None, u'file_id': u'2340', u'provider': u'generic', u'agenda_provider_agenda_id': None, u'session_title': u'City Council - Regular Meeting - 11/15/11', u'type': u'Agenda', u'id': u'2282', u'agenda_provider_id': None}, {u'user_id': u'199', u'type_id': u'3', u'url': u'https://ompnetwork.s3-us-west-2.amazonaws.com/sites/199/granicus_files/771_calendar_1321340400.html', u'storage': u'external', u'session_id': u'6362', u'label': None, u'file_id': None, u'provider': u'generic', u'agenda_provider_agenda_id': None, u'session_title': u'City Council - Regular Meeting - 11/15/11', u'type': u'Calendar', u'id': u'2283', u'agenda_provider_id': None}, {u'user_id': u'199', u'type_id': u'2', u'url': u'https://ompnetwork.s3-us-west-2.amazonaws.com/sites/199/documents/cc_minutes_11-15-2011.pdf?VcHC9fO1q.k_TNTmbWHgETBXv7oddSIp', u'storage': u'attachment', u'session_id': u'6362', u'label': None, u'file_id': u'2341', u'provider': u'generic', u'agenda_provider_agenda_id': None, u'session_title': u'City Council - Regular Meeting - 11/15/11', u'type': u'Journal', u'id': u'2284', u'agenda_provider_id': None}, {u'user_id': u'199', u'type_id': u'5', u'url': u'https://ompnetwork.s3-us-west-2.amazonaws.com/sites/199/documents/cc_packet_11-15-2011.pdf?ESKXn4KK6GmRzUPOHGtN4KZuoZN97qAg', u'storage': u'attachment', u'session_id': u'6362', u'label': None, u'file_id': u'2342', u'provider': u'generic', u'agenda_provider_agenda_id': None, u'session_title': u'City Council - Regular Meeting - 11/15/11', u'type': u'Packet', u'id': u'2285', u'agenda_provider_id': None}]"
153,305,"[3, 16, 17, 18]",City Council Work Session 01-28-2015,City Council Work Session 01-28-2015,,0,shows/city-council-work-session-01-28-2015,134.0,2015-01-28,2015-01-28,2017-03-20,HFX6dGzmeGE,https://www.youtube.com/watch?v=HFX6dGzmeGE,20.0,City Council,253.0,https://ompnetwork.s3-us-west-2.amazonaws.com/sites/134/documents/agenda_packet_131.pdf,"[{u'livestream': u'1', u'position': u'-10', u'user_id': u'134', u'id': u'20', u'label': u'City Council'}]","[{u'user_id': u'134', u'type_id': u'1', u'url': u'https://ompnetwork.s3-us-west-2.amazonaws.com/sites/134/documents/agenda_packet_131.pdf', u'storage': u'attachment', u'session_id': u'305', u'label': None, u'file_id': u'323', u'provider': u'generic', u'agenda_provider_agenda_id': None, u'session_title': u'City Council Work Session 01-28-2015', u'type': u'Agenda', u'id': u'253', u'agenda_provider_id': None}, {u'user_id': u'134', u'type_id': u'4', u'url': u'https://ompnetwork.s3-us-west-2.amazonaws.com/sites/134/documents/minutes_85.pdf', u'storage': u'attachment', u'session_id': u'305', u'label': None, u'file_id': u'324', u'provider': u'generic', u'agenda_provider_agenda_id': None, u'session_title': u'City Council Work Session 01-28-2015', u'type': u'Minutes', u'id': u'254', u'agenda_provider_id': None}]"
154,3290,[18],Shop Thornton First 2016,Shop Thornton First 2016,"<p>This PSA ws created as part of a campaign asking Thornton residents to shop locally.</p>

<p>www.shopthorntonfirst.com</p>
",0,,186.0,2013-12-18,2013-12-18,2017-07-11,6iegwcyhPts,http://www.youtube.com/watch?feature=player_detailpage&v=6iegwcyhPts,62.0,PSAs,,,"[{u'livestream': u'0', u'position': u'-5', u'user_id': u'186', u'id': u'62', u'label': u'PSAs'}]",
155,527,"[4, 6, 7]",Planning Commission 07-28-2015,Planning Commission 07-28-2015,,0,shows/planning-commission-07-28-2015,134.0,2015-07-28,2015-07-28,2017-03-20,MdR9dGzIJJs,https://www.youtube.com/watch?v=MdR9dGzIJJs,22.0,Planning Commission,654.0,https://ompnetwork.s3-us-west-2.amazonaws.com/sites/134/documents/agenda_packet_84_0.pdf,"[{u'livestream': u'1', u'position': u'-9', u'user_id': u'134', u'id': u'22', u'label': u'Planning Commission'}]","[{u'user_id': u'134', u'type_id': u'1', u'url': u'https://ompnetwork.s3-us-west-2.amazonaws.com/sites/134/documents/agenda_packet_84_0.pdf', u'storage': u'attachment', u'session_id': u'527', u'label': None, u'file_id': u'724', u'provider': u'generic', u'agenda_provider_agenda_id': None, u'session_title': u'Planning Commission 07-28-2015', u'type': u'Agenda', u'id': u'654', u'agenda_provider_id': None}]"
156,390,"[0, 16, 17]",City Council Work Session 01-22-2014,City Council Work Session 01-22-2014,,0,shows/city-council-work-session-01-22-2014,134.0,2014-01-22,2014-01-22,2017-03-20,otyxGytPO6g,https://www.youtube.com/watch?v=otyxGytPO6g,20.0,City Council,413.0,https://ompnetwork.s3-us-west-2.amazonaws.com/sites/134/documents/agenda_packet_204.pdf,"[{u'livestream': u'1', u'position': u'-10', u'user_id': u'134', u'id': u'20', u'label': u'City Council'}]","[{u'user_id': u'134', u'type_id': u'1', u'url': u'https://ompnetwork.s3-us-west-2.amazonaws.com/sites/134/documents/agenda_packet_204.pdf', u'storage': u'attachment', u'session_id': u'390', u'label': None, u'file_id': u'483', u'provider': u'generic', u'agenda_provider_agenda_id': None, u'session_title': u'City Council Work Session 01-22-2014', u'type': u'Agenda', u'id': u'413', u'agenda_provider_id': None}, {u'user_id': u'134', u'type_id': u'4', u'url': u'https://ompnetwork.s3-us-west-2.amazonaws.com/sites/134/documents/minutes_160.pdf', u'storage': u'attachment', u'session_id': u'390', u'label': None, u'file_id': u'484', u'provider': u'generic', u'agenda_provider_agenda_id': None, u'session_title': u'City Council Work Session 01-22-2014', u'type': u'Minutes', u'id': u'414', u'agenda_provider_id': None}]"
157,6599,"[0, 1, 2, 10, 12, 16]",City Council - Regular Meeting - 08/02/11,City Council - Regular Meeting - 08/02/11,,0,,199.0,2011-08-02,2011-08-02,2017-08-01,bnIu4mTzhjE,https://www.youtube.com/watch?v=bnIu4mTzhjE,69.0,Council,2320.0,https://ompnetwork.s3-us-west-2.amazonaws.com/sites/199/documents/cc_agenda_08-02-2011.pdf?02OCGtMpB4e4iKTirVusDsxctCWmgvZm,"[{u'livestream': u'1', u'position': u'0', u'user_id': u'199', u'id': u'69', u'label': u'Council'}]","[{u'user_id': u'199', u'type_id': u'1', u'url': u'https://ompnetwork.s3-us-west-2.amazonaws.com/sites/199/documents/cc_agenda_08-02-2011.pdf?02OCGtMpB4e4iKTirVusDsxctCWmgvZm', u'storage': u'attachment', u'session_id': u'6599', u'label': None, u'file_id': u'2360', u'provider': u'generic', u'agenda_provider_agenda_id': None, u'session_title': u'City Council - Regular Meeting - 08/02/11', u'type': u'Agenda', u'id': u'2320', u'agenda_provider_id': None}, {u'user_id': u'199', u'type_id': u'3', u'url': u'https://ompnetwork.s3-us-west-2.amazonaws.com/sites/199/granicus_files/715_calendar_1312264800.html', u'storage': u'external', u'session_id': u'6599', u'label': None, u'file_id': None, u'provider': u'generic', u'agenda_provider_agenda_id': None, u'session_title': u'City Council - Regular Meeting - 08/02/11', u'type': u'Calendar', u'id': u'2321', u'agenda_provider_id': None}, {u'user_id': u'199', u'type_id': u'2', u'url': u'https://ompnetwork.s3-us-west-2.amazonaws.com/sites/199/documents/cc_minutes_08-02-2011.pdf?GZ2cjeR1VATAAyh4F35KK3VO8buH3eK9', u'storage': u'attachment', u'session_id': u'6599', u'label': None, u'file_id': u'2361', u'provider': u'generic', u'agenda_provider_agenda_id': None, u'session_title': u'City Council - Regular Meeting - 08/02/11', u'type': u'Journal', u'id': u'2322', u'agenda_provider_id': None}, {u'user_id': u'199', u'type_id': u'5', u'url': u'https://ompnetwork.s3-us-west-2.amazonaws.com/sites/199/documents/cc_packet_08-02-2011.pdf?zgvQggwXmhyUdtVYmMKKBkxI8suoWY_k', u'storage': u'attachment', u'session_id': u'6599', u'label': None, u'file_id': u'2362', u'provider': u'generic', u'agenda_provider_agenda_id': None, u'session_title': u'City Council - Regular Meeting - 08/02/11', u'type': u'Packet', u'id': u'2323', u'agenda_provider_id': None}]"
158,17014,"[3, 5, 11, 18]",BOCC Work Session - 01/14/14,BOCC Work Session - 01/14/14,,0,,273.0,2014-01-14,2014-01-14,2017-10-30,hhqh2W1fV0E,https://www.youtube.com/watch?v=hhqh2W1fV0E,147.0,2014,4364.0,https://ompnetwork.s3-us-west-2.amazonaws.com/sites/273/granicus_files/493_calendar_1389682800.html,"[{u'livestream': u'0', u'position': u'-6', u'user_id': u'273', u'id': u'147', u'label': u'2014'}]","[{u'user_id': u'273', u'type_id': u'3', u'url': u'https://ompnetwork.s3-us-west-2.amazonaws.com/sites/273/granicus_files/493_calendar_1389682800.html', u'storage': u'external', u'session_id': u'17014', u'label': None, u'file_id': None, u'provider': u'generic', u'agenda_provider_agenda_id': None, u'session_title': u'BOCC Work Session - 01/14/14', u'type': u'Calendar', u'id': u'4364', u'agenda_provider_id': None}]"
159,219,"[3, 18, 19]",City Council Work Session and URA Meeting 03-14-2016,City Council Work Session and URA Meeting 03-14-2016,,0,shows/city-council-work-session-and-ura-meeting-03-14-2016,134.0,2016-03-14,2016-03-14,2017-03-20,EACiL8zz5D0,https://www.youtube.com/watch?v=EACiL8zz5D0,20.0,City Council,95.0,https://ompnetwork.s3-us-west-2.amazonaws.com/sites/134/documents/agenda_packet_21.pdf,"[{u'livestream': u'1', u'position': u'-10', u'user_id': u'134', u'id': u'20', u'label': u'City Council'}]","[{u'user_id': u'134', u'type_id': u'1', u'url': u'https://ompnetwork.s3-us-west-2.amazonaws.com/sites/134/documents/agenda_packet_21.pdf', u'storage': u'attachment', u'session_id': u'219', u'label': None, u'file_id': u'165', u'provider': u'generic', u'agenda_provider_agenda_id': None, u'session_title': u'City Council Work Session and URA Meeting 03-14-2016', u'type': u'Agenda', u'id': u'95', u'agenda_provider_id': None}, {u'user_id': u'134', u'type_id': u'4', u'url': u'https://ompnetwork.s3-us-west-2.amazonaws.com/sites/134/documents/minutes_9_0.pdf', u'storage': u'attachment', u'session_id': u'219', u'label': None, u'file_id': u'166', u'provider': u'generic', u'agenda_provider_agenda_id': None, u'session_title': u'City Council Work Session and URA Meeting 03-14-2016', u'type': u'Minutes', u'id': u'96', u'agenda_provider_id': None}]"
160,678,"[3, 6, 7]",Planning Commission Public Hearing 07-09-2013,Planning Commission Public Hearing 07-09-2013,,0,shows/planning-commission-public-hearing-07-09-2013,134.0,2013-07-09,2013-07-09,2017-03-20,-zUj0Qe64Lo,https://www.youtube.com/watch?v=-zUj0Qe64Lo,22.0,Planning Commission,884.0,https://ompnetwork.s3-us-west-2.amazonaws.com/sites/134/documents/agenda_packet_150.pdf,"[{u'livestream': u'1', u'position': u'-9', u'user_id': u'134', u'id': u'22', u'label': u'Planning Commission'}]","[{u'user_id': u'134', u'type_id': u'1', u'url': u'https://ompnetwork.s3-us-west-2.amazonaws.com/sites/134/documents/agenda_packet_150.pdf', u'storage': u'attachment', u'session_id': u'678', u'label': None, u'file_id': u'955', u'provider': u'generic', u'agenda_provider_agenda_id': None, u'session_title': u'Planning Commission Public Hearing 07-09-2013', u'type': u'Agenda', u'id': u'884', u'agenda_provider_id': None}]"
161,19461,"[3, 5, 17]",BOCC Regular Meeting 07/12/2017,BOCC Regular Meeting 07/12/2017,,0,,273.0,2017-07-12,2017-07-12,2017-10-31,Id4jKIsTaug,https://www.youtube.com/watch?v=Id4jKIsTaug,150.0,2017,4652.0,https://ompnetwork.s3-us-west-2.amazonaws.com/sites/273/documents/july_12_2017_agenda.pdf?qJdANAKimrRGUy7gc78tQP01kdmpL3P8,"[{u'livestream': u'0', u'position': u'-9', u'user_id': u'273', u'id': u'150', u'label': u'2017'}]","[{u'user_id': u'273', u'type_id': u'1', u'url': u'https://ompnetwork.s3-us-west-2.amazonaws.com/sites/273/documents/july_12_2017_agenda.pdf?qJdANAKimrRGUy7gc78tQP01kdmpL3P8', u'storage': u'attachment', u'session_id': u'19461', u'label': None, u'file_id': u'3933', u'provider': u'generic', u'agenda_provider_agenda_id': None, u'session_title': u'BOCC Regular Meeting 07/12/2017', u'type': u'Agenda', u'id': u'4652', u'agenda_provider_id': None}]"
162,443,"[3, 5, 18, 19]",City Council Work Session 06-12-2013,City Council Work Session 06-12-2013,,0,shows/city-council-work-session-06-12-2013,134.0,2013-06-12,2013-06-12,2017-03-20,Ag8P57AVuHM,https://www.youtube.com/watch?v=Ag8P57AVuHM,20.0,City Council,513.0,https://ompnetwork.s3-us-west-2.amazonaws.com/sites/134/documents/agenda_packet_265.pdf,"[{u'livestream': u'1', u'position': u'-10', u'user_id': u'134', u'id': u'20', u'label': u'City Council'}]","[{u'user_id': u'134', u'type_id': u'1', u'url': u'https://ompnetwork.s3-us-west-2.amazonaws.com/sites/134/documents/agenda_packet_265.pdf', u'storage': u'attachment', u'session_id': u'443', u'label': None, u'file_id': u'583', u'provider': u'generic', u'agenda_provider_agenda_id': None, u'session_title': u'City Council Work Session 06-12-2013', u'type': u'Agenda', u'id': u'513', u'agenda_provider_id': None}, {u'user_id': u'134', u'type_id': u'4', u'url': u'https://ompnetwork.s3-us-west-2.amazonaws.com/sites/134/documents/minutes_202.pdf', u'storage': u'attachment', u'session_id': u'443', u'label': None, u'file_id': u'584', u'provider': u'generic', u'agenda_provider_agenda_id': None, u'session_title': u'City Council Work Session 06-12-2013', u'type': u'Minutes', u'id': u'514', u'agenda_provider_id': None}]"
163,2520,"[4, 11, 18, 19]","Board of Commissioners Morning Meeting: January 6, 2015","Board of Commissioners Morning Meeting: January 6, 2015",,0,,143.0,2017-05-10,2015-01-06,2017-05-10,uvuIp-OP6uo,https://www.youtube.com/watch?v=uvuIp-OP6uo,25.0,Board of County Commissioners,,,"[{u'livestream': u'1', u'position': u'0', u'user_id': u'143', u'id': u'25', u'label': u'Board of County Commissioners'}]",
164,797,"[3, 8]",Planning Commission  10-31-2011,Planning Commission  10-31-2011,,0,shows/planning-commission-10-31-2011,134.0,2011-10-31,2011-10-31,2017-03-20,Szw1GeuFTy4,https://www.youtube.com/watch?v=Szw1GeuFTy4,22.0,Planning Commission,1059.0,https://ompnetwork.s3-us-west-2.amazonaws.com/sites/134/documents/agenda_25_0.pdf,"[{u'livestream': u'1', u'position': u'-9', u'user_id': u'134', u'id': u'22', u'label': u'Planning Commission'}]","[{u'user_id': u'134', u'type_id': u'1', u'url': u'https://ompnetwork.s3-us-west-2.amazonaws.com/sites/134/documents/agenda_25_0.pdf', u'storage': u'attachment', u'session_id': u'797', u'label': None, u'file_id': u'1130', u'provider': u'generic', u'agenda_provider_agenda_id': None, u'session_title': u'Planning Commission  10-31-2011', u'type': u'Agenda', u'id': u'1059', u'agenda_provider_id': None}]"
165,698,"[3, 9]",Planning Commission Public Hearing 05-14-2013,Planning Commission Public Hearing 05-14-2013,,0,shows/planning-commission-public-hearing-05-14-2013,134.0,2013-05-14,2013-05-14,2017-03-20,QRsSMuW4Vm0,https://www.youtube.com/watch?v=QRsSMuW4Vm0,22.0,Planning Commission,915.0,https://ompnetwork.s3-us-west-2.amazonaws.com/sites/134/documents/agenda_packet_156_0.pdf,"[{u'livestream': u'1', u'position': u'-9', u'user_id': u'134', u'id': u'22', u'label': u'Planning Commission'}]","[{u'user_id': u'134', u'type_id': u'1', u'url': u'https://ompnetwork.s3-us-west-2.amazonaws.com/sites/134/documents/agenda_packet_156_0.pdf', u'storage': u'attachment', u'session_id': u'698', u'label': None, u'file_id': u'986', u'provider': u'generic', u'agenda_provider_agenda_id': None, u'session_title': u'Planning Commission Public Hearing 05-14-2013', u'type': u'Agenda', u'id': u'915', u'agenda_provider_id': None}]"
166,660,"[3, 5, 7]",Planning Commission Public Hearing 10-01-2013,Planning Commission Public Hearing 10-01-2013,,0,shows/planning-commission-public-hearing-10-01-2013,134.0,2013-10-01,2013-10-01,2017-03-20,CTg5g7_lx2g,https://www.youtube.com/watch?v=CTg5g7_lx2g,22.0,Planning Commission,855.0,https://ompnetwork.s3-us-west-2.amazonaws.com/sites/134/documents/agenda_packet_143_0.pdf,"[{u'livestream': u'1', u'position': u'-9', u'user_id': u'134', u'id': u'22', u'label': u'Planning Commission'}]","[{u'user_id': u'134', u'type_id': u'1', u'url': u'https://ompnetwork.s3-us-west-2.amazonaws.com/sites/134/documents/agenda_packet_143_0.pdf', u'storage': u'attachment', u'session_id': u'660', u'label': None, u'file_id': u'926', u'provider': u'generic', u'agenda_provider_agenda_id': None, u'session_title': u'Planning Commission Public Hearing 10-01-2013', u'type': u'Agenda', u'id': u'855', u'agenda_provider_id': None}]"
167,3321,"[18, 19]",I-25 North Express Lanes Project,I-25 North Express Lanes Project,"<p>Expect delays along I-25 in Thornton Friday, July 25, 10 p.m. - Monday, July 28, 5:30 a.m. and again Friday, August 1, 10 p.m. - Monday, August 4, 5:30 a.m.</p>

<p><a name=""_MailEndCompose"">http://www.coloradodot.info/projects/i25northexpresslanes</a></p>
",0,,186.0,2014-07-24,2014-07-24,2017-07-11,VcmwujpwmiA,http://youtu.be/VcmwujpwmiA?list=UUfibNwatXEZBJG99917d5sA,60.0,Local Interest,,,"[{u'livestream': u'0', u'position': u'-8', u'user_id': u'186', u'id': u'60', u'label': u'Local Interest'}]",
168,3273,"[2, 13, 16]",T-Town Clowns (English),T-Town Clowns (English),,0,,186.0,2013-07-10,2013-07-10,2017-07-11,eO_lJWCTggA,https://www.youtube.com/watch?v=eO_lJWCTggA,61.0,Health and Safety,1621.0,https://docs.google.com/document/d/14ZbJyGveXCAXAgAVCFgaR33v81nuDdbtqRdNdo1H_3s/pub,"[{u'livestream': u'0', u'position': u'-7', u'user_id': u'186', u'id': u'61', u'label': u'Health and Safety'}]","[{u'user_id': u'186', u'type_id': u'1', u'url': u'https://docs.google.com/document/d/14ZbJyGveXCAXAgAVCFgaR33v81nuDdbtqRdNdo1H_3s/pub', u'storage': u'external', u'session_id': u'3273', u'label': None, u'file_id': None, u'provider': u'om_googledrive', u'agenda_provider_agenda_id': None, u'session_title': u'T-Town Clowns (English)', u'type': u'Agenda', u'id': u'1621', u'agenda_provider_id': None}]"
169,14925,"[3, 5, 18, 19]","Eugene City Council Work Session: September 25, 2017","Eugene City Council Work Session: September 25, 2017",,0,,134.0,2017-09-25,2017-09-25,2017-12-11,nZ3yxpRVvGw,https://www.youtube.com/watch?v=nZ3yxpRVvGw,20.0,City Council,4050.0,https://ompnetwork.s3-us-west-2.amazonaws.com/sites/134/documents/cc_agenda_for_09-25-17_ws.pdf?.nAeP_sDLKDGkYDnv_976kPlfwD9n5Ld,"[{u'livestream': u'1', u'position': u'-10', u'user_id': u'134', u'id': u'20', u'label': u'City Council'}]","[{u'user_id': u'134', u'type_id': u'1', u'url': u'https://ompnetwork.s3-us-west-2.amazonaws.com/sites/134/documents/cc_agenda_for_09-25-17_ws.pdf?.nAeP_sDLKDGkYDnv_976kPlfwD9n5Ld', u'storage': u'attachment', u'session_id': u'14925', u'label': None, u'file_id': u'3573', u'provider': u'generic', u'agenda_provider_agenda_id': None, u'session_title': u'Eugene City Council Work Session: September 25, 2017', u'type': u'Agenda', u'id': u'4050', u'agenda_provider_id': None}, {u'user_id': u'134', u'type_id': u'4', u'url': u'https://ompnetwork.s3-us-west-2.amazonaws.com/sites/134/documents/9-25-2017_cc_ws_minutes.pdf?4Z.G8gmzuxixb1EKi8WZEjhpw6yo645X', u'storage': u'attachment', u'session_id': u'14925', u'label': None, u'file_id': u'4196', u'provider': u'generic', u'agenda_provider_agenda_id': None, u'session_title': u'Eugene City Council Work Session: September 25, 2017', u'type': u'Minutes', u'id': u'4833', u'agenda_provider_id': None}]"
170,3265,"[2, 16]",T-Town Clowns (Spanish),T-Town Clowns (Spanish),,0,,186.0,2013-07-10,2013-07-10,2017-07-11,G3Px_ARG_2o,https://www.youtube.com/watch?v=G3Px_ARG_2o,61.0,Health and Safety,1620.0,https://docs.google.com/document/d/1L3VZnERuVqLjxu8DQQzJi45JvcGy6mRCjz5ouloaNLY/pub,"[{u'livestream': u'0', u'position': u'-7', u'user_id': u'186', u'id': u'61', u'label': u'Health and Safety'}]","[{u'user_id': u'186', u'type_id': u'1', u'url': u'https://docs.google.com/document/d/1L3VZnERuVqLjxu8DQQzJi45JvcGy6mRCjz5ouloaNLY/pub', u'storage': u'external', u'session_id': u'3265', u'label': None, u'file_id': None, u'provider': u'om_googledrive', u'agenda_provider_agenda_id': None, u'session_title': u'T-Town Clowns (Spanish)', u'type': u'Agenda', u'id': u'1620', u'agenda_provider_id': None}]"
171,3309,[11],Park and Recreation Month - Out Is In - July 2014 PSA,Park and Recreation Month - Out Is In - July 2014 PSA,"<p>This July, Out Is In!<br />
Join the city of Thornton and help celebrate Park &amp; Recreation Month this July 2014!</p>
",0,,186.0,2014-06-11,2014-06-11,2017-07-11,js6p5raGglM,https://www.youtube.com/watch?v=js6p5raGglM,62.0,PSAs,,,"[{u'livestream': u'0', u'position': u'-5', u'user_id': u'186', u'id': u'62', u'label': u'PSAs'}]",
172,3310,[11],Park and Recreation Month - Out Is In - July 2014 PSA ,Park and Recreation Month - Out Is In - July 2014 PSA ,"<p>This July, Out Is In!<br />
Join the city of Thornton and help celebrate Park &amp; Recreation Month this July 2014!</p>
",0,,186.0,2014-06-11,2014-06-11,2017-07-11,js6p5raGglM,https://www.youtube.com/watch?v=js6p5raGglM,60.0,Local Interest,,,"[{u'livestream': u'0', u'position': u'-8', u'user_id': u'186', u'id': u'60', u'label': u'Local Interest'}]",
173,3771,"[1, 2, 14]",Coyote Safety,Coyote Safety,"<p>The coyote, both wild and beautiful, is one neighbor that we need to consider hazing. So we can help them learn to live with us safely, along the front range we both call home.</p>
",0,,186.0,2017-05-17,2017-05-17,2017-07-11,XQ4zwXZgHzM,https://www.youtube.com/watch?v=XQ4zwXZgHzM,60.0,Local Interest,,,"[{u'livestream': u'0', u'position': u'-8', u'user_id': u'186', u'id': u'60', u'label': u'Local Interest'}]",
174,16404,[18],Board of County Commissioners Regular Meeting - 01/14/15,Board of County Commissioners Regular Meeting - 01/14/15,,0,,273.0,2015-01-14,2015-01-14,2017-10-30,ncSt3Nr2Mps,https://www.youtube.com/watch?v=ncSt3Nr2Mps,148.0,2015,4299.0,https://ompnetwork.s3-us-west-2.amazonaws.com/sites/273/granicus_files/605_calendar_1421218800.html,"[{u'livestream': u'0', u'position': u'-7', u'user_id': u'273', u'id': u'148', u'label': u'2015'}]","[{u'user_id': u'273', u'type_id': u'3', u'url': u'https://ompnetwork.s3-us-west-2.amazonaws.com/sites/273/granicus_files/605_calendar_1421218800.html', u'storage': u'external', u'session_id': u'16404', u'label': None, u'file_id': None, u'provider': u'generic', u'agenda_provider_agenda_id': None, u'session_title': u'Board of County Commissioners Regular Meeting - 01/14/15', u'type': u'Calendar', u'id': u'4299', u'agenda_provider_id': None}]"
175,3772,"[1, 2, 14]",Coyote Safety,Coyote Safety,"<p>The coyote, both wild and beautiful, is one neighbor that we need to consider hazing. So we can help them learn to live with us safely, along the front range we both call home.</p>
",0,,186.0,2017-05-17,2017-05-17,2017-07-11,XQ4zwXZgHzM,https://www.youtube.com/watch?v=XQ4zwXZgHzM,61.0,Health and Safety,,,"[{u'livestream': u'0', u'position': u'-7', u'user_id': u'186', u'id': u'61', u'label': u'Health and Safety'}]",
176,16892,"[6, 11, 12, 13, 16]",BOCC Work Session - 03/25/14,BOCC Work Session - 03/25/14,,0,,273.0,2014-03-25,2014-03-25,2017-10-30,ogk4D6KlRSg,https://www.youtube.com/watch?v=ogk4D6KlRSg,147.0,2014,4352.0,https://ompnetwork.s3-us-west-2.amazonaws.com/sites/273/granicus_files/512_calendar_1395727200.html,"[{u'livestream': u'0', u'position': u'-6', u'user_id': u'273', u'id': u'147', u'label': u'2014'}]","[{u'user_id': u'273', u'type_id': u'3', u'url': u'https://ompnetwork.s3-us-west-2.amazonaws.com/sites/273/granicus_files/512_calendar_1395727200.html', u'storage': u'external', u'session_id': u'16892', u'label': None, u'file_id': None, u'provider': u'generic', u'agenda_provider_agenda_id': None, u'session_title': u'BOCC Work Session - 03/25/14', u'type': u'Calendar', u'id': u'4352', u'agenda_provider_id': None}]"
177,8485,"[0, 3, 4, 5, 16, 18]",Planning Commission Regular Meeting - 01/10/11,Planning Commission Regular Meeting - 01/10/11,,0,,199.0,2011-01-10,2011-01-10,2017-08-01,441c-MC6tFs,https://www.youtube.com/watch?v=441c-MC6tFs,70.0,Planning,2759.0,https://ompnetwork.s3-us-west-2.amazonaws.com/sites/199/granicus_files/580_calendar_1294642800.html,"[{u'livestream': u'1', u'position': u'0', u'user_id': u'199', u'id': u'70', u'label': u'Planning'}]","[{u'user_id': u'199', u'type_id': u'3', u'url': u'https://ompnetwork.s3-us-west-2.amazonaws.com/sites/199/granicus_files/580_calendar_1294642800.html', u'storage': u'external', u'session_id': u'8485', u'label': None, u'file_id': None, u'provider': u'generic', u'agenda_provider_agenda_id': None, u'session_title': u'Planning Commission Regular Meeting - 01/10/11', u'type': u'Calendar', u'id': u'2759', u'agenda_provider_id': None}]"
178,8484,"[3, 5, 18]",Planning Commisson Study Session - 01/24/11,Planning Commisson Study Session - 01/24/11,,0,,199.0,2011-01-24,2011-01-24,2017-08-01,EGJy3AMBwaI,https://www.youtube.com/watch?v=EGJy3AMBwaI,70.0,Planning,2758.0,https://ompnetwork.s3-us-west-2.amazonaws.com/sites/199/granicus_files/589_calendar_1295852400.html,"[{u'livestream': u'1', u'position': u'0', u'user_id': u'199', u'id': u'70', u'label': u'Planning'}]","[{u'user_id': u'199', u'type_id': u'3', u'url': u'https://ompnetwork.s3-us-west-2.amazonaws.com/sites/199/granicus_files/589_calendar_1295852400.html', u'storage': u'external', u'session_id': u'8484', u'label': None, u'file_id': None, u'provider': u'generic', u'agenda_provider_agenda_id': None, u'session_title': u'Planning Commisson Study Session - 01/24/11', u'type': u'Calendar', u'id': u'2758', u'agenda_provider_id': None}]"
179,1457,"[0, 2, 10, 11, 13]","Board of Commissioners Afternoon Meeting May 24, 2016","Board of Commissioners Afternoon Meeting May 24, 2016",,0,shows/board-commissioners-afternoon-meeting-may-24-2016,143.0,2016-05-24,2016-05-24,2017-04-10,03P-ICfW8cI,https://www.youtube.com/watch?v=03P-ICfW8cI,25.0,Board of County Commissioners,1409.0,https://ompnetwork.s3-us-west-2.amazonaws.com/sites/143/documents/05-24_25-16viewagenda_0.pdf,"[{u'livestream': u'1', u'position': u'0', u'user_id': u'143', u'id': u'25', u'label': u'Board of County Commissioners'}]","[{u'user_id': u'143', u'type_id': u'1', u'url': u'https://ompnetwork.s3-us-west-2.amazonaws.com/sites/143/documents/05-24_25-16viewagenda_0.pdf', u'storage': u'attachment', u'session_id': u'1457', u'label': None, u'file_id': u'1512', u'provider': u'generic', u'agenda_provider_agenda_id': None, u'session_title': u'Board of Commissioners Afternoon Meeting May 24, 2016', u'type': u'Agenda', u'id': u'1409', u'agenda_provider_id': None}]"
180,810,"[4, 5, 6, 7]",Planning Commission Public Hearing 09-06-2011,Planning Commission Public Hearing 09-06-2011,,0,shows/planning-commission-public-hearing-09-06-2011,134.0,2011-09-06,2011-09-06,2017-03-20,HxnA9edBcIg,https://www.youtube.com/watch?v=HxnA9edBcIg,22.0,Planning Commission,1078.0,https://ompnetwork.s3-us-west-2.amazonaws.com/sites/134/documents/agenda_34_0.pdf,"[{u'livestream': u'1', u'position': u'-9', u'user_id': u'134', u'id': u'22', u'label': u'Planning Commission'}]","[{u'user_id': u'134', u'type_id': u'1', u'url': u'https://ompnetwork.s3-us-west-2.amazonaws.com/sites/134/documents/agenda_34_0.pdf', u'storage': u'attachment', u'session_id': u'810', u'label': None, u'file_id': u'1149', u'provider': u'generic', u'agenda_provider_agenda_id': None, u'session_title': u'Planning Commission Public Hearing 09-06-2011', u'type': u'Agenda', u'id': u'1078', u'agenda_provider_id': None}]"
181,453,"[8, 17, 18, 19]",City Council Work Session 05-22-2013,City Council Work Session 05-22-2013,,0,shows/city-council-work-session-05-22-2013,134.0,2013-05-22,2013-05-22,2017-03-20,aSZgfF58h0E,https://www.youtube.com/watch?v=aSZgfF58h0E,20.0,City Council,533.0,https://ompnetwork.s3-us-west-2.amazonaws.com/sites/134/documents/agenda_packet_276.pdf,"[{u'livestream': u'1', u'position': u'-10', u'user_id': u'134', u'id': u'20', u'label': u'City Council'}]","[{u'user_id': u'134', u'type_id': u'1', u'url': u'https://ompnetwork.s3-us-west-2.amazonaws.com/sites/134/documents/agenda_packet_276.pdf', u'storage': u'attachment', u'session_id': u'453', u'label': None, u'file_id': u'603', u'provider': u'generic', u'agenda_provider_agenda_id': None, u'session_title': u'City Council Work Session 05-22-2013', u'type': u'Agenda', u'id': u'533', u'agenda_provider_id': None}, {u'user_id': u'134', u'type_id': u'4', u'url': u'https://ompnetwork.s3-us-west-2.amazonaws.com/sites/134/documents/minutes_208.pdf', u'storage': u'attachment', u'session_id': u'453', u'label': None, u'file_id': u'604', u'provider': u'generic', u'agenda_provider_agenda_id': None, u'session_title': u'City Council Work Session 05-22-2013', u'type': u'Minutes', u'id': u'534', u'agenda_provider_id': None}]"
182,21124,"[1, 7, 13, 19]","December 7, 2017 Special Meeting","December 7, 2017 Special Meeting",,0,,250.0,2017-12-06,2017-12-07,2017-12-06,JEPLE5jz6Y0,https://www.youtube.com/watch?v=JEPLE5jz6Y0,117.0,Frazier Park PUD Board of Directors Meetings,4815.0,https://ompnetwork.s3-us-west-2.amazonaws.com/sites/250/documents/2017_12_07_special_meeting_agenda.pdf?jpFLhbJeReQLhK1CpTEV._3fwh4JfAoL,"[{u'livestream': u'1', u'position': u'0', u'user_id': u'250', u'id': u'117', u'label': u'Frazier Park PUD Board of Directors Meetings'}]","[{u'user_id': u'250', u'type_id': u'1', u'url': u'https://ompnetwork.s3-us-west-2.amazonaws.com/sites/250/documents/2017_12_07_special_meeting_agenda.pdf?jpFLhbJeReQLhK1CpTEV._3fwh4JfAoL', u'storage': u'attachment', u'session_id': u'21124', u'label': None, u'file_id': u'4170', u'provider': u'generic', u'agenda_provider_agenda_id': None, u'session_title': u'December 7, 2017 Special Meeting', u'type': u'Agenda', u'id': u'4815', u'agenda_provider_id': None}]"
183,3158,[16],"Toxics Board Meeting: January 15, 2015","Toxics Board Meeting: January 15, 2015",,0,,134.0,2017-07-07,2015-01-15,2017-07-20,1uJe_PDrY70,https://youtu.be/1uJe_PDrY70,46.0,Toxics Board,1781.0,https://ompnetwork.s3-us-west-2.amazonaws.com/sites/134/documents/archive.aspxadid3502?Xy74vjmfQ_73XknKSfVZ8A9arhJ1r3CE,"[{u'livestream': u'0', u'position': u'0', u'user_id': u'134', u'id': u'46', u'label': u'Toxics Board'}]","[{u'user_id': u'134', u'type_id': u'1', u'url': u'https://ompnetwork.s3-us-west-2.amazonaws.com/sites/134/documents/archive.aspxadid3502?Xy74vjmfQ_73XknKSfVZ8A9arhJ1r3CE', u'storage': u'attachment', u'session_id': u'3158', u'label': None, u'file_id': u'1919', u'provider': u'generic', u'agenda_provider_agenda_id': None, u'session_title': u'Toxics Board Meeting: January 15, 2015', u'type': u'Agenda', u'id': u'1781', u'agenda_provider_id': None}]"
184,721,"[3, 5, 18]",Planning Commission Public Hearing 02-05-2013,Planning Commission Public Hearing 02-05-2013,,0,shows/planning-commission-public-hearing-02-05-2013,134.0,2013-02-05,2013-02-05,2017-03-20,A-C583BErbY,https://www.youtube.com/watch?v=A-C583BErbY,22.0,Planning Commission,950.0,https://ompnetwork.s3-us-west-2.amazonaws.com/sites/134/documents/agenda_packet_169_0.pdf,"[{u'livestream': u'1', u'position': u'-9', u'user_id': u'134', u'id': u'22', u'label': u'Planning Commission'}]","[{u'user_id': u'134', u'type_id': u'1', u'url': u'https://ompnetwork.s3-us-west-2.amazonaws.com/sites/134/documents/agenda_packet_169_0.pdf', u'storage': u'attachment', u'session_id': u'721', u'label': None, u'file_id': u'1021', u'provider': u'generic', u'agenda_provider_agenda_id': None, u'session_title': u'Planning Commission Public Hearing 02-05-2013', u'type': u'Agenda', u'id': u'950', u'agenda_provider_id': None}]"
185,8464,"[5, 18]",Planning Commission Special Session  - 09/22/11,Planning Commission Special Session  - 09/22/11,,0,,199.0,2011-09-22,2011-09-22,2017-08-01,mVhnzkX31Es,https://www.youtube.com/watch?v=mVhnzkX31Es,70.0,Planning,2742.0,https://ompnetwork.s3-us-west-2.amazonaws.com/sites/199/granicus_files/745_calendar_1316671200.html,"[{u'livestream': u'1', u'position': u'0', u'user_id': u'199', u'id': u'70', u'label': u'Planning'}]","[{u'user_id': u'199', u'type_id': u'3', u'url': u'https://ompnetwork.s3-us-west-2.amazonaws.com/sites/199/granicus_files/745_calendar_1316671200.html', u'storage': u'external', u'session_id': u'8464', u'label': None, u'file_id': None, u'provider': u'generic', u'agenda_provider_agenda_id': None, u'session_title': u'Planning Commission Special Session  - 09/22/11', u'type': u'Calendar', u'id': u'2742', u'agenda_provider_id': None}]"
186,481,"[3, 14]",City Council Work Session 01-30-2013,City Council Work Session 01-30-2013,,0,shows/city-council-work-session-01-30-2013,134.0,2013-01-30,2013-01-30,2017-03-20,QGjNJXqk274,https://www.youtube.com/watch?v=QGjNJXqk274,20.0,City Council,584.0,https://ompnetwork.s3-us-west-2.amazonaws.com/sites/134/documents/agenda_37.pdf,"[{u'livestream': u'1', u'position': u'-10', u'user_id': u'134', u'id': u'20', u'label': u'City Council'}]","[{u'user_id': u'134', u'type_id': u'1', u'url': u'https://ompnetwork.s3-us-west-2.amazonaws.com/sites/134/documents/agenda_37.pdf', u'storage': u'attachment', u'session_id': u'481', u'label': None, u'file_id': u'654', u'provider': u'generic', u'agenda_provider_agenda_id': None, u'session_title': u'City Council Work Session 01-30-2013', u'type': u'Agenda', u'id': u'584', u'agenda_provider_id': None}, {u'user_id': u'134', u'type_id': u'4', u'url': u'https://ompnetwork.s3-us-west-2.amazonaws.com/sites/134/documents/minutes_37_0.pdf', u'storage': u'attachment', u'session_id': u'481', u'label': None, u'file_id': u'655', u'provider': u'generic', u'agenda_provider_agenda_id': None, u'session_title': u'City Council Work Session 01-30-2013', u'type': u'Minutes', u'id': u'585', u'agenda_provider_id': None}]"
187,245,"[0, 2, 7, 8, 12, 13, 16]",City Council Public Hearing 11-16-2015,City Council Public Hearing 11-16-2015,,0,shows/city-council-public-hearing-11-16-2015,134.0,2015-11-16,2015-11-16,2017-03-20,CMCCtSlNHEE,https://www.youtube.com/watch?v=CMCCtSlNHEE,20.0,City Council,,,"[{u'livestream': u'1', u'position': u'-10', u'user_id': u'134', u'id': u'20', u'label': u'City Council'}]",
188,315,"[6, 12, 13, 18]",City Council Work Session 11-19-2014,City Council Work Session 11-19-2014,,0,shows/city-council-work-session-11-19-2014,134.0,2014-11-19,2014-11-19,2017-03-20,Y755ot9sDoM,https://www.youtube.com/watch?v=Y755ot9sDoM,20.0,City Council,273.0,https://ompnetwork.s3-us-west-2.amazonaws.com/sites/134/documents/agenda_packet_151.pdf,"[{u'livestream': u'1', u'position': u'-10', u'user_id': u'134', u'id': u'20', u'label': u'City Council'}]","[{u'user_id': u'134', u'type_id': u'1', u'url': u'https://ompnetwork.s3-us-west-2.amazonaws.com/sites/134/documents/agenda_packet_151.pdf', u'storage': u'attachment', u'session_id': u'315', u'label': None, u'file_id': u'343', u'provider': u'generic', u'agenda_provider_agenda_id': None, u'session_title': u'City Council Work Session 11-19-2014', u'type': u'Agenda', u'id': u'273', u'agenda_provider_id': None}, {u'user_id': u'134', u'type_id': u'4', u'url': u'https://ompnetwork.s3-us-west-2.amazonaws.com/sites/134/documents/minutes_91.pdf', u'storage': u'attachment', u'session_id': u'315', u'label': None, u'file_id': u'344', u'provider': u'generic', u'agenda_provider_agenda_id': None, u'session_title': u'City Council Work Session 11-19-2014', u'type': u'Minutes', u'id': u'274', u'agenda_provider_id': None}]"
189,812,"[3, 6, 7, 13]",Planning Commission Public Hearing 08-31-2011,Planning Commission Public Hearing 08-31-2011,,0,shows/planning-commission-public-hearing-08-31-2011,134.0,2011-08-31,2011-08-31,2017-03-20,eyn0zp4YwfI,https://www.youtube.com/watch?v=eyn0zp4YwfI,22.0,Planning Commission,1080.0,https://ompnetwork.s3-us-west-2.amazonaws.com/sites/134/documents/agenda_35_0.pdf,"[{u'livestream': u'1', u'position': u'-9', u'user_id': u'134', u'id': u'22', u'label': u'Planning Commission'}]","[{u'user_id': u'134', u'type_id': u'1', u'url': u'https://ompnetwork.s3-us-west-2.amazonaws.com/sites/134/documents/agenda_35_0.pdf', u'storage': u'attachment', u'session_id': u'812', u'label': None, u'file_id': u'1151', u'provider': u'generic', u'agenda_provider_agenda_id': None, u'session_title': u'Planning Commission Public Hearing 08-31-2011', u'type': u'Agenda', u'id': u'1080', u'agenda_provider_id': None}]"
190,1063,"[4, 7, 8, 11, 13, 18]","Eugene City Council Work Session: December 7, 2016","Eugene City Council Work Session: December 7, 2016",,0,shows/eugene-city-council-work-session-december-7-2016,134.0,2016-12-07,2016-12-07,2017-03-20,KYRJAh7y5E8,https://www.youtube.com/watch?v=KYRJAh7y5E8,20.0,City Council,1328.0,https://ompnetwork.s3-us-west-2.amazonaws.com/sites/134/documents/cc_agenda_12-07-16_web.pdf,"[{u'livestream': u'1', u'position': u'-10', u'user_id': u'134', u'id': u'20', u'label': u'City Council'}]","[{u'user_id': u'134', u'type_id': u'1', u'url': u'https://ompnetwork.s3-us-west-2.amazonaws.com/sites/134/documents/cc_agenda_12-07-16_web.pdf', u'storage': u'attachment', u'session_id': u'1063', u'label': None, u'file_id': u'1399', u'provider': u'generic', u'agenda_provider_agenda_id': None, u'session_title': u'Eugene City Council Work Session: December 7, 2016', u'type': u'Agenda', u'id': u'1328', u'agenda_provider_id': None}, {u'user_id': u'134', u'type_id': u'4', u'url': u'https://ompnetwork.s3-us-west-2.amazonaws.com/sites/134/documents/161207.ws_.sire_.pdf', u'storage': u'attachment', u'session_id': u'1063', u'label': None, u'file_id': u'1400', u'provider': u'generic', u'agenda_provider_agenda_id': None, u'session_title': u'Eugene City Council Work Session: December 7, 2016', u'type': u'Minutes', u'id': u'1329', u'agenda_provider_id': None}]"
191,792,"[3, 7]",Planning Commission Public Hearing 11-15-2011,Planning Commission Public Hearing 11-15-2011,,0,shows/planning-commission-public-hearing-11-15-2011,134.0,2011-11-15,2011-11-15,2017-03-20,zK5f2CfNJ8E,https://www.youtube.com/watch?v=zK5f2CfNJ8E,22.0,Planning Commission,1052.0,https://ompnetwork.s3-us-west-2.amazonaws.com/sites/134/documents/agenda_19_0.pdf,"[{u'livestream': u'1', u'position': u'-9', u'user_id': u'134', u'id': u'22', u'label': u'Planning Commission'}]","[{u'user_id': u'134', u'type_id': u'1', u'url': u'https://ompnetwork.s3-us-west-2.amazonaws.com/sites/134/documents/agenda_19_0.pdf', u'storage': u'attachment', u'session_id': u'792', u'label': None, u'file_id': u'1123', u'provider': u'generic', u'agenda_provider_agenda_id': None, u'session_title': u'Planning Commission Public Hearing 11-15-2011', u'type': u'Agenda', u'id': u'1052', u'agenda_provider_id': None}]"
192,884,"[3, 18, 19]",City Council Public Hearing 04-19-2010,City Council Public Hearing 04-19-2010,,0,shows/city-council-public-hearing-04-19-2010,134.0,2010-04-19,2010-04-19,2017-03-20,IiIJ4g7ByPM,https://www.youtube.com/watch?v=IiIJ4g7ByPM,20.0,City Council,1214.0,https://ompnetwork.s3-us-west-2.amazonaws.com/sites/134/documents/agenda_243.pdf,"[{u'livestream': u'1', u'position': u'-10', u'user_id': u'134', u'id': u'20', u'label': u'City Council'}]","[{u'user_id': u'134', u'type_id': u'1', u'url': u'https://ompnetwork.s3-us-west-2.amazonaws.com/sites/134/documents/agenda_243.pdf', u'storage': u'attachment', u'session_id': u'884', u'label': None, u'file_id': u'1285', u'provider': u'generic', u'agenda_provider_agenda_id': None, u'session_title': u'City Council Public Hearing 04-19-2010', u'type': u'Agenda', u'id': u'1214', u'agenda_provider_id': None}, {u'user_id': u'134', u'type_id': u'4', u'url': u'https://ompnetwork.s3-us-west-2.amazonaws.com/sites/134/documents/minutes_301.pdf', u'storage': u'attachment', u'session_id': u'884', u'label': None, u'file_id': u'1286', u'provider': u'generic', u'agenda_provider_agenda_id': None, u'session_title': u'City Council Public Hearing 04-19-2010', u'type': u'Minutes', u'id': u'1215', u'agenda_provider_id': None}]"
193,6658,"[4, 11, 12, 13, 19]",City Council  - Special Meeting  - 07/12/11,City Council  - Special Meeting  - 07/12/11,,0,,199.0,2011-07-12,2011-07-12,2017-08-01,XKMzgIM9-_c,https://www.youtube.com/watch?v=XKMzgIM9-_c,69.0,Council,2332.0,https://ompnetwork.s3-us-west-2.amazonaws.com/sites/199/documents/cc_agenda_07-12-2011.pdf?ds3sWH9hyD29lUbikoIBPNOG2cqwzi2L,"[{u'livestream': u'1', u'position': u'0', u'user_id': u'199', u'id': u'69', u'label': u'Council'}]","[{u'user_id': u'199', u'type_id': u'1', u'url': u'https://ompnetwork.s3-us-west-2.amazonaws.com/sites/199/documents/cc_agenda_07-12-2011.pdf?ds3sWH9hyD29lUbikoIBPNOG2cqwzi2L', u'storage': u'attachment', u'session_id': u'6658', u'label': None, u'file_id': u'2369', u'provider': u'generic', u'agenda_provider_agenda_id': None, u'session_title': u'City Council  - Special Meeting  - 07/12/11', u'type': u'Agenda', u'id': u'2332', u'agenda_provider_id': None}, {u'user_id': u'199', u'type_id': u'3', u'url': u'https://ompnetwork.s3-us-west-2.amazonaws.com/sites/199/granicus_files/702_calendar_1310450400.html', u'storage': u'external', u'session_id': u'6658', u'label': None, u'file_id': None, u'provider': u'generic', u'agenda_provider_agenda_id': None, u'session_title': u'City Council  - Special Meeting  - 07/12/11', u'type': u'Calendar', u'id': u'2333', u'agenda_provider_id': None}, {u'user_id': u'199', u'type_id': u'2', u'url': u'https://ompnetwork.s3-us-west-2.amazonaws.com/sites/199/documents/cc_minutes_07-12-2011.pdf?idMM8Zn6Loy6.vl3VWCpCqsRXGAheEiY', u'storage': u'attachment', u'session_id': u'6658', u'label': None, u'file_id': u'2370', u'provider': u'generic', u'agenda_provider_agenda_id': None, u'session_title': u'City Council  - Special Meeting  - 07/12/11', u'type': u'Journal', u'id': u'2334', u'agenda_provider_id': None}, {u'user_id': u'199', u'type_id': u'5', u'url': u'https://ompnetwork.s3-us-west-2.amazonaws.com/sites/199/documents/cc_packet_07-12-2011.pdf?JLDWKisHX6Nx.1JT.nRNwZdjWr1LpXIr', u'storage': u'attachment', u'session_id': u'6658', u'label': None, u'file_id': u'2371', u'provider': u'generic', u'agenda_provider_agenda_id': None, u'session_title': u'City Council  - Special Meeting  - 07/12/11', u'type': u'Packet', u'id': u'2335', u'agenda_provider_id': None}]"
194,213,"[4, 11, 17, 19]",City Council Work Session 04-27-2016,City Council Work Session 04-27-2016,,0,shows/city-council-work-session-04-27-2016,134.0,2016-04-27,2016-04-27,2017-03-20,Fx3q2HCsoiw,https://www.youtube.com/watch?v=Fx3q2HCsoiw,20.0,City Council,83.0,https://ompnetwork.s3-us-west-2.amazonaws.com/sites/134/documents/agenda_packet_14.pdf,"[{u'livestream': u'1', u'position': u'-10', u'user_id': u'134', u'id': u'20', u'label': u'City Council'}]","[{u'user_id': u'134', u'type_id': u'1', u'url': u'https://ompnetwork.s3-us-west-2.amazonaws.com/sites/134/documents/agenda_packet_14.pdf', u'storage': u'attachment', u'session_id': u'213', u'label': None, u'file_id': u'153', u'provider': u'generic', u'agenda_provider_agenda_id': None, u'session_title': u'City Council Work Session 04-27-2016', u'type': u'Agenda', u'id': u'83', u'agenda_provider_id': None}, {u'user_id': u'134', u'type_id': u'4', u'url': u'https://ompnetwork.s3-us-west-2.amazonaws.com/sites/134/documents/minutes_12.pdf', u'storage': u'attachment', u'session_id': u'213', u'label': None, u'file_id': u'154', u'provider': u'generic', u'agenda_provider_agenda_id': None, u'session_title': u'City Council Work Session 04-27-2016', u'type': u'Minutes', u'id': u'84', u'agenda_provider_id': None}]"
195,3834,"[12, 13, 15, 18]","Eugene Police Commission Meeting July 13, 2017","Eugene Police Commission Meeting July 13, 2017",,0,,134.0,2017-07-14,2017-07-13,2017-07-18,XLOWCjFMyv8,https://youtu.be/XLOWCjFMyv8,45.0,Police Commission,1734.0,https://ompnetwork.s3-us-west-2.amazonaws.com/sites/134/documents/eugene_police_commission_agenda_packet_july_13_2017.pdf?OQECkScnQddAo9P0NRbOAaH9UX1e3_A7,"[{u'livestream': u'0', u'position': u'0', u'user_id': u'134', u'id': u'45', u'label': u'Police Commission'}]","[{u'user_id': u'134', u'type_id': u'1', u'url': u'https://ompnetwork.s3-us-west-2.amazonaws.com/sites/134/documents/eugene_police_commission_agenda_packet_july_13_2017.pdf?OQECkScnQddAo9P0NRbOAaH9UX1e3_A7', u'storage': u'attachment', u'session_id': u'3834', u'label': None, u'file_id': u'1888', u'provider': u'generic', u'agenda_provider_agenda_id': None, u'session_title': u'Eugene Police Commission Meeting July 13, 2017', u'type': u'Agenda', u'id': u'1734', u'agenda_provider_id': None}]"
196,3854,"[0, 12, 13, 16]","Eugene Police Commission Meeting Feburary 13, 2014","Eugene Police Commission Meeting Feburary 13, 2014",,0,,134.0,2017-07-15,2014-02-13,2017-07-17,WTi-L2Hvm8M,https://youtu.be/WTi-L2Hvm8M,45.0,Police Commission,1682.0,https://ompnetwork.s3-us-west-2.amazonaws.com/sites/134/documents/2014_02_13_meeting_rn2946_0.pdf,"[{u'livestream': u'0', u'position': u'0', u'user_id': u'134', u'id': u'45', u'label': u'Police Commission'}]","[{u'user_id': u'134', u'type_id': u'1', u'url': u'https://ompnetwork.s3-us-west-2.amazonaws.com/sites/134/documents/2014_02_13_meeting_rn2946_0.pdf', u'storage': u'attachment', u'session_id': u'3854', u'label': None, u'file_id': u'1841', u'provider': u'generic', u'agenda_provider_agenda_id': None, u'session_title': u'Eugene Police Commission Meeting Feburary 13, 2014', u'type': u'Agenda', u'id': u'1682', u'agenda_provider_id': None}]"
197,254,"[9, 10, 15, 19]",City Council Work Session 10-12-2015,City Council Work Session 10-12-2015,,0,shows/city-council-work-session-10-12-2015,134.0,2015-10-12,2015-10-12,2017-03-20,cTbcqTvQfEA,https://www.youtube.com/watch?v=cTbcqTvQfEA,20.0,City Council,159.0,https://ompnetwork.s3-us-west-2.amazonaws.com/sites/134/documents/agenda_packet_54.pdf,"[{u'livestream': u'1', u'position': u'-10', u'user_id': u'134', u'id': u'20', u'label': u'City Council'}]","[{u'user_id': u'134', u'type_id': u'1', u'url': u'https://ompnetwork.s3-us-west-2.amazonaws.com/sites/134/documents/agenda_packet_54.pdf', u'storage': u'attachment', u'session_id': u'254', u'label': None, u'file_id': u'229', u'provider': u'generic', u'agenda_provider_agenda_id': None, u'session_title': u'City Council Work Session 10-12-2015', u'type': u'Agenda', u'id': u'159', u'agenda_provider_id': None}, {u'user_id': u'134', u'type_id': u'4', u'url': u'https://ompnetwork.s3-us-west-2.amazonaws.com/sites/134/documents/minutes_38.pdf', u'storage': u'attachment', u'session_id': u'254', u'label': None, u'file_id': u'230', u'provider': u'generic', u'agenda_provider_agenda_id': None, u'session_title': u'City Council Work Session 10-12-2015', u'type': u'Minutes', u'id': u'160', u'agenda_provider_id': None}]"
198,14725,"[7, 8]","Planning Commission Meeting: August 23, 2016","Planning Commission Meeting: August 23, 2016",,0,,134.0,2017-09-15,2016-08-23,2017-09-15,gXwDbzVBd8o,https://www.youtube.com/watch?v=gXwDbzVBd8o&feature=youtu.be,20.0,City Council,3974.0,,"[{u'livestream': u'1', u'position': u'-10', u'user_id': u'134', u'id': u'20', u'label': u'City Council'}]","[{u'user_id': u'134', u'type_id': u'1', u'url': None, u'storage': u'external', u'session_id': u'14725', u'label': None, u'file_id': None, u'provider': u'generic', u'agenda_provider_agenda_id': None, u'session_title': u'Planning Commission Meeting: August 23, 2016', u'type': u'Agenda', u'id': u'3974', u'agenda_provider_id': None}]"
199,432,"[3, 5]",City Council Work Session 07-17-2013,City Council Work Session 07-17-2013,,0,shows/city-council-work-session-07-17-2013,134.0,2013-07-17,2013-07-17,2017-03-20,6emNr8AZ_L0,https://www.youtube.com/watch?v=6emNr8AZ_L0,20.0,City Council,493.0,https://ompnetwork.s3-us-west-2.amazonaws.com/sites/134/documents/agenda_packet_253.pdf,"[{u'livestream': u'1', u'position': u'-10', u'user_id': u'134', u'id': u'20', u'label': u'City Council'}]","[{u'user_id': u'134', u'type_id': u'1', u'url': u'https://ompnetwork.s3-us-west-2.amazonaws.com/sites/134/documents/agenda_packet_253.pdf', u'storage': u'attachment', u'session_id': u'432', u'label': None, u'file_id': u'563', u'provider': u'generic', u'agenda_provider_agenda_id': None, u'session_title': u'City Council Work Session 07-17-2013', u'type': u'Agenda', u'id': u'493', u'agenda_provider_id': None}, {u'user_id': u'134', u'type_id': u'4', u'url': u'https://ompnetwork.s3-us-west-2.amazonaws.com/sites/134/documents/minutes_192.pdf', u'storage': u'attachment', u'session_id': u'432', u'label': None, u'file_id': u'564', u'provider': u'generic', u'agenda_provider_agenda_id': None, u'session_title': u'City Council Work Session 07-17-2013', u'type': u'Minutes', u'id': u'494', u'agenda_provider_id': None}]"
200,14727,"[7, 8]","Planning Commission Meeting: August 23, 2016","Planning Commission Meeting: August 23, 2016",,0,,134.0,2017-09-15,2016-08-23,2017-09-15,gXwDbzVBd8o,https://www.youtube.com/watch?v=gXwDbzVBd8o&feature=youtu.be,22.0,Planning Commission,3978.0,,"[{u'livestream': u'1', u'position': u'-9', u'user_id': u'134', u'id': u'22', u'label': u'Planning Commission'}]","[{u'user_id': u'134', u'type_id': u'1', u'url': None, u'storage': u'external', u'session_id': u'14727', u'label': None, u'file_id': None, u'provider': u'generic', u'agenda_provider_agenda_id': None, u'session_title': u'Planning Commission Meeting: August 23, 2016', u'type': u'Agenda', u'id': u'3978', u'agenda_provider_id': None}]"
201,3371,[2],Harvest Fest 2015,Harvest Fest 2015,"<p>Come to Harvest Fest on Saturday, September 12, 2015 fom 10 a.m. to 5 p.m, at the Community Park at Thornton Parkway and York Street.</p>

<p>For more info visit:</p>

<p>http://www.cityofthornton.net/festivals-events/Pages/harvest-fest.aspx</p>
",0,,186.0,2015-08-01,2015-08-01,2017-07-11,6cu2RqGvL8Q,https://www.youtube.com/watch?v=6cu2RqGvL8Q,62.0,PSAs,,,"[{u'livestream': u'0', u'position': u'-5', u'user_id': u'186', u'id': u'62', u'label': u'PSAs'}]",
202,2568,"[10, 12, 16]","Board of Commissioners Morning Meeting: August 5, 2015","Board of Commissioners Morning Meeting: August 5, 2015",,0,,143.0,2017-05-10,2015-08-05,2017-05-10,vJs-Dtuw5hI,https://www.youtube.com/watch?v=vJs-Dtuw5hI,25.0,Board of County Commissioners,,,"[{u'livestream': u'1', u'position': u'0', u'user_id': u'143', u'id': u'25', u'label': u'Board of County Commissioners'}]",
203,537,"[2, 3, 7]",Planning Commission 07-14-2015,Planning Commission 07-14-2015,,0,shows/planning-commission-07-14-2015,134.0,2015-07-14,2015-07-14,2017-03-20,nBnilAn5GJs,https://www.youtube.com/watch?v=nBnilAn5GJs,22.0,Planning Commission,668.0,https://ompnetwork.s3-us-west-2.amazonaws.com/sites/134/documents/agenda_packet_87_0.pdf,"[{u'livestream': u'1', u'position': u'-9', u'user_id': u'134', u'id': u'22', u'label': u'Planning Commission'}]","[{u'user_id': u'134', u'type_id': u'1', u'url': u'https://ompnetwork.s3-us-west-2.amazonaws.com/sites/134/documents/agenda_packet_87_0.pdf', u'storage': u'attachment', u'session_id': u'537', u'label': None, u'file_id': u'738', u'provider': u'generic', u'agenda_provider_agenda_id': None, u'session_title': u'Planning Commission 07-14-2015', u'type': u'Agenda', u'id': u'668', u'agenda_provider_id': None}]"
204,21314,"[2, 5, 16]",Town of New Castle Board Meeting 12/11/17,Town of New Castle Board Meeting 12/11/17,,0,,281.0,2017-12-12,2017-12-11,2017-12-12,mxKtf0pd32w,https://youtu.be/mxKtf0pd32w,158.0,Town of New Castle Board Meetings,4853.0,https://ompnetwork.s3-us-west-2.amazonaws.com/sites/281/documents/12.11.17_agenda_test_0.pdf?mDTEq5MmaDaqHfjjHU.2GpVPiPweT7QI,"[{u'livestream': u'0', u'position': u'-10', u'user_id': u'281', u'id': u'158', u'label': u'Town of New Castle Board Meetings'}]","[{u'user_id': u'281', u'type_id': u'1', u'url': u'https://ompnetwork.s3-us-west-2.amazonaws.com/sites/281/documents/12.11.17_agenda_test_0.pdf?mDTEq5MmaDaqHfjjHU.2GpVPiPweT7QI', u'storage': u'attachment', u'session_id': u'21314', u'label': None, u'file_id': u'4217', u'provider': u'generic', u'agenda_provider_agenda_id': None, u'session_title': u'Town of New Castle Board Meeting 12/11/17', u'type': u'Agenda', u'id': u'4853', u'agenda_provider_id': None}]"
205,5852,"[0, 6, 12, 16, 19]",City Council - Regular Meeting  - 09/18/12,City Council - Regular Meeting  - 09/18/12,,0,,199.0,2012-09-18,2012-09-18,2017-08-01,Ow-dkCK70Js,https://www.youtube.com/watch?v=Ow-dkCK70Js,69.0,Council,2176.0,https://ompnetwork.s3-us-west-2.amazonaws.com/sites/199/documents/cc_agenda_09-18-2012.pdf?DO97TP5Vc5ermurhiNxIeHlYmqmAFQKi,"[{u'livestream': u'1', u'position': u'0', u'user_id': u'199', u'id': u'69', u'label': u'Council'}]","[{u'user_id': u'199', u'type_id': u'1', u'url': u'https://ompnetwork.s3-us-west-2.amazonaws.com/sites/199/documents/cc_agenda_09-18-2012.pdf?DO97TP5Vc5ermurhiNxIeHlYmqmAFQKi', u'storage': u'attachment', u'session_id': u'5852', u'label': None, u'file_id': u'2272', u'provider': u'generic', u'agenda_provider_agenda_id': None, u'session_title': u'City Council - Regular Meeting  - 09/18/12', u'type': u'Agenda', u'id': u'2176', u'agenda_provider_id': None}, {u'user_id': u'199', u'type_id': u'3', u'url': u'https://ompnetwork.s3-us-west-2.amazonaws.com/sites/199/granicus_files/921_calendar_1347948000.html', u'storage': u'external', u'session_id': u'5852', u'label': None, u'file_id': None, u'provider': u'generic', u'agenda_provider_agenda_id': None, u'session_title': u'City Council - Regular Meeting  - 09/18/12', u'type': u'Calendar', u'id': u'2177', u'agenda_provider_id': None}, {u'user_id': u'199', u'type_id': u'2', u'url': u'https://ompnetwork.s3-us-west-2.amazonaws.com/sites/199/documents/cc_minutes_09-18-2012.pdf?x93wbEDBZ8LvD5xVuMISuIajkWkerWeP', u'storage': u'attachment', u'session_id': u'5852', u'label': None, u'file_id': u'2273', u'provider': u'generic', u'agenda_provider_agenda_id': None, u'session_title': u'City Council - Regular Meeting  - 09/18/12', u'type': u'Journal', u'id': u'2178', u'agenda_provider_id': None}, {u'user_id': u'199', u'type_id': u'5', u'url': u'https://ompnetwork.s3-us-west-2.amazonaws.com/sites/199/documents/cc_packet_09-18-2012.pdf?x2MOtBTILi42WxEejUSI28CM2KYb8ZNR', u'storage': u'attachment', u'session_id': u'5852', u'label': None, u'file_id': u'2274', u'provider': u'generic', u'agenda_provider_agenda_id': None, u'session_title': u'City Council - Regular Meeting  - 09/18/12', u'type': u'Packet', u'id': u'2179', u'agenda_provider_id': None}]"
206,2540,"[12, 13, 18]","Budget Committee Meeting: May 12, 2015","Budget Committee Meeting: May 12, 2015",,0,,143.0,2017-05-10,2015-05-12,2017-05-10,J1vUyeT00P4,https://www.youtube.com/watch?v=J1vUyeT00P4,28.0,Budget Committee,,,"[{u'livestream': u'1', u'position': u'0', u'user_id': u'143', u'id': u'28', u'label': u'Budget Committee'}]",
207,3260,"[2, 9, 14, 17]",Connected Colorado - April-May 2013 ,Connected Colorado - April-May 2013 ,"<p>It's time to spring forward and get outside and enjoy some great open spaces and trails! We'll show you Two Ponds in Arvada, which is the smallest National Wildlife Refuge in the country, plus the brand new Metzger Farm Open Space, and some great bike trails in Lakewood. It's also time for planting, so we'll learn about an urban agriculture program in Wheat Ridge. We'll also visit the fascinating Butterfly Pavilion, on Connected Colorado.</p>
",0,,186.0,2013-07-09,2013-07-09,2017-07-11,F2wDSZGqGFo,http://www.youtube.com/watch?feature=player_detailpage&v=F2wDSZGqGFo,63.0,Connected Colorado,,,"[{u'livestream': u'0', u'position': u'-4', u'user_id': u'186', u'id': u'63', u'label': u'Connected Colorado'}]",
208,3817,"[0, 7]","Thornton City Council Meeting - July 11, 2017","Thornton City Council Meeting - July 11, 2017","To access the closed caption information associated with this video, click the CC icon in the lower right corner of the video player.

View more information on Thornton's City Council&nbsp;<a href=""http://www.cityofthornton.net/government/city-council/Pages/default.aspx"">here.</a>
",0,,186.0,2017-07-11,2017-07-11,2017-07-18,aDrXNw7zUTA,https://www.youtube.com/watch?v=aDrXNw7zUTA,58.0,City Council Meeting,1646.0,https://docs.google.com/document/d/1KwcdcSUSX1SblwuxdbNb2J46GRYQFj7SLUKj3N68vLw/pub,"[{u'livestream': u'1', u'position': u'-10', u'user_id': u'186', u'id': u'58', u'label': u'City Council Meeting'}]","[{u'user_id': u'186', u'type_id': u'1', u'url': u'https://docs.google.com/document/d/1KwcdcSUSX1SblwuxdbNb2J46GRYQFj7SLUKj3N68vLw/pub', u'storage': u'external', u'session_id': u'3817', u'label': None, u'file_id': None, u'provider': u'om_googledrive', u'agenda_provider_agenda_id': None, u'session_title': u'Thornton City Council Meeting - July 11, 2017', u'type': u'Agenda', u'id': u'1646', u'agenda_provider_id': None}]"
209,734,"[2, 3, 5]",Planning Commission Public Hearing 12-11-2012,Planning Commission Public Hearing 12-11-2012,,0,shows/planning-commission-public-hearing-12-11-2012,134.0,2012-12-11,2012-12-11,2017-03-20,RoI590wwl6E,https://www.youtube.com/watch?v=RoI590wwl6E,22.0,Planning Commission,970.0,https://ompnetwork.s3-us-west-2.amazonaws.com/sites/134/documents/agenda_packet_174_0.pdf,"[{u'livestream': u'1', u'position': u'-9', u'user_id': u'134', u'id': u'22', u'label': u'Planning Commission'}]","[{u'user_id': u'134', u'type_id': u'1', u'url': u'https://ompnetwork.s3-us-west-2.amazonaws.com/sites/134/documents/agenda_packet_174_0.pdf', u'storage': u'attachment', u'session_id': u'734', u'label': None, u'file_id': u'1041', u'provider': u'generic', u'agenda_provider_agenda_id': None, u'session_title': u'Planning Commission Public Hearing 12-11-2012', u'type': u'Agenda', u'id': u'970', u'agenda_provider_id': None}]"
210,2536,"[0, 4, 12, 13]","Board of Commissioners Morning Meeting: May 8, 2015","Board of Commissioners Morning Meeting: May 8, 2015",,0,,143.0,2017-05-10,2015-05-08,2017-05-10,o_fS-tOAmec,https://www.youtube.com/watch?v=o_fS-tOAmec,25.0,Board of County Commissioners,,,"[{u'livestream': u'1', u'position': u'0', u'user_id': u'143', u'id': u'25', u'label': u'Board of County Commissioners'}]",
211,10046,"[3, 5, 11]",Planning Board - 3/9/2015,Planning Board - 3/9/2015,,0,,199.0,2015-03-09,2015-03-09,2017-08-02,g72wgbOycNw,https://www.youtube.com/watch?v=g72wgbOycNw,70.0,Planning,3326.0,https://ompnetwork.s3-us-west-2.amazonaws.com/sites/199/granicus_files/1432_calendar_1425880800.pdf,"[{u'livestream': u'1', u'position': u'0', u'user_id': u'199', u'id': u'70', u'label': u'Planning'}]","[{u'user_id': u'199', u'type_id': u'3', u'url': u'https://ompnetwork.s3-us-west-2.amazonaws.com/sites/199/granicus_files/1432_calendar_1425880800.pdf', u'storage': u'external', u'session_id': u'10046', u'label': None, u'file_id': None, u'provider': u'generic', u'agenda_provider_agenda_id': None, u'session_title': u'Planning Board - 3/9/2015', u'type': u'Calendar', u'id': u'3326', u'agenda_provider_id': None}, {u'user_id': u'199', u'type_id': u'2', u'url': u'https://ompnetwork.s3-us-west-2.amazonaws.com/sites/199/documents/pb_minutes_030915_journal_legistar.pdf?rfUhJyYBMEpl4onEflD3yobxtsvrs.Dr', u'storage': u'attachment', u'session_id': u'10046', u'label': None, u'file_id': u'2988', u'provider': u'generic', u'agenda_provider_agenda_id': None, u'session_title': u'Planning Board - 3/9/2015', u'type': u'Journal', u'id': u'3327', u'agenda_provider_id': None}]"
212,406,"[13, 14]",City Council Meeting 11-12-2013,City Council Meeting 11-12-2013,,0,shows/city-council-meeting-11-12-2013,134.0,2013-11-12,2013-11-12,2017-03-20,SWsXMH6depU,https://www.youtube.com/watch?v=SWsXMH6depU,20.0,City Council,443.0,https://ompnetwork.s3-us-west-2.amazonaws.com/sites/134/documents/agenda_packet_219.pdf,"[{u'livestream': u'1', u'position': u'-10', u'user_id': u'134', u'id': u'20', u'label': u'City Council'}]","[{u'user_id': u'134', u'type_id': u'1', u'url': u'https://ompnetwork.s3-us-west-2.amazonaws.com/sites/134/documents/agenda_packet_219.pdf', u'storage': u'attachment', u'session_id': u'406', u'label': None, u'file_id': u'513', u'provider': u'generic', u'agenda_provider_agenda_id': None, u'session_title': u'City Council Meeting 11-12-2013', u'type': u'Agenda', u'id': u'443', u'agenda_provider_id': None}, {u'user_id': u'134', u'type_id': u'4', u'url': u'https://ompnetwork.s3-us-west-2.amazonaws.com/sites/134/documents/minutes_171.pdf', u'storage': u'attachment', u'session_id': u'406', u'label': None, u'file_id': u'514', u'provider': u'generic', u'agenda_provider_agenda_id': None, u'session_title': u'City Council Meeting 11-12-2013', u'type': u'Minutes', u'id': u'444', u'agenda_provider_id': None}]"
213,316,"[8, 16, 19]",City Council Public Hearing 11-17-2014,City Council Public Hearing 11-17-2014,,0,shows/city-council-public-hearing-11-17-2014,134.0,2014-11-17,2014-11-17,2017-03-20,3iex8vsmLxw,https://www.youtube.com/watch?v=3iex8vsmLxw,20.0,City Council,275.0,https://ompnetwork.s3-us-west-2.amazonaws.com/sites/134/documents/agenda_packet_152.pdf,"[{u'livestream': u'1', u'position': u'-10', u'user_id': u'134', u'id': u'20', u'label': u'City Council'}]","[{u'user_id': u'134', u'type_id': u'1', u'url': u'https://ompnetwork.s3-us-west-2.amazonaws.com/sites/134/documents/agenda_packet_152.pdf', u'storage': u'attachment', u'session_id': u'316', u'label': None, u'file_id': u'345', u'provider': u'generic', u'agenda_provider_agenda_id': None, u'session_title': u'City Council Public Hearing 11-17-2014', u'type': u'Agenda', u'id': u'275', u'agenda_provider_id': None}, {u'user_id': u'134', u'type_id': u'4', u'url': u'https://ompnetwork.s3-us-west-2.amazonaws.com/sites/134/documents/minutes_92.pdf', u'storage': u'attachment', u'session_id': u'316', u'label': None, u'file_id': u'346', u'provider': u'generic', u'agenda_provider_agenda_id': None, u'session_title': u'City Council Public Hearing 11-17-2014', u'type': u'Minutes', u'id': u'276', u'agenda_provider_id': None}]"
214,3354,"[1, 2, 13, 14, 18]","Thornton360 - April 1, 2015","Thornton360 - April 1, 2015","<p>Thornton360 is produced by the city of Thornton after each city council meeting, recapping the latest meeting and keeping residents informed about important news, issues and events happening in our community.</p>

<p><a href=""http://www.cityofthornton.tv/"" style=""color: rgb(51, 149, 210);"">www.cityofthornton.tv</a></p>
",0,,186.0,2015-04-01,2015-04-01,2017-07-11,rfyZyk7AGxI,https://www.youtube.com/watch?v=rfyZyk7AGxI,59.0,Thornton360,,,"[{u'livestream': u'0', u'position': u'-9', u'user_id': u'186', u'id': u'59', u'label': u'Thornton360'}]",
215,291,"[0, 8, 16, 18]",City Council Work Session 04-15-2015,City Council Work Session 04-15-2015,,0,shows/city-council-work-session-04-15-2015,134.0,2015-04-15,2015-04-15,2017-03-20,Tt7feTfXy4Y,https://www.youtube.com/watch?v=Tt7feTfXy4Y,20.0,City Council,227.0,https://ompnetwork.s3-us-west-2.amazonaws.com/sites/134/documents/agenda_packet_111.pdf,"[{u'livestream': u'1', u'position': u'-10', u'user_id': u'134', u'id': u'20', u'label': u'City Council'}]","[{u'user_id': u'134', u'type_id': u'1', u'url': u'https://ompnetwork.s3-us-west-2.amazonaws.com/sites/134/documents/agenda_packet_111.pdf', u'storage': u'attachment', u'session_id': u'291', u'label': None, u'file_id': u'297', u'provider': u'generic', u'agenda_provider_agenda_id': None, u'session_title': u'City Council Work Session 04-15-2015', u'type': u'Agenda', u'id': u'227', u'agenda_provider_id': None}, {u'user_id': u'134', u'type_id': u'4', u'url': u'https://ompnetwork.s3-us-west-2.amazonaws.com/sites/134/documents/minutes_69.pdf', u'storage': u'attachment', u'session_id': u'291', u'label': None, u'file_id': u'298', u'provider': u'generic', u'agenda_provider_agenda_id': None, u'session_title': u'City Council Work Session 04-15-2015', u'type': u'Minutes', u'id': u'228', u'agenda_provider_id': None}]"
216,269,"[8, 11]",City Council Work Session 07-13-2015,City Council Work Session 07-13-2015,,0,shows/city-council-work-session-07-13-2015,134.0,2015-07-13,2015-07-13,2017-03-20,PCOA-6_-3BM,https://www.youtube.com/watch?v=PCOA-6_-3BM,20.0,City Council,187.0,https://ompnetwork.s3-us-west-2.amazonaws.com/sites/134/documents/agenda_packet_80.pdf,"[{u'livestream': u'1', u'position': u'-10', u'user_id': u'134', u'id': u'20', u'label': u'City Council'}]","[{u'user_id': u'134', u'type_id': u'1', u'url': u'https://ompnetwork.s3-us-west-2.amazonaws.com/sites/134/documents/agenda_packet_80.pdf', u'storage': u'attachment', u'session_id': u'269', u'label': None, u'file_id': u'257', u'provider': u'generic', u'agenda_provider_agenda_id': None, u'session_title': u'City Council Work Session 07-13-2015', u'type': u'Agenda', u'id': u'187', u'agenda_provider_id': None}, {u'user_id': u'134', u'type_id': u'4', u'url': u'https://ompnetwork.s3-us-west-2.amazonaws.com/sites/134/documents/minutes_52.pdf', u'storage': u'attachment', u'session_id': u'269', u'label': None, u'file_id': u'258', u'provider': u'generic', u'agenda_provider_agenda_id': None, u'session_title': u'City Council Work Session 07-13-2015', u'type': u'Minutes', u'id': u'188', u'agenda_provider_id': None}]"
217,497,"[3, 7, 8]",Planning Commission 01-26-2016,Planning Commission 01-26-2016,,0,shows/planning-commission-01-26-2016,134.0,2016-01-26,2016-01-26,2017-03-20,o8bs0BFbQtI,https://www.youtube.com/watch?v=o8bs0BFbQtI,22.0,Planning Commission,609.0,https://ompnetwork.s3-us-west-2.amazonaws.com/sites/134/documents/agenda_packet_25_0.pdf,"[{u'livestream': u'1', u'position': u'-9', u'user_id': u'134', u'id': u'22', u'label': u'Planning Commission'}]","[{u'user_id': u'134', u'type_id': u'1', u'url': u'https://ompnetwork.s3-us-west-2.amazonaws.com/sites/134/documents/agenda_packet_25_0.pdf', u'storage': u'attachment', u'session_id': u'497', u'label': None, u'file_id': u'679', u'provider': u'generic', u'agenda_provider_agenda_id': None, u'session_title': u'Planning Commission 01-26-2016', u'type': u'Agenda', u'id': u'609', u'agenda_provider_id': None}]"
218,3858,"[0, 1, 2, 12, 13]","Eugene Police Commission Meeting January 12, 2017","Eugene Police Commission Meeting January 12, 2017",,0,,134.0,2017-07-16,2017-01-12,2017-07-17,up--uqQjDAA,https://youtu.be/up--uqQjDAA,45.0,Police Commission,1652.0,https://ompnetwork.s3-us-west-2.amazonaws.com/sites/134/documents/reduced_size_jan_2017.pdf,"[{u'livestream': u'0', u'position': u'0', u'user_id': u'134', u'id': u'45', u'label': u'Police Commission'}]","[{u'user_id': u'134', u'type_id': u'1', u'url': u'https://ompnetwork.s3-us-west-2.amazonaws.com/sites/134/documents/reduced_size_jan_2017.pdf', u'storage': u'attachment', u'session_id': u'3858', u'label': None, u'file_id': u'1810', u'provider': u'generic', u'agenda_provider_agenda_id': None, u'session_title': u'Eugene Police Commission Meeting January 12, 2017', u'type': u'Agenda', u'id': u'1652', u'agenda_provider_id': None}]"
219,8536,[3],Planning Commission Regular Meeting - 10/12/09,Planning Commission Regular Meeting - 10/12/09,,0,,199.0,2009-10-12,2009-10-12,2017-08-01,CS9OR5pRmlM,https://www.youtube.com/watch?v=CS9OR5pRmlM,70.0,Planning,2789.0,https://ompnetwork.s3-us-west-2.amazonaws.com/sites/199/granicus_files/320_calendar_1255327200.html,"[{u'livestream': u'1', u'position': u'0', u'user_id': u'199', u'id': u'70', u'label': u'Planning'}]","[{u'user_id': u'199', u'type_id': u'3', u'url': u'https://ompnetwork.s3-us-west-2.amazonaws.com/sites/199/granicus_files/320_calendar_1255327200.html', u'storage': u'external', u'session_id': u'8536', u'label': None, u'file_id': None, u'provider': u'generic', u'agenda_provider_agenda_id': None, u'session_title': u'Planning Commission Regular Meeting - 10/12/09', u'type': u'Calendar', u'id': u'2789', u'agenda_provider_id': None}]"
220,3254,"[12, 18]",Thornton Senior Center - Medicare Assistance ,Thornton Senior Center - Medicare Assistance ,"If you or a loved one has questions about navigating the complexities of Medicare, the Thornton Senior Center offers no cost Medicare assistance.

Thornton Senior Center<br />
9471 Dorothy Blvd&nbsp; Thornton, CO 80229<br />
(303) 255-7850
",0,,186.0,2013-07-09,2013-07-09,2017-07-11,_1QqgYPRbik,http://www.youtube.com/watch?feature=player_detailpage&v=_1QqgYPRbik,61.0,Health and Safety,,,"[{u'livestream': u'0', u'position': u'-7', u'user_id': u'186', u'id': u'61', u'label': u'Health and Safety'}]",
221,789,"[3, 5, 7, 8]",Planning Commission Public Hearing 11-01-2011,Planning Commission Public Hearing 11-01-2011,,0,shows/planning-commission-public-hearing-11-01-2011,134.0,2011-11-01,2011-11-01,2017-03-20,YZ43RBdvzXE,https://www.youtube.com/watch?v=YZ43RBdvzXE,22.0,Planning Commission,1048.0,https://ompnetwork.s3-us-west-2.amazonaws.com/sites/134/documents/agenda_32_0.pdf,"[{u'livestream': u'1', u'position': u'-9', u'user_id': u'134', u'id': u'22', u'label': u'Planning Commission'}]","[{u'user_id': u'134', u'type_id': u'1', u'url': u'https://ompnetwork.s3-us-west-2.amazonaws.com/sites/134/documents/agenda_32_0.pdf', u'storage': u'attachment', u'session_id': u'789', u'label': None, u'file_id': u'1119', u'provider': u'generic', u'agenda_provider_agenda_id': None, u'session_title': u'Planning Commission Public Hearing 11-01-2011', u'type': u'Agenda', u'id': u'1048', u'agenda_provider_id': None}]"
222,22829,"[1, 13, 14]",Basalt Council Eagle Joint Meeting 02/10/15,Basalt Council Eagle Joint Meeting 02/10/15,,0,,296.0,2015-02-10,2015-02-10,2018-01-17,nAN2Jh0ZI1I,https://www.youtube.com/watch?v=nAN2Jh0ZI1I,197.0,Town Council,4981.0,https://ompnetwork.s3-us-west-2.amazonaws.com/sites/296/documents/tob_tc_agenda_2015_02_10.pdf?98moSdJSDI6EbP03lqoDCtOeSR0zcLxZ,"[{u'livestream': u'1', u'position': u'0', u'user_id': u'296', u'id': u'197', u'label': u'Town Council'}]","[{u'user_id': u'296', u'type_id': u'1', u'url': u'https://ompnetwork.s3-us-west-2.amazonaws.com/sites/296/documents/tob_tc_agenda_2015_02_10.pdf?98moSdJSDI6EbP03lqoDCtOeSR0zcLxZ', u'storage': u'attachment', u'session_id': u'22829', u'label': None, u'file_id': u'4395', u'provider': u'generic', u'agenda_provider_agenda_id': None, u'session_title': u'Basalt Council Eagle Joint Meeting 02/10/15', u'type': u'Agenda', u'id': u'4981', u'agenda_provider_id': None}]"
223,472,"[1, 6, 11, 16]",City Council Work Session 02-13-2013,City Council Work Session 02-13-2013,,0,shows/city-council-work-session-02-13-2013,134.0,2013-02-13,2013-02-13,2017-03-20,OCqM0ZteHxY,https://www.youtube.com/watch?v=OCqM0ZteHxY,20.0,City Council,569.0,https://ompnetwork.s3-us-west-2.amazonaws.com/sites/134/documents/agenda_33.pdf,"[{u'livestream': u'1', u'position': u'-10', u'user_id': u'134', u'id': u'20', u'label': u'City Council'}]","[{u'user_id': u'134', u'type_id': u'1', u'url': u'https://ompnetwork.s3-us-west-2.amazonaws.com/sites/134/documents/agenda_33.pdf', u'storage': u'attachment', u'session_id': u'472', u'label': None, u'file_id': u'639', u'provider': u'generic', u'agenda_provider_agenda_id': None, u'session_title': u'City Council Work Session 02-13-2013', u'type': u'Agenda', u'id': u'569', u'agenda_provider_id': None}, {u'user_id': u'134', u'type_id': u'4', u'url': u'https://ompnetwork.s3-us-west-2.amazonaws.com/sites/134/documents/minutes_32_0.pdf', u'storage': u'attachment', u'session_id': u'472', u'label': None, u'file_id': u'640', u'provider': u'generic', u'agenda_provider_agenda_id': None, u'session_title': u'City Council Work Session 02-13-2013', u'type': u'Minutes', u'id': u'570', u'agenda_provider_id': None}]"
224,637,"[4, 7]",Planning Commission Public Hearing 12-05-2013,Planning Commission Public Hearing 12-05-2013,,0,shows/planning-commission-public-hearing-12-05-2013,134.0,2013-12-05,2013-12-05,2017-03-20,Z5mU8b13jOM,https://www.youtube.com/watch?v=Z5mU8b13jOM,22.0,Planning Commission,822.0,https://ompnetwork.s3-us-west-2.amazonaws.com/sites/134/documents/agenda_packet_132.pdf,"[{u'livestream': u'1', u'position': u'-9', u'user_id': u'134', u'id': u'22', u'label': u'Planning Commission'}]","[{u'user_id': u'134', u'type_id': u'1', u'url': u'https://ompnetwork.s3-us-west-2.amazonaws.com/sites/134/documents/agenda_packet_132.pdf', u'storage': u'attachment', u'session_id': u'637', u'label': None, u'file_id': u'893', u'provider': u'generic', u'agenda_provider_agenda_id': None, u'session_title': u'Planning Commission Public Hearing 12-05-2013', u'type': u'Agenda', u'id': u'822', u'agenda_provider_id': None}]"
225,247,"[3, 7, 16, 18]",City Council Work Session 11-09-2015,City Council Work Session 11-09-2015,,0,shows/city-council-work-session-11-09-2015,134.0,2015-11-09,2015-11-09,2017-03-20,Dg1bqdjh3Cg,https://www.youtube.com/watch?v=Dg1bqdjh3Cg,20.0,City Council,145.0,https://ompnetwork.s3-us-west-2.amazonaws.com/sites/134/documents/agenda_packet_26.pdf,"[{u'livestream': u'1', u'position': u'-10', u'user_id': u'134', u'id': u'20', u'label': u'City Council'}]","[{u'user_id': u'134', u'type_id': u'1', u'url': u'https://ompnetwork.s3-us-west-2.amazonaws.com/sites/134/documents/agenda_packet_26.pdf', u'storage': u'attachment', u'session_id': u'247', u'label': None, u'file_id': u'215', u'provider': u'generic', u'agenda_provider_agenda_id': None, u'session_title': u'City Council Work Session 11-09-2015', u'type': u'Agenda', u'id': u'145', u'agenda_provider_id': None}, {u'user_id': u'134', u'type_id': u'4', u'url': u'https://ompnetwork.s3-us-west-2.amazonaws.com/sites/134/documents/minutes_31_0.pdf', u'storage': u'attachment', u'session_id': u'247', u'label': None, u'file_id': u'216', u'provider': u'generic', u'agenda_provider_agenda_id': None, u'session_title': u'City Council Work Session 11-09-2015', u'type': u'Minutes', u'id': u'146', u'agenda_provider_id': None}]"
226,3747,"[3, 12, 14]",2017 City of Thornton Business Appreciation Event,2017 City of Thornton Business Appreciation Event,,0,,186.0,2017-04-28,2017-04-28,2017-07-11,xTwslYPnwIk,https://youtu.be/xTwslYPnwIk,60.0,Local Interest,,,"[{u'livestream': u'0', u'position': u'-8', u'user_id': u'186', u'id': u'60', u'label': u'Local Interest'}]",
227,282,"[3, 19]",City Council Work Session and URA Meeting 05-13-2015,City Council Work Session and URA Meeting 05-13-2015,,0,shows/city-council-work-session-and-ura-meeting-05-13-2015,134.0,2015-05-13,2015-05-13,2017-03-20,iJg0LHLUdxs,https://www.youtube.com/watch?v=iJg0LHLUdxs,20.0,City Council,211.0,https://ompnetwork.s3-us-west-2.amazonaws.com/sites/134/documents/agenda_packet_101.pdf,"[{u'livestream': u'1', u'position': u'-10', u'user_id': u'134', u'id': u'20', u'label': u'City Council'}]","[{u'user_id': u'134', u'type_id': u'1', u'url': u'https://ompnetwork.s3-us-west-2.amazonaws.com/sites/134/documents/agenda_packet_101.pdf', u'storage': u'attachment', u'session_id': u'282', u'label': None, u'file_id': u'281', u'provider': u'generic', u'agenda_provider_agenda_id': None, u'session_title': u'City Council Work Session and URA Meeting 05-13-2015', u'type': u'Agenda', u'id': u'211', u'agenda_provider_id': None}, {u'user_id': u'134', u'type_id': u'4', u'url': u'https://ompnetwork.s3-us-west-2.amazonaws.com/sites/134/documents/minutes_64.pdf', u'storage': u'attachment', u'session_id': u'282', u'label': None, u'file_id': u'282', u'provider': u'generic', u'agenda_provider_agenda_id': None, u'session_title': u'City Council Work Session and URA Meeting 05-13-2015', u'type': u'Minutes', u'id': u'212', u'agenda_provider_id': None}]"
228,201,"[3, 9, 10, 15, 19]",City Council and URA Work Session 06-08-2016,City Council and URA Work Session 06-08-2016,,0,shows/city-council-and-ura-work-session-06-08-2016,134.0,2016-06-08,2016-06-08,2017-03-20,LSN5QBkDtEs,https://www.youtube.com/watch?v=LSN5QBkDtEs,20.0,City Council,60.0,https://ompnetwork.s3-us-west-2.amazonaws.com/sites/134/documents/agenda_4.pdf,"[{u'livestream': u'1', u'position': u'-10', u'user_id': u'134', u'id': u'20', u'label': u'City Council'}]","[{u'user_id': u'134', u'type_id': u'1', u'url': u'https://ompnetwork.s3-us-west-2.amazonaws.com/sites/134/documents/agenda_4.pdf', u'storage': u'attachment', u'session_id': u'201', u'label': None, u'file_id': u'130', u'provider': u'generic', u'agenda_provider_agenda_id': None, u'session_title': u'City Council and URA Work Session 06-08-2016', u'type': u'Agenda', u'id': u'60', u'agenda_provider_id': None}, {u'user_id': u'134', u'type_id': u'4', u'url': u'https://ompnetwork.s3-us-west-2.amazonaws.com/sites/134/documents/minutes_5.pdf', u'storage': u'attachment', u'session_id': u'201', u'label': None, u'file_id': u'131', u'provider': u'generic', u'agenda_provider_agenda_id': None, u'session_title': u'City Council and URA Work Session 06-08-2016', u'type': u'Minutes', u'id': u'61', u'agenda_provider_id': None}]"
229,7149,"[0, 1, 11]",City Council - Regular Meeting - 11/16/10,City Council - Regular Meeting - 11/16/10,,0,,199.0,2010-11-16,2010-11-16,2017-08-01,xJRPL2KB6Dw,https://www.youtube.com/watch?v=xJRPL2KB6Dw,69.0,Council,2427.0,https://ompnetwork.s3-us-west-2.amazonaws.com/sites/199/documents/cc_agenda_11-16-2010.pdf?PNWoNkmlg36VqS2_yDdDjLAcHGPO.tJT,"[{u'livestream': u'1', u'position': u'0', u'user_id': u'199', u'id': u'69', u'label': u'Council'}]","[{u'user_id': u'199', u'type_id': u'1', u'url': u'https://ompnetwork.s3-us-west-2.amazonaws.com/sites/199/documents/cc_agenda_11-16-2010.pdf?PNWoNkmlg36VqS2_yDdDjLAcHGPO.tJT', u'storage': u'attachment', u'session_id': u'7149', u'label': None, u'file_id': u'2436', u'provider': u'generic', u'agenda_provider_agenda_id': None, u'session_title': u'City Council - Regular Meeting - 11/16/10', u'type': u'Agenda', u'id': u'2427', u'agenda_provider_id': None}, {u'user_id': u'199', u'type_id': u'3', u'url': u'https://ompnetwork.s3-us-west-2.amazonaws.com/sites/199/granicus_files/563_calendar_1289890800.html', u'storage': u'external', u'session_id': u'7149', u'label': None, u'file_id': None, u'provider': u'generic', u'agenda_provider_agenda_id': None, u'session_title': u'City Council - Regular Meeting - 11/16/10', u'type': u'Calendar', u'id': u'2428', u'agenda_provider_id': None}, {u'user_id': u'199', u'type_id': u'2', u'url': u'https://ompnetwork.s3-us-west-2.amazonaws.com/sites/199/documents/cc_minutes_11-16-2010.pdf?0zd7ZrQyQWM9UkMjHC5zpB9.l_aCSRmF', u'storage': u'attachment', u'session_id': u'7149', u'label': None, u'file_id': u'2437', u'provider': u'generic', u'agenda_provider_agenda_id': None, u'session_title': u'City Council - Regular Meeting - 11/16/10', u'type': u'Journal', u'id': u'2429', u'agenda_provider_id': None}, {u'user_id': u'199', u'type_id': u'5', u'url': u'https://ompnetwork.s3-us-west-2.amazonaws.com/sites/199/documents/cc_packet_11-16-2010.pdf?gbcxgu7CsCE9KET44Beoe_vn_z6I4.zR', u'storage': u'attachment', u'session_id': u'7149', u'label': None, u'file_id': u'2438', u'provider': u'generic', u'agenda_provider_agenda_id': None, u'session_title': u'City Council - Regular Meeting - 11/16/10', u'type': u'Packet', u'id': u'2430', u'agenda_provider_id': None}]"
230,9956,"[0, 3, 5, 6, 11, 16]",Planning Board - 10/13/2014,Planning Board - 10/13/2014,,0,,199.0,2014-10-13,2014-10-13,2017-08-02,p90Jk45LBdo,https://www.youtube.com/watch?v=p90Jk45LBdo,70.0,Planning,3289.0,https://ompnetwork.s3-us-west-2.amazonaws.com/sites/199/granicus_files/1338_calendar_1413180000.pdf,"[{u'livestream': u'1', u'position': u'0', u'user_id': u'199', u'id': u'70', u'label': u'Planning'}]","[{u'user_id': u'199', u'type_id': u'3', u'url': u'https://ompnetwork.s3-us-west-2.amazonaws.com/sites/199/granicus_files/1338_calendar_1413180000.pdf', u'storage': u'external', u'session_id': u'9956', u'label': None, u'file_id': None, u'provider': u'generic', u'agenda_provider_agenda_id': None, u'session_title': u'Planning Board - 10/13/2014', u'type': u'Calendar', u'id': u'3289', u'agenda_provider_id': None}, {u'user_id': u'199', u'type_id': u'2', u'url': u'https://ompnetwork.s3-us-west-2.amazonaws.com/sites/199/documents/pb14-1013_final_certified.pdf?DF70eAmVEteAnJdvho04iOtRKRkB9zKV', u'storage': u'attachment', u'session_id': u'9956', u'label': None, u'file_id': u'2966', u'provider': u'generic', u'agenda_provider_agenda_id': None, u'session_title': u'Planning Board - 10/13/2014', u'type': u'Journal', u'id': u'3290', u'agenda_provider_id': None}]"
231,842,"[3, 8, 9, 19]",City Council Work Session 09-22-2010,City Council Work Session 09-22-2010,,0,shows/city-council-work-session-09-22-2010,134.0,2010-09-22,2010-09-22,2017-03-20,2sVbh-Pd978,https://www.youtube.com/watch?v=2sVbh-Pd978,20.0,City Council,1132.0,https://ompnetwork.s3-us-west-2.amazonaws.com/sites/134/documents/agenda_211.pdf,"[{u'livestream': u'1', u'position': u'-10', u'user_id': u'134', u'id': u'20', u'label': u'City Council'}]","[{u'user_id': u'134', u'type_id': u'1', u'url': u'https://ompnetwork.s3-us-west-2.amazonaws.com/sites/134/documents/agenda_211.pdf', u'storage': u'attachment', u'session_id': u'842', u'label': None, u'file_id': u'1203', u'provider': u'generic', u'agenda_provider_agenda_id': None, u'session_title': u'City Council Work Session 09-22-2010', u'type': u'Agenda', u'id': u'1132', u'agenda_provider_id': None}, {u'user_id': u'134', u'type_id': u'4', u'url': u'https://ompnetwork.s3-us-west-2.amazonaws.com/sites/134/documents/minutes_269.pdf', u'storage': u'attachment', u'session_id': u'842', u'label': None, u'file_id': u'1204', u'provider': u'generic', u'agenda_provider_agenda_id': None, u'session_title': u'City Council Work Session 09-22-2010', u'type': u'Minutes', u'id': u'1133', u'agenda_provider_id': None}]"
232,411,[],City Council Public Hearing 10-21-2013,City Council Public Hearing 10-21-2013,,0,shows/city-council-public-hearing-10-21-2013,134.0,2013-10-21,2013-10-21,2017-03-20,270OSEr7Yek,https://www.youtube.com/watch?v=270OSEr7Yek,20.0,City Council,453.0,https://ompnetwork.s3-us-west-2.amazonaws.com/sites/134/documents/agenda_packet_226.pdf,"[{u'livestream': u'1', u'position': u'-10', u'user_id': u'134', u'id': u'20', u'label': u'City Council'}]","[{u'user_id': u'134', u'type_id': u'1', u'url': u'https://ompnetwork.s3-us-west-2.amazonaws.com/sites/134/documents/agenda_packet_226.pdf', u'storage': u'attachment', u'session_id': u'411', u'label': None, u'file_id': u'523', u'provider': u'generic', u'agenda_provider_agenda_id': None, u'session_title': u'City Council Public Hearing 10-21-2013', u'type': u'Agenda', u'id': u'453', u'agenda_provider_id': None}, {u'user_id': u'134', u'type_id': u'4', u'url': u'https://ompnetwork.s3-us-west-2.amazonaws.com/sites/134/documents/minutes_177.pdf', u'storage': u'attachment', u'session_id': u'411', u'label': None, u'file_id': u'524', u'provider': u'generic', u'agenda_provider_agenda_id': None, u'session_title': u'City Council Public Hearing 10-21-2013', u'type': u'Minutes', u'id': u'454', u'agenda_provider_id': None}]"
233,20729,"[0, 12, 16, 19]",Town of New Castle Board Meeting 11/28/17,Town of New Castle Board Meeting 11/28/17,,0,,281.0,2017-11-28,2017-11-28,2017-11-29,6DOIW6JLipk,https://youtu.be/6DOIW6JLipk,158.0,Town of New Castle Board Meetings,4775.0,https://ompnetwork.s3-us-west-2.amazonaws.com/sites/281/documents/11.28.17_town_board_work_session.pdf?puCE2vaGAZa9bi3KoNnrA7sif44g6ZJj,"[{u'livestream': u'0', u'position': u'-10', u'user_id': u'281', u'id': u'158', u'label': u'Town of New Castle Board Meetings'}]","[{u'user_id': u'281', u'type_id': u'1', u'url': u'https://ompnetwork.s3-us-west-2.amazonaws.com/sites/281/documents/11.28.17_town_board_work_session.pdf?puCE2vaGAZa9bi3KoNnrA7sif44g6ZJj', u'storage': u'attachment', u'session_id': u'20729', u'label': None, u'file_id': u'4115', u'provider': u'generic', u'agenda_provider_agenda_id': None, u'session_title': u'Town of New Castle Board Meeting 11/28/17', u'type': u'Agenda', u'id': u'4775', u'agenda_provider_id': None}]"
234,697,"[5, 10, 13, 15]",City Council Meeting 07-25-2011,City Council Meeting 07-25-2011,,0,shows/city-council-meeting-07-25-2011,134.0,2011-07-25,2011-07-25,2017-03-20,ACEh9WbCcMc,https://www.youtube.com/watch?v=ACEh9WbCcMc,20.0,City Council,913.0,https://ompnetwork.s3-us-west-2.amazonaws.com/sites/134/documents/agenda_144.pdf,"[{u'livestream': u'1', u'position': u'-10', u'user_id': u'134', u'id': u'20', u'label': u'City Council'}]","[{u'user_id': u'134', u'type_id': u'1', u'url': u'https://ompnetwork.s3-us-west-2.amazonaws.com/sites/134/documents/agenda_144.pdf', u'storage': u'attachment', u'session_id': u'697', u'label': None, u'file_id': u'984', u'provider': u'generic', u'agenda_provider_agenda_id': None, u'session_title': u'City Council Meeting 07-25-2011', u'type': u'Agenda', u'id': u'913', u'agenda_provider_id': None}, {u'user_id': u'134', u'type_id': u'4', u'url': u'https://ompnetwork.s3-us-west-2.amazonaws.com/sites/134/documents/minutes_201_0.pdf', u'storage': u'attachment', u'session_id': u'697', u'label': None, u'file_id': u'985', u'provider': u'generic', u'agenda_provider_agenda_id': None, u'session_title': u'City Council Meeting 07-25-2011', u'type': u'Minutes', u'id': u'914', u'agenda_provider_id': None}]"
235,2595,"[3, 8, 18]","Board of Commissioners Afternoon Meeting: December 8, 2015","Board of Commissioners Afternoon Meeting: December 8, 2015",,0,,143.0,2017-05-11,2015-12-08,2017-05-11,AT4WdA2RGLk,https://www.youtube.com/watch?v=AT4WdA2RGLk,25.0,Board of County Commissioners,,,"[{u'livestream': u'1', u'position': u'0', u'user_id': u'143', u'id': u'25', u'label': u'Board of County Commissioners'}]",
236,22193,[2],BOCC Work Session 1/16/18,BOCC Work Session 1/16/18,,0,,273.0,2018-01-12,2018-01-16,2018-01-17,aX3v1dgElGc,https://youtu.be/aX3v1dgElGc,187.0,2018,4935.0,https://ompnetwork.s3-us-west-2.amazonaws.com/sites/273/documents/abbrev_agenda_numbered_01.16.18.pdf?OgUkUhB.lBc1drMp.2_isudjfNJTNsC0,"[{u'livestream': u'1', u'position': u'-10', u'user_id': u'273', u'id': u'187', u'label': u'2018'}]","[{u'user_id': u'273', u'type_id': u'1', u'url': u'https://ompnetwork.s3-us-west-2.amazonaws.com/sites/273/documents/abbrev_agenda_numbered_01.16.18.pdf?OgUkUhB.lBc1drMp.2_isudjfNJTNsC0', u'storage': u'attachment', u'session_id': u'22193', u'label': None, u'file_id': u'4334', u'provider': u'generic', u'agenda_provider_agenda_id': None, u'session_title': u'BOCC Work Session 1/16/18', u'type': u'Agenda', u'id': u'4935', u'agenda_provider_id': None}]"
237,458,"[7, 12]",City Council Work Session 05-08-2013,City Council Work Session 05-08-2013,,0,shows/city-council-work-session-05-08-2013,134.0,2013-05-08,2013-05-08,2017-03-20,8_YV6r4gfso,https://www.youtube.com/watch?v=8_YV6r4gfso,20.0,City Council,541.0,https://ompnetwork.s3-us-west-2.amazonaws.com/sites/134/documents/agenda_packet_283.pdf,"[{u'livestream': u'1', u'position': u'-10', u'user_id': u'134', u'id': u'20', u'label': u'City Council'}]","[{u'user_id': u'134', u'type_id': u'1', u'url': u'https://ompnetwork.s3-us-west-2.amazonaws.com/sites/134/documents/agenda_packet_283.pdf', u'storage': u'attachment', u'session_id': u'458', u'label': None, u'file_id': u'611', u'provider': u'generic', u'agenda_provider_agenda_id': None, u'session_title': u'City Council Work Session 05-08-2013', u'type': u'Agenda', u'id': u'541', u'agenda_provider_id': None}, {u'user_id': u'134', u'type_id': u'4', u'url': u'https://ompnetwork.s3-us-west-2.amazonaws.com/sites/134/documents/minutes_212.pdf', u'storage': u'attachment', u'session_id': u'458', u'label': None, u'file_id': u'612', u'provider': u'generic', u'agenda_provider_agenda_id': None, u'session_title': u'City Council Work Session 05-08-2013', u'type': u'Minutes', u'id': u'542', u'agenda_provider_id': None}]"
238,298,"[8, 16, 19]",City Council Work Session 02-18-2015,City Council Work Session 02-18-2015,,0,shows/city-council-work-session-02-18-2015,134.0,2015-02-18,2015-02-18,2017-03-20,phxl9cLarvM,https://www.youtube.com/watch?v=phxl9cLarvM,20.0,City Council,241.0,https://ompnetwork.s3-us-west-2.amazonaws.com/sites/134/documents/agenda_packet_123.pdf,"[{u'livestream': u'1', u'position': u'-10', u'user_id': u'134', u'id': u'20', u'label': u'City Council'}]","[{u'user_id': u'134', u'type_id': u'1', u'url': u'https://ompnetwork.s3-us-west-2.amazonaws.com/sites/134/documents/agenda_packet_123.pdf', u'storage': u'attachment', u'session_id': u'298', u'label': None, u'file_id': u'311', u'provider': u'generic', u'agenda_provider_agenda_id': None, u'session_title': u'City Council Work Session 02-18-2015', u'type': u'Agenda', u'id': u'241', u'agenda_provider_id': None}, {u'user_id': u'134', u'type_id': u'4', u'url': u'https://ompnetwork.s3-us-west-2.amazonaws.com/sites/134/documents/minutes_76.pdf', u'storage': u'attachment', u'session_id': u'298', u'label': None, u'file_id': u'312', u'provider': u'generic', u'agenda_provider_agenda_id': None, u'session_title': u'City Council Work Session 02-18-2015', u'type': u'Minutes', u'id': u'242', u'agenda_provider_id': None}]"
239,843,"[17, 18, 19]",City Council Work Session and Meeting of the URA 09-15-2010,City Council Work Session and Meeting of the URA 09-15-2010,,0,shows/city-council-work-session-and-meeting-ura-09-15-2010,134.0,2010-09-15,2010-09-15,2017-03-20,f8iAhIl25X0,https://www.youtube.com/watch?v=f8iAhIl25X0,20.0,City Council,1134.0,https://ompnetwork.s3-us-west-2.amazonaws.com/sites/134/documents/agenda_212.pdf,"[{u'livestream': u'1', u'position': u'-10', u'user_id': u'134', u'id': u'20', u'label': u'City Council'}]","[{u'user_id': u'134', u'type_id': u'1', u'url': u'https://ompnetwork.s3-us-west-2.amazonaws.com/sites/134/documents/agenda_212.pdf', u'storage': u'attachment', u'session_id': u'843', u'label': None, u'file_id': u'1205', u'provider': u'generic', u'agenda_provider_agenda_id': None, u'session_title': u'City Council Work Session and Meeting of the URA 09-15-2010', u'type': u'Agenda', u'id': u'1134', u'agenda_provider_id': None}, {u'user_id': u'134', u'type_id': u'4', u'url': u'https://ompnetwork.s3-us-west-2.amazonaws.com/sites/134/documents/minutes_270.pdf', u'storage': u'attachment', u'session_id': u'843', u'label': None, u'file_id': u'1206', u'provider': u'generic', u'agenda_provider_agenda_id': None, u'session_title': u'City Council Work Session and Meeting of the URA 09-15-2010', u'type': u'Minutes', u'id': u'1135', u'agenda_provider_id': None}]"
240,367,"[3, 5, 6]",City Council Public Hearing 04-21-2014,City Council Public Hearing 04-21-2014,,0,shows/city-council-public-hearing-04-21-2014,134.0,2014-04-21,2014-04-21,2017-03-20,CfIizmwTVa4,https://www.youtube.com/watch?v=CfIizmwTVa4,20.0,City Council,,,"[{u'livestream': u'1', u'position': u'-10', u'user_id': u'134', u'id': u'20', u'label': u'City Council'}]",
241,450,"[0, 5, 13]",City Council Meeting 05-28-2013,City Council Meeting 05-28-2013,,0,shows/city-council-meeting-05-28-2013,134.0,2013-05-28,2013-05-28,2017-03-20,EPToC4RFzmk,https://www.youtube.com/watch?v=EPToC4RFzmk,20.0,City Council,527.0,https://ompnetwork.s3-us-west-2.amazonaws.com/sites/134/documents/agenda_packet_274.pdf,"[{u'livestream': u'1', u'position': u'-10', u'user_id': u'134', u'id': u'20', u'label': u'City Council'}]","[{u'user_id': u'134', u'type_id': u'1', u'url': u'https://ompnetwork.s3-us-west-2.amazonaws.com/sites/134/documents/agenda_packet_274.pdf', u'storage': u'attachment', u'session_id': u'450', u'label': None, u'file_id': u'597', u'provider': u'generic', u'agenda_provider_agenda_id': None, u'session_title': u'City Council Meeting 05-28-2013', u'type': u'Agenda', u'id': u'527', u'agenda_provider_id': None}, {u'user_id': u'134', u'type_id': u'4', u'url': u'https://ompnetwork.s3-us-west-2.amazonaws.com/sites/134/documents/minutes_207.pdf', u'storage': u'attachment', u'session_id': u'450', u'label': None, u'file_id': u'598', u'provider': u'generic', u'agenda_provider_agenda_id': None, u'session_title': u'City Council Meeting 05-28-2013', u'type': u'Minutes', u'id': u'528', u'agenda_provider_id': None}]"
242,720,"[11, 19]",City Council Work Session 06-15-2011,City Council Work Session 06-15-2011,,0,shows/city-council-work-session-06-15-2011,134.0,2011-06-15,2011-06-15,2017-03-20,A_WoiFAbBns,https://www.youtube.com/watch?v=A_WoiFAbBns,20.0,City Council,948.0,https://ompnetwork.s3-us-west-2.amazonaws.com/sites/134/documents/agenda_155.pdf,"[{u'livestream': u'1', u'position': u'-10', u'user_id': u'134', u'id': u'20', u'label': u'City Council'}]","[{u'user_id': u'134', u'type_id': u'1', u'url': u'https://ompnetwork.s3-us-west-2.amazonaws.com/sites/134/documents/agenda_155.pdf', u'storage': u'attachment', u'session_id': u'720', u'label': None, u'file_id': u'1019', u'provider': u'generic', u'agenda_provider_agenda_id': None, u'session_title': u'City Council Work Session 06-15-2011', u'type': u'Agenda', u'id': u'948', u'agenda_provider_id': None}, {u'user_id': u'134', u'type_id': u'4', u'url': u'https://ompnetwork.s3-us-west-2.amazonaws.com/sites/134/documents/minutes_213.pdf', u'storage': u'attachment', u'session_id': u'720', u'label': None, u'file_id': u'1020', u'provider': u'generic', u'agenda_provider_agenda_id': None, u'session_title': u'City Council Work Session 06-15-2011', u'type': u'Minutes', u'id': u'949', u'agenda_provider_id': None}]"
243,358,"[3, 6]",City Council Work Session 05-14-2014,City Council Work Session 05-14-2014,,0,shows/city-council-work-session-05-14-2014,134.0,2014-05-14,2014-05-14,2017-03-20,xuGoXjPM8r0,https://www.youtube.com/watch?v=xuGoXjPM8r0,20.0,City Council,353.0,https://ompnetwork.s3-us-west-2.amazonaws.com/sites/134/documents/agenda_packet_130.pdf,"[{u'livestream': u'1', u'position': u'-10', u'user_id': u'134', u'id': u'20', u'label': u'City Council'}]","[{u'user_id': u'134', u'type_id': u'1', u'url': u'https://ompnetwork.s3-us-west-2.amazonaws.com/sites/134/documents/agenda_packet_130.pdf', u'storage': u'attachment', u'session_id': u'358', u'label': None, u'file_id': u'423', u'provider': u'generic', u'agenda_provider_agenda_id': None, u'session_title': u'City Council Work Session 05-14-2014', u'type': u'Agenda', u'id': u'353', u'agenda_provider_id': None}, {u'user_id': u'134', u'type_id': u'4', u'url': u'https://ompnetwork.s3-us-west-2.amazonaws.com/sites/134/documents/minutes_134.pdf', u'storage': u'attachment', u'session_id': u'358', u'label': None, u'file_id': u'424', u'provider': u'generic', u'agenda_provider_agenda_id': None, u'session_title': u'City Council Work Session 05-14-2014', u'type': u'Minutes', u'id': u'354', u'agenda_provider_id': None}]"
244,3258,"[2, 11]",T-Net,T-Net,,0,,186.0,2013-07-09,2013-07-09,2017-07-11,BF7rjCeUpe4,https://www.youtube.com/watch?v=BF7rjCeUpe4,60.0,Local Interest,1619.0,https://docs.google.com/document/d/1PpxQIAgphNzO3pHw7lcwZTxtScTRuIU6zT6SaOddIf0/pub,"[{u'livestream': u'0', u'position': u'-8', u'user_id': u'186', u'id': u'60', u'label': u'Local Interest'}]","[{u'user_id': u'186', u'type_id': u'1', u'url': u'https://docs.google.com/document/d/1PpxQIAgphNzO3pHw7lcwZTxtScTRuIU6zT6SaOddIf0/pub', u'storage': u'external', u'session_id': u'3258', u'label': None, u'file_id': None, u'provider': u'om_googledrive', u'agenda_provider_agenda_id': None, u'session_title': u'T-Net', u'type': u'Agenda', u'id': u'1619', u'agenda_provider_id': None}]"
245,371,"[5, 11, 16]",City Council Work Session 04-09-2014,City Council Work Session 04-09-2014,,0,shows/city-council-work-session-04-09-2014,134.0,2014-04-09,2014-04-09,2017-03-20,dhASAOZ_xLE,https://www.youtube.com/watch?v=dhASAOZ_xLE,20.0,City Council,377.0,https://ompnetwork.s3-us-west-2.amazonaws.com/sites/134/documents/agenda_packet_178.pdf,"[{u'livestream': u'1', u'position': u'-10', u'user_id': u'134', u'id': u'20', u'label': u'City Council'}]","[{u'user_id': u'134', u'type_id': u'1', u'url': u'https://ompnetwork.s3-us-west-2.amazonaws.com/sites/134/documents/agenda_packet_178.pdf', u'storage': u'attachment', u'session_id': u'371', u'label': None, u'file_id': u'447', u'provider': u'generic', u'agenda_provider_agenda_id': None, u'session_title': u'City Council Work Session 04-09-2014', u'type': u'Agenda', u'id': u'377', u'agenda_provider_id': None}, {u'user_id': u'134', u'type_id': u'4', u'url': u'https://ompnetwork.s3-us-west-2.amazonaws.com/sites/134/documents/minutes_145.pdf', u'storage': u'attachment', u'session_id': u'371', u'label': None, u'file_id': u'448', u'provider': u'generic', u'agenda_provider_agenda_id': None, u'session_title': u'City Council Work Session 04-09-2014', u'type': u'Minutes', u'id': u'378', u'agenda_provider_id': None}]"
246,6725,"[0, 16, 19]",City Council - Regular Meeting - 06/07/11,City Council - Regular Meeting - 06/07/11,,0,,199.0,2011-06-07,2011-06-07,2017-08-01,RVVmxwsqEUA,https://www.youtube.com/watch?v=RVVmxwsqEUA,69.0,Council,2349.0,https://ompnetwork.s3-us-west-2.amazonaws.com/sites/199/documents/cc_agenda_06-07-2011.pdf?7kxT0Cfrz__q7dQMoypDxpKZ.f7RMmjB,"[{u'livestream': u'1', u'position': u'0', u'user_id': u'199', u'id': u'69', u'label': u'Council'}]","[{u'user_id': u'199', u'type_id': u'1', u'url': u'https://ompnetwork.s3-us-west-2.amazonaws.com/sites/199/documents/cc_agenda_06-07-2011.pdf?7kxT0Cfrz__q7dQMoypDxpKZ.f7RMmjB', u'storage': u'attachment', u'session_id': u'6725', u'label': None, u'file_id': u'2381', u'provider': u'generic', u'agenda_provider_agenda_id': None, u'session_title': u'City Council - Regular Meeting - 06/07/11', u'type': u'Agenda', u'id': u'2349', u'agenda_provider_id': None}, {u'user_id': u'199', u'type_id': u'3', u'url': u'https://ompnetwork.s3-us-west-2.amazonaws.com/sites/199/granicus_files/677_calendar_1307426400.html', u'storage': u'external', u'session_id': u'6725', u'label': None, u'file_id': None, u'provider': u'generic', u'agenda_provider_agenda_id': None, u'session_title': u'City Council - Regular Meeting - 06/07/11', u'type': u'Calendar', u'id': u'2350', u'agenda_provider_id': None}, {u'user_id': u'199', u'type_id': u'2', u'url': u'https://ompnetwork.s3-us-west-2.amazonaws.com/sites/199/documents/cc_minutes_06-07-2011.pdf?.Ny1.KWwamShu7BhuIjMgsUk_Xnifc53', u'storage': u'attachment', u'session_id': u'6725', u'label': None, u'file_id': u'2382', u'provider': u'generic', u'agenda_provider_agenda_id': None, u'session_title': u'City Council - Regular Meeting - 06/07/11', u'type': u'Journal', u'id': u'2351', u'agenda_provider_id': None}, {u'user_id': u'199', u'type_id': u'5', u'url': u'https://ompnetwork.s3-us-west-2.amazonaws.com/sites/199/documents/cc_packet_06-07-2011.pdf?mw6mifLqHg2xLq87M4mGTiWfgpoSAmPh', u'storage': u'attachment', u'session_id': u'6725', u'label': None, u'file_id': u'2383', u'provider': u'generic', u'agenda_provider_agenda_id': None, u'session_title': u'City Council - Regular Meeting - 06/07/11', u'type': u'Packet', u'id': u'2352', u'agenda_provider_id': None}]"
247,317,"[18, 19]",City Council Work Session 11-12-2014,City Council Work Session 11-12-2014,,0,shows/city-council-work-session-11-12-2014,134.0,2014-11-12,2014-11-12,2017-03-20,43m1CBR-590,https://www.youtube.com/watch?v=43m1CBR-590,20.0,City Council,277.0,https://ompnetwork.s3-us-west-2.amazonaws.com/sites/134/documents/agenda_packet_154.pdf,"[{u'livestream': u'1', u'position': u'-10', u'user_id': u'134', u'id': u'20', u'label': u'City Council'}]","[{u'user_id': u'134', u'type_id': u'1', u'url': u'https://ompnetwork.s3-us-west-2.amazonaws.com/sites/134/documents/agenda_packet_154.pdf', u'storage': u'attachment', u'session_id': u'317', u'label': None, u'file_id': u'347', u'provider': u'generic', u'agenda_provider_agenda_id': None, u'session_title': u'City Council Work Session 11-12-2014', u'type': u'Agenda', u'id': u'277', u'agenda_provider_id': None}, {u'user_id': u'134', u'type_id': u'4', u'url': u'https://ompnetwork.s3-us-west-2.amazonaws.com/sites/134/documents/minutes_93.pdf', u'storage': u'attachment', u'session_id': u'317', u'label': None, u'file_id': u'348', u'provider': u'generic', u'agenda_provider_agenda_id': None, u'session_title': u'City Council Work Session 11-12-2014', u'type': u'Minutes', u'id': u'278', u'agenda_provider_id': None}]"
248,588,"[11, 12, 19]",Budget Committee 04-25-2012,Budget Committee 04-25-2012,,0,shows/budget-committee-04-25-2012,134.0,2012-04-25,2012-04-25,2017-03-20,E0iNc3vCwXs,https://www.youtube.com/watch?v=E0iNc3vCwXs,21.0,Budget Committee,745.0,https://ompnetwork.s3-us-west-2.amazonaws.com/sites/134/documents/agenda_packet_64_0.pdf,"[{u'livestream': u'1', u'position': u'-8', u'user_id': u'134', u'id': u'21', u'label': u'Budget Committee'}]","[{u'user_id': u'134', u'type_id': u'1', u'url': u'https://ompnetwork.s3-us-west-2.amazonaws.com/sites/134/documents/agenda_packet_64_0.pdf', u'storage': u'attachment', u'session_id': u'588', u'label': None, u'file_id': u'816', u'provider': u'generic', u'agenda_provider_agenda_id': None, u'session_title': u'Budget Committee 04-25-2012', u'type': u'Agenda', u'id': u'745', u'agenda_provider_id': None}, {u'user_id': u'134', u'type_id': u'4', u'url': u'https://ompnetwork.s3-us-west-2.amazonaws.com/sites/134/documents/minutes_148_0.pdf', u'storage': u'attachment', u'session_id': u'588', u'label': None, u'file_id': u'817', u'provider': u'generic', u'agenda_provider_agenda_id': None, u'session_title': u'Budget Committee 04-25-2012', u'type': u'Minutes', u'id': u'746', u'agenda_provider_id': None}]"
249,859,"[5, 11]",City Council Public Hearing 06-21-2010,City Council Public Hearing 06-21-2010,,0,shows/city-council-public-hearing-06-21-2010,134.0,2010-06-21,2010-06-21,2017-03-20,BTft646sz-E,https://www.youtube.com/watch?v=BTft646sz-E,20.0,City Council,1165.0,https://ompnetwork.s3-us-west-2.amazonaws.com/sites/134/documents/minutes_285.pdf,"[{u'livestream': u'1', u'position': u'-10', u'user_id': u'134', u'id': u'20', u'label': u'City Council'}]","[{u'user_id': u'134', u'type_id': u'4', u'url': u'https://ompnetwork.s3-us-west-2.amazonaws.com/sites/134/documents/minutes_285.pdf', u'storage': u'attachment', u'session_id': u'859', u'label': None, u'file_id': u'1236', u'provider': u'generic', u'agenda_provider_agenda_id': None, u'session_title': u'City Council Public Hearing 06-21-2010', u'type': u'Minutes', u'id': u'1165', u'agenda_provider_id': None}]"
250,3845,[16],"Toxics Board Meeting December 1, 2011","Toxics Board Meeting December 1, 2011",,0,,134.0,2017-07-15,2011-12-01,2017-07-20,I2Y-YUzTI88,https://youtu.be/I2Y-YUzTI88,46.0,Toxics Board,1801.0,https://ompnetwork.s3-us-west-2.amazonaws.com/sites/134/documents/archive.aspxadid1602?XACyV4y9Werlh9VNETP2wOPHeD0UnYUj,"[{u'livestream': u'0', u'position': u'0', u'user_id': u'134', u'id': u'46', u'label': u'Toxics Board'}]","[{u'user_id': u'134', u'type_id': u'1', u'url': u'https://ompnetwork.s3-us-west-2.amazonaws.com/sites/134/documents/archive.aspxadid1602?XACyV4y9Werlh9VNETP2wOPHeD0UnYUj', u'storage': u'attachment', u'session_id': u'3845', u'label': None, u'file_id': u'1938', u'provider': u'generic', u'agenda_provider_agenda_id': None, u'session_title': u'Toxics Board Meeting December 1, 2011', u'type': u'Agenda', u'id': u'1801', u'agenda_provider_id': None}]"
251,3253,"[2, 11]",T-Net,T-Net,,0,,186.0,2013-04-10,2013-04-10,2017-07-11,BF7rjCeUpe4,https://www.youtube.com/watch?v=BF7rjCeUpe4,62.0,PSAs,1618.0,https://docs.google.com/document/d/1PpxQIAgphNzO3pHw7lcwZTxtScTRuIU6zT6SaOddIf0/pub,"[{u'livestream': u'0', u'position': u'-5', u'user_id': u'186', u'id': u'62', u'label': u'PSAs'}]","[{u'user_id': u'186', u'type_id': u'1', u'url': u'https://docs.google.com/document/d/1PpxQIAgphNzO3pHw7lcwZTxtScTRuIU6zT6SaOddIf0/pub', u'storage': u'external', u'session_id': u'3253', u'label': None, u'file_id': None, u'provider': u'om_googledrive', u'agenda_provider_agenda_id': None, u'session_title': u'T-Net', u'type': u'Agenda', u'id': u'1618', u'agenda_provider_id': None}]"
252,3848,[16],"Toxics Board Meeting July 17, 2013","Toxics Board Meeting July 17, 2013",,0,,134.0,2017-07-15,2013-07-17,2017-07-20,v7vEAev18ds,https://youtu.be/v7vEAev18ds,46.0,Toxics Board,1790.0,https://ompnetwork.s3-us-west-2.amazonaws.com/sites/134/documents/archive.aspxadid2531?5b6X1.94tEbv6Whxp..pI1ukZsrVT43P,"[{u'livestream': u'0', u'position': u'0', u'user_id': u'134', u'id': u'46', u'label': u'Toxics Board'}]","[{u'user_id': u'134', u'type_id': u'1', u'url': u'https://ompnetwork.s3-us-west-2.amazonaws.com/sites/134/documents/archive.aspxadid2531?5b6X1.94tEbv6Whxp..pI1ukZsrVT43P', u'storage': u'attachment', u'session_id': u'3848', u'label': None, u'file_id': u'1928', u'provider': u'generic', u'agenda_provider_agenda_id': None, u'session_title': u'Toxics Board Meeting July 17, 2013', u'type': u'Agenda', u'id': u'1790', u'agenda_provider_id': None}]"
253,15793,"[8, 19]",Willow Bay Added to County Open Space,Willow Bay Added to County Open Space,"<p>Adams County Parks &amp; Open Space now has another recreational asset in Willow Bay that they hope to develop in the coming years.</p>
",0,,272.0,2017-10-30,2017-08-17,2017-10-30,VGS1BqhLyk4,https://www.youtube.com/watch?v=VGS1BqhLyk4,143.0,County Resources,,,"[{u'livestream': u'0', u'position': u'0', u'user_id': u'272', u'id': u'143', u'label': u'County Resources'}]",
254,14726,"[3, 7, 11]","Planning Commission Meeting: August 25, 2016","Planning Commission Meeting: August 25, 2016",,0,,134.0,2017-09-15,2016-08-25,2017-09-15,1oK4Gf_Gv0E,https://www.youtube.com/watch?v=1oK4Gf_Gv0E&feature=youtu.be,22.0,Planning Commission,3975.0,,"[{u'livestream': u'1', u'position': u'-9', u'user_id': u'134', u'id': u'22', u'label': u'Planning Commission'}]","[{u'user_id': u'134', u'type_id': u'1', u'url': None, u'storage': u'external', u'session_id': u'14726', u'label': None, u'file_id': None, u'provider': u'generic', u'agenda_provider_agenda_id': None, u'session_title': u'Planning Commission Meeting: August 25, 2016', u'type': u'Agenda', u'id': u'3975', u'agenda_provider_id': None}, {u'user_id': u'134', u'type_id': u'1', u'url': None, u'storage': u'external', u'session_id': u'14726', u'label': None, u'file_id': None, u'provider': u'generic', u'agenda_provider_agenda_id': None, u'session_title': u'Planning Commission Meeting: August 25, 2016', u'type': u'Agenda', u'id': u'3976', u'agenda_provider_id': None}, {u'user_id': u'134', u'type_id': u'1', u'url': None, u'storage': u'external', u'session_id': u'14726', u'label': None, u'file_id': None, u'provider': u'generic', u'agenda_provider_agenda_id': None, u'session_title': u'Planning Commission Meeting: August 25, 2016', u'type': u'Agenda', u'id': u'3977', u'agenda_provider_id': None}]"
255,8395,[16],Planning Board  Special Study Session  - 06/10/13,Planning Board  Special Study Session  - 06/10/13,,0,,199.0,2013-06-10,2013-06-10,2017-08-01,jRG9Zp2XKrU,https://www.youtube.com/watch?v=jRG9Zp2XKrU,70.0,Planning,2697.0,https://ompnetwork.s3-us-west-2.amazonaws.com/sites/199/granicus_files/1073_calendar_1370844000.html,"[{u'livestream': u'1', u'position': u'0', u'user_id': u'199', u'id': u'70', u'label': u'Planning'}]","[{u'user_id': u'199', u'type_id': u'3', u'url': u'https://ompnetwork.s3-us-west-2.amazonaws.com/sites/199/granicus_files/1073_calendar_1370844000.html', u'storage': u'external', u'session_id': u'8395', u'label': None, u'file_id': None, u'provider': u'generic', u'agenda_provider_agenda_id': None, u'session_title': u'Planning Board  Special Study Session  - 06/10/13', u'type': u'Calendar', u'id': u'2697', u'agenda_provider_id': None}]"
256,848,"[2, 4, 13, 19]",City Council Work Session 07-28-2010,City Council Work Session 07-28-2010,,0,shows/city-council-work-session-07-28-2010,134.0,2010-07-28,2010-07-28,2017-03-20,l4k2HNMeuL4,https://www.youtube.com/watch?v=l4k2HNMeuL4,20.0,City Council,1144.0,https://ompnetwork.s3-us-west-2.amazonaws.com/sites/134/documents/agenda_217.pdf,"[{u'livestream': u'1', u'position': u'-10', u'user_id': u'134', u'id': u'20', u'label': u'City Council'}]","[{u'user_id': u'134', u'type_id': u'1', u'url': u'https://ompnetwork.s3-us-west-2.amazonaws.com/sites/134/documents/agenda_217.pdf', u'storage': u'attachment', u'session_id': u'848', u'label': None, u'file_id': u'1215', u'provider': u'generic', u'agenda_provider_agenda_id': None, u'session_title': u'City Council Work Session 07-28-2010', u'type': u'Agenda', u'id': u'1144', u'agenda_provider_id': None}, {u'user_id': u'134', u'type_id': u'4', u'url': u'https://ompnetwork.s3-us-west-2.amazonaws.com/sites/134/documents/minutes_275.pdf', u'storage': u'attachment', u'session_id': u'848', u'label': None, u'file_id': u'1216', u'provider': u'generic', u'agenda_provider_agenda_id': None, u'session_title': u'City Council Work Session 07-28-2010', u'type': u'Minutes', u'id': u'1145', u'agenda_provider_id': None}]"
257,737,"[9, 13, 16]",City Council Work Session 05-18-2011,City Council Work Session 05-18-2011,,0,shows/city-council-work-session-05-18-2011,134.0,2011-05-18,2011-05-18,2017-03-20,jlI7pPdXgNo,https://www.youtube.com/watch?v=jlI7pPdXgNo,20.0,City Council,974.0,https://ompnetwork.s3-us-west-2.amazonaws.com/sites/134/documents/agenda_162.pdf,"[{u'livestream': u'1', u'position': u'-10', u'user_id': u'134', u'id': u'20', u'label': u'City Council'}]","[{u'user_id': u'134', u'type_id': u'1', u'url': u'https://ompnetwork.s3-us-west-2.amazonaws.com/sites/134/documents/agenda_162.pdf', u'storage': u'attachment', u'session_id': u'737', u'label': None, u'file_id': u'1045', u'provider': u'generic', u'agenda_provider_agenda_id': None, u'session_title': u'City Council Work Session 05-18-2011', u'type': u'Agenda', u'id': u'974', u'agenda_provider_id': None}, {u'user_id': u'134', u'type_id': u'4', u'url': u'https://ompnetwork.s3-us-west-2.amazonaws.com/sites/134/documents/minutes_220.pdf', u'storage': u'attachment', u'session_id': u'737', u'label': None, u'file_id': u'1046', u'provider': u'generic', u'agenda_provider_agenda_id': None, u'session_title': u'City Council Work Session 05-18-2011', u'type': u'Minutes', u'id': u'975', u'agenda_provider_id': None}]"
258,229,"[18, 19]",City Council Work Session 01-27-2016,City Council Work Session 01-27-2016,,0,shows/city-council-work-session-01-27-2016,134.0,2016-01-27,2016-01-27,2017-03-20,IAvIQFwcqFw,https://www.youtube.com/watch?v=IAvIQFwcqFw,20.0,City Council,113.0,https://ompnetwork.s3-us-west-2.amazonaws.com/sites/134/documents/agenda_packet_37.pdf,"[{u'livestream': u'1', u'position': u'-10', u'user_id': u'134', u'id': u'20', u'label': u'City Council'}]","[{u'user_id': u'134', u'type_id': u'1', u'url': u'https://ompnetwork.s3-us-west-2.amazonaws.com/sites/134/documents/agenda_packet_37.pdf', u'storage': u'attachment', u'session_id': u'229', u'label': None, u'file_id': u'183', u'provider': u'generic', u'agenda_provider_agenda_id': None, u'session_title': u'City Council Work Session 01-27-2016', u'type': u'Agenda', u'id': u'113', u'agenda_provider_id': None}, {u'user_id': u'134', u'type_id': u'4', u'url': u'https://ompnetwork.s3-us-west-2.amazonaws.com/sites/134/documents/minutes_16_0.pdf', u'storage': u'attachment', u'session_id': u'229', u'label': None, u'file_id': u'184', u'provider': u'generic', u'agenda_provider_agenda_id': None, u'session_title': u'City Council Work Session 01-27-2016', u'type': u'Minutes', u'id': u'114', u'agenda_provider_id': None}]"
259,15853,"[11, 19]",BOCC Work Session - 11/24/15,BOCC Work Session - 11/24/15,,0,,273.0,2015-11-24,2015-11-24,2017-10-30,MDrby3C57Uo,https://www.youtube.com/watch?v=MDrby3C57Uo,148.0,2015,4243.0,https://ompnetwork.s3-us-west-2.amazonaws.com/sites/273/granicus_files/683_calendar_1448348400.html,"[{u'livestream': u'0', u'position': u'-7', u'user_id': u'273', u'id': u'148', u'label': u'2015'}]","[{u'user_id': u'273', u'type_id': u'3', u'url': u'https://ompnetwork.s3-us-west-2.amazonaws.com/sites/273/granicus_files/683_calendar_1448348400.html', u'storage': u'external', u'session_id': u'15853', u'label': None, u'file_id': None, u'provider': u'generic', u'agenda_provider_agenda_id': None, u'session_title': u'BOCC Work Session - 11/24/15', u'type': u'Calendar', u'id': u'4243', u'agenda_provider_id': None}]"
260,402,"[3, 5, 6, 18]",City Council Meeting 11-18-2013,City Council Meeting 11-18-2013,,0,shows/city-council-meeting-11-18-2013,134.0,2013-11-18,2013-11-18,2017-03-20,DyA5sbBwUWU,https://www.youtube.com/watch?v=DyA5sbBwUWU,20.0,City Council,435.0,https://ompnetwork.s3-us-west-2.amazonaws.com/sites/134/documents/agenda_packet_213.pdf,"[{u'livestream': u'1', u'position': u'-10', u'user_id': u'134', u'id': u'20', u'label': u'City Council'}]","[{u'user_id': u'134', u'type_id': u'1', u'url': u'https://ompnetwork.s3-us-west-2.amazonaws.com/sites/134/documents/agenda_packet_213.pdf', u'storage': u'attachment', u'session_id': u'402', u'label': None, u'file_id': u'505', u'provider': u'generic', u'agenda_provider_agenda_id': None, u'session_title': u'City Council Meeting 11-18-2013', u'type': u'Agenda', u'id': u'435', u'agenda_provider_id': None}, {u'user_id': u'134', u'type_id': u'4', u'url': u'https://ompnetwork.s3-us-west-2.amazonaws.com/sites/134/documents/minutes_168.pdf', u'storage': u'attachment', u'session_id': u'402', u'label': None, u'file_id': u'506', u'provider': u'generic', u'agenda_provider_agenda_id': None, u'session_title': u'City Council Meeting 11-18-2013', u'type': u'Minutes', u'id': u'436', u'agenda_provider_id': None}]"
261,401,"[11, 18]",City Council Work Session 11-20-2013,City Council Work Session 11-20-2013,,0,shows/city-council-work-session-11-20-2013,134.0,2013-11-20,2013-11-20,2017-03-20,b9h7qKvVw3I,https://www.youtube.com/watch?v=b9h7qKvVw3I,20.0,City Council,433.0,https://ompnetwork.s3-us-west-2.amazonaws.com/sites/134/documents/agenda_packet_212.pdf,"[{u'livestream': u'1', u'position': u'-10', u'user_id': u'134', u'id': u'20', u'label': u'City Council'}]","[{u'user_id': u'134', u'type_id': u'1', u'url': u'https://ompnetwork.s3-us-west-2.amazonaws.com/sites/134/documents/agenda_packet_212.pdf', u'storage': u'attachment', u'session_id': u'401', u'label': None, u'file_id': u'503', u'provider': u'generic', u'agenda_provider_agenda_id': None, u'session_title': u'City Council Work Session 11-20-2013', u'type': u'Agenda', u'id': u'433', u'agenda_provider_id': None}, {u'user_id': u'134', u'type_id': u'4', u'url': u'https://ompnetwork.s3-us-west-2.amazonaws.com/sites/134/documents/minutes_167.pdf', u'storage': u'attachment', u'session_id': u'401', u'label': None, u'file_id': u'504', u'provider': u'generic', u'agenda_provider_agenda_id': None, u'session_title': u'City Council Work Session 11-20-2013', u'type': u'Minutes', u'id': u'434', u'agenda_provider_id': None}]"
262,691,"[7, 13]",City Council Meeting 09-12-2011,City Council Meeting 09-12-2011,,0,shows/city-council-meeting-09-12-2011,134.0,2011-09-12,2011-09-12,2017-03-20,2dmIGcrtmv0,https://www.youtube.com/watch?v=2dmIGcrtmv0,20.0,City Council,904.0,https://ompnetwork.s3-us-west-2.amazonaws.com/sites/134/documents/agenda_140.pdf,"[{u'livestream': u'1', u'position': u'-10', u'user_id': u'134', u'id': u'20', u'label': u'City Council'}]","[{u'user_id': u'134', u'type_id': u'1', u'url': u'https://ompnetwork.s3-us-west-2.amazonaws.com/sites/134/documents/agenda_140.pdf', u'storage': u'attachment', u'session_id': u'691', u'label': None, u'file_id': u'975', u'provider': u'generic', u'agenda_provider_agenda_id': None, u'session_title': u'City Council Meeting 09-12-2011', u'type': u'Agenda', u'id': u'904', u'agenda_provider_id': None}, {u'user_id': u'134', u'type_id': u'4', u'url': u'https://ompnetwork.s3-us-west-2.amazonaws.com/sites/134/documents/minutes_198_0.pdf', u'storage': u'attachment', u'session_id': u'691', u'label': None, u'file_id': u'976', u'provider': u'generic', u'agenda_provider_agenda_id': None, u'session_title': u'City Council Meeting 09-12-2011', u'type': u'Minutes', u'id': u'905', u'agenda_provider_id': None}]"
263,439,"[3, 8, 16]",City Council Work Session 06-24-2013,City Council Work Session 06-24-2013,,0,shows/city-council-work-session-06-24-2013,134.0,2013-06-24,2013-06-24,2017-03-20,ztXbR143zeQ,https://www.youtube.com/watch?v=ztXbR143zeQ,20.0,City Council,505.0,https://ompnetwork.s3-us-west-2.amazonaws.com/sites/134/documents/agenda_packet_263.pdf,"[{u'livestream': u'1', u'position': u'-10', u'user_id': u'134', u'id': u'20', u'label': u'City Council'}]","[{u'user_id': u'134', u'type_id': u'1', u'url': u'https://ompnetwork.s3-us-west-2.amazonaws.com/sites/134/documents/agenda_packet_263.pdf', u'storage': u'attachment', u'session_id': u'439', u'label': None, u'file_id': u'575', u'provider': u'generic', u'agenda_provider_agenda_id': None, u'session_title': u'City Council Work Session 06-24-2013', u'type': u'Agenda', u'id': u'505', u'agenda_provider_id': None}, {u'user_id': u'134', u'type_id': u'4', u'url': u'https://ompnetwork.s3-us-west-2.amazonaws.com/sites/134/documents/minutes_198.pdf', u'storage': u'attachment', u'session_id': u'439', u'label': None, u'file_id': u'576', u'provider': u'generic', u'agenda_provider_agenda_id': None, u'session_title': u'City Council Work Session 06-24-2013', u'type': u'Minutes', u'id': u'506', u'agenda_provider_id': None}]"
264,862,"[4, 12, 13]",City Council Work Session 06-14-2010,City Council Work Session 06-14-2010,,0,shows/city-council-work-session-06-14-2010,134.0,2010-06-14,2010-06-14,2017-03-20,gRSceRTMjwI,https://www.youtube.com/watch?v=gRSceRTMjwI,20.0,City Council,1170.0,https://ompnetwork.s3-us-west-2.amazonaws.com/sites/134/documents/agenda_230.pdf,"[{u'livestream': u'1', u'position': u'-10', u'user_id': u'134', u'id': u'20', u'label': u'City Council'}]","[{u'user_id': u'134', u'type_id': u'1', u'url': u'https://ompnetwork.s3-us-west-2.amazonaws.com/sites/134/documents/agenda_230.pdf', u'storage': u'attachment', u'session_id': u'862', u'label': None, u'file_id': u'1241', u'provider': u'generic', u'agenda_provider_agenda_id': None, u'session_title': u'City Council Work Session 06-14-2010', u'type': u'Agenda', u'id': u'1170', u'agenda_provider_id': None}, {u'user_id': u'134', u'type_id': u'4', u'url': u'https://ompnetwork.s3-us-west-2.amazonaws.com/sites/134/documents/minutes_288.pdf', u'storage': u'attachment', u'session_id': u'862', u'label': None, u'file_id': u'1242', u'provider': u'generic', u'agenda_provider_agenda_id': None, u'session_title': u'City Council Work Session 06-14-2010', u'type': u'Minutes', u'id': u'1171', u'agenda_provider_id': None}]"
265,699,"[0, 5, 13, 16, 17]",City Council Work Session 07-25-2011,City Council Work Session 07-25-2011,,0,shows/city-council-work-session-07-25-2011,134.0,2011-07-25,2011-07-25,2017-03-20,EbZqr4cCzA8,https://www.youtube.com/watch?v=EbZqr4cCzA8,20.0,City Council,916.0,https://ompnetwork.s3-us-west-2.amazonaws.com/sites/134/documents/agenda_145.pdf,"[{u'livestream': u'1', u'position': u'-10', u'user_id': u'134', u'id': u'20', u'label': u'City Council'}]","[{u'user_id': u'134', u'type_id': u'1', u'url': u'https://ompnetwork.s3-us-west-2.amazonaws.com/sites/134/documents/agenda_145.pdf', u'storage': u'attachment', u'session_id': u'699', u'label': None, u'file_id': u'987', u'provider': u'generic', u'agenda_provider_agenda_id': None, u'session_title': u'City Council Work Session 07-25-2011', u'type': u'Agenda', u'id': u'916', u'agenda_provider_id': None}, {u'user_id': u'134', u'type_id': u'4', u'url': u'https://ompnetwork.s3-us-west-2.amazonaws.com/sites/134/documents/minutes_202_0.pdf', u'storage': u'attachment', u'session_id': u'699', u'label': None, u'file_id': u'988', u'provider': u'generic', u'agenda_provider_agenda_id': None, u'session_title': u'City Council Work Session 07-25-2011', u'type': u'Minutes', u'id': u'917', u'agenda_provider_id': None}]"
266,267,[18],City Council Work Session 07-20-2015,City Council Work Session 07-20-2015,,0,shows/city-council-work-session-07-20-2015,134.0,2015-07-20,2015-07-20,2017-03-20,IL-VhCtHV1w,https://www.youtube.com/watch?v=IL-VhCtHV1w,20.0,City Council,183.0,https://ompnetwork.s3-us-west-2.amazonaws.com/sites/134/documents/agenda_packet_76.pdf,"[{u'livestream': u'1', u'position': u'-10', u'user_id': u'134', u'id': u'20', u'label': u'City Council'}]","[{u'user_id': u'134', u'type_id': u'1', u'url': u'https://ompnetwork.s3-us-west-2.amazonaws.com/sites/134/documents/agenda_packet_76.pdf', u'storage': u'attachment', u'session_id': u'267', u'label': None, u'file_id': u'253', u'provider': u'generic', u'agenda_provider_agenda_id': None, u'session_title': u'City Council Work Session 07-20-2015', u'type': u'Agenda', u'id': u'183', u'agenda_provider_id': None}, {u'user_id': u'134', u'type_id': u'4', u'url': u'https://ompnetwork.s3-us-west-2.amazonaws.com/sites/134/documents/minutes_50.pdf', u'storage': u'attachment', u'session_id': u'267', u'label': None, u'file_id': u'254', u'provider': u'generic', u'agenda_provider_agenda_id': None, u'session_title': u'City Council Work Session 07-20-2015', u'type': u'Minutes', u'id': u'184', u'agenda_provider_id': None}]"
267,852,"[12, 13, 18]",City Council Work Session 07-14-2010,City Council Work Session 07-14-2010,,0,shows/city-council-work-session-07-14-2010,134.0,2010-07-14,2010-07-14,2017-03-20,WrA5-vWrP_0,https://www.youtube.com/watch?v=WrA5-vWrP_0,20.0,City Council,1151.0,https://ompnetwork.s3-us-west-2.amazonaws.com/sites/134/documents/agenda_221.pdf,"[{u'livestream': u'1', u'position': u'-10', u'user_id': u'134', u'id': u'20', u'label': u'City Council'}]","[{u'user_id': u'134', u'type_id': u'1', u'url': u'https://ompnetwork.s3-us-west-2.amazonaws.com/sites/134/documents/agenda_221.pdf', u'storage': u'attachment', u'session_id': u'852', u'label': None, u'file_id': u'1222', u'provider': u'generic', u'agenda_provider_agenda_id': None, u'session_title': u'City Council Work Session 07-14-2010', u'type': u'Agenda', u'id': u'1151', u'agenda_provider_id': None}, {u'user_id': u'134', u'type_id': u'4', u'url': u'https://ompnetwork.s3-us-west-2.amazonaws.com/sites/134/documents/minutes_278.pdf', u'storage': u'attachment', u'session_id': u'852', u'label': None, u'file_id': u'1223', u'provider': u'generic', u'agenda_provider_agenda_id': None, u'session_title': u'City Council Work Session 07-14-2010', u'type': u'Minutes', u'id': u'1152', u'agenda_provider_id': None}]"
268,3915,"[0, 12, 13]","Eugene Police Commission Meeting December 8, 2011","Eugene Police Commission Meeting December 8, 2011",,0,,134.0,2017-07-17,2011-12-08,2017-07-20,R-sI1REdppY,https://youtu.be/R-sI1REdppY,45.0,Police Commission,1705.0,https://ompnetwork.s3-us-west-2.amazonaws.com/sites/134/documents/2011_12_8_pc_packet.pdf,"[{u'livestream': u'0', u'position': u'0', u'user_id': u'134', u'id': u'45', u'label': u'Police Commission'}]","[{u'user_id': u'134', u'type_id': u'1', u'url': u'https://ompnetwork.s3-us-west-2.amazonaws.com/sites/134/documents/2011_12_8_pc_packet.pdf', u'storage': u'attachment', u'session_id': u'3915', u'label': None, u'file_id': u'1866', u'provider': u'generic', u'agenda_provider_agenda_id': None, u'session_title': u'Eugene Police Commission Meeting December 8, 2011', u'type': u'Agenda', u'id': u'1705', u'agenda_provider_id': None}]"
269,587,"[5, 18]",City Council Work Session 05-09-2012,City Council Work Session 05-09-2012,,0,shows/city-council-work-session-05-09-2012,134.0,2012-05-09,2012-05-09,2017-03-20,d0cyuSxLWfs,https://www.youtube.com/watch?v=d0cyuSxLWfs,20.0,City Council,743.0,https://ompnetwork.s3-us-west-2.amazonaws.com/sites/134/documents/agenda_112.pdf,"[{u'livestream': u'1', u'position': u'-10', u'user_id': u'134', u'id': u'20', u'label': u'City Council'}]","[{u'user_id': u'134', u'type_id': u'1', u'url': u'https://ompnetwork.s3-us-west-2.amazonaws.com/sites/134/documents/agenda_112.pdf', u'storage': u'attachment', u'session_id': u'587', u'label': None, u'file_id': u'814', u'provider': u'generic', u'agenda_provider_agenda_id': None, u'session_title': u'City Council Work Session 05-09-2012', u'type': u'Agenda', u'id': u'743', u'agenda_provider_id': None}, {u'user_id': u'134', u'type_id': u'4', u'url': u'https://ompnetwork.s3-us-west-2.amazonaws.com/sites/134/documents/minutes_95_0.pdf', u'storage': u'attachment', u'session_id': u'587', u'label': None, u'file_id': u'815', u'provider': u'generic', u'agenda_provider_agenda_id': None, u'session_title': u'City Council Work Session 05-09-2012', u'type': u'Minutes', u'id': u'744', u'agenda_provider_id': None}]"
270,325,"[4, 8, 18, 19]",City Council Work Session 10-15-2014,City Council Work Session 10-15-2014,,0,shows/city-council-work-session-10-15-2014,134.0,2014-10-15,2014-10-15,2017-03-20,RsPy5GgjaFA,https://www.youtube.com/watch?v=RsPy5GgjaFA,20.0,City Council,293.0,https://ompnetwork.s3-us-west-2.amazonaws.com/sites/134/documents/agenda_packet_169.pdf,"[{u'livestream': u'1', u'position': u'-10', u'user_id': u'134', u'id': u'20', u'label': u'City Council'}]","[{u'user_id': u'134', u'type_id': u'1', u'url': u'https://ompnetwork.s3-us-west-2.amazonaws.com/sites/134/documents/agenda_packet_169.pdf', u'storage': u'attachment', u'session_id': u'325', u'label': None, u'file_id': u'363', u'provider': u'generic', u'agenda_provider_agenda_id': None, u'session_title': u'City Council Work Session 10-15-2014', u'type': u'Agenda', u'id': u'293', u'agenda_provider_id': None}, {u'user_id': u'134', u'type_id': u'4', u'url': u'https://ompnetwork.s3-us-west-2.amazonaws.com/sites/134/documents/minutes_101.pdf', u'storage': u'attachment', u'session_id': u'325', u'label': None, u'file_id': u'364', u'provider': u'generic', u'agenda_provider_agenda_id': None, u'session_title': u'City Council Work Session 10-15-2014', u'type': u'Minutes', u'id': u'294', u'agenda_provider_id': None}]"
271,376,"[4, 8, 11, 13, 16, 18]",City Council Work Session 02-26-2014,City Council Work Session 02-26-2014,,0,shows/city-council-work-session-02-26-2014,134.0,2014-02-26,2014-02-26,2017-03-20,khuI8siuAfg,https://www.youtube.com/watch?v=khuI8siuAfg,20.0,City Council,387.0,https://ompnetwork.s3-us-west-2.amazonaws.com/sites/134/documents/agenda_packet_189.pdf,"[{u'livestream': u'1', u'position': u'-10', u'user_id': u'134', u'id': u'20', u'label': u'City Council'}]","[{u'user_id': u'134', u'type_id': u'1', u'url': u'https://ompnetwork.s3-us-west-2.amazonaws.com/sites/134/documents/agenda_packet_189.pdf', u'storage': u'attachment', u'session_id': u'376', u'label': None, u'file_id': u'457', u'provider': u'generic', u'agenda_provider_agenda_id': None, u'session_title': u'City Council Work Session 02-26-2014', u'type': u'Agenda', u'id': u'387', u'agenda_provider_id': None}, {u'user_id': u'134', u'type_id': u'4', u'url': u'https://ompnetwork.s3-us-west-2.amazonaws.com/sites/134/documents/minutes_150.pdf', u'storage': u'attachment', u'session_id': u'376', u'label': None, u'file_id': u'458', u'provider': u'generic', u'agenda_provider_agenda_id': None, u'session_title': u'City Council Work Session 02-26-2014', u'type': u'Minutes', u'id': u'388', u'agenda_provider_id': None}]"
272,333,[18],City Council Work Session 09-10-2014,City Council Work Session 09-10-2014,,0,shows/city-council-work-session-09-10-2014,134.0,2014-09-10,2014-09-10,2017-03-20,H-xbf7CWtvo,https://www.youtube.com/watch?v=H-xbf7CWtvo,20.0,City Council,309.0,https://ompnetwork.s3-us-west-2.amazonaws.com/sites/134/documents/agenda_packet_3_1.pdf,"[{u'livestream': u'1', u'position': u'-10', u'user_id': u'134', u'id': u'20', u'label': u'City Council'}]","[{u'user_id': u'134', u'type_id': u'1', u'url': u'https://ompnetwork.s3-us-west-2.amazonaws.com/sites/134/documents/agenda_packet_3_1.pdf', u'storage': u'attachment', u'session_id': u'333', u'label': None, u'file_id': u'379', u'provider': u'generic', u'agenda_provider_agenda_id': None, u'session_title': u'City Council Work Session 09-10-2014', u'type': u'Agenda', u'id': u'309', u'agenda_provider_id': None}, {u'user_id': u'134', u'type_id': u'4', u'url': u'https://ompnetwork.s3-us-west-2.amazonaws.com/sites/134/documents/minutes_109.pdf', u'storage': u'attachment', u'session_id': u'333', u'label': None, u'file_id': u'380', u'provider': u'generic', u'agenda_provider_agenda_id': None, u'session_title': u'City Council Work Session 09-10-2014', u'type': u'Minutes', u'id': u'310', u'agenda_provider_id': None}]"
273,205,"[16, 17, 18, 19]",City Council Work Session 05-18-2016,City Council Work Session 05-18-2016,,0,shows/city-council-work-session-05-18-2016,134.0,2016-05-18,2016-05-18,2017-03-20,OQQZ--SUteY,https://www.youtube.com/watch?v=OQQZ--SUteY,20.0,City Council,68.0,https://ompnetwork.s3-us-west-2.amazonaws.com/sites/134/documents/agenda_packet_8.pdf,"[{u'livestream': u'1', u'position': u'-10', u'user_id': u'134', u'id': u'20', u'label': u'City Council'}]","[{u'user_id': u'134', u'type_id': u'1', u'url': u'https://ompnetwork.s3-us-west-2.amazonaws.com/sites/134/documents/agenda_packet_8.pdf', u'storage': u'attachment', u'session_id': u'205', u'label': None, u'file_id': u'138', u'provider': u'generic', u'agenda_provider_agenda_id': None, u'session_title': u'City Council Work Session 05-18-2016', u'type': u'Agenda', u'id': u'68', u'agenda_provider_id': None}, {u'user_id': u'134', u'type_id': u'4', u'url': u'https://ompnetwork.s3-us-west-2.amazonaws.com/sites/134/documents/minutes_3_0.pdf', u'storage': u'attachment', u'session_id': u'205', u'label': None, u'file_id': u'139', u'provider': u'generic', u'agenda_provider_agenda_id': None, u'session_title': u'City Council Work Session 05-18-2016', u'type': u'Minutes', u'id': u'69', u'agenda_provider_id': None}]"
274,490,"[3, 5, 7]",Planning Commission Public Hearing 04-12-2016,Planning Commission Public Hearing 04-12-2016,,0,shows/planning-commission-public-hearing-04-12-2016,134.0,2016-04-12,2016-04-12,2017-03-20,3fMtT4QCXRo,https://www.youtube.com/watch?v=3fMtT4QCXRo,22.0,Planning Commission,598.0,https://ompnetwork.s3-us-west-2.amazonaws.com/sites/134/documents/agenda_packet_22_0.pdf,"[{u'livestream': u'1', u'position': u'-9', u'user_id': u'134', u'id': u'22', u'label': u'Planning Commission'}]","[{u'user_id': u'134', u'type_id': u'1', u'url': u'https://ompnetwork.s3-us-west-2.amazonaws.com/sites/134/documents/agenda_packet_22_0.pdf', u'storage': u'attachment', u'session_id': u'490', u'label': None, u'file_id': u'668', u'provider': u'generic', u'agenda_provider_agenda_id': None, u'session_title': u'Planning Commission Public Hearing 04-12-2016', u'type': u'Agenda', u'id': u'598', u'agenda_provider_id': None}]"
275,716,"[3, 5, 6, 7]",Planning Commission  02-25-2013,Planning Commission  02-25-2013,,0,shows/planning-commission-02-25-2013,134.0,2013-02-25,2013-02-25,2017-03-20,P-a-wonfoIU,https://www.youtube.com/watch?v=P-a-wonfoIU,22.0,Planning Commission,942.0,https://ompnetwork.s3-us-west-2.amazonaws.com/sites/134/documents/agenda_packet_167_0.pdf,"[{u'livestream': u'1', u'position': u'-9', u'user_id': u'134', u'id': u'22', u'label': u'Planning Commission'}]","[{u'user_id': u'134', u'type_id': u'1', u'url': u'https://ompnetwork.s3-us-west-2.amazonaws.com/sites/134/documents/agenda_packet_167_0.pdf', u'storage': u'attachment', u'session_id': u'716', u'label': None, u'file_id': u'1013', u'provider': u'generic', u'agenda_provider_agenda_id': None, u'session_title': u'Planning Commission  02-25-2013', u'type': u'Agenda', u'id': u'942', u'agenda_provider_id': None}]"
276,591,"[5, 8, 16, 17]",Planning Commission  07-21-2014,Planning Commission  07-21-2014,,0,shows/planning-commission-07-21-2014,134.0,2014-07-21,2014-07-21,2017-03-20,WVLcoM6u_-c,https://www.youtube.com/watch?v=WVLcoM6u_-c,22.0,Planning Commission,750.0,https://ompnetwork.s3-us-west-2.amazonaws.com/sites/134/documents/agenda_packet_113_0.pdf,"[{u'livestream': u'1', u'position': u'-9', u'user_id': u'134', u'id': u'22', u'label': u'Planning Commission'}]","[{u'user_id': u'134', u'type_id': u'1', u'url': u'https://ompnetwork.s3-us-west-2.amazonaws.com/sites/134/documents/agenda_packet_113_0.pdf', u'storage': u'attachment', u'session_id': u'591', u'label': None, u'file_id': u'821', u'provider': u'generic', u'agenda_provider_agenda_id': None, u'session_title': u'Planning Commission  07-21-2014', u'type': u'Agenda', u'id': u'750', u'agenda_provider_id': None}]"
277,865,"[3, 11, 19]",Budget Committee 05-27-2010,Budget Committee 05-27-2010,,0,shows/budget-committee-05-27-2010,134.0,2010-05-27,2010-05-27,2017-03-20,tMls-5EtqmU,https://www.youtube.com/watch?v=tMls-5EtqmU,21.0,Budget Committee,1176.0,https://ompnetwork.s3-us-west-2.amazonaws.com/sites/134/documents/agenda_packet_77_0.pdf,"[{u'livestream': u'1', u'position': u'-8', u'user_id': u'134', u'id': u'21', u'label': u'Budget Committee'}]","[{u'user_id': u'134', u'type_id': u'1', u'url': u'https://ompnetwork.s3-us-west-2.amazonaws.com/sites/134/documents/agenda_packet_77_0.pdf', u'storage': u'attachment', u'session_id': u'865', u'label': None, u'file_id': u'1247', u'provider': u'generic', u'agenda_provider_agenda_id': None, u'session_title': u'Budget Committee 05-27-2010', u'type': u'Agenda', u'id': u'1176', u'agenda_provider_id': None}, {u'user_id': u'134', u'type_id': u'4', u'url': u'https://ompnetwork.s3-us-west-2.amazonaws.com/sites/134/documents/minutes_161_0.pdf', u'storage': u'attachment', u'session_id': u'865', u'label': None, u'file_id': u'1248', u'provider': u'generic', u'agenda_provider_agenda_id': None, u'session_title': u'Budget Committee 05-27-2010', u'type': u'Minutes', u'id': u'1177', u'agenda_provider_id': None}]"
278,387,"[7, 12, 13]",City Council Work Session 01-27-2014,City Council Work Session 01-27-2014,,0,shows/city-council-work-session-01-27-2014,134.0,2014-01-27,2014-01-27,2017-03-20,2UikIWdxi8g,https://www.youtube.com/watch?v=2UikIWdxi8g,20.0,City Council,407.0,https://ompnetwork.s3-us-west-2.amazonaws.com/sites/134/documents/agenda_14.pdf,"[{u'livestream': u'1', u'position': u'-10', u'user_id': u'134', u'id': u'20', u'label': u'City Council'}]","[{u'user_id': u'134', u'type_id': u'1', u'url': u'https://ompnetwork.s3-us-west-2.amazonaws.com/sites/134/documents/agenda_14.pdf', u'storage': u'attachment', u'session_id': u'387', u'label': None, u'file_id': u'477', u'provider': u'generic', u'agenda_provider_agenda_id': None, u'session_title': u'City Council Work Session 01-27-2014', u'type': u'Agenda', u'id': u'407', u'agenda_provider_id': None}, {u'user_id': u'134', u'type_id': u'4', u'url': u'https://ompnetwork.s3-us-west-2.amazonaws.com/sites/134/documents/minutes_159.pdf', u'storage': u'attachment', u'session_id': u'387', u'label': None, u'file_id': u'478', u'provider': u'generic', u'agenda_provider_agenda_id': None, u'session_title': u'City Council Work Session 01-27-2014', u'type': u'Minutes', u'id': u'408', u'agenda_provider_id': None}]"
279,672,"[0, 12, 13, 18]",City Council Work Session 10-24-2011,City Council Work Session 10-24-2011,,0,shows/city-council-work-session-10-24-2011,134.0,2011-10-24,2011-10-24,2017-03-20,bTtJNHnDDYg,https://www.youtube.com/watch?v=bTtJNHnDDYg,20.0,City Council,874.0,https://ompnetwork.s3-us-west-2.amazonaws.com/sites/134/documents/agenda_81.pdf,"[{u'livestream': u'1', u'position': u'-10', u'user_id': u'134', u'id': u'20', u'label': u'City Council'}]","[{u'user_id': u'134', u'type_id': u'1', u'url': u'https://ompnetwork.s3-us-west-2.amazonaws.com/sites/134/documents/agenda_81.pdf', u'storage': u'attachment', u'session_id': u'672', u'label': None, u'file_id': u'945', u'provider': u'generic', u'agenda_provider_agenda_id': None, u'session_title': u'City Council Work Session 10-24-2011', u'type': u'Agenda', u'id': u'874', u'agenda_provider_id': None}, {u'user_id': u'134', u'type_id': u'4', u'url': u'https://ompnetwork.s3-us-west-2.amazonaws.com/sites/134/documents/minutes_186_0.pdf', u'storage': u'attachment', u'session_id': u'672', u'label': None, u'file_id': u'946', u'provider': u'generic', u'agenda_provider_agenda_id': None, u'session_title': u'City Council Work Session 10-24-2011', u'type': u'Minutes', u'id': u'875', u'agenda_provider_id': None}]"
280,20638,[7],"Board of Commissioners Morning Meeting: November 28, 2017","Board of Commissioners Morning Meeting: November 28, 2017",,0,,143.0,2017-11-22,2017-11-28,2017-12-15,FI7FPEQohHM,https://youtu.be/FI7FPEQohHM,25.0,Board of County Commissioners,4762.0,https://ompnetwork.s3-us-west-2.amazonaws.com/sites/143/documents/11_28_29_17agenda.pdf?YTMk3doaP2J_EM9glC26Tk.aSQX0t_1f,"[{u'livestream': u'1', u'position': u'0', u'user_id': u'143', u'id': u'25', u'label': u'Board of County Commissioners'}]","[{u'user_id': u'143', u'type_id': u'1', u'url': u'https://ompnetwork.s3-us-west-2.amazonaws.com/sites/143/documents/11_28_29_17agenda.pdf?YTMk3doaP2J_EM9glC26Tk.aSQX0t_1f', u'storage': u'attachment', u'session_id': u'20638', u'label': None, u'file_id': u'4101', u'provider': u'generic', u'agenda_provider_agenda_id': None, u'session_title': u'Board of Commissioners Morning Meeting: November 28, 2017', u'type': u'Agenda', u'id': u'4762', u'agenda_provider_id': None}]"
281,793,"[3, 5, 17, 18]",Planning Commission  11-14-2011,Planning Commission  11-14-2011,,0,shows/planning-commission-11-14-2011,134.0,2011-11-14,2011-11-14,2017-03-20,KA6NZ9L6aTw,https://www.youtube.com/watch?v=KA6NZ9L6aTw,22.0,Planning Commission,1053.0,https://ompnetwork.s3-us-west-2.amazonaws.com/sites/134/documents/agenda_20_0.pdf,"[{u'livestream': u'1', u'position': u'-9', u'user_id': u'134', u'id': u'22', u'label': u'Planning Commission'}]","[{u'user_id': u'134', u'type_id': u'1', u'url': u'https://ompnetwork.s3-us-west-2.amazonaws.com/sites/134/documents/agenda_20_0.pdf', u'storage': u'attachment', u'session_id': u'793', u'label': None, u'file_id': u'1124', u'provider': u'generic', u'agenda_provider_agenda_id': None, u'session_title': u'Planning Commission  11-14-2011', u'type': u'Agenda', u'id': u'1053', u'agenda_provider_id': None}]"
282,417,"[13, 19]",City Council Work Session 09-25-2013,City Council Work Session 09-25-2013,,0,shows/city-council-work-session-09-25-2013,134.0,2013-09-25,2013-09-25,2017-03-20,2kaw7s6-xQs,https://www.youtube.com/watch?v=2kaw7s6-xQs,20.0,City Council,465.0,https://ompnetwork.s3-us-west-2.amazonaws.com/sites/134/documents/agenda_packet_237.pdf,"[{u'livestream': u'1', u'position': u'-10', u'user_id': u'134', u'id': u'20', u'label': u'City Council'}]","[{u'user_id': u'134', u'type_id': u'1', u'url': u'https://ompnetwork.s3-us-west-2.amazonaws.com/sites/134/documents/agenda_packet_237.pdf', u'storage': u'attachment', u'session_id': u'417', u'label': None, u'file_id': u'535', u'provider': u'generic', u'agenda_provider_agenda_id': None, u'session_title': u'City Council Work Session 09-25-2013', u'type': u'Agenda', u'id': u'465', u'agenda_provider_id': None}, {u'user_id': u'134', u'type_id': u'4', u'url': u'https://ompnetwork.s3-us-west-2.amazonaws.com/sites/134/documents/minutes_181.pdf', u'storage': u'attachment', u'session_id': u'417', u'label': None, u'file_id': u'536', u'provider': u'generic', u'agenda_provider_agenda_id': None, u'session_title': u'City Council Work Session 09-25-2013', u'type': u'Minutes', u'id': u'466', u'agenda_provider_id': None}]"
283,449,"[8, 11, 18, 19]",City Council Work Session 05-29-2013,City Council Work Session 05-29-2013,,0,shows/city-council-work-session-05-29-2013,134.0,2013-05-29,2013-05-29,2017-03-20,AgUnH_jqCME,https://www.youtube.com/watch?v=AgUnH_jqCME,20.0,City Council,525.0,https://ompnetwork.s3-us-west-2.amazonaws.com/sites/134/documents/agenda_packet_272.pdf,"[{u'livestream': u'1', u'position': u'-10', u'user_id': u'134', u'id': u'20', u'label': u'City Council'}]","[{u'user_id': u'134', u'type_id': u'1', u'url': u'https://ompnetwork.s3-us-west-2.amazonaws.com/sites/134/documents/agenda_packet_272.pdf', u'storage': u'attachment', u'session_id': u'449', u'label': None, u'file_id': u'595', u'provider': u'generic', u'agenda_provider_agenda_id': None, u'session_title': u'City Council Work Session 05-29-2013', u'type': u'Agenda', u'id': u'525', u'agenda_provider_id': None}, {u'user_id': u'134', u'type_id': u'4', u'url': u'https://ompnetwork.s3-us-west-2.amazonaws.com/sites/134/documents/minutes_206.pdf', u'storage': u'attachment', u'session_id': u'449', u'label': None, u'file_id': u'596', u'provider': u'generic', u'agenda_provider_agenda_id': None, u'session_title': u'City Council Work Session 05-29-2013', u'type': u'Minutes', u'id': u'526', u'agenda_provider_id': None}]"
284,14702,"[0, 2, 3, 9, 11, 13, 16]","Thornton360 - September 13, 2017","Thornton360 - September 13, 2017","<p>Thornton360 is produced by the city of Thornton after each city council meeting, recapping the latest meeting and keeping residents informed about important news, issues and events happening in our community.</p>

<p>http://www.cityofthornton.tv</p>
",0,,186.0,2017-09-13,2017-09-13,2017-09-28,bxB7MsyfIzk,https://www.youtube.com/watch?v=bxB7MsyfIzk,59.0,Thornton360,,,"[{u'livestream': u'0', u'position': u'-9', u'user_id': u'186', u'id': u'59', u'label': u'Thornton360'}]",
285,880,"[0, 9, 11, 15]",City Council Work Session 04-28-2010,City Council Work Session 04-28-2010,,0,shows/city-council-work-session-04-28-2010,134.0,2010-04-28,2010-04-28,2017-03-20,GDyftjDNccs,https://www.youtube.com/watch?v=GDyftjDNccs,20.0,City Council,1206.0,https://ompnetwork.s3-us-west-2.amazonaws.com/sites/134/documents/agenda_239.pdf,"[{u'livestream': u'1', u'position': u'-10', u'user_id': u'134', u'id': u'20', u'label': u'City Council'}]","[{u'user_id': u'134', u'type_id': u'1', u'url': u'https://ompnetwork.s3-us-west-2.amazonaws.com/sites/134/documents/agenda_239.pdf', u'storage': u'attachment', u'session_id': u'880', u'label': None, u'file_id': u'1277', u'provider': u'generic', u'agenda_provider_agenda_id': None, u'session_title': u'City Council Work Session 04-28-2010', u'type': u'Agenda', u'id': u'1206', u'agenda_provider_id': None}, {u'user_id': u'134', u'type_id': u'4', u'url': u'https://ompnetwork.s3-us-west-2.amazonaws.com/sites/134/documents/minutes_297.pdf', u'storage': u'attachment', u'session_id': u'880', u'label': None, u'file_id': u'1278', u'provider': u'generic', u'agenda_provider_agenda_id': None, u'session_title': u'City Council Work Session 04-28-2010', u'type': u'Minutes', u'id': u'1207', u'agenda_provider_id': None}]"
286,475,"[8, 11, 16, 19]",City Council Work Session 02-11-2013,City Council Work Session 02-11-2013,,0,shows/city-council-work-session-02-11-2013,134.0,2013-02-11,2013-02-11,2017-03-20,4U4EpGAs468,https://www.youtube.com/watch?v=4U4EpGAs468,20.0,City Council,574.0,https://ompnetwork.s3-us-west-2.amazonaws.com/sites/134/documents/agenda_36.pdf,"[{u'livestream': u'1', u'position': u'-10', u'user_id': u'134', u'id': u'20', u'label': u'City Council'}]","[{u'user_id': u'134', u'type_id': u'1', u'url': u'https://ompnetwork.s3-us-west-2.amazonaws.com/sites/134/documents/agenda_36.pdf', u'storage': u'attachment', u'session_id': u'475', u'label': None, u'file_id': u'644', u'provider': u'generic', u'agenda_provider_agenda_id': None, u'session_title': u'City Council Work Session 02-11-2013', u'type': u'Agenda', u'id': u'574', u'agenda_provider_id': None}, {u'user_id': u'134', u'type_id': u'4', u'url': u'https://ompnetwork.s3-us-west-2.amazonaws.com/sites/134/documents/minutes_34_0.pdf', u'storage': u'attachment', u'session_id': u'475', u'label': None, u'file_id': u'645', u'provider': u'generic', u'agenda_provider_agenda_id': None, u'session_title': u'City Council Work Session 02-11-2013', u'type': u'Minutes', u'id': u'575', u'agenda_provider_id': None}]"
287,198,"[7, 12, 13, 16, 17]",City Council Work Session 06-15-2016,City Council Work Session 06-15-2016,,0,shows/city-council-work-session-06-15-2016,134.0,2016-06-15,2016-06-15,2017-03-20,Gv52911KF44,https://www.youtube.com/watch?v=Gv52911KF44,20.0,City Council,54.0,https://ompnetwork.s3-us-west-2.amazonaws.com/sites/134/documents/agenda_1_0.pdf,"[{u'livestream': u'1', u'position': u'-10', u'user_id': u'134', u'id': u'20', u'label': u'City Council'}]","[{u'user_id': u'134', u'type_id': u'1', u'url': u'https://ompnetwork.s3-us-west-2.amazonaws.com/sites/134/documents/agenda_1_0.pdf', u'storage': u'attachment', u'session_id': u'198', u'label': None, u'file_id': u'124', u'provider': u'generic', u'agenda_provider_agenda_id': None, u'session_title': u'City Council Work Session 06-15-2016', u'type': u'Agenda', u'id': u'54', u'agenda_provider_id': None}, {u'user_id': u'134', u'type_id': u'4', u'url': u'https://ompnetwork.s3-us-west-2.amazonaws.com/sites/134/documents/minutes_6.pdf', u'storage': u'attachment', u'session_id': u'198', u'label': None, u'file_id': u'125', u'provider': u'generic', u'agenda_provider_agenda_id': None, u'session_title': u'City Council Work Session 06-15-2016', u'type': u'Minutes', u'id': u'55', u'agenda_provider_id': None}]"
288,228,"[3, 16, 18, 19]",City Council Work Session 02-08-2016,City Council Work Session 02-08-2016,,0,shows/city-council-work-session-02-08-2016,134.0,2016-02-08,2016-02-08,2017-03-20,S-OEnZ-ot9E,https://www.youtube.com/watch?v=S-OEnZ-ot9E,20.0,City Council,111.0,https://ompnetwork.s3-us-west-2.amazonaws.com/sites/134/documents/agenda_packet_35.pdf,"[{u'livestream': u'1', u'position': u'-10', u'user_id': u'134', u'id': u'20', u'label': u'City Council'}]","[{u'user_id': u'134', u'type_id': u'1', u'url': u'https://ompnetwork.s3-us-west-2.amazonaws.com/sites/134/documents/agenda_packet_35.pdf', u'storage': u'attachment', u'session_id': u'228', u'label': None, u'file_id': u'181', u'provider': u'generic', u'agenda_provider_agenda_id': None, u'session_title': u'City Council Work Session 02-08-2016', u'type': u'Agenda', u'id': u'111', u'agenda_provider_id': None}, {u'user_id': u'134', u'type_id': u'4', u'url': u'https://ompnetwork.s3-us-west-2.amazonaws.com/sites/134/documents/minutes_15_0.pdf', u'storage': u'attachment', u'session_id': u'228', u'label': None, u'file_id': u'182', u'provider': u'generic', u'agenda_provider_agenda_id': None, u'session_title': u'City Council Work Session 02-08-2016', u'type': u'Minutes', u'id': u'112', u'agenda_provider_id': None}]"
289,8584,"[6, 10]",Licensing Authority - 08/22/13,Licensing Authority - 08/22/13,,0,,199.0,2013-08-22,2013-08-22,2017-08-01,ZoL37AnOn2Q,https://www.youtube.com/watch?v=ZoL37AnOn2Q,71.0,Licensing,2822.0,https://ompnetwork.s3-us-west-2.amazonaws.com/sites/199/documents/lla_agenda_08-22-2013.pdf?bmLdfwVYU2m6rE.a98j2DJSs4wUm11fz,"[{u'livestream': u'1', u'position': u'0', u'user_id': u'199', u'id': u'71', u'label': u'Licensing'}]","[{u'user_id': u'199', u'type_id': u'1', u'url': u'https://ompnetwork.s3-us-west-2.amazonaws.com/sites/199/documents/lla_agenda_08-22-2013.pdf?bmLdfwVYU2m6rE.a98j2DJSs4wUm11fz', u'storage': u'attachment', u'session_id': u'8584', u'label': None, u'file_id': u'2641', u'provider': u'generic', u'agenda_provider_agenda_id': None, u'session_title': u'Licensing Authority - 08/22/13', u'type': u'Agenda', u'id': u'2822', u'agenda_provider_id': None}, {u'user_id': u'199', u'type_id': u'3', u'url': u'https://ompnetwork.s3-us-west-2.amazonaws.com/sites/199/granicus_files/1113_calendar_1377151200.html', u'storage': u'external', u'session_id': u'8584', u'label': None, u'file_id': None, u'provider': u'generic', u'agenda_provider_agenda_id': None, u'session_title': u'Licensing Authority - 08/22/13', u'type': u'Calendar', u'id': u'2823', u'agenda_provider_id': None}, {u'user_id': u'199', u'type_id': u'2', u'url': u'https://ompnetwork.s3-us-west-2.amazonaws.com/sites/199/documents/lla_journal_08-22-2013.pdf?tjvBbXXcABN28JDda6jDXfE0_jXrcVjh', u'storage': u'attachment', u'session_id': u'8584', u'label': None, u'file_id': u'2642', u'provider': u'generic', u'agenda_provider_agenda_id': None, u'session_title': u'Licensing Authority - 08/22/13', u'type': u'Journal', u'id': u'2824', u'agenda_provider_id': None}, {u'user_id': u'199', u'type_id': u'5', u'url': u'https://ompnetwork.s3-us-west-2.amazonaws.com/sites/199/documents/lla_packet_08-22-2013.pdf?2YQnWU_T9XBMIsAhRIsHz2WBGJk81Kj.', u'storage': u'attachment', u'session_id': u'8584', u'label': None, u'file_id': u'2643', u'provider': u'generic', u'agenda_provider_agenda_id': None, u'session_title': u'Licensing Authority - 08/22/13', u'type': u'Packet', u'id': u'2825', u'agenda_provider_id': None}]"
290,347,"[7, 18]",City Council Work Session 06-23-2014,City Council Work Session 06-23-2014,,0,shows/city-council-work-session-06-23-2014,134.0,2014-06-23,2014-06-23,2017-03-20,jVGfYDY9JYs,https://www.youtube.com/watch?v=jVGfYDY9JYs,20.0,City Council,335.0,https://ompnetwork.s3-us-west-2.amazonaws.com/sites/134/documents/agenda_packet_86.pdf,"[{u'livestream': u'1', u'position': u'-10', u'user_id': u'134', u'id': u'20', u'label': u'City Council'}]","[{u'user_id': u'134', u'type_id': u'1', u'url': u'https://ompnetwork.s3-us-west-2.amazonaws.com/sites/134/documents/agenda_packet_86.pdf', u'storage': u'attachment', u'session_id': u'347', u'label': None, u'file_id': u'405', u'provider': u'generic', u'agenda_provider_agenda_id': None, u'session_title': u'City Council Work Session 06-23-2014', u'type': u'Agenda', u'id': u'335', u'agenda_provider_id': None}, {u'user_id': u'134', u'type_id': u'4', u'url': u'https://ompnetwork.s3-us-west-2.amazonaws.com/sites/134/documents/minutes_123.pdf', u'storage': u'attachment', u'session_id': u'347', u'label': None, u'file_id': u'406', u'provider': u'generic', u'agenda_provider_agenda_id': None, u'session_title': u'City Council Work Session 06-23-2014', u'type': u'Minutes', u'id': u'336', u'agenda_provider_id': None}]"
291,22292,[5],Town of New Castle Planning Board Meeting 1/16/18,Town of New Castle Planning Board Meeting 1/16/18,,0,,281.0,2018-01-17,2018-01-16,2018-01-17,zI_yG-s6KVU,https://youtu.be/zI_yG-s6KVU,160.0,Town of New Castle Planning Board Meetings,4946.0,https://ompnetwork.s3-us-west-2.amazonaws.com/sites/281/documents/agendas_-_planning_board_agendas_-_2018_-_1.16.18_pb_agenda.pdf?Q2hq8b1USrRKDMUfcJ1I2Cu6ROV8BZLL,"[{u'livestream': u'0', u'position': u'-8', u'user_id': u'281', u'id': u'160', u'label': u'Town of New Castle Planning Board Meetings'}]","[{u'user_id': u'281', u'type_id': u'1', u'url': u'https://ompnetwork.s3-us-west-2.amazonaws.com/sites/281/documents/agendas_-_planning_board_agendas_-_2018_-_1.16.18_pb_agenda.pdf?Q2hq8b1USrRKDMUfcJ1I2Cu6ROV8BZLL', u'storage': u'attachment', u'session_id': u'22292', u'label': None, u'file_id': u'4346', u'provider': u'generic', u'agenda_provider_agenda_id': None, u'session_title': u'Town of New Castle Planning Board Meeting 1/16/18', u'type': u'Agenda', u'id': u'4946', u'agenda_provider_id': None}]"
292,3868,"[0, 2, 6, 12, 16]","Eugene Police Commission Meeting March 10, 2016","Eugene Police Commission Meeting March 10, 2016",,0,,134.0,2017-07-17,2016-03-10,2017-07-17,sAo3fKVdmK8,https://youtu.be/sAo3fKVdmK8,45.0,Police Commission,1660.0,https://ompnetwork.s3-us-west-2.amazonaws.com/sites/134/documents/2016_03_10_pc_packet_updated.pdf,"[{u'livestream': u'0', u'position': u'0', u'user_id': u'134', u'id': u'45', u'label': u'Police Commission'}]","[{u'user_id': u'134', u'type_id': u'1', u'url': u'https://ompnetwork.s3-us-west-2.amazonaws.com/sites/134/documents/2016_03_10_pc_packet_updated.pdf', u'storage': u'attachment', u'session_id': u'3868', u'label': None, u'file_id': u'1819', u'provider': u'generic', u'agenda_provider_agenda_id': None, u'session_title': u'Eugene Police Commission Meeting March 10, 2016', u'type': u'Agenda', u'id': u'1660', u'agenda_provider_id': None}]"
293,353,"[3, 8, 17]",Council Work Session 05-28-2014,Council Work Session 05-28-2014,,0,shows/council-work-session-05-28-2014,134.0,2014-05-28,2014-05-28,2017-03-20,2L2WinSrdqk,https://www.youtube.com/watch?v=2L2WinSrdqk,20.0,City Council,345.0,https://ompnetwork.s3-us-west-2.amazonaws.com/sites/134/documents/agenda_packet_112.pdf,"[{u'livestream': u'1', u'position': u'-10', u'user_id': u'134', u'id': u'20', u'label': u'City Council'}]","[{u'user_id': u'134', u'type_id': u'1', u'url': u'https://ompnetwork.s3-us-west-2.amazonaws.com/sites/134/documents/agenda_packet_112.pdf', u'storage': u'attachment', u'session_id': u'353', u'label': None, u'file_id': u'415', u'provider': u'generic', u'agenda_provider_agenda_id': None, u'session_title': u'Council Work Session 05-28-2014', u'type': u'Agenda', u'id': u'345', u'agenda_provider_id': None}, {u'user_id': u'134', u'type_id': u'4', u'url': u'https://ompnetwork.s3-us-west-2.amazonaws.com/sites/134/documents/minutes_129.pdf', u'storage': u'attachment', u'session_id': u'353', u'label': None, u'file_id': u'416', u'provider': u'generic', u'agenda_provider_agenda_id': None, u'session_title': u'Council Work Session 05-28-2014', u'type': u'Minutes', u'id': u'346', u'agenda_provider_id': None}]"
294,4841,"[5, 9, 15, 16, 17]",City Council Study Session - 02/18/2014,City Council Study Session - 02/18/2014,,0,,199.0,2014-02-18,2014-02-18,2017-07-25,IhWsWGlcSzE,https://www.youtube.com/watch?v=IhWsWGlcSzE,69.0,Council,1978.0,https://ompnetwork.s3-us-west-2.amazonaws.com/sites/199/documents/02-18-2014_study_session.pdf?l5tATr93kna1nVlNJYUV3T1Y1L9q0DNA,"[{u'livestream': u'1', u'position': u'0', u'user_id': u'199', u'id': u'69', u'label': u'Council'}]","[{u'user_id': u'199', u'type_id': u'1', u'url': u'https://ompnetwork.s3-us-west-2.amazonaws.com/sites/199/documents/02-18-2014_study_session.pdf?l5tATr93kna1nVlNJYUV3T1Y1L9q0DNA', u'storage': u'attachment', u'session_id': u'4841', u'label': None, u'file_id': u'2138', u'provider': u'generic', u'agenda_provider_agenda_id': None, u'session_title': u'City Council Study Session - 02/18/2014', u'type': u'Agenda', u'id': u'1978', u'agenda_provider_id': None}, {u'user_id': u'199', u'type_id': u'3', u'url': u'https://ompnetwork.s3-us-west-2.amazonaws.com/sites/199/granicus_files/1223_calendar_1392706800.html', u'storage': u'external', u'session_id': u'4841', u'label': None, u'file_id': None, u'provider': u'generic', u'agenda_provider_agenda_id': None, u'session_title': u'City Council Study Session - 02/18/2014', u'type': u'Calendar', u'id': u'1979', u'agenda_provider_id': None}]"
295,15789,"[2, 18]",Absolutely Adams - Winter 2016/17,Absolutely Adams - Winter 2016/17,"<p>Our latest county update looks at the snow plow decision-making process at the Adams County Transportation Department. It also looks at some of the exciting things that happened around Adams County Government during the Fall of 2016.</p>
",0,,272.0,2017-10-30,2016-12-16,2017-10-30,dFVwhfvx32o,https://www.youtube.com/watch?v=dFVwhfvx32o,139.0,Absolutely Adams ,,,"[{u'livestream': u'0', u'position': u'0', u'user_id': u'272', u'id': u'139', u'label': u'Absolutely Adams '}]",
296,232,"[3, 19]",City Council Work Session 01-20-2016,City Council Work Session 01-20-2016,,0,shows/city-council-work-session-01-20-2016,134.0,2016-01-20,2016-01-20,2017-03-20,7r_sY0euQBQ,https://www.youtube.com/watch?v=7r_sY0euQBQ,20.0,City Council,119.0,https://ompnetwork.s3-us-west-2.amazonaws.com/sites/134/documents/agenda_packet_42.pdf,"[{u'livestream': u'1', u'position': u'-10', u'user_id': u'134', u'id': u'20', u'label': u'City Council'}]","[{u'user_id': u'134', u'type_id': u'1', u'url': u'https://ompnetwork.s3-us-west-2.amazonaws.com/sites/134/documents/agenda_packet_42.pdf', u'storage': u'attachment', u'session_id': u'232', u'label': None, u'file_id': u'189', u'provider': u'generic', u'agenda_provider_agenda_id': None, u'session_title': u'City Council Work Session 01-20-2016', u'type': u'Agenda', u'id': u'119', u'agenda_provider_id': None}, {u'user_id': u'134', u'type_id': u'4', u'url': u'https://ompnetwork.s3-us-west-2.amazonaws.com/sites/134/documents/minutes_19.pdf', u'storage': u'attachment', u'session_id': u'232', u'label': None, u'file_id': u'190', u'provider': u'generic', u'agenda_provider_agenda_id': None, u'session_title': u'City Council Work Session 01-20-2016', u'type': u'Minutes', u'id': u'120', u'agenda_provider_id': None}]"
297,3866,"[0, 12, 13, 14, 15]","Eugene Police Commission Meeting June 12, 2014","Eugene Police Commission Meeting June 12, 2014",,0,,134.0,2017-07-17,2014-06-12,2017-07-17,IFsZWufPg-A,https://youtu.be/IFsZWufPg-A,45.0,Police Commission,1679.0,https://ompnetwork.s3-us-west-2.amazonaws.com/sites/134/documents/jun_packet.pdf,"[{u'livestream': u'0', u'position': u'0', u'user_id': u'134', u'id': u'45', u'label': u'Police Commission'}]","[{u'user_id': u'134', u'type_id': u'1', u'url': u'https://ompnetwork.s3-us-west-2.amazonaws.com/sites/134/documents/jun_packet.pdf', u'storage': u'attachment', u'session_id': u'3866', u'label': None, u'file_id': u'1835', u'provider': u'generic', u'agenda_provider_agenda_id': None, u'session_title': u'Eugene Police Commission Meeting June 12, 2014', u'type': u'Agenda', u'id': u'1679', u'agenda_provider_id': None}]"
298,6263,"[0, 5, 16]",City Council - Regular Meeting - 01/17/12,City Council - Regular Meeting - 01/17/12,,0,,199.0,2012-01-17,2012-01-17,2017-08-01,KyIjdBTheJs,https://www.youtube.com/watch?v=KyIjdBTheJs,69.0,Council,2259.0,https://ompnetwork.s3-us-west-2.amazonaws.com/sites/199/documents/cc_agenda_01-17-2012.pdf?kkfXbHOGNmX5GLDiiGrs1fiejpUe4Qne,"[{u'livestream': u'1', u'position': u'0', u'user_id': u'199', u'id': u'69', u'label': u'Council'}]","[{u'user_id': u'199', u'type_id': u'1', u'url': u'https://ompnetwork.s3-us-west-2.amazonaws.com/sites/199/documents/cc_agenda_01-17-2012.pdf?kkfXbHOGNmX5GLDiiGrs1fiejpUe4Qne', u'storage': u'attachment', u'session_id': u'6263', u'label': None, u'file_id': u'2326', u'provider': u'generic', u'agenda_provider_agenda_id': None, u'session_title': u'City Council - Regular Meeting - 01/17/12', u'type': u'Agenda', u'id': u'2259', u'agenda_provider_id': None}, {u'user_id': u'199', u'type_id': u'3', u'url': u'https://ompnetwork.s3-us-west-2.amazonaws.com/sites/199/granicus_files/802_calendar_1326783600.html', u'storage': u'external', u'session_id': u'6263', u'label': None, u'file_id': None, u'provider': u'generic', u'agenda_provider_agenda_id': None, u'session_title': u'City Council - Regular Meeting - 01/17/12', u'type': u'Calendar', u'id': u'2260', u'agenda_provider_id': None}, {u'user_id': u'199', u'type_id': u'2', u'url': u'https://ompnetwork.s3-us-west-2.amazonaws.com/sites/199/documents/cc_minutes_01-17-2012.pdf?i5F.vWJMqEmFjL.2gFv107XImkBnAwLs', u'storage': u'attachment', u'session_id': u'6263', u'label': None, u'file_id': u'2327', u'provider': u'generic', u'agenda_provider_agenda_id': None, u'session_title': u'City Council - Regular Meeting - 01/17/12', u'type': u'Journal', u'id': u'2261', u'agenda_provider_id': None}, {u'user_id': u'199', u'type_id': u'5', u'url': u'https://ompnetwork.s3-us-west-2.amazonaws.com/sites/199/documents/cc_packet_01-17-2012.pdf?n.tjyUN5T8nrNTC_w8qGyfvYxSMX7dQA', u'storage': u'attachment', u'session_id': u'6263', u'label': None, u'file_id': u'2328', u'provider': u'generic', u'agenda_provider_agenda_id': None, u'session_title': u'City Council - Regular Meeting - 01/17/12', u'type': u'Packet', u'id': u'2262', u'agenda_provider_id': None}]"
299,4844,"[5, 9, 15, 16, 17]",City Council Meeting - 02/18/14,City Council Meeting - 02/18/14,,0,,199.0,2014-02-18,2014-02-18,2017-07-25,IhWsWGlcSzE,https://www.youtube.com/watch?v=IhWsWGlcSzE,69.0,Council,1980.0,https://ompnetwork.s3-us-west-2.amazonaws.com/sites/199/granicus_files/1220_calendar_1392706800.html,"[{u'livestream': u'1', u'position': u'0', u'user_id': u'199', u'id': u'69', u'label': u'Council'}]","[{u'user_id': u'199', u'type_id': u'3', u'url': u'https://ompnetwork.s3-us-west-2.amazonaws.com/sites/199/granicus_files/1220_calendar_1392706800.html', u'storage': u'external', u'session_id': u'4844', u'label': None, u'file_id': None, u'provider': u'generic', u'agenda_provider_agenda_id': None, u'session_title': u'City Council Meeting - 02/18/14', u'type': u'Calendar', u'id': u'1980', u'agenda_provider_id': None}]"
300,3880,"[12, 13]","Eugene Police Commission Meeting October 8, 2015","Eugene Police Commission Meeting October 8, 2015",,0,,134.0,2017-07-17,2015-10-08,2017-07-18,zpDJP5MO5bw,https://youtu.be/zpDJP5MO5bw,45.0,Police Commission,1669.0,https://ompnetwork.s3-us-west-2.amazonaws.com/sites/134/documents/pc_packet_october_2015.pdf,"[{u'livestream': u'0', u'position': u'0', u'user_id': u'134', u'id': u'45', u'label': u'Police Commission'}]","[{u'user_id': u'134', u'type_id': u'1', u'url': u'https://ompnetwork.s3-us-west-2.amazonaws.com/sites/134/documents/pc_packet_october_2015.pdf', u'storage': u'attachment', u'session_id': u'3880', u'label': None, u'file_id': u'1826', u'provider': u'generic', u'agenda_provider_agenda_id': None, u'session_title': u'Eugene Police Commission Meeting October 8, 2015', u'type': u'Agenda', u'id': u'1669', u'agenda_provider_id': None}]"
301,4286,"[0, 3, 5, 12, 18]",10/24/16 Town Board Meeting,10/24/16 Town Board Meeting,,0,,198.0,2016-10-24,2016-10-24,2017-07-24,WDzFhTu-aSI,https://www.youtube.com/watch?v=WDzFhTu-aSI,67.0,Town Board,1858.0,https://ompnetwork.s3-us-west-2.amazonaws.com/sites/198/documents/10.24.16_tb_agenda_0.pdf?HS_8gN.4DnLj.vv93QzgVPAl_yxGEp7d,"[{u'livestream': u'1', u'position': u'0', u'user_id': u'198', u'id': u'67', u'label': u'Town Board'}]","[{u'user_id': u'198', u'type_id': u'1', u'url': u'https://ompnetwork.s3-us-west-2.amazonaws.com/sites/198/documents/10.24.16_tb_agenda_0.pdf?HS_8gN.4DnLj.vv93QzgVPAl_yxGEp7d', u'storage': u'attachment', u'session_id': u'4286', u'label': None, u'file_id': u'1999', u'provider': u'generic', u'agenda_provider_agenda_id': None, u'session_title': u'10/24/16 Town Board Meeting', u'type': u'Agenda', u'id': u'1858', u'agenda_provider_id': None}, {u'user_id': u'198', u'type_id': u'5', u'url': u'https://ompnetwork.s3-us-west-2.amazonaws.com/sites/198/documents/10.24.16_tb_packet.pdf?uAbE3krtZrEeLSdvrSwlwKaVj0lk5qAd', u'storage': u'attachment', u'session_id': u'4286', u'label': None, u'file_id': u'2000', u'provider': u'generic', u'agenda_provider_agenda_id': None, u'session_title': u'10/24/16 Town Board Meeting', u'type': u'Packet', u'id': u'1859', u'agenda_provider_id': None}]"
302,2826,"[7, 18]","Board of Commissioners Morning Meeting: June 6, 2017","Board of Commissioners Morning Meeting: June 6, 2017",,0,,143.0,2017-05-31,2017-06-06,2017-06-07,MCb0jQBVd70,https://www.youtube.com/watch?v=MCb0jQBVd70,25.0,Board of County Commissioners,1556.0,https://ompnetwork.s3-us-west-2.amazonaws.com/sites/143/documents/06_06-07_17agenda.pdf,"[{u'livestream': u'1', u'position': u'0', u'user_id': u'143', u'id': u'25', u'label': u'Board of County Commissioners'}]","[{u'user_id': u'143', u'type_id': u'1', u'url': u'https://ompnetwork.s3-us-west-2.amazonaws.com/sites/143/documents/06_06-07_17agenda.pdf', u'storage': u'attachment', u'session_id': u'2826', u'label': None, u'file_id': u'1716', u'provider': u'generic', u'agenda_provider_agenda_id': None, u'session_title': u'Board of Commissioners Morning Meeting: June 6, 2017', u'type': u'Agenda', u'id': u'1556', u'agenda_provider_id': None}]"
303,441,"[3, 5, 17, 18]",City Council Public Hearing 06-17-2013,City Council Public Hearing 06-17-2013,,0,shows/city-council-public-hearing-06-17-2013,134.0,2013-06-17,2013-06-17,2017-03-20,Yzw3nbmozcc,https://www.youtube.com/watch?v=Yzw3nbmozcc,20.0,City Council,509.0,https://ompnetwork.s3-us-west-2.amazonaws.com/sites/134/documents/agenda_18.pdf,"[{u'livestream': u'1', u'position': u'-10', u'user_id': u'134', u'id': u'20', u'label': u'City Council'}]","[{u'user_id': u'134', u'type_id': u'1', u'url': u'https://ompnetwork.s3-us-west-2.amazonaws.com/sites/134/documents/agenda_18.pdf', u'storage': u'attachment', u'session_id': u'441', u'label': None, u'file_id': u'579', u'provider': u'generic', u'agenda_provider_agenda_id': None, u'session_title': u'City Council Public Hearing 06-17-2013', u'type': u'Agenda', u'id': u'509', u'agenda_provider_id': None}, {u'user_id': u'134', u'type_id': u'4', u'url': u'https://ompnetwork.s3-us-west-2.amazonaws.com/sites/134/documents/minutes_200.pdf', u'storage': u'attachment', u'session_id': u'441', u'label': None, u'file_id': u'580', u'provider': u'generic', u'agenda_provider_agenda_id': None, u'session_title': u'City Council Public Hearing 06-17-2013', u'type': u'Minutes', u'id': u'510', u'agenda_provider_id': None}]"
304,2594,[18],"Board of Commissioners Morning Meeting: December 8, 2015","Board of Commissioners Morning Meeting: December 8, 2015",,0,,143.0,2017-05-11,2015-12-08,2017-05-11,vem-8XD_oz8,https://www.youtube.com/watch?v=vem-8XD_oz8,25.0,Board of County Commissioners,,,"[{u'livestream': u'1', u'position': u'0', u'user_id': u'143', u'id': u'25', u'label': u'Board of County Commissioners'}]",
305,8651,[6],Licensing Authority - 10/10/12,Licensing Authority - 10/10/12,,0,,199.0,2012-10-10,2012-10-10,2017-08-01,2cU6Jl8m474,https://www.youtube.com/watch?v=2cU6Jl8m474,71.0,Licensing,2858.0,https://ompnetwork.s3-us-west-2.amazonaws.com/sites/199/documents/lla_agenda_10-10-2012.pdf?SbnzMVXXrdB5Y1yrfr8qwYxa6jWdJALT,"[{u'livestream': u'1', u'position': u'0', u'user_id': u'199', u'id': u'71', u'label': u'Licensing'}]","[{u'user_id': u'199', u'type_id': u'1', u'url': u'https://ompnetwork.s3-us-west-2.amazonaws.com/sites/199/documents/lla_agenda_10-10-2012.pdf?SbnzMVXXrdB5Y1yrfr8qwYxa6jWdJALT', u'storage': u'attachment', u'session_id': u'8651', u'label': None, u'file_id': u'2668', u'provider': u'generic', u'agenda_provider_agenda_id': None, u'session_title': u'Licensing Authority - 10/10/12', u'type': u'Agenda', u'id': u'2858', u'agenda_provider_id': None}, {u'user_id': u'199', u'type_id': u'3', u'url': u'https://ompnetwork.s3-us-west-2.amazonaws.com/sites/199/granicus_files/940_calendar_1349848800.html', u'storage': u'external', u'session_id': u'8651', u'label': None, u'file_id': None, u'provider': u'generic', u'agenda_provider_agenda_id': None, u'session_title': u'Licensing Authority - 10/10/12', u'type': u'Calendar', u'id': u'2859', u'agenda_provider_id': None}, {u'user_id': u'199', u'type_id': u'2', u'url': u'https://ompnetwork.s3-us-west-2.amazonaws.com/sites/199/documents/lla_journal_10-10-2012.pdf?A7r3zbNx6FSieJIa8p4hDMIVciQLKGRj', u'storage': u'attachment', u'session_id': u'8651', u'label': None, u'file_id': u'2669', u'provider': u'generic', u'agenda_provider_agenda_id': None, u'session_title': u'Licensing Authority - 10/10/12', u'type': u'Journal', u'id': u'2860', u'agenda_provider_id': None}, {u'user_id': u'199', u'type_id': u'5', u'url': u'https://ompnetwork.s3-us-west-2.amazonaws.com/sites/199/documents/lla_packet_10-10-2012.pdf?0bl33m7VhaZcKALS.AEbxPRZMqhoOFfs', u'storage': u'attachment', u'session_id': u'8651', u'label': None, u'file_id': u'2670', u'provider': u'generic', u'agenda_provider_agenda_id': None, u'session_title': u'Licensing Authority - 10/10/12', u'type': u'Packet', u'id': u'2861', u'agenda_provider_id': None}]"
306,209,"[17, 18, 19]",City Coucil Work Session 05-09-2016,City Coucil Work Session 05-09-2016,,0,shows/city-coucil-work-session-05-09-2016,134.0,2016-05-09,2016-05-09,2017-03-20,7h8vOzmHtk0,https://www.youtube.com/watch?v=7h8vOzmHtk0,20.0,City Council,76.0,https://ompnetwork.s3-us-west-2.amazonaws.com/sites/134/documents/agenda_packet_13.pdf,"[{u'livestream': u'1', u'position': u'-10', u'user_id': u'134', u'id': u'20', u'label': u'City Council'}]","[{u'user_id': u'134', u'type_id': u'1', u'url': u'https://ompnetwork.s3-us-west-2.amazonaws.com/sites/134/documents/agenda_packet_13.pdf', u'storage': u'attachment', u'session_id': u'209', u'label': None, u'file_id': u'146', u'provider': u'generic', u'agenda_provider_agenda_id': None, u'session_title': u'City Coucil Work Session 05-09-2016', u'type': u'Agenda', u'id': u'76', u'agenda_provider_id': None}, {u'user_id': u'134', u'type_id': u'4', u'url': u'https://ompnetwork.s3-us-west-2.amazonaws.com/sites/134/documents/minutes_11.pdf', u'storage': u'attachment', u'session_id': u'209', u'label': None, u'file_id': u'147', u'provider': u'generic', u'agenda_provider_agenda_id': None, u'session_title': u'City Coucil Work Session 05-09-2016', u'type': u'Minutes', u'id': u'77', u'agenda_provider_id': None}]"
307,867,"[0, 3, 18]",City Council Work Session 05-24-2010,City Council Work Session 05-24-2010,,0,shows/city-council-work-session-05-24-2010,134.0,2010-05-24,2010-05-24,2017-03-20,PJxro9A3yE8,https://www.youtube.com/watch?v=PJxro9A3yE8,20.0,City Council,1180.0,https://ompnetwork.s3-us-west-2.amazonaws.com/sites/134/documents/agenda_234.pdf,"[{u'livestream': u'1', u'position': u'-10', u'user_id': u'134', u'id': u'20', u'label': u'City Council'}]","[{u'user_id': u'134', u'type_id': u'1', u'url': u'https://ompnetwork.s3-us-west-2.amazonaws.com/sites/134/documents/agenda_234.pdf', u'storage': u'attachment', u'session_id': u'867', u'label': None, u'file_id': u'1251', u'provider': u'generic', u'agenda_provider_agenda_id': None, u'session_title': u'City Council Work Session 05-24-2010', u'type': u'Agenda', u'id': u'1180', u'agenda_provider_id': None}, {u'user_id': u'134', u'type_id': u'4', u'url': u'https://ompnetwork.s3-us-west-2.amazonaws.com/sites/134/documents/minutes_292.pdf', u'storage': u'attachment', u'session_id': u'867', u'label': None, u'file_id': u'1252', u'provider': u'generic', u'agenda_provider_agenda_id': None, u'session_title': u'City Council Work Session 05-24-2010', u'type': u'Minutes', u'id': u'1181', u'agenda_provider_id': None}]"
308,339,"[3, 18]",City Council Work Session 07-23-2014,City Council Work Session 07-23-2014,,0,shows/city-council-work-session-07-23-2014,134.0,2014-07-23,2014-07-23,2017-03-20,1BA9aYuLFko,https://www.youtube.com/watch?v=1BA9aYuLFko,20.0,City Council,321.0,https://ompnetwork.s3-us-west-2.amazonaws.com/sites/134/documents/agenda_packet_59.pdf,"[{u'livestream': u'1', u'position': u'-10', u'user_id': u'134', u'id': u'20', u'label': u'City Council'}]","[{u'user_id': u'134', u'type_id': u'1', u'url': u'https://ompnetwork.s3-us-west-2.amazonaws.com/sites/134/documents/agenda_packet_59.pdf', u'storage': u'attachment', u'session_id': u'339', u'label': None, u'file_id': u'391', u'provider': u'generic', u'agenda_provider_agenda_id': None, u'session_title': u'City Council Work Session 07-23-2014', u'type': u'Agenda', u'id': u'321', u'agenda_provider_id': None}, {u'user_id': u'134', u'type_id': u'4', u'url': u'https://ompnetwork.s3-us-west-2.amazonaws.com/sites/134/documents/minutes_115.pdf', u'storage': u'attachment', u'session_id': u'339', u'label': None, u'file_id': u'392', u'provider': u'generic', u'agenda_provider_agenda_id': None, u'session_title': u'City Council Work Session 07-23-2014', u'type': u'Minutes', u'id': u'322', u'agenda_provider_id': None}]"
309,8797,[0],Licensing Authority - 04/14/10,Licensing Authority - 04/14/10,,0,,199.0,2010-04-14,2010-04-14,2017-08-01,WyqzlgQ1xyU,https://www.youtube.com/watch?v=WyqzlgQ1xyU,71.0,Licensing,2938.0,https://ompnetwork.s3-us-west-2.amazonaws.com/sites/199/documents/lla_agenda_04-14-2010.pdf?AzzrH_JnRzK97O5XfriCUKYdiOB6LlGa,"[{u'livestream': u'1', u'position': u'0', u'user_id': u'199', u'id': u'71', u'label': u'Licensing'}]","[{u'user_id': u'199', u'type_id': u'1', u'url': u'https://ompnetwork.s3-us-west-2.amazonaws.com/sites/199/documents/lla_agenda_04-14-2010.pdf?AzzrH_JnRzK97O5XfriCUKYdiOB6LlGa', u'storage': u'attachment', u'session_id': u'8797', u'label': None, u'file_id': u'2727', u'provider': u'generic', u'agenda_provider_agenda_id': None, u'session_title': u'Licensing Authority - 04/14/10', u'type': u'Agenda', u'id': u'2938', u'agenda_provider_id': None}, {u'user_id': u'199', u'type_id': u'3', u'url': u'https://ompnetwork.s3-us-west-2.amazonaws.com/sites/199/granicus_files/449_calendar_1271224800.html', u'storage': u'external', u'session_id': u'8797', u'label': None, u'file_id': None, u'provider': u'generic', u'agenda_provider_agenda_id': None, u'session_title': u'Licensing Authority - 04/14/10', u'type': u'Calendar', u'id': u'2939', u'agenda_provider_id': None}, {u'user_id': u'199', u'type_id': u'2', u'url': u'https://ompnetwork.s3-us-west-2.amazonaws.com/sites/199/documents/lla_journal_04-14-2010.pdf?1Wa6NOoWwa8h0iD1dZ2eZvS_okb8iv1B', u'storage': u'attachment', u'session_id': u'8797', u'label': None, u'file_id': u'2728', u'provider': u'generic', u'agenda_provider_agenda_id': None, u'session_title': u'Licensing Authority - 04/14/10', u'type': u'Journal', u'id': u'2940', u'agenda_provider_id': None}, {u'user_id': u'199', u'type_id': u'5', u'url': u'https://ompnetwork.s3-us-west-2.amazonaws.com/sites/199/documents/lla_packet_04-14-2010.pdf?fyVqDdwEhAMrhceGzIZ8OeUeoTZf1Lq9', u'storage': u'attachment', u'session_id': u'8797', u'label': None, u'file_id': u'2729', u'provider': u'generic', u'agenda_provider_agenda_id': None, u'session_title': u'Licensing Authority - 04/14/10', u'type': u'Packet', u'id': u'2941', u'agenda_provider_id': None}]"
310,3788,"[0, 2, 11, 13]","Thornton360 - May 24, 2017","Thornton360 - May 24, 2017","<p>Thornton360 is produced by the city of Thornton after each city council meeting, recapping the latest meeting and keeping residents informed about important news, issues and events happening in our community.</p>

<p>http://www.cityofthornton.tv</p>
",0,,186.0,2017-05-24,2017-05-24,2017-07-11,Mr5_EW3mOXY,https://www.youtube.com/watch?v=Mr5_EW3mOXY,59.0,Thornton360,,,"[{u'livestream': u'0', u'position': u'-9', u'user_id': u'186', u'id': u'59', u'label': u'Thornton360'}]",
311,881,"[14, 18]",City Council Meeting 04-26-2010,City Council Meeting 04-26-2010,,0,shows/city-council-meeting-04-26-2010,134.0,2010-04-26,2010-04-26,2017-03-20,DnqoT8_43wc,https://www.youtube.com/watch?v=DnqoT8_43wc,20.0,City Council,1208.0,https://ompnetwork.s3-us-west-2.amazonaws.com/sites/134/documents/agenda_241.pdf,"[{u'livestream': u'1', u'position': u'-10', u'user_id': u'134', u'id': u'20', u'label': u'City Council'}]","[{u'user_id': u'134', u'type_id': u'1', u'url': u'https://ompnetwork.s3-us-west-2.amazonaws.com/sites/134/documents/agenda_241.pdf', u'storage': u'attachment', u'session_id': u'881', u'label': None, u'file_id': u'1279', u'provider': u'generic', u'agenda_provider_agenda_id': None, u'session_title': u'City Council Meeting 04-26-2010', u'type': u'Agenda', u'id': u'1208', u'agenda_provider_id': None}, {u'user_id': u'134', u'type_id': u'4', u'url': u'https://ompnetwork.s3-us-west-2.amazonaws.com/sites/134/documents/minutes_299.pdf', u'storage': u'attachment', u'session_id': u'881', u'label': None, u'file_id': u'1280', u'provider': u'generic', u'agenda_provider_agenda_id': None, u'session_title': u'City Council Meeting 04-26-2010', u'type': u'Minutes', u'id': u'1209', u'agenda_provider_id': None}]"
312,564,"[11, 19]",City Council Work Session 06-20-2012,City Council Work Session 06-20-2012,,0,shows/city-council-work-session-06-20-2012,134.0,2012-06-20,2012-06-20,2017-03-20,RFton44RHyY,https://www.youtube.com/watch?v=RFton44RHyY,20.0,City Council,708.0,https://ompnetwork.s3-us-west-2.amazonaws.com/sites/134/documents/agenda_98.pdf,"[{u'livestream': u'1', u'position': u'-10', u'user_id': u'134', u'id': u'20', u'label': u'City Council'}]","[{u'user_id': u'134', u'type_id': u'1', u'url': u'https://ompnetwork.s3-us-west-2.amazonaws.com/sites/134/documents/agenda_98.pdf', u'storage': u'attachment', u'session_id': u'564', u'label': None, u'file_id': u'779', u'provider': u'generic', u'agenda_provider_agenda_id': None, u'session_title': u'City Council Work Session 06-20-2012', u'type': u'Agenda', u'id': u'708', u'agenda_provider_id': None}, {u'user_id': u'134', u'type_id': u'4', u'url': u'https://ompnetwork.s3-us-west-2.amazonaws.com/sites/134/documents/minutes_83_0.pdf', u'storage': u'attachment', u'session_id': u'564', u'label': None, u'file_id': u'780', u'provider': u'generic', u'agenda_provider_agenda_id': None, u'session_title': u'City Council Work Session 06-20-2012', u'type': u'Minutes', u'id': u'709', u'agenda_provider_id': None}]"
313,5603,"[2, 3]","Thornton360 - July 26, 2017","Thornton360 - July 26, 2017","<p>Thornton360 is produced by the city of Thornton after each city council meeting, recapping the latest meeting and keeping residents informed about important news, issues and events happening in our community.</p>

<p>www.cityofthornton.tv</p>
",0,,186.0,2017-07-27,2017-07-26,2017-07-27,3shiFOj3i2Q,https://www.youtube.com/watch?v=3shiFOj3i2Q,59.0,Thornton360,,,"[{u'livestream': u'0', u'position': u'-9', u'user_id': u'186', u'id': u'59', u'label': u'Thornton360'}]",[False]
314,331,"[11, 17, 19]",City Council Work Session 09-22-2014,City Council Work Session 09-22-2014,,0,shows/city-council-work-session-09-22-2014,134.0,2014-09-22,2014-09-22,2017-03-20,s39CUHiDvFQ,https://www.youtube.com/watch?v=s39CUHiDvFQ,20.0,City Council,305.0,https://ompnetwork.s3-us-west-2.amazonaws.com/sites/134/documents/agenda_packet_179.pdf,"[{u'livestream': u'1', u'position': u'-10', u'user_id': u'134', u'id': u'20', u'label': u'City Council'}]","[{u'user_id': u'134', u'type_id': u'1', u'url': u'https://ompnetwork.s3-us-west-2.amazonaws.com/sites/134/documents/agenda_packet_179.pdf', u'storage': u'attachment', u'session_id': u'331', u'label': None, u'file_id': u'375', u'provider': u'generic', u'agenda_provider_agenda_id': None, u'session_title': u'City Council Work Session 09-22-2014', u'type': u'Agenda', u'id': u'305', u'agenda_provider_id': None}, {u'user_id': u'134', u'type_id': u'4', u'url': u'https://ompnetwork.s3-us-west-2.amazonaws.com/sites/134/documents/minutes_107.pdf', u'storage': u'attachment', u'session_id': u'331', u'label': None, u'file_id': u'376', u'provider': u'generic', u'agenda_provider_agenda_id': None, u'session_title': u'City Council Work Session 09-22-2014', u'type': u'Minutes', u'id': u'306', u'agenda_provider_id': None}]"
315,3728,"[2, 8, 12]","Thornton360 - March 29, 2017","Thornton360 - March 29, 2017","<p>Thornton360 is produced by the city of Thornton after each city council meeting, recapping the latest meeting and keeping residents informed about important news, issues and events happening in our community.</p>

<p><a href=""http://www.cityofthornton.tv/"" style=""color: rgb(51, 149, 210);"">www.cityofthornton.tv</a></p>
",0,,186.0,2017-03-29,2017-03-29,2017-07-11,x3Rl3ChCNjo,https://www.youtube.com/watch?v=x3Rl3ChCNjo,59.0,Thornton360,,,"[{u'livestream': u'0', u'position': u'-9', u'user_id': u'186', u'id': u'59', u'label': u'Thornton360'}]",
316,3869,"[13, 16, 18]","Eugene Police Commission Meeting March 12, 2015","Eugene Police Commission Meeting March 12, 2015",,0,,134.0,2017-07-17,2015-03-12,2017-07-17,ZwMFjBV7YP8,https://youtu.be/ZwMFjBV7YP8,45.0,Police Commission,1670.0,https://ompnetwork.s3-us-west-2.amazonaws.com/sites/134/documents/police_commission_packet_march_2015.pdf,"[{u'livestream': u'0', u'position': u'0', u'user_id': u'134', u'id': u'45', u'label': u'Police Commission'}]","[{u'user_id': u'134', u'type_id': u'1', u'url': u'https://ompnetwork.s3-us-west-2.amazonaws.com/sites/134/documents/police_commission_packet_march_2015.pdf', u'storage': u'attachment', u'session_id': u'3869', u'label': None, u'file_id': u'1829', u'provider': u'generic', u'agenda_provider_agenda_id': None, u'session_title': u'Eugene Police Commission Meeting March 12, 2015', u'type': u'Agenda', u'id': u'1670', u'agenda_provider_id': None}]"
317,870,"[4, 11, 16, 19]",Budget Committee 05-17-2010,Budget Committee 05-17-2010,,0,shows/budget-committee-05-17-2010,134.0,2010-05-17,2010-05-17,2017-03-20,3mWrewW-eFM,https://www.youtube.com/watch?v=3mWrewW-eFM,21.0,Budget Committee,1186.0,https://ompnetwork.s3-us-west-2.amazonaws.com/sites/134/documents/agenda_packet_4_0.pdf,"[{u'livestream': u'1', u'position': u'-8', u'user_id': u'134', u'id': u'21', u'label': u'Budget Committee'}]","[{u'user_id': u'134', u'type_id': u'1', u'url': u'https://ompnetwork.s3-us-west-2.amazonaws.com/sites/134/documents/agenda_packet_4_0.pdf', u'storage': u'attachment', u'session_id': u'870', u'label': None, u'file_id': u'1257', u'provider': u'generic', u'agenda_provider_agenda_id': None, u'session_title': u'Budget Committee 05-17-2010', u'type': u'Agenda', u'id': u'1186', u'agenda_provider_id': None}, {u'user_id': u'134', u'type_id': u'4', u'url': u'https://ompnetwork.s3-us-west-2.amazonaws.com/sites/134/documents/minutes_164_0.pdf', u'storage': u'attachment', u'session_id': u'870', u'label': None, u'file_id': u'1258', u'provider': u'generic', u'agenda_provider_agenda_id': None, u'session_title': u'Budget Committee 05-17-2010', u'type': u'Minutes', u'id': u'1187', u'agenda_provider_id': None}]"
318,15358,"[12, 13, 18]","Eugene Police Commission Meeting: September 14, 2017","Eugene Police Commission Meeting: September 14, 2017",,0,,134.0,2017-10-13,2017-09-14,2017-10-13,IWMH4lWqQlA,https://www.youtube.com/watch?v=IWMH4lWqQlA&feature=youtu.be,45.0,Police Commission,4172.0,https://ompnetwork.s3-us-west-2.amazonaws.com/sites/134/documents/01_-_sep_14_agenda.pdf?_7FnmqM5VuvFEXIJE8jU._B8S5GOVWP1,"[{u'livestream': u'0', u'position': u'0', u'user_id': u'134', u'id': u'45', u'label': u'Police Commission'}]","[{u'user_id': u'134', u'type_id': u'1', u'url': u'https://ompnetwork.s3-us-west-2.amazonaws.com/sites/134/documents/01_-_sep_14_agenda.pdf?_7FnmqM5VuvFEXIJE8jU._B8S5GOVWP1', u'storage': u'attachment', u'session_id': u'15358', u'label': None, u'file_id': u'3687', u'provider': u'generic', u'agenda_provider_agenda_id': None, u'session_title': u'Eugene Police Commission Meeting: September 14, 2017', u'type': u'Agenda', u'id': u'4172', u'agenda_provider_id': None}]"
319,723,"[8, 14, 18]",Planning Commission  01-28-2013,Planning Commission  01-28-2013,,0,shows/planning-commission-01-28-2013,134.0,2013-01-28,2013-01-28,2017-03-20,IU4zylCaWlY,https://www.youtube.com/watch?v=IU4zylCaWlY,22.0,Planning Commission,953.0,https://ompnetwork.s3-us-west-2.amazonaws.com/sites/134/documents/agenda_packet_170_0.pdf,"[{u'livestream': u'1', u'position': u'-9', u'user_id': u'134', u'id': u'22', u'label': u'Planning Commission'}]","[{u'user_id': u'134', u'type_id': u'1', u'url': u'https://ompnetwork.s3-us-west-2.amazonaws.com/sites/134/documents/agenda_packet_170_0.pdf', u'storage': u'attachment', u'session_id': u'723', u'label': None, u'file_id': u'1024', u'provider': u'generic', u'agenda_provider_agenda_id': None, u'session_title': u'Planning Commission  01-28-2013', u'type': u'Agenda', u'id': u'953', u'agenda_provider_id': None}]"
320,199,"[5, 7, 11]",City Council Meeting 06-13-2016,City Council Meeting 06-13-2016,,0,shows/city-council-meeting-06-13-2016,134.0,2016-06-13,2016-06-13,2017-03-20,IBeaH4CQtLM,https://www.youtube.com/watch?v=IBeaH4CQtLM,20.0,City Council,56.0,https://ompnetwork.s3-us-west-2.amazonaws.com/sites/134/documents/agenda_2.pdf,"[{u'livestream': u'1', u'position': u'-10', u'user_id': u'134', u'id': u'20', u'label': u'City Council'}]","[{u'user_id': u'134', u'type_id': u'1', u'url': u'https://ompnetwork.s3-us-west-2.amazonaws.com/sites/134/documents/agenda_2.pdf', u'storage': u'attachment', u'session_id': u'199', u'label': None, u'file_id': u'126', u'provider': u'generic', u'agenda_provider_agenda_id': None, u'session_title': u'City Council Meeting 06-13-2016', u'type': u'Agenda', u'id': u'56', u'agenda_provider_id': None}, {u'user_id': u'134', u'type_id': u'4', u'url': u'https://ompnetwork.s3-us-west-2.amazonaws.com/sites/134/documents/minutes_7.pdf', u'storage': u'attachment', u'session_id': u'199', u'label': None, u'file_id': u'127', u'provider': u'generic', u'agenda_provider_agenda_id': None, u'session_title': u'City Council Meeting 06-13-2016', u'type': u'Minutes', u'id': u'57', u'agenda_provider_id': None}]"
321,3666,"[4, 7, 8]","Thornton360 - February 15, 2017","Thornton360 - February 15, 2017","<p>Thornton360 is produced by the city of Thornton after each city council meeting, recapping the latest meeting and keeping residents informed about important news, issues and events happening in our community.</p>

<p><a href=""http://www.cityofthornton.tv/"" style=""color: rgb(51, 149, 210);"">www.cityofthornton.tv</a></p>
",0,,186.0,2017-02-15,2017-02-15,2017-07-11,Z9xW06HJmoI,https://www.youtube.com/watch?v=Z9xW06HJmoI,59.0,Thornton360,,,"[{u'livestream': u'0', u'position': u'-9', u'user_id': u'186', u'id': u'59', u'label': u'Thornton360'}]",
322,21758,[13],"Thornton360 - December 20, 2017","Thornton360 - December 20, 2017","<p>Thornton360 is produced by the city of Thornton after each city council meeting, recapping the latest meeting and keeping residents informed about important news, issues and events happening in our community.</p>

<p>http://www.cityofthornton.tv</p>
",0,,186.0,2017-12-21,2017-12-20,2018-01-12,1RdN2cSKvQw,https://www.youtube.com/watch?v=1RdN2cSKvQw,59.0,Thornton360,,,"[{u'livestream': u'0', u'position': u'-9', u'user_id': u'186', u'id': u'59', u'label': u'Thornton360'}]",
323,3746,"[2, 5, 12, 13, 14, 16, 17, 18]","Thornton360 - April 26, 2017 ","Thornton360 - April 26, 2017 ","<p>Thornton360 is produced by the city of Thornton after each city council meeting, recapping the latest meeting and keeping residents informed about important news, issues and events happening in our community.</p>

<p>http://www.cityofthornton.tv</p>
",0,,186.0,2017-04-28,2017-04-28,2017-07-11,DdUlTXW4j9g,https://youtu.be/DdUlTXW4j9g,59.0,Thornton360,,,"[{u'livestream': u'0', u'position': u'-9', u'user_id': u'186', u'id': u'59', u'label': u'Thornton360'}]",
324,582,[5],City Council Work Session 05-16-2012,City Council Work Session 05-16-2012,,0,shows/city-council-work-session-05-16-2012,134.0,2012-05-16,2012-05-16,2017-03-20,JZH9kHMBn2Y,https://www.youtube.com/watch?v=JZH9kHMBn2Y,20.0,City Council,735.0,https://ompnetwork.s3-us-west-2.amazonaws.com/sites/134/documents/agenda_109.pdf,"[{u'livestream': u'1', u'position': u'-10', u'user_id': u'134', u'id': u'20', u'label': u'City Council'}]","[{u'user_id': u'134', u'type_id': u'1', u'url': u'https://ompnetwork.s3-us-west-2.amazonaws.com/sites/134/documents/agenda_109.pdf', u'storage': u'attachment', u'session_id': u'582', u'label': None, u'file_id': u'806', u'provider': u'generic', u'agenda_provider_agenda_id': None, u'session_title': u'City Council Work Session 05-16-2012', u'type': u'Agenda', u'id': u'735', u'agenda_provider_id': None}, {u'user_id': u'134', u'type_id': u'4', u'url': u'https://ompnetwork.s3-us-west-2.amazonaws.com/sites/134/documents/minutes_92_0.pdf', u'storage': u'attachment', u'session_id': u'582', u'label': None, u'file_id': u'807', u'provider': u'generic', u'agenda_provider_agenda_id': None, u'session_title': u'City Council Work Session 05-16-2012', u'type': u'Minutes', u'id': u'736', u'agenda_provider_id': None}]"
325,274,"[12, 18]",City Council Work Session 06-22-2015,City Council Work Session 06-22-2015,,0,shows/city-council-work-session-06-22-2015,134.0,2015-06-22,2015-06-22,2017-03-20,Y9RmtRVaAX4,https://www.youtube.com/watch?v=Y9RmtRVaAX4,20.0,City Council,197.0,https://ompnetwork.s3-us-west-2.amazonaws.com/sites/134/documents/agenda_packet_88.pdf,"[{u'livestream': u'1', u'position': u'-10', u'user_id': u'134', u'id': u'20', u'label': u'City Council'}]","[{u'user_id': u'134', u'type_id': u'1', u'url': u'https://ompnetwork.s3-us-west-2.amazonaws.com/sites/134/documents/agenda_packet_88.pdf', u'storage': u'attachment', u'session_id': u'274', u'label': None, u'file_id': u'267', u'provider': u'generic', u'agenda_provider_agenda_id': None, u'session_title': u'City Council Work Session 06-22-2015', u'type': u'Agenda', u'id': u'197', u'agenda_provider_id': None}, {u'user_id': u'134', u'type_id': u'4', u'url': u'https://ompnetwork.s3-us-west-2.amazonaws.com/sites/134/documents/minutes_57.pdf', u'storage': u'attachment', u'session_id': u'274', u'label': None, u'file_id': u'268', u'provider': u'generic', u'agenda_provider_agenda_id': None, u'session_title': u'City Council Work Session 06-22-2015', u'type': u'Minutes', u'id': u'198', u'agenda_provider_id': None}]"
326,3405,"[0, 2]","Thornton360 - February 24, 2016","Thornton360 - February 24, 2016","<p>Thornton360 is produced by the city of Thornton after each city council meeting, recapping the latest meeting and keeping residents informed about important news, issues and events happening in our community.</p>

<p>www.cityofthornton.tv</p>
",0,,186.0,2016-02-24,2016-02-24,2017-07-11,VjcCWZcj1uc,https://www.youtube.com/watch?v=VjcCWZcj1uc,59.0,Thornton360,,,"[{u'livestream': u'0', u'position': u'-9', u'user_id': u'186', u'id': u'59', u'label': u'Thornton360'}]",
327,552,"[4, 16]",City Council Work Session 07-18-2012,City Council Work Session 07-18-2012,,0,shows/city-council-work-session-07-18-2012,134.0,2012-07-18,2012-07-18,2017-03-20,dXtzULDQNM4,https://www.youtube.com/watch?v=dXtzULDQNM4,20.0,City Council,690.0,https://ompnetwork.s3-us-west-2.amazonaws.com/sites/134/documents/agenda_90.pdf,"[{u'livestream': u'1', u'position': u'-10', u'user_id': u'134', u'id': u'20', u'label': u'City Council'}]","[{u'user_id': u'134', u'type_id': u'1', u'url': u'https://ompnetwork.s3-us-west-2.amazonaws.com/sites/134/documents/agenda_90.pdf', u'storage': u'attachment', u'session_id': u'552', u'label': None, u'file_id': u'761', u'provider': u'generic', u'agenda_provider_agenda_id': None, u'session_title': u'City Council Work Session 07-18-2012', u'type': u'Agenda', u'id': u'690', u'agenda_provider_id': None}, {u'user_id': u'134', u'type_id': u'4', u'url': u'https://ompnetwork.s3-us-west-2.amazonaws.com/sites/134/documents/minutes_77_0.pdf', u'storage': u'attachment', u'session_id': u'552', u'label': None, u'file_id': u'762', u'provider': u'generic', u'agenda_provider_agenda_id': None, u'session_title': u'City Council Work Session 07-18-2012', u'type': u'Minutes', u'id': u'691', u'agenda_provider_id': None}]"
328,293,"[3, 11, 12, 18]",City Council Work Session 03-11-2015,City Council Work Session 03-11-2015,,0,shows/city-council-work-session-03-11-2015,134.0,2015-03-11,2015-03-11,2017-03-20,FDvUBAJfqIM,https://www.youtube.com/watch?v=FDvUBAJfqIM,20.0,City Council,231.0,https://ompnetwork.s3-us-west-2.amazonaws.com/sites/134/documents/agenda_packet_114.pdf,"[{u'livestream': u'1', u'position': u'-10', u'user_id': u'134', u'id': u'20', u'label': u'City Council'}]","[{u'user_id': u'134', u'type_id': u'1', u'url': u'https://ompnetwork.s3-us-west-2.amazonaws.com/sites/134/documents/agenda_packet_114.pdf', u'storage': u'attachment', u'session_id': u'293', u'label': None, u'file_id': u'301', u'provider': u'generic', u'agenda_provider_agenda_id': None, u'session_title': u'City Council Work Session 03-11-2015', u'type': u'Agenda', u'id': u'231', u'agenda_provider_id': None}, {u'user_id': u'134', u'type_id': u'4', u'url': u'https://ompnetwork.s3-us-west-2.amazonaws.com/sites/134/documents/minutes_71.pdf', u'storage': u'attachment', u'session_id': u'293', u'label': None, u'file_id': u'302', u'provider': u'generic', u'agenda_provider_agenda_id': None, u'session_title': u'City Council Work Session 03-11-2015', u'type': u'Minutes', u'id': u'232', u'agenda_provider_id': None}]"
329,366,"[11, 12, 17]",City Council Work Session 04-23-2014,City Council Work Session 04-23-2014,,0,shows/city-council-work-session-04-23-2014,134.0,2014-04-23,2014-04-23,2017-03-20,Cq9tXKa0nmg,https://www.youtube.com/watch?v=Cq9tXKa0nmg,20.0,City Council,369.0,https://ompnetwork.s3-us-west-2.amazonaws.com/sites/134/documents/agenda_packet_157.pdf,"[{u'livestream': u'1', u'position': u'-10', u'user_id': u'134', u'id': u'20', u'label': u'City Council'}]","[{u'user_id': u'134', u'type_id': u'1', u'url': u'https://ompnetwork.s3-us-west-2.amazonaws.com/sites/134/documents/agenda_packet_157.pdf', u'storage': u'attachment', u'session_id': u'366', u'label': None, u'file_id': u'439', u'provider': u'generic', u'agenda_provider_agenda_id': None, u'session_title': u'City Council Work Session 04-23-2014', u'type': u'Agenda', u'id': u'369', u'agenda_provider_id': None}, {u'user_id': u'134', u'type_id': u'4', u'url': u'https://ompnetwork.s3-us-west-2.amazonaws.com/sites/134/documents/minutes_140.pdf', u'storage': u'attachment', u'session_id': u'366', u'label': None, u'file_id': u'440', u'provider': u'generic', u'agenda_provider_agenda_id': None, u'session_title': u'City Council Work Session 04-23-2014', u'type': u'Minutes', u'id': u'370', u'agenda_provider_id': None}]"
330,4161,"[2, 12, 13, 16]",City Council Study Session - 03/25/14,City Council Study Session - 03/25/14,,0,,199.0,2014-03-25,2014-03-25,2017-07-24,93TUopnfWLY,https://www.youtube.com/watch?v=93TUopnfWLY,69.0,Council,1835.0,https://ompnetwork.s3-us-west-2.amazonaws.com/sites/199/documents/cc_agenda_03-25-2014.pdf?ue9Xkwid9H0vYbgNX6Bjcz7p53kwoBMG,"[{u'livestream': u'1', u'position': u'0', u'user_id': u'199', u'id': u'69', u'label': u'Council'}]","[{u'user_id': u'199', u'type_id': u'1', u'url': u'https://ompnetwork.s3-us-west-2.amazonaws.com/sites/199/documents/cc_agenda_03-25-2014.pdf?ue9Xkwid9H0vYbgNX6Bjcz7p53kwoBMG', u'storage': u'attachment', u'session_id': u'4161', u'label': None, u'file_id': u'1975', u'provider': u'generic', u'agenda_provider_agenda_id': None, u'session_title': u'City Council Study Session - 03/25/14', u'type': u'Agenda', u'id': u'1835', u'agenda_provider_id': None}, {u'user_id': u'199', u'type_id': u'3', u'url': u'https://ompnetwork.s3-us-west-2.amazonaws.com/sites/199/granicus_files/1236_calendar_1395727200.html', u'storage': u'external', u'session_id': u'4161', u'label': None, u'file_id': None, u'provider': u'generic', u'agenda_provider_agenda_id': None, u'session_title': u'City Council Study Session - 03/25/14', u'type': u'Calendar', u'id': u'1836', u'agenda_provider_id': None}]"
331,9835,"[0, 1, 4, 6]",Licensing Authority - 7/9/2014,Licensing Authority - 7/9/2014,,0,,199.0,2014-07-09,2014-07-09,2017-08-02,_F7uYMf0IHQ,https://www.youtube.com/watch?v=_F7uYMf0IHQ,71.0,Licensing,3207.0,https://ompnetwork.s3-us-west-2.amazonaws.com/sites/199/documents/lla_agenda_07-09-2014.pdf?lKpkQ8DS9pE12FdxQ1gNrShXm40p_0Fy,"[{u'livestream': u'1', u'position': u'0', u'user_id': u'199', u'id': u'71', u'label': u'Licensing'}]","[{u'user_id': u'199', u'type_id': u'1', u'url': u'https://ompnetwork.s3-us-west-2.amazonaws.com/sites/199/documents/lla_agenda_07-09-2014.pdf?lKpkQ8DS9pE12FdxQ1gNrShXm40p_0Fy', u'storage': u'attachment', u'session_id': u'9835', u'label': None, u'file_id': u'2913', u'provider': u'generic', u'agenda_provider_agenda_id': None, u'session_title': u'Licensing Authority - 7/9/2014', u'type': u'Agenda', u'id': u'3207', u'agenda_provider_id': None}, {u'user_id': u'199', u'type_id': u'3', u'url': u'https://ompnetwork.s3-us-west-2.amazonaws.com/sites/199/granicus_files/1279_calendar_1404885600.pdf', u'storage': u'external', u'session_id': u'9835', u'label': None, u'file_id': None, u'provider': u'generic', u'agenda_provider_agenda_id': None, u'session_title': u'Licensing Authority - 7/9/2014', u'type': u'Calendar', u'id': u'3208', u'agenda_provider_id': None}, {u'user_id': u'199', u'type_id': u'2', u'url': u'https://ompnetwork.s3-us-west-2.amazonaws.com/sites/199/documents/lla_journal_07-09-2014.pdf?pok6R9XUm.iYgLNMRj1GiwTBi3lMq8o3', u'storage': u'attachment', u'session_id': u'9835', u'label': None, u'file_id': u'2914', u'provider': u'generic', u'agenda_provider_agenda_id': None, u'session_title': u'Licensing Authority - 7/9/2014', u'type': u'Journal', u'id': u'3209', u'agenda_provider_id': None}, {u'user_id': u'199', u'type_id': u'5', u'url': u'https://ompnetwork.s3-us-west-2.amazonaws.com/sites/199/documents/lla_packet_07-09-2014.pdf?9wogpuYaKlRBoD3fIsKAneeh2rms8M76', u'storage': u'attachment', u'session_id': u'9835', u'label': None, u'file_id': u'2915', u'provider': u'generic', u'agenda_provider_agenda_id': None, u'session_title': u'Licensing Authority - 7/9/2014', u'type': u'Packet', u'id': u'3210', u'agenda_provider_id': None}]"
332,486,"[11, 16, 18]",City Council Work Session 01-23-2013,City Council Work Session 01-23-2013,,0,shows/city-council-work-session-01-23-2013,134.0,2013-01-23,2013-01-23,2017-03-20,Kmfd2Sj0ViY,https://www.youtube.com/watch?v=Kmfd2Sj0ViY,20.0,City Council,592.0,https://ompnetwork.s3-us-west-2.amazonaws.com/sites/134/documents/agenda_41.pdf,"[{u'livestream': u'1', u'position': u'-10', u'user_id': u'134', u'id': u'20', u'label': u'City Council'}]","[{u'user_id': u'134', u'type_id': u'1', u'url': u'https://ompnetwork.s3-us-west-2.amazonaws.com/sites/134/documents/agenda_41.pdf', u'storage': u'attachment', u'session_id': u'486', u'label': None, u'file_id': u'662', u'provider': u'generic', u'agenda_provider_agenda_id': None, u'session_title': u'City Council Work Session 01-23-2013', u'type': u'Agenda', u'id': u'592', u'agenda_provider_id': None}, {u'user_id': u'134', u'type_id': u'4', u'url': u'https://ompnetwork.s3-us-west-2.amazonaws.com/sites/134/documents/minutes_40_0.pdf', u'storage': u'attachment', u'session_id': u'486', u'label': None, u'file_id': u'663', u'provider': u'generic', u'agenda_provider_agenda_id': None, u'session_title': u'City Council Work Session 01-23-2013', u'type': u'Minutes', u'id': u'593', u'agenda_provider_id': None}]"
333,346,"[7, 13]",City Council Meeting 06-23-2014,City Council Meeting 06-23-2014,,0,shows/city-council-meeting-06-23-2014,134.0,2014-06-23,2014-06-23,2017-03-20,o0FgacebIgU,https://www.youtube.com/watch?v=o0FgacebIgU,20.0,City Council,333.0,https://ompnetwork.s3-us-west-2.amazonaws.com/sites/134/documents/agenda_packet_83.pdf,"[{u'livestream': u'1', u'position': u'-10', u'user_id': u'134', u'id': u'20', u'label': u'City Council'}]","[{u'user_id': u'134', u'type_id': u'1', u'url': u'https://ompnetwork.s3-us-west-2.amazonaws.com/sites/134/documents/agenda_packet_83.pdf', u'storage': u'attachment', u'session_id': u'346', u'label': None, u'file_id': u'403', u'provider': u'generic', u'agenda_provider_agenda_id': None, u'session_title': u'City Council Meeting 06-23-2014', u'type': u'Agenda', u'id': u'333', u'agenda_provider_id': None}, {u'user_id': u'134', u'type_id': u'4', u'url': u'https://ompnetwork.s3-us-west-2.amazonaws.com/sites/134/documents/minutes_122_0.pdf', u'storage': u'attachment', u'session_id': u'346', u'label': None, u'file_id': u'404', u'provider': u'generic', u'agenda_provider_agenda_id': None, u'session_title': u'City Council Meeting 06-23-2014', u'type': u'Minutes', u'id': u'334', u'agenda_provider_id': None}]"
334,6721,"[4, 6, 13, 16]",City Council  - Special Meeting  - 06/14/11,City Council  - Special Meeting  - 06/14/11,,0,,199.0,2011-06-14,2011-06-14,2017-08-01,5ZhY6r0mdI8,https://www.youtube.com/watch?v=5ZhY6r0mdI8,69.0,Council,2345.0,https://ompnetwork.s3-us-west-2.amazonaws.com/sites/199/documents/cc_agenda_06-14-2011.pdf?D3VCFX1JQu6xE.QmA6Ei_CfVnAEq3b5m,"[{u'livestream': u'1', u'position': u'0', u'user_id': u'199', u'id': u'69', u'label': u'Council'}]","[{u'user_id': u'199', u'type_id': u'1', u'url': u'https://ompnetwork.s3-us-west-2.amazonaws.com/sites/199/documents/cc_agenda_06-14-2011.pdf?D3VCFX1JQu6xE.QmA6Ei_CfVnAEq3b5m', u'storage': u'attachment', u'session_id': u'6721', u'label': None, u'file_id': u'2378', u'provider': u'generic', u'agenda_provider_agenda_id': None, u'session_title': u'City Council  - Special Meeting  - 06/14/11', u'type': u'Agenda', u'id': u'2345', u'agenda_provider_id': None}, {u'user_id': u'199', u'type_id': u'3', u'url': u'https://ompnetwork.s3-us-west-2.amazonaws.com/sites/199/granicus_files/686_calendar_1308031200.html', u'storage': u'external', u'session_id': u'6721', u'label': None, u'file_id': None, u'provider': u'generic', u'agenda_provider_agenda_id': None, u'session_title': u'City Council  - Special Meeting  - 06/14/11', u'type': u'Calendar', u'id': u'2346', u'agenda_provider_id': None}, {u'user_id': u'199', u'type_id': u'2', u'url': u'https://ompnetwork.s3-us-west-2.amazonaws.com/sites/199/documents/cc_minutes_06-14-2011.pdf?bMrx_6zBJeA8vDjfRvZIGZl4vEoBIMP6', u'storage': u'attachment', u'session_id': u'6721', u'label': None, u'file_id': u'2379', u'provider': u'generic', u'agenda_provider_agenda_id': None, u'session_title': u'City Council  - Special Meeting  - 06/14/11', u'type': u'Journal', u'id': u'2347', u'agenda_provider_id': None}, {u'user_id': u'199', u'type_id': u'5', u'url': u'https://ompnetwork.s3-us-west-2.amazonaws.com/sites/199/documents/cc_packet_06-14-2011.pdf?hnKF3KdVxAnr2Uq2c9zOUZUZ5QAXX6G_', u'storage': u'attachment', u'session_id': u'6721', u'label': None, u'file_id': u'2380', u'provider': u'generic', u'agenda_provider_agenda_id': None, u'session_title': u'City Council  - Special Meeting  - 06/14/11', u'type': u'Packet', u'id': u'2348', u'agenda_provider_id': None}]"
335,3380,"[2, 3]","Thornton360 - October 14, 2015","Thornton360 - October 14, 2015","<p>Thornton360 is produced by the city of Thornton after each city council meeting, recapping the latest meeting and keeping residents informed about important news, issues and events happening in our community.</p>

<p>www.cityofthornton.tv</p>
",0,,186.0,2015-10-14,2015-10-14,2017-07-11,iQcXT8IEcaw,https://www.youtube.com/watch?v=iQcXT8IEcaw,59.0,Thornton360,,,"[{u'livestream': u'0', u'position': u'-9', u'user_id': u'186', u'id': u'59', u'label': u'Thornton360'}]",
336,791,"[0, 11, 16]",City Council Work Session 02-14-2011,City Council Work Session 02-14-2011,,0,shows/city-council-work-session-02-14-2011,134.0,2011-02-14,2011-02-14,2017-03-20,Y7Og7bOcA9U,https://www.youtube.com/watch?v=Y7Og7bOcA9U,20.0,City Council,1050.0,https://ompnetwork.s3-us-west-2.amazonaws.com/sites/134/documents/agenda_181.pdf,"[{u'livestream': u'1', u'position': u'-10', u'user_id': u'134', u'id': u'20', u'label': u'City Council'}]","[{u'user_id': u'134', u'type_id': u'1', u'url': u'https://ompnetwork.s3-us-west-2.amazonaws.com/sites/134/documents/agenda_181.pdf', u'storage': u'attachment', u'session_id': u'791', u'label': None, u'file_id': u'1121', u'provider': u'generic', u'agenda_provider_agenda_id': None, u'session_title': u'City Council Work Session 02-14-2011', u'type': u'Agenda', u'id': u'1050', u'agenda_provider_id': None}, {u'user_id': u'134', u'type_id': u'4', u'url': u'https://ompnetwork.s3-us-west-2.amazonaws.com/sites/134/documents/minutes_239.pdf', u'storage': u'attachment', u'session_id': u'791', u'label': None, u'file_id': u'1122', u'provider': u'generic', u'agenda_provider_agenda_id': None, u'session_title': u'City Council Work Session 02-14-2011', u'type': u'Minutes', u'id': u'1051', u'agenda_provider_id': None}]"
337,887,"[0, 16, 18]",City Council Work Session 04-12-2010,City Council Work Session 04-12-2010,,0,shows/city-council-work-session-04-12-2010,134.0,2010-04-12,2010-04-12,2017-03-20,KnlxR_qs5Yk,https://www.youtube.com/watch?v=KnlxR_qs5Yk,20.0,City Council,1220.0,https://ompnetwork.s3-us-west-2.amazonaws.com/sites/134/documents/agenda_246.pdf,"[{u'livestream': u'1', u'position': u'-10', u'user_id': u'134', u'id': u'20', u'label': u'City Council'}]","[{u'user_id': u'134', u'type_id': u'1', u'url': u'https://ompnetwork.s3-us-west-2.amazonaws.com/sites/134/documents/agenda_246.pdf', u'storage': u'attachment', u'session_id': u'887', u'label': None, u'file_id': u'1291', u'provider': u'generic', u'agenda_provider_agenda_id': None, u'session_title': u'City Council Work Session 04-12-2010', u'type': u'Agenda', u'id': u'1220', u'agenda_provider_id': None}, {u'user_id': u'134', u'type_id': u'4', u'url': u'https://ompnetwork.s3-us-west-2.amazonaws.com/sites/134/documents/minutes_304.pdf', u'storage': u'attachment', u'session_id': u'887', u'label': None, u'file_id': u'1292', u'provider': u'generic', u'agenda_provider_agenda_id': None, u'session_title': u'City Council Work Session 04-12-2010', u'type': u'Minutes', u'id': u'1221', u'agenda_provider_id': None}]"
338,768,"[0, 1, 11, 13, 16]",City Council Work Session 03-14-2011,City Council Work Session 03-14-2011,,0,shows/city-council-work-session-03-14-2011,134.0,2011-03-14,2011-03-14,2017-03-20,jymLe8dQbzE,https://www.youtube.com/watch?v=jymLe8dQbzE,20.0,City Council,1020.0,https://ompnetwork.s3-us-west-2.amazonaws.com/sites/134/documents/agenda_173.pdf,"[{u'livestream': u'1', u'position': u'-10', u'user_id': u'134', u'id': u'20', u'label': u'City Council'}]","[{u'user_id': u'134', u'type_id': u'1', u'url': u'https://ompnetwork.s3-us-west-2.amazonaws.com/sites/134/documents/agenda_173.pdf', u'storage': u'attachment', u'session_id': u'768', u'label': None, u'file_id': u'1091', u'provider': u'generic', u'agenda_provider_agenda_id': None, u'session_title': u'City Council Work Session 03-14-2011', u'type': u'Agenda', u'id': u'1020', u'agenda_provider_id': None}, {u'user_id': u'134', u'type_id': u'4', u'url': u'https://ompnetwork.s3-us-west-2.amazonaws.com/sites/134/documents/minutes_232.pdf', u'storage': u'attachment', u'session_id': u'768', u'label': None, u'file_id': u'1092', u'provider': u'generic', u'agenda_provider_agenda_id': None, u'session_title': u'City Council Work Session 03-14-2011', u'type': u'Minutes', u'id': u'1021', u'agenda_provider_id': None}]"
339,3382,"[0, 2, 3, 13, 16]","Thornton360 - October 28, 2015","Thornton360 - October 28, 2015","<p>Thornton360 is produced by the city of Thornton after each city council meeting, recapping the latest meeting and keeping residents informed about important news, issues and events happening in our community.</p>

<p>www.cityofthornton.tv</p>
",0,,186.0,2015-10-28,2015-10-28,2017-07-11,flPYnpgESVk,https://www.youtube.com/watch?v=flPYnpgESVk,59.0,Thornton360,,,"[{u'livestream': u'0', u'position': u'-9', u'user_id': u'186', u'id': u'59', u'label': u'Thornton360'}]",
340,8563,"[0, 16]",Planning Commission Study Session - 02/09/09,Planning Commission Study Session - 02/09/09,,0,,199.0,2009-02-09,2009-02-09,2017-08-01,gooufHiQeEI,https://www.youtube.com/watch?v=gooufHiQeEI,70.0,Planning,2800.0,https://ompnetwork.s3-us-west-2.amazonaws.com/sites/199/granicus_files/122_calendar_1234162800.html,"[{u'livestream': u'1', u'position': u'0', u'user_id': u'199', u'id': u'70', u'label': u'Planning'}]","[{u'user_id': u'199', u'type_id': u'3', u'url': u'https://ompnetwork.s3-us-west-2.amazonaws.com/sites/199/granicus_files/122_calendar_1234162800.html', u'storage': u'external', u'session_id': u'8563', u'label': None, u'file_id': None, u'provider': u'generic', u'agenda_provider_agenda_id': None, u'session_title': u'Planning Commission Study Session - 02/09/09', u'type': u'Calendar', u'id': u'2800', u'agenda_provider_id': None}]"
341,261,"[3, 13, 16, 18]",City Council Work Session 09-14-2015,City Council Work Session 09-14-2015,,0,shows/city-council-work-session-09-14-2015,134.0,2015-09-14,2015-09-14,2017-03-20,CO1rgBRvLIU,https://www.youtube.com/watch?v=CO1rgBRvLIU,20.0,City Council,171.0,https://ompnetwork.s3-us-west-2.amazonaws.com/sites/134/documents/agenda_packet_66.pdf,"[{u'livestream': u'1', u'position': u'-10', u'user_id': u'134', u'id': u'20', u'label': u'City Council'}]","[{u'user_id': u'134', u'type_id': u'1', u'url': u'https://ompnetwork.s3-us-west-2.amazonaws.com/sites/134/documents/agenda_packet_66.pdf', u'storage': u'attachment', u'session_id': u'261', u'label': None, u'file_id': u'241', u'provider': u'generic', u'agenda_provider_agenda_id': None, u'session_title': u'City Council Work Session 09-14-2015', u'type': u'Agenda', u'id': u'171', u'agenda_provider_id': None}, {u'user_id': u'134', u'type_id': u'4', u'url': u'https://ompnetwork.s3-us-west-2.amazonaws.com/sites/134/documents/minutes_45.pdf', u'storage': u'attachment', u'session_id': u'261', u'label': None, u'file_id': u'242', u'provider': u'generic', u'agenda_provider_agenda_id': None, u'session_title': u'City Council Work Session 09-14-2015', u'type': u'Minutes', u'id': u'172', u'agenda_provider_id': None}]"
342,19832,"[0, 5, 6]",Town of New Castle Board Meeting 10/24/17,Town of New Castle Board Meeting 10/24/17,,0,,281.0,2017-11-01,2017-10-24,2017-11-01,K0j4O0bX95o,https://youtu.be/K0j4O0bX95o,158.0,Town of New Castle Board Meetings,4685.0,https://ompnetwork.s3-us-west-2.amazonaws.com/sites/281/documents/10.24.17_town_boardwork_session_0.pdf?alsPqZ.3RqYiIMjFWZz0BYJMU.3lmEfy,"[{u'livestream': u'0', u'position': u'-10', u'user_id': u'281', u'id': u'158', u'label': u'Town of New Castle Board Meetings'}]","[{u'user_id': u'281', u'type_id': u'1', u'url': u'https://ompnetwork.s3-us-west-2.amazonaws.com/sites/281/documents/10.24.17_town_boardwork_session_0.pdf?alsPqZ.3RqYiIMjFWZz0BYJMU.3lmEfy', u'storage': u'attachment', u'session_id': u'19832', u'label': None, u'file_id': u'3983', u'provider': u'generic', u'agenda_provider_agenda_id': None, u'session_title': u'Town of New Castle Board Meeting 10/24/17', u'type': u'Agenda', u'id': u'4685', u'agenda_provider_id': None}]"
343,3407,"[0, 4, 6, 9, 19]","Thornton360 - March 30, 2016","Thornton360 - March 30, 2016","<p>Thornton360 is produced by the city of Thornton after each city council meeting, recapping the latest meeting and keeping residents informed about important news, issues and events happening in our community.</p>

<p>www.cityofthornton.tv</p>
",0,,186.0,2016-03-30,2016-03-30,2017-07-11,D9BwT3BOgO0,https://www.youtube.com/watch?v=D9BwT3BOgO0,59.0,Thornton360,,,"[{u'livestream': u'0', u'position': u'-9', u'user_id': u'186', u'id': u'59', u'label': u'Thornton360'}]",
344,324,"[3, 17, 18]",City Council Work Session 10-20-2014,City Council Work Session 10-20-2014,,0,shows/city-council-work-session-10-20-2014,134.0,2014-10-20,2014-10-20,2017-03-20,fpW-w8B-oN4,https://www.youtube.com/watch?v=fpW-w8B-oN4,20.0,City Council,291.0,https://ompnetwork.s3-us-west-2.amazonaws.com/sites/134/documents/agenda_packet_167.pdf,"[{u'livestream': u'1', u'position': u'-10', u'user_id': u'134', u'id': u'20', u'label': u'City Council'}]","[{u'user_id': u'134', u'type_id': u'1', u'url': u'https://ompnetwork.s3-us-west-2.amazonaws.com/sites/134/documents/agenda_packet_167.pdf', u'storage': u'attachment', u'session_id': u'324', u'label': None, u'file_id': u'361', u'provider': u'generic', u'agenda_provider_agenda_id': None, u'session_title': u'City Council Work Session 10-20-2014', u'type': u'Agenda', u'id': u'291', u'agenda_provider_id': None}, {u'user_id': u'134', u'type_id': u'4', u'url': u'https://ompnetwork.s3-us-west-2.amazonaws.com/sites/134/documents/minutes_100.pdf', u'storage': u'attachment', u'session_id': u'324', u'label': None, u'file_id': u'362', u'provider': u'generic', u'agenda_provider_agenda_id': None, u'session_title': u'City Council Work Session 10-20-2014', u'type': u'Minutes', u'id': u'292', u'agenda_provider_id': None}]"
345,3311,"[1, 2, 7, 18, 19]","Thornton360 - June 11, 2014","Thornton360 - June 11, 2014","<p>Thornton360 is produced by the city of Thornton after each city council meeting, recapping the latest meeting and keeping residents informed about important news, issues and events happening in our community.</p>

<p><a href=""http://www.cityofthornton.tv/"" style=""color: rgb(51, 149, 210);"">www.cityofthornton.tv</a></p>

<p>&nbsp;</p>
",0,,186.0,2014-06-13,2014-06-13,2017-07-11,hT041yylQFc,http://www.youtube.com/watch?v=hT041yylQFc&list=UUfibNwatXEZBJG99917d5sA&feature=share,59.0,Thornton360,,,"[{u'livestream': u'0', u'position': u'-9', u'user_id': u'186', u'id': u'59', u'label': u'Thornton360'}]",
346,2589,[10],"Board of Commissioners Morning Meeting: November 16, 2015","Board of Commissioners Morning Meeting: November 16, 2015",,0,,143.0,2017-05-11,2015-11-16,2017-05-11,qM3ukGygmug,https://www.youtube.com/watch?v=qM3ukGygmug,25.0,Board of County Commissioners,,,"[{u'livestream': u'1', u'position': u'0', u'user_id': u'143', u'id': u'25', u'label': u'Board of County Commissioners'}]",
347,502,"[16, 19]",City Council Work Session 12-10-2012,City Council Work Session 12-10-2012,,0,shows/city-council-work-session-12-10-2012,134.0,2012-12-10,2012-12-10,2017-03-20,7QPguz3PAOA,https://www.youtube.com/watch?v=7QPguz3PAOA,20.0,City Council,616.0,https://ompnetwork.s3-us-west-2.amazonaws.com/sites/134/documents/agenda_53.pdf,"[{u'livestream': u'1', u'position': u'-10', u'user_id': u'134', u'id': u'20', u'label': u'City Council'}]","[{u'user_id': u'134', u'type_id': u'1', u'url': u'https://ompnetwork.s3-us-west-2.amazonaws.com/sites/134/documents/agenda_53.pdf', u'storage': u'attachment', u'session_id': u'502', u'label': None, u'file_id': u'686', u'provider': u'generic', u'agenda_provider_agenda_id': None, u'session_title': u'City Council Work Session 12-10-2012', u'type': u'Agenda', u'id': u'616', u'agenda_provider_id': None}, {u'user_id': u'134', u'type_id': u'4', u'url': u'https://ompnetwork.s3-us-west-2.amazonaws.com/sites/134/documents/minutes_50_0.pdf', u'storage': u'attachment', u'session_id': u'502', u'label': None, u'file_id': u'687', u'provider': u'generic', u'agenda_provider_agenda_id': None, u'session_title': u'City Council Work Session 12-10-2012', u'type': u'Minutes', u'id': u'617', u'agenda_provider_id': None}]"
348,187,"[3, 19]",City Council Work Session and Meeting of URA 07-27-2016,City Council Work Session and Meeting of URA 07-27-2016,,0,shows/city-council-work-session-and-meeting-ura-07-27-2016,134.0,2016-07-27,2016-07-27,2017-03-20,W0RToQqkZM8,https://www.youtube.com/watch?v=W0RToQqkZM8,20.0,City Council,33.0,https://ompnetwork.s3-us-west-2.amazonaws.com/sites/134/documents/agenda_0.pdf,"[{u'livestream': u'1', u'position': u'-10', u'user_id': u'134', u'id': u'20', u'label': u'City Council'}]","[{u'user_id': u'134', u'type_id': u'1', u'url': u'https://ompnetwork.s3-us-west-2.amazonaws.com/sites/134/documents/agenda_0.pdf', u'storage': u'attachment', u'session_id': u'187', u'label': None, u'file_id': u'103', u'provider': u'generic', u'agenda_provider_agenda_id': None, u'session_title': u'City Council Work Session and Meeting of URA 07-27-2016', u'type': u'Agenda', u'id': u'33', u'agenda_provider_id': None}, {u'user_id': u'134', u'type_id': u'4', u'url': u'https://ompnetwork.s3-us-west-2.amazonaws.com/sites/134/documents/160727.ws_.sire_.pdf', u'storage': u'attachment', u'session_id': u'187', u'label': None, u'file_id': u'104', u'provider': u'generic', u'agenda_provider_agenda_id': None, u'session_title': u'City Council Work Session and Meeting of URA 07-27-2016', u'type': u'Minutes', u'id': u'34', u'agenda_provider_id': None}]"
349,22963,[19],Basalt Council Meeting 04/26/16,Basalt Council Meeting 04/26/16,,0,,296.0,2016-04-26,2016-04-26,2018-01-17,Llm36HCyjvM,https://www.youtube.com/watch?v=Llm36HCyjvM,197.0,Town Council,4988.0,https://ompnetwork.s3-us-west-2.amazonaws.com/sites/296/documents/council_agenda_04-26-16_0.pdf?2TtCAjvO2JuL.s.YrE1mN2D2hTWChiQs,"[{u'livestream': u'1', u'position': u'0', u'user_id': u'296', u'id': u'197', u'label': u'Town Council'}]","[{u'user_id': u'296', u'type_id': u'1', u'url': u'https://ompnetwork.s3-us-west-2.amazonaws.com/sites/296/documents/council_agenda_04-26-16_0.pdf?2TtCAjvO2JuL.s.YrE1mN2D2hTWChiQs', u'storage': u'attachment', u'session_id': u'22963', u'label': None, u'file_id': u'4402', u'provider': u'generic', u'agenda_provider_agenda_id': None, u'session_title': u'Basalt Council Meeting 04/26/16', u'type': u'Agenda', u'id': u'4988', u'agenda_provider_id': None}]"
350,3579,"[2, 11, 17]","Thornton360 - November 15, 2016","Thornton360 - November 15, 2016","<p>Thornton360 is produced by the city of Thornton after each city council meeting, recapping the latest meeting and keeping residents informed about important news, issues and events happening in our community.</p>

<p><a href=""http://www.cityofthornton.tv/"" style=""color: rgb(51, 149, 210);"">www.cityofthornton.tv</a></p>
",0,,186.0,2016-11-15,2016-11-15,2017-07-11,dZtXnOaF2rs,https://www.youtube.com/watch?v=dZtXnOaF2rs,59.0,Thornton360,,,"[{u'livestream': u'0', u'position': u'-9', u'user_id': u'186', u'id': u'59', u'label': u'Thornton360'}]",
351,3153,[16],"Toxics Board Meeting: May 17, 2017","Toxics Board Meeting: May 17, 2017",,0,,134.0,2017-07-07,2017-05-17,2017-07-20,F0xGdzUGzBQ,https://youtu.be/F0xGdzUGzBQ,46.0,Toxics Board,1766.0,https://ompnetwork.s3-us-west-2.amazonaws.com/sites/134/documents/archive.aspxadid4774?5sxtMjddyjklprW0lwXUuAfDwghTGOUE,"[{u'livestream': u'0', u'position': u'0', u'user_id': u'134', u'id': u'46', u'label': u'Toxics Board'}]","[{u'user_id': u'134', u'type_id': u'1', u'url': u'https://ompnetwork.s3-us-west-2.amazonaws.com/sites/134/documents/archive.aspxadid4774?5sxtMjddyjklprW0lwXUuAfDwghTGOUE', u'storage': u'attachment', u'session_id': u'3153', u'label': None, u'file_id': u'1904', u'provider': u'generic', u'agenda_provider_agenda_id': None, u'session_title': u'Toxics Board Meeting: May 17, 2017', u'type': u'Agenda', u'id': u'1766', u'agenda_provider_id': None}]"
352,457,"[8, 11, 12, 19]",City Council Work Session 05-13-2013,City Council Work Session 05-13-2013,,0,shows/city-council-work-session-05-13-2013,134.0,2013-05-13,2013-05-13,2017-03-20,mDfJfeBMHew,https://www.youtube.com/watch?v=mDfJfeBMHew,20.0,City Council,539.0,https://ompnetwork.s3-us-west-2.amazonaws.com/sites/134/documents/agenda_packet_281.pdf,"[{u'livestream': u'1', u'position': u'-10', u'user_id': u'134', u'id': u'20', u'label': u'City Council'}]","[{u'user_id': u'134', u'type_id': u'1', u'url': u'https://ompnetwork.s3-us-west-2.amazonaws.com/sites/134/documents/agenda_packet_281.pdf', u'storage': u'attachment', u'session_id': u'457', u'label': None, u'file_id': u'609', u'provider': u'generic', u'agenda_provider_agenda_id': None, u'session_title': u'City Council Work Session 05-13-2013', u'type': u'Agenda', u'id': u'539', u'agenda_provider_id': None}, {u'user_id': u'134', u'type_id': u'4', u'url': u'https://ompnetwork.s3-us-west-2.amazonaws.com/sites/134/documents/minutes_211.pdf', u'storage': u'attachment', u'session_id': u'457', u'label': None, u'file_id': u'610', u'provider': u'generic', u'agenda_provider_agenda_id': None, u'session_title': u'City Council Work Session 05-13-2013', u'type': u'Minutes', u'id': u'540', u'agenda_provider_id': None}]"
353,3330,"[0, 1, 3, 8, 12, 19]","Thornton360 - September 24, 2014","Thornton360 - September 24, 2014","<p>Thornton360 is produced by the city of Thornton after each city council meeting, recapping the latest meeting and keeping residents informed about important news, issues and events happening in our community.</p>

<p><a href=""http://www.cityofthornton.tv/"" style=""color: rgb(51, 149, 210);"">www.cityofthornton.tv</a></p>

<p>&nbsp;</p>
",0,,186.0,2014-09-24,2014-09-24,2017-07-11,zvVJ1LCO_94,https://www.youtube.com/watch?feature=player_detailpage&v=zvVJ1LCO_94,59.0,Thornton360,,,"[{u'livestream': u'0', u'position': u'-9', u'user_id': u'186', u'id': u'59', u'label': u'Thornton360'}]",
354,590,"[8, 18, 19]",City Council Work Sesssion 04-25-2012,City Council Work Sesssion 04-25-2012,,0,shows/city-council-work-sesssion-04-25-2012,134.0,2012-04-25,2012-04-25,2017-03-20,c29SbYToLqs,https://www.youtube.com/watch?v=c29SbYToLqs,20.0,City Council,748.0,https://ompnetwork.s3-us-west-2.amazonaws.com/sites/134/documents/agenda_114.pdf,"[{u'livestream': u'1', u'position': u'-10', u'user_id': u'134', u'id': u'20', u'label': u'City Council'}]","[{u'user_id': u'134', u'type_id': u'1', u'url': u'https://ompnetwork.s3-us-west-2.amazonaws.com/sites/134/documents/agenda_114.pdf', u'storage': u'attachment', u'session_id': u'590', u'label': None, u'file_id': u'819', u'provider': u'generic', u'agenda_provider_agenda_id': None, u'session_title': u'City Council Work Sesssion 04-25-2012', u'type': u'Agenda', u'id': u'748', u'agenda_provider_id': None}, {u'user_id': u'134', u'type_id': u'4', u'url': u'https://ompnetwork.s3-us-west-2.amazonaws.com/sites/134/documents/minutes_96_0.pdf', u'storage': u'attachment', u'session_id': u'590', u'label': None, u'file_id': u'820', u'provider': u'generic', u'agenda_provider_agenda_id': None, u'session_title': u'City Council Work Sesssion 04-25-2012', u'type': u'Minutes', u'id': u'749', u'agenda_provider_id': None}]"
355,3856,"[0, 4, 13]","Eugene Police Commission Meeting January 8, 2015","Eugene Police Commission Meeting January 8, 2015",,0,,134.0,2017-07-15,2015-01-08,2017-07-17,0_iP9HwhTYs,https://youtu.be/0_iP9HwhTYs,45.0,Police Commission,1672.0,https://ompnetwork.s3-us-west-2.amazonaws.com/sites/134/documents/2015_01_08_packet.pdf,"[{u'livestream': u'0', u'position': u'0', u'user_id': u'134', u'id': u'45', u'label': u'Police Commission'}]","[{u'user_id': u'134', u'type_id': u'1', u'url': u'https://ompnetwork.s3-us-west-2.amazonaws.com/sites/134/documents/2015_01_08_packet.pdf', u'storage': u'attachment', u'session_id': u'3856', u'label': None, u'file_id': u'1831', u'provider': u'generic', u'agenda_provider_agenda_id': None, u'session_title': u'Eugene Police Commission Meeting January 8, 2015', u'type': u'Agenda', u'id': u'1672', u'agenda_provider_id': None}]"
356,378,"[5, 12, 13, 16]",City Council Work Session 02-24-2014,City Council Work Session 02-24-2014,,0,shows/city-council-work-session-02-24-2014,134.0,2014-02-24,2014-02-24,2017-03-20,1QQWRoTynoU,https://www.youtube.com/watch?v=1QQWRoTynoU,20.0,City Council,391.0,https://ompnetwork.s3-us-west-2.amazonaws.com/sites/134/documents/agenda_packet_193.pdf,"[{u'livestream': u'1', u'position': u'-10', u'user_id': u'134', u'id': u'20', u'label': u'City Council'}]","[{u'user_id': u'134', u'type_id': u'1', u'url': u'https://ompnetwork.s3-us-west-2.amazonaws.com/sites/134/documents/agenda_packet_193.pdf', u'storage': u'attachment', u'session_id': u'378', u'label': None, u'file_id': u'461', u'provider': u'generic', u'agenda_provider_agenda_id': None, u'session_title': u'City Council Work Session 02-24-2014', u'type': u'Agenda', u'id': u'391', u'agenda_provider_id': None}, {u'user_id': u'134', u'type_id': u'4', u'url': u'https://ompnetwork.s3-us-west-2.amazonaws.com/sites/134/documents/minutes_152.pdf', u'storage': u'attachment', u'session_id': u'378', u'label': None, u'file_id': u'462', u'provider': u'generic', u'agenda_provider_agenda_id': None, u'session_title': u'City Council Work Session 02-24-2014', u'type': u'Minutes', u'id': u'392', u'agenda_provider_id': None}]"
357,283,"[8, 9, 10, 12, 14, 16, 18]",City Council Meeting 05-11-2015,City Council Meeting 05-11-2015,,0,shows/city-council-meeting-05-11-2015,134.0,2015-05-11,2015-05-11,2017-03-20,kkSeh1mSrN0,https://www.youtube.com/watch?v=kkSeh1mSrN0,20.0,City Council,213.0,https://ompnetwork.s3-us-west-2.amazonaws.com/sites/134/documents/agenda_packet_103.pdf,"[{u'livestream': u'1', u'position': u'-10', u'user_id': u'134', u'id': u'20', u'label': u'City Council'}]","[{u'user_id': u'134', u'type_id': u'1', u'url': u'https://ompnetwork.s3-us-west-2.amazonaws.com/sites/134/documents/agenda_packet_103.pdf', u'storage': u'attachment', u'session_id': u'283', u'label': None, u'file_id': u'283', u'provider': u'generic', u'agenda_provider_agenda_id': None, u'session_title': u'City Council Meeting 05-11-2015', u'type': u'Agenda', u'id': u'213', u'agenda_provider_id': None}, {u'user_id': u'134', u'type_id': u'4', u'url': u'https://ompnetwork.s3-us-west-2.amazonaws.com/sites/134/documents/minutes_65.pdf', u'storage': u'attachment', u'session_id': u'283', u'label': None, u'file_id': u'284', u'provider': u'generic', u'agenda_provider_agenda_id': None, u'session_title': u'City Council Meeting 05-11-2015', u'type': u'Minutes', u'id': u'214', u'agenda_provider_id': None}]"
358,659,"[3, 6, 7]",Planning Commission  10-07-2013,Planning Commission  10-07-2013,,0,shows/planning-commission-10-07-2013,134.0,2013-10-07,2013-10-07,2017-03-20,Yw2IuwjRQqE,https://www.youtube.com/watch?v=Yw2IuwjRQqE,22.0,Planning Commission,854.0,https://ompnetwork.s3-us-west-2.amazonaws.com/sites/134/documents/agenda_packet_142_0.pdf,"[{u'livestream': u'1', u'position': u'-9', u'user_id': u'134', u'id': u'22', u'label': u'Planning Commission'}]","[{u'user_id': u'134', u'type_id': u'1', u'url': u'https://ompnetwork.s3-us-west-2.amazonaws.com/sites/134/documents/agenda_packet_142_0.pdf', u'storage': u'attachment', u'session_id': u'659', u'label': None, u'file_id': u'925', u'provider': u'generic', u'agenda_provider_agenda_id': None, u'session_title': u'Planning Commission  10-07-2013', u'type': u'Agenda', u'id': u'854', u'agenda_provider_id': None}]"
359,20643,"[2, 4, 12, 13, 16, 18]","Eugene CIty Council Work Session: November 27, 2017","Eugene CIty Council Work Session: November 27, 2017",,0,,134.0,2017-11-22,2017-11-27,2017-11-29,nRj3l75XGeo,https://youtu.be/nRj3l75XGeo,20.0,City Council,4764.0,https://ompnetwork.s3-us-west-2.amazonaws.com/sites/134/documents/cc_agenda_11-27-17ws.pdf?1S5tjWwuEayC2r2zRlBPpdtxIowIEOrx,"[{u'livestream': u'1', u'position': u'-10', u'user_id': u'134', u'id': u'20', u'label': u'City Council'}]","[{u'user_id': u'134', u'type_id': u'1', u'url': u'https://ompnetwork.s3-us-west-2.amazonaws.com/sites/134/documents/cc_agenda_11-27-17ws.pdf?1S5tjWwuEayC2r2zRlBPpdtxIowIEOrx', u'storage': u'attachment', u'session_id': u'20643', u'label': None, u'file_id': u'4103', u'provider': u'generic', u'agenda_provider_agenda_id': None, u'session_title': u'Eugene CIty Council Work Session: November 27, 2017', u'type': u'Agenda', u'id': u'4764', u'agenda_provider_id': None}]"
360,382,"[5, 6, 8]",City Council Work Session 02-12-2014,City Council Work Session 02-12-2014,,0,shows/city-council-work-session-02-12-2014,134.0,2014-02-12,2014-02-12,2017-03-20,DAVSCD2KvjQ,https://www.youtube.com/watch?v=DAVSCD2KvjQ,20.0,City Council,397.0,https://ompnetwork.s3-us-west-2.amazonaws.com/sites/134/documents/agenda_packet_197.pdf,"[{u'livestream': u'1', u'position': u'-10', u'user_id': u'134', u'id': u'20', u'label': u'City Council'}]","[{u'user_id': u'134', u'type_id': u'1', u'url': u'https://ompnetwork.s3-us-west-2.amazonaws.com/sites/134/documents/agenda_packet_197.pdf', u'storage': u'attachment', u'session_id': u'382', u'label': None, u'file_id': u'467', u'provider': u'generic', u'agenda_provider_agenda_id': None, u'session_title': u'City Council Work Session 02-12-2014', u'type': u'Agenda', u'id': u'397', u'agenda_provider_id': None}, {u'user_id': u'134', u'type_id': u'4', u'url': u'https://ompnetwork.s3-us-west-2.amazonaws.com/sites/134/documents/minutes_154.pdf', u'storage': u'attachment', u'session_id': u'382', u'label': None, u'file_id': u'468', u'provider': u'generic', u'agenda_provider_agenda_id': None, u'session_title': u'City Council Work Session 02-12-2014', u'type': u'Minutes', u'id': u'398', u'agenda_provider_id': None}]"
361,306,"[6, 8, 16]",City Council Work Session 01-21-2015,City Council Work Session 01-21-2015,,0,shows/city-council-work-session-01-21-2015,134.0,2015-01-21,2015-01-21,2017-03-20,LDqv61ViNqE,https://www.youtube.com/watch?v=LDqv61ViNqE,20.0,City Council,255.0,https://ompnetwork.s3-us-west-2.amazonaws.com/sites/134/documents/agenda_packet_134.pdf,"[{u'livestream': u'1', u'position': u'-10', u'user_id': u'134', u'id': u'20', u'label': u'City Council'}]","[{u'user_id': u'134', u'type_id': u'1', u'url': u'https://ompnetwork.s3-us-west-2.amazonaws.com/sites/134/documents/agenda_packet_134.pdf', u'storage': u'attachment', u'session_id': u'306', u'label': None, u'file_id': u'325', u'provider': u'generic', u'agenda_provider_agenda_id': None, u'session_title': u'City Council Work Session 01-21-2015', u'type': u'Agenda', u'id': u'255', u'agenda_provider_id': None}, {u'user_id': u'134', u'type_id': u'4', u'url': u'https://ompnetwork.s3-us-west-2.amazonaws.com/sites/134/documents/minutes_86.pdf', u'storage': u'attachment', u'session_id': u'306', u'label': None, u'file_id': u'326', u'provider': u'generic', u'agenda_provider_agenda_id': None, u'session_title': u'City Council Work Session 01-21-2015', u'type': u'Minutes', u'id': u'256', u'agenda_provider_id': None}]"
362,9909,"[6, 11, 13]",LIFT - 2/12/2015,LIFT - 2/12/2015,,0,,199.0,2015-02-12,2015-02-12,2017-08-02,PdMnHrRbBls,https://www.youtube.com/watch?v=PdMnHrRbBls,73.0,LIFT,3268.0,https://ompnetwork.s3-us-west-2.amazonaws.com/sites/199/granicus_files/1421_calendar_1423724400.pdf,"[{u'livestream': u'0', u'position': u'0', u'user_id': u'199', u'id': u'73', u'label': u'LIFT'}]","[{u'user_id': u'199', u'type_id': u'3', u'url': u'https://ompnetwork.s3-us-west-2.amazonaws.com/sites/199/granicus_files/1421_calendar_1423724400.pdf', u'storage': u'external', u'session_id': u'9909', u'label': None, u'file_id': None, u'provider': u'generic', u'agenda_provider_agenda_id': None, u'session_title': u'LIFT - 2/12/2015', u'type': u'Calendar', u'id': u'3268', u'agenda_provider_id': None}]"
363,15574,"[0, 2, 6, 9]",10-23-17 City Council Regular Meeting,10-23-17 City Council Regular Meeting,,0,,253.0,2017-10-23,2017-10-23,2017-11-02,jxw78tgbjAs,https://www.youtube.com/watch?v=jxw78tgbjAs,118.0,Meetings,4209.0,https://ompnetwork.s3-us-west-2.amazonaws.com/sites/253/documents/10-23-17_regular_meeting.pdf?uvj8X_74lUjrHGJ0w1Mcn3FqDTxmTS0G,"[{u'livestream': u'1', u'position': u'0', u'user_id': u'253', u'id': u'118', u'label': u'Meetings'}]","[{u'user_id': u'253', u'type_id': u'1', u'url': u'https://ompnetwork.s3-us-west-2.amazonaws.com/sites/253/documents/10-23-17_regular_meeting.pdf?uvj8X_74lUjrHGJ0w1Mcn3FqDTxmTS0G', u'storage': u'attachment', u'session_id': u'15574', u'label': None, u'file_id': u'3722', u'provider': u'generic', u'agenda_provider_agenda_id': None, u'session_title': u'10-23-17 City Council Regular Meeting', u'type': u'Agenda', u'id': u'4209', u'agenda_provider_id': None}]"
364,423,"[3, 18, 19]",City Council Work Session 09-11-2013,City Council Work Session 09-11-2013,,0,shows/city-council-work-session-09-11-2013,134.0,2013-09-11,2013-09-11,2017-03-20,zUpnyp7QnbA,https://www.youtube.com/watch?v=zUpnyp7QnbA,20.0,City Council,475.0,https://ompnetwork.s3-us-west-2.amazonaws.com/sites/134/documents/agenda_packet_241.pdf,"[{u'livestream': u'1', u'position': u'-10', u'user_id': u'134', u'id': u'20', u'label': u'City Council'}]","[{u'user_id': u'134', u'type_id': u'1', u'url': u'https://ompnetwork.s3-us-west-2.amazonaws.com/sites/134/documents/agenda_packet_241.pdf', u'storage': u'attachment', u'session_id': u'423', u'label': None, u'file_id': u'545', u'provider': u'generic', u'agenda_provider_agenda_id': None, u'session_title': u'City Council Work Session 09-11-2013', u'type': u'Agenda', u'id': u'475', u'agenda_provider_id': None}, {u'user_id': u'134', u'type_id': u'4', u'url': u'https://ompnetwork.s3-us-west-2.amazonaws.com/sites/134/documents/minutes_184.pdf', u'storage': u'attachment', u'session_id': u'423', u'label': None, u'file_id': u'546', u'provider': u'generic', u'agenda_provider_agenda_id': None, u'session_title': u'City Council Work Session 09-11-2013', u'type': u'Minutes', u'id': u'476', u'agenda_provider_id': None}]"
365,372,"[0, 2, 5, 12, 16, 18]",City Council Work Session 03-12-2014,City Council Work Session 03-12-2014,,0,shows/city-council-work-session-03-12-2014,134.0,2014-03-12,2014-03-12,2017-03-20,AMoJ_hTbcNI,https://www.youtube.com/watch?v=AMoJ_hTbcNI,20.0,City Council,379.0,https://ompnetwork.s3-us-west-2.amazonaws.com/sites/134/documents/agenda_packet_183.pdf,"[{u'livestream': u'1', u'position': u'-10', u'user_id': u'134', u'id': u'20', u'label': u'City Council'}]","[{u'user_id': u'134', u'type_id': u'1', u'url': u'https://ompnetwork.s3-us-west-2.amazonaws.com/sites/134/documents/agenda_packet_183.pdf', u'storage': u'attachment', u'session_id': u'372', u'label': None, u'file_id': u'449', u'provider': u'generic', u'agenda_provider_agenda_id': None, u'session_title': u'City Council Work Session 03-12-2014', u'type': u'Agenda', u'id': u'379', u'agenda_provider_id': None}, {u'user_id': u'134', u'type_id': u'4', u'url': u'https://ompnetwork.s3-us-west-2.amazonaws.com/sites/134/documents/minutes_147.pdf', u'storage': u'attachment', u'session_id': u'372', u'label': None, u'file_id': u'450', u'provider': u'generic', u'agenda_provider_agenda_id': None, u'session_title': u'City Council Work Session 03-12-2014', u'type': u'Minutes', u'id': u'380', u'agenda_provider_id': None}]"
366,227,"[0, 10, 12, 16]",City Council Meeting 02-08-2016,City Council Meeting 02-08-2016,,0,shows/city-council-meeting-02-08-2016,134.0,2016-02-08,2016-02-08,2017-03-20,FdDfi_eCNlc,https://www.youtube.com/watch?v=FdDfi_eCNlc,20.0,City Council,109.0,https://ompnetwork.s3-us-west-2.amazonaws.com/sites/134/documents/agenda_packet_33.pdf,"[{u'livestream': u'1', u'position': u'-10', u'user_id': u'134', u'id': u'20', u'label': u'City Council'}]","[{u'user_id': u'134', u'type_id': u'1', u'url': u'https://ompnetwork.s3-us-west-2.amazonaws.com/sites/134/documents/agenda_packet_33.pdf', u'storage': u'attachment', u'session_id': u'227', u'label': None, u'file_id': u'179', u'provider': u'generic', u'agenda_provider_agenda_id': None, u'session_title': u'City Council Meeting 02-08-2016', u'type': u'Agenda', u'id': u'109', u'agenda_provider_id': None}, {u'user_id': u'134', u'type_id': u'4', u'url': u'https://ompnetwork.s3-us-west-2.amazonaws.com/sites/134/documents/minutes_14_0.pdf', u'storage': u'attachment', u'session_id': u'227', u'label': None, u'file_id': u'180', u'provider': u'generic', u'agenda_provider_agenda_id': None, u'session_title': u'City Council Meeting 02-08-2016', u'type': u'Minutes', u'id': u'110', u'agenda_provider_id': None}]"
367,19493,"[1, 2, 9, 18]",BOCC Regular Meeting 07/26/17,BOCC Regular Meeting 07/26/17,,0,,273.0,2017-07-26,2017-07-26,2017-10-31,BnaMuTFFLFE,https://www.youtube.com/watch?v=BnaMuTFFLFE,150.0,2017,,,"[{u'livestream': u'0', u'position': u'-9', u'user_id': u'273', u'id': u'150', u'label': u'2017'}]",
368,265,"[0, 8, 10, 13]",City Council Work Session and URA Meeting 07-27-2015,City Council Work Session and URA Meeting 07-27-2015,,0,shows/city-council-work-session-and-ura-meeting-07-27-2015,134.0,2015-07-27,2015-07-27,2017-03-20,jOysSsYZgmk,https://www.youtube.com/watch?v=jOysSsYZgmk,20.0,City Council,179.0,https://ompnetwork.s3-us-west-2.amazonaws.com/sites/134/documents/agenda_packet_72.pdf,"[{u'livestream': u'1', u'position': u'-10', u'user_id': u'134', u'id': u'20', u'label': u'City Council'}]","[{u'user_id': u'134', u'type_id': u'1', u'url': u'https://ompnetwork.s3-us-west-2.amazonaws.com/sites/134/documents/agenda_packet_72.pdf', u'storage': u'attachment', u'session_id': u'265', u'label': None, u'file_id': u'249', u'provider': u'generic', u'agenda_provider_agenda_id': None, u'session_title': u'City Council Work Session and URA Meeting 07-27-2015', u'type': u'Agenda', u'id': u'179', u'agenda_provider_id': None}, {u'user_id': u'134', u'type_id': u'4', u'url': u'https://ompnetwork.s3-us-west-2.amazonaws.com/sites/134/documents/minutes_48.pdf', u'storage': u'attachment', u'session_id': u'265', u'label': None, u'file_id': u'250', u'provider': u'generic', u'agenda_provider_agenda_id': None, u'session_title': u'City Council Work Session and URA Meeting 07-27-2015', u'type': u'Minutes', u'id': u'180', u'agenda_provider_id': None}]"
369,252,"[7, 13, 18]",City Council Work Session 10-14-2015,City Council Work Session 10-14-2015,,0,shows/city-council-work-session-10-14-2015,134.0,2015-10-14,2015-10-14,2017-03-20,qXGFf3NRIHI,https://www.youtube.com/watch?v=qXGFf3NRIHI,20.0,City Council,155.0,https://ompnetwork.s3-us-west-2.amazonaws.com/sites/134/documents/agenda_packet_49.pdf,"[{u'livestream': u'1', u'position': u'-10', u'user_id': u'134', u'id': u'20', u'label': u'City Council'}]","[{u'user_id': u'134', u'type_id': u'1', u'url': u'https://ompnetwork.s3-us-west-2.amazonaws.com/sites/134/documents/agenda_packet_49.pdf', u'storage': u'attachment', u'session_id': u'252', u'label': None, u'file_id': u'225', u'provider': u'generic', u'agenda_provider_agenda_id': None, u'session_title': u'City Council Work Session 10-14-2015', u'type': u'Agenda', u'id': u'155', u'agenda_provider_id': None}, {u'user_id': u'134', u'type_id': u'4', u'url': u'https://ompnetwork.s3-us-west-2.amazonaws.com/sites/134/documents/minutes_36.pdf', u'storage': u'attachment', u'session_id': u'252', u'label': None, u'file_id': u'226', u'provider': u'generic', u'agenda_provider_agenda_id': None, u'session_title': u'City Council Work Session 10-14-2015', u'type': u'Minutes', u'id': u'156', u'agenda_provider_id': None}]"
370,275,[19],City Council Work Session 06-17-2015,City Council Work Session 06-17-2015,,0,shows/city-council-work-session-06-17-2015,134.0,2015-06-17,2015-06-17,2017-03-20,gbpM_atW1Pw,https://www.youtube.com/watch?v=gbpM_atW1Pw,20.0,City Council,199.0,https://ompnetwork.s3-us-west-2.amazonaws.com/sites/134/documents/agenda_packet_90.pdf,"[{u'livestream': u'1', u'position': u'-10', u'user_id': u'134', u'id': u'20', u'label': u'City Council'}]","[{u'user_id': u'134', u'type_id': u'1', u'url': u'https://ompnetwork.s3-us-west-2.amazonaws.com/sites/134/documents/agenda_packet_90.pdf', u'storage': u'attachment', u'session_id': u'275', u'label': None, u'file_id': u'269', u'provider': u'generic', u'agenda_provider_agenda_id': None, u'session_title': u'City Council Work Session 06-17-2015', u'type': u'Agenda', u'id': u'199', u'agenda_provider_id': None}, {u'user_id': u'134', u'type_id': u'4', u'url': u'https://ompnetwork.s3-us-west-2.amazonaws.com/sites/134/documents/minutes_58.pdf', u'storage': u'attachment', u'session_id': u'275', u'label': None, u'file_id': u'270', u'provider': u'generic', u'agenda_provider_agenda_id': None, u'session_title': u'City Council Work Session 06-17-2015', u'type': u'Minutes', u'id': u'200', u'agenda_provider_id': None}]"
371,285,"[2, 4, 11, 16]",City Council Meeting 05-05-2015,City Council Meeting 05-05-2015,,0,shows/city-council-meeting-05-05-2015,134.0,2015-05-05,2015-05-05,2017-03-20,J0AQAbs7nAM,https://www.youtube.com/watch?v=J0AQAbs7nAM,20.0,City Council,,,"[{u'livestream': u'1', u'position': u'-10', u'user_id': u'134', u'id': u'20', u'label': u'City Council'}]",
372,599,"[0, 3, 5, 6, 8, 13, 18]",City Council Public Hearing 04-16-2012,City Council Public Hearing 04-16-2012,,0,shows/city-council-public-hearing-04-16-2012,134.0,2012-04-16,2012-04-16,2017-03-20,EuSP1266QwE,https://www.youtube.com/watch?v=EuSP1266QwE,20.0,City Council,762.0,https://ompnetwork.s3-us-west-2.amazonaws.com/sites/134/documents/agenda_118.pdf,"[{u'livestream': u'1', u'position': u'-10', u'user_id': u'134', u'id': u'20', u'label': u'City Council'}]","[{u'user_id': u'134', u'type_id': u'1', u'url': u'https://ompnetwork.s3-us-west-2.amazonaws.com/sites/134/documents/agenda_118.pdf', u'storage': u'attachment', u'session_id': u'599', u'label': None, u'file_id': u'833', u'provider': u'generic', u'agenda_provider_agenda_id': None, u'session_title': u'City Council Public Hearing 04-16-2012', u'type': u'Agenda', u'id': u'762', u'agenda_provider_id': None}, {u'user_id': u'134', u'type_id': u'4', u'url': u'https://ompnetwork.s3-us-west-2.amazonaws.com/sites/134/documents/minutes_100_0.pdf', u'storage': u'attachment', u'session_id': u'599', u'label': None, u'file_id': u'834', u'provider': u'generic', u'agenda_provider_agenda_id': None, u'session_title': u'City Council Public Hearing 04-16-2012', u'type': u'Minutes', u'id': u'763', u'agenda_provider_id': None}]"
373,3469,"[4, 6]","Thornton360 - August 10, 2016","Thornton360 - August 10, 2016","<p>Thornton360 is produced by the city of Thornton after each city council meeting, recapping the latest meeting and keeping residents informed about important news, issues and events happening in our community.</p>

<p><a href=""http://www.cityofthornton.tv/"" style=""color: rgb(51, 149, 210);"">www.cityofthornton.tv</a></p>
",0,,186.0,2016-08-10,2016-08-10,2017-07-11,o_lIt7DVEBc,https://www.youtube.com/watch?v=o_lIt7DVEBc,59.0,Thornton360,,,"[{u'livestream': u'0', u'position': u'-9', u'user_id': u'186', u'id': u'59', u'label': u'Thornton360'}]",
374,271,"[7, 13]",City Council Emergency Meeting 07-01-2015,City Council Emergency Meeting 07-01-2015,,0,shows/city-council-emergency-meeting-07-01-2015,134.0,2015-07-01,2015-07-01,2017-03-20,zoLh7_ua668,https://www.youtube.com/watch?v=zoLh7_ua668,20.0,City Council,191.0,https://ompnetwork.s3-us-west-2.amazonaws.com/sites/134/documents/agenda_packet_84.pdf,"[{u'livestream': u'1', u'position': u'-10', u'user_id': u'134', u'id': u'20', u'label': u'City Council'}]","[{u'user_id': u'134', u'type_id': u'1', u'url': u'https://ompnetwork.s3-us-west-2.amazonaws.com/sites/134/documents/agenda_packet_84.pdf', u'storage': u'attachment', u'session_id': u'271', u'label': None, u'file_id': u'261', u'provider': u'generic', u'agenda_provider_agenda_id': None, u'session_title': u'City Council Emergency Meeting 07-01-2015', u'type': u'Agenda', u'id': u'191', u'agenda_provider_id': None}, {u'user_id': u'134', u'type_id': u'4', u'url': u'https://ompnetwork.s3-us-west-2.amazonaws.com/sites/134/documents/minutes_54.pdf', u'storage': u'attachment', u'session_id': u'271', u'label': None, u'file_id': u'262', u'provider': u'generic', u'agenda_provider_agenda_id': None, u'session_title': u'City Council Emergency Meeting 07-01-2015', u'type': u'Minutes', u'id': u'192', u'agenda_provider_id': None}]"
375,419,"[11, 12, 19]",Budget Committee 09-23-2013,Budget Committee 09-23-2013,,0,shows/budget-committee-09-23-2013,134.0,2013-09-23,2013-09-23,2017-03-20,Y55_GHXOROg,https://www.youtube.com/watch?v=Y55_GHXOROg,21.0,Budget Committee,469.0,https://ompnetwork.s3-us-west-2.amazonaws.com/sites/134/documents/agenda_packet_47.pdf,"[{u'livestream': u'1', u'position': u'-8', u'user_id': u'134', u'id': u'21', u'label': u'Budget Committee'}]","[{u'user_id': u'134', u'type_id': u'1', u'url': u'https://ompnetwork.s3-us-west-2.amazonaws.com/sites/134/documents/agenda_packet_47.pdf', u'storage': u'attachment', u'session_id': u'419', u'label': None, u'file_id': u'539', u'provider': u'generic', u'agenda_provider_agenda_id': None, u'session_title': u'Budget Committee 09-23-2013', u'type': u'Agenda', u'id': u'469', u'agenda_provider_id': None}, {u'user_id': u'134', u'type_id': u'4', u'url': u'https://ompnetwork.s3-us-west-2.amazonaws.com/sites/134/documents/minutes_143_0.pdf', u'storage': u'attachment', u'session_id': u'419', u'label': None, u'file_id': u'540', u'provider': u'generic', u'agenda_provider_agenda_id': None, u'session_title': u'Budget Committee 09-23-2013', u'type': u'Minutes', u'id': u'470', u'agenda_provider_id': None}]"
376,559,"[9, 11, 16]",City Council Work Session 06-27-2012,City Council Work Session 06-27-2012,,0,shows/city-council-work-session-06-27-2012,134.0,2012-06-27,2012-06-27,2017-03-20,8cMp7Jgxf70,https://www.youtube.com/watch?v=8cMp7Jgxf70,20.0,City Council,700.0,https://ompnetwork.s3-us-west-2.amazonaws.com/sites/134/documents/agenda_94.pdf,"[{u'livestream': u'1', u'position': u'-10', u'user_id': u'134', u'id': u'20', u'label': u'City Council'}]","[{u'user_id': u'134', u'type_id': u'1', u'url': u'https://ompnetwork.s3-us-west-2.amazonaws.com/sites/134/documents/agenda_94.pdf', u'storage': u'attachment', u'session_id': u'559', u'label': None, u'file_id': u'771', u'provider': u'generic', u'agenda_provider_agenda_id': None, u'session_title': u'City Council Work Session 06-27-2012', u'type': u'Agenda', u'id': u'700', u'agenda_provider_id': None}, {u'user_id': u'134', u'type_id': u'4', u'url': u'https://ompnetwork.s3-us-west-2.amazonaws.com/sites/134/documents/minutes_80_0.pdf', u'storage': u'attachment', u'session_id': u'559', u'label': None, u'file_id': u'772', u'provider': u'generic', u'agenda_provider_agenda_id': None, u'session_title': u'City Council Work Session 06-27-2012', u'type': u'Minutes', u'id': u'701', u'agenda_provider_id': None}]"
377,370,"[8, 18]",City Council Work Session 04-14-2014,City Council Work Session 04-14-2014,,0,shows/city-council-work-session-04-14-2014,134.0,2014-04-14,2014-04-14,2017-03-20,s7YDnkGk5h8,https://www.youtube.com/watch?v=s7YDnkGk5h8,20.0,City Council,375.0,https://ompnetwork.s3-us-west-2.amazonaws.com/sites/134/documents/agenda_packet_173.pdf,"[{u'livestream': u'1', u'position': u'-10', u'user_id': u'134', u'id': u'20', u'label': u'City Council'}]","[{u'user_id': u'134', u'type_id': u'1', u'url': u'https://ompnetwork.s3-us-west-2.amazonaws.com/sites/134/documents/agenda_packet_173.pdf', u'storage': u'attachment', u'session_id': u'370', u'label': None, u'file_id': u'445', u'provider': u'generic', u'agenda_provider_agenda_id': None, u'session_title': u'City Council Work Session 04-14-2014', u'type': u'Agenda', u'id': u'375', u'agenda_provider_id': None}, {u'user_id': u'134', u'type_id': u'4', u'url': u'https://ompnetwork.s3-us-west-2.amazonaws.com/sites/134/documents/minutes_144.pdf', u'storage': u'attachment', u'session_id': u'370', u'label': None, u'file_id': u'446', u'provider': u'generic', u'agenda_provider_agenda_id': None, u'session_title': u'City Council Work Session 04-14-2014', u'type': u'Minutes', u'id': u'376', u'agenda_provider_id': None}]"
378,377,"[12, 18]",City Council Meeting 02-24-2014,City Council Meeting 02-24-2014,,0,shows/city-council-meeting-02-24-2014,134.0,2014-02-24,2014-02-24,2017-03-20,lfXPo1yCwlg,https://www.youtube.com/watch?v=lfXPo1yCwlg,20.0,City Council,389.0,https://ompnetwork.s3-us-west-2.amazonaws.com/sites/134/documents/agenda_packet_192.pdf,"[{u'livestream': u'1', u'position': u'-10', u'user_id': u'134', u'id': u'20', u'label': u'City Council'}]","[{u'user_id': u'134', u'type_id': u'1', u'url': u'https://ompnetwork.s3-us-west-2.amazonaws.com/sites/134/documents/agenda_packet_192.pdf', u'storage': u'attachment', u'session_id': u'377', u'label': None, u'file_id': u'459', u'provider': u'generic', u'agenda_provider_agenda_id': None, u'session_title': u'City Council Meeting 02-24-2014', u'type': u'Agenda', u'id': u'389', u'agenda_provider_id': None}, {u'user_id': u'134', u'type_id': u'4', u'url': u'https://ompnetwork.s3-us-west-2.amazonaws.com/sites/134/documents/minutes_151.pdf', u'storage': u'attachment', u'session_id': u'377', u'label': None, u'file_id': u'460', u'provider': u'generic', u'agenda_provider_agenda_id': None, u'session_title': u'City Council Meeting 02-24-2014', u'type': u'Minutes', u'id': u'390', u'agenda_provider_id': None}]"
379,3902,"[12, 13, 16]","Eugene Police Commission Meeting April 11, 2013","Eugene Police Commission Meeting April 11, 2013",,0,,134.0,2017-07-17,2013-04-11,2017-07-20,REdvQhnkL40,https://youtu.be/REdvQhnkL40,45.0,Police Commission,1691.0,https://ompnetwork.s3-us-west-2.amazonaws.com/sites/134/documents/2013_04_11_pc_packet_0.pdf,"[{u'livestream': u'0', u'position': u'0', u'user_id': u'134', u'id': u'45', u'label': u'Police Commission'}]","[{u'user_id': u'134', u'type_id': u'1', u'url': u'https://ompnetwork.s3-us-west-2.amazonaws.com/sites/134/documents/2013_04_11_pc_packet_0.pdf', u'storage': u'attachment', u'session_id': u'3902', u'label': None, u'file_id': u'1851', u'provider': u'generic', u'agenda_provider_agenda_id': None, u'session_title': u'Eugene Police Commission Meeting April 11, 2013', u'type': u'Agenda', u'id': u'1691', u'agenda_provider_id': None}]"
380,828,"[8, 11, 16, 18]",Planning Commission 01-24-2011,Planning Commission 01-24-2011,,0,shows/planning-commission-01-24-2011,134.0,2011-01-24,2011-01-24,2017-03-20,zLWO4FM0pLM,https://www.youtube.com/watch?v=zLWO4FM0pLM,22.0,Planning Commission,1105.0,https://ompnetwork.s3-us-west-2.amazonaws.com/sites/134/documents/agenda_13_0.pdf,"[{u'livestream': u'1', u'position': u'-9', u'user_id': u'134', u'id': u'22', u'label': u'Planning Commission'}]","[{u'user_id': u'134', u'type_id': u'1', u'url': u'https://ompnetwork.s3-us-west-2.amazonaws.com/sites/134/documents/agenda_13_0.pdf', u'storage': u'attachment', u'session_id': u'828', u'label': None, u'file_id': u'1176', u'provider': u'generic', u'agenda_provider_agenda_id': None, u'session_title': u'Planning Commission 01-24-2011', u'type': u'Agenda', u'id': u'1105', u'agenda_provider_id': None}]"
381,23290,"[6, 9, 12, 13, 18]",Basalt Council Special Meeting 10/04/16,Basalt Council Special Meeting 10/04/16,,0,,296.0,2016-10-04,2016-10-04,2018-01-17,mdbayEt3x0g,https://www.youtube.com/watch?v=mdbayEt3x0g,197.0,Town Council,5010.0,https://ompnetwork.s3-us-west-2.amazonaws.com/sites/296/documents/council_agenda_10-04-16.pdf?7RHHfRvyMLWApNAmPkT2RVrJHFoKDltu,"[{u'livestream': u'1', u'position': u'0', u'user_id': u'296', u'id': u'197', u'label': u'Town Council'}]","[{u'user_id': u'296', u'type_id': u'1', u'url': u'https://ompnetwork.s3-us-west-2.amazonaws.com/sites/296/documents/council_agenda_10-04-16.pdf?7RHHfRvyMLWApNAmPkT2RVrJHFoKDltu', u'storage': u'attachment', u'session_id': u'23290', u'label': None, u'file_id': u'4424', u'provider': u'generic', u'agenda_provider_agenda_id': None, u'session_title': u'Basalt Council Special Meeting 10/04/16', u'type': u'Agenda', u'id': u'5010', u'agenda_provider_id': None}]"
382,345,"[10, 11, 13, 16, 18]",City Council Work Session 06-25-2014,City Council Work Session 06-25-2014,,0,shows/city-council-work-session-06-25-2014,134.0,2014-06-25,2014-06-25,2017-03-20,DNw-aYA1xps,https://www.youtube.com/watch?v=DNw-aYA1xps,20.0,City Council,331.0,https://ompnetwork.s3-us-west-2.amazonaws.com/sites/134/documents/agenda_packet_77.pdf,"[{u'livestream': u'1', u'position': u'-10', u'user_id': u'134', u'id': u'20', u'label': u'City Council'}]","[{u'user_id': u'134', u'type_id': u'1', u'url': u'https://ompnetwork.s3-us-west-2.amazonaws.com/sites/134/documents/agenda_packet_77.pdf', u'storage': u'attachment', u'session_id': u'345', u'label': None, u'file_id': u'401', u'provider': u'generic', u'agenda_provider_agenda_id': None, u'session_title': u'City Council Work Session 06-25-2014', u'type': u'Agenda', u'id': u'331', u'agenda_provider_id': None}, {u'user_id': u'134', u'type_id': u'4', u'url': u'https://ompnetwork.s3-us-west-2.amazonaws.com/sites/134/documents/minutes_120.pdf', u'storage': u'attachment', u'session_id': u'345', u'label': None, u'file_id': u'402', u'provider': u'generic', u'agenda_provider_agenda_id': None, u'session_title': u'City Council Work Session 06-25-2014', u'type': u'Minutes', u'id': u'332', u'agenda_provider_id': None}]"
383,743,"[0, 1, 3, 10, 13]",City Council Meeting 05-09-2011,City Council Meeting 05-09-2011,,0,shows/city-council-meeting-05-09-2011,134.0,2011-05-09,2011-05-09,2017-03-20,IPl9wmDMzEs,https://www.youtube.com/watch?v=IPl9wmDMzEs,20.0,City Council,983.0,https://ompnetwork.s3-us-west-2.amazonaws.com/sites/134/documents/agenda_165.pdf,"[{u'livestream': u'1', u'position': u'-10', u'user_id': u'134', u'id': u'20', u'label': u'City Council'}]","[{u'user_id': u'134', u'type_id': u'1', u'url': u'https://ompnetwork.s3-us-west-2.amazonaws.com/sites/134/documents/agenda_165.pdf', u'storage': u'attachment', u'session_id': u'743', u'label': None, u'file_id': u'1054', u'provider': u'generic', u'agenda_provider_agenda_id': None, u'session_title': u'City Council Meeting 05-09-2011', u'type': u'Agenda', u'id': u'983', u'agenda_provider_id': None}, {u'user_id': u'134', u'type_id': u'4', u'url': u'https://ompnetwork.s3-us-west-2.amazonaws.com/sites/134/documents/minutes_223.pdf', u'storage': u'attachment', u'session_id': u'743', u'label': None, u'file_id': u'1055', u'provider': u'generic', u'agenda_provider_agenda_id': None, u'session_title': u'City Council Meeting 05-09-2011', u'type': u'Minutes', u'id': u'984', u'agenda_provider_id': None}]"
384,838,"[2, 13, 17, 19]",City Council Work Session 10-11-2010,City Council Work Session 10-11-2010,,0,shows/city-council-work-session-10-11-2010,134.0,2010-10-11,2010-10-11,2017-03-20,uBqnKcU-zTg,https://www.youtube.com/watch?v=uBqnKcU-zTg,20.0,City Council,1124.0,https://ompnetwork.s3-us-west-2.amazonaws.com/sites/134/documents/agenda_207.pdf,"[{u'livestream': u'1', u'position': u'-10', u'user_id': u'134', u'id': u'20', u'label': u'City Council'}]","[{u'user_id': u'134', u'type_id': u'1', u'url': u'https://ompnetwork.s3-us-west-2.amazonaws.com/sites/134/documents/agenda_207.pdf', u'storage': u'attachment', u'session_id': u'838', u'label': None, u'file_id': u'1195', u'provider': u'generic', u'agenda_provider_agenda_id': None, u'session_title': u'City Council Work Session 10-11-2010', u'type': u'Agenda', u'id': u'1124', u'agenda_provider_id': None}, {u'user_id': u'134', u'type_id': u'4', u'url': u'https://ompnetwork.s3-us-west-2.amazonaws.com/sites/134/documents/minutes_265.pdf', u'storage': u'attachment', u'session_id': u'838', u'label': None, u'file_id': u'1196', u'provider': u'generic', u'agenda_provider_agenda_id': None, u'session_title': u'City Council Work Session 10-11-2010', u'type': u'Minutes', u'id': u'1125', u'agenda_provider_id': None}]"
385,290,"[0, 4, 12]",City Council Work Session 04-22-2015,City Council Work Session 04-22-2015,,0,shows/city-council-work-session-04-22-2015,134.0,2015-04-22,2015-04-22,2017-03-20,W76HDpF_4AA,https://www.youtube.com/watch?v=W76HDpF_4AA,20.0,City Council,225.0,https://ompnetwork.s3-us-west-2.amazonaws.com/sites/134/documents/agenda_packet_109.pdf,"[{u'livestream': u'1', u'position': u'-10', u'user_id': u'134', u'id': u'20', u'label': u'City Council'}]","[{u'user_id': u'134', u'type_id': u'1', u'url': u'https://ompnetwork.s3-us-west-2.amazonaws.com/sites/134/documents/agenda_packet_109.pdf', u'storage': u'attachment', u'session_id': u'290', u'label': None, u'file_id': u'295', u'provider': u'generic', u'agenda_provider_agenda_id': None, u'session_title': u'City Council Work Session 04-22-2015', u'type': u'Agenda', u'id': u'225', u'agenda_provider_id': None}, {u'user_id': u'134', u'type_id': u'4', u'url': u'https://ompnetwork.s3-us-west-2.amazonaws.com/sites/134/documents/minutes_66.pdf', u'storage': u'attachment', u'session_id': u'290', u'label': None, u'file_id': u'296', u'provider': u'generic', u'agenda_provider_agenda_id': None, u'session_title': u'City Council Work Session 04-22-2015', u'type': u'Minutes', u'id': u'226', u'agenda_provider_id': None}]"
386,831,"[11, 14, 16, 18]",City Council Work Session 10-27-2010,City Council Work Session 10-27-2010,,0,shows/city-council-work-session-10-27-2010,134.0,2010-10-27,2010-10-27,2017-03-20,O7xBQGj7lo4,https://www.youtube.com/watch?v=O7xBQGj7lo4,20.0,City Council,1110.0,https://ompnetwork.s3-us-west-2.amazonaws.com/sites/134/documents/agenda_200.pdf,"[{u'livestream': u'1', u'position': u'-10', u'user_id': u'134', u'id': u'20', u'label': u'City Council'}]","[{u'user_id': u'134', u'type_id': u'1', u'url': u'https://ompnetwork.s3-us-west-2.amazonaws.com/sites/134/documents/agenda_200.pdf', u'storage': u'attachment', u'session_id': u'831', u'label': None, u'file_id': u'1181', u'provider': u'generic', u'agenda_provider_agenda_id': None, u'session_title': u'City Council Work Session 10-27-2010', u'type': u'Agenda', u'id': u'1110', u'agenda_provider_id': None}, {u'user_id': u'134', u'type_id': u'4', u'url': u'https://ompnetwork.s3-us-west-2.amazonaws.com/sites/134/documents/minutes_258.pdf', u'storage': u'attachment', u'session_id': u'831', u'label': None, u'file_id': u'1182', u'provider': u'generic', u'agenda_provider_agenda_id': None, u'session_title': u'City Council Work Session 10-27-2010', u'type': u'Minutes', u'id': u'1111', u'agenda_provider_id': None}]"
387,468,"[4, 11, 12, 18, 19]",City Council Work Session 02-27-2013,City Council Work Session 02-27-2013,,0,shows/city-council-work-session-02-27-2013,134.0,2013-02-27,2013-02-27,2017-03-20,NTCG7flQ0nY,https://www.youtube.com/watch?v=NTCG7flQ0nY,20.0,City Council,561.0,https://ompnetwork.s3-us-west-2.amazonaws.com/sites/134/documents/agenda_29.pdf,"[{u'livestream': u'1', u'position': u'-10', u'user_id': u'134', u'id': u'20', u'label': u'City Council'}]","[{u'user_id': u'134', u'type_id': u'1', u'url': u'https://ompnetwork.s3-us-west-2.amazonaws.com/sites/134/documents/agenda_29.pdf', u'storage': u'attachment', u'session_id': u'468', u'label': None, u'file_id': u'631', u'provider': u'generic', u'agenda_provider_agenda_id': None, u'session_title': u'City Council Work Session 02-27-2013', u'type': u'Agenda', u'id': u'561', u'agenda_provider_id': None}, {u'user_id': u'134', u'type_id': u'4', u'url': u'https://ompnetwork.s3-us-west-2.amazonaws.com/sites/134/documents/minutes_28_0.pdf', u'storage': u'attachment', u'session_id': u'468', u'label': None, u'file_id': u'632', u'provider': u'generic', u'agenda_provider_agenda_id': None, u'session_title': u'City Council Work Session 02-27-2013', u'type': u'Minutes', u'id': u'562', u'agenda_provider_id': None}]"
388,3259,[],"The City of Thornton: Your Family, Your Friends, Your Future ","The City of Thornton: Your Family, Your Friends, Your Future ","<p>This is a video highlighting why the city of Thornton, Colorado as a great place to live, work and play.</p>
",0,,186.0,2013-07-09,2013-07-09,2017-07-11,JNITf2fbhSI,http://www.youtube.com/watch?feature=player_detailpage&v=JNITf2fbhSI,60.0,Local Interest,,,"[{u'livestream': u'0', u'position': u'-8', u'user_id': u'186', u'id': u'60', u'label': u'Local Interest'}]",
389,13980,"[0, 3, 10, 12]","Thornton City Council Meeting - August 8, 2017","Thornton City Council Meeting - August 8, 2017","To access the closed caption information associated with this video, click the CC icon in the lower right corner of the video player.

View more information on Thornton's City Council&nbsp;<a href=""http://www.cityofthornton.net/government/city-council/Pages/default.aspx"">here.</a>
",0,,186.0,2017-08-08,2017-08-08,2017-08-22,VF7HsNXtBos,https://www.youtube.com/watch?v=VF7HsNXtBos,58.0,City Council Meeting,3756.0,https://docs.google.com/document/d/1kN5SMjckf8MlGKE7pLJLAQA-llWO_OHJUv5OEj5d2zE/pub,"[{u'livestream': u'1', u'position': u'-10', u'user_id': u'186', u'id': u'58', u'label': u'City Council Meeting'}]","[{u'user_id': u'186', u'type_id': u'1', u'url': u'https://docs.google.com/document/d/1kN5SMjckf8MlGKE7pLJLAQA-llWO_OHJUv5OEj5d2zE/pub', u'storage': u'external', u'session_id': u'13980', u'label': None, u'file_id': None, u'provider': u'om_googledrive', u'agenda_provider_agenda_id': None, u'session_title': u'Thornton City Council Meeting - August 8, 2017', u'type': u'Agenda', u'id': u'3756', u'agenda_provider_id': None}]"
390,3857,"[4, 12, 13, 16]","Eugene Police Commission Meeting January 9, 2014","Eugene Police Commission Meeting January 9, 2014",,0,,134.0,2017-07-16,2014-01-09,2017-07-17,rGb3mp631Og,https://youtu.be/rGb3mp631Og,45.0,Police Commission,1683.0,https://ompnetwork.s3-us-west-2.amazonaws.com/sites/134/documents/meeting_january.pdf,"[{u'livestream': u'0', u'position': u'0', u'user_id': u'134', u'id': u'45', u'label': u'Police Commission'}]","[{u'user_id': u'134', u'type_id': u'1', u'url': u'https://ompnetwork.s3-us-west-2.amazonaws.com/sites/134/documents/meeting_january.pdf', u'storage': u'attachment', u'session_id': u'3857', u'label': None, u'file_id': u'1842', u'provider': u'generic', u'agenda_provider_agenda_id': None, u'session_title': u'Eugene Police Commission Meeting January 9, 2014', u'type': u'Agenda', u'id': u'1683', u'agenda_provider_id': None}]"
391,2516,"[0, 5, 12, 19]","Board of Commissioners Morning Meeting: January 13, 2017","Board of Commissioners Morning Meeting: January 13, 2017",,0,,143.0,2017-05-10,2015-01-13,2017-05-10,TpXQKCokJ7w,https://www.youtube.com/watch?v=TpXQKCokJ7w,25.0,Board of County Commissioners,,,"[{u'livestream': u'1', u'position': u'0', u'user_id': u'143', u'id': u'25', u'label': u'Board of County Commissioners'}]",
392,15060,"[3, 12]","Thornton360 - September 27, 2017","Thornton360 - September 27, 2017","<p>Thornton360 is produced by the city of Thornton after each city council meeting, recapping the latest meeting and keeping residents informed about important news, issues and events happening in our community.</p>

<p>http://www.cityofthornton.tv</p>
",0,,186.0,2017-09-28,2017-09-27,2017-10-12,v5tBHlspeAQ,https://www.youtube.com/watch?v=v5tBHlspeAQ,59.0,Thornton360,,,"[{u'livestream': u'0', u'position': u'-9', u'user_id': u'186', u'id': u'59', u'label': u'Thornton360'}]",
393,9524,"[12, 13, 16, 18]",City Council - 6/9/2015,City Council - 6/9/2015,,0,,199.0,2015-06-09,2015-06-09,2017-08-02,Q2B-euURCOg,https://www.youtube.com/watch?v=Q2B-euURCOg,69.0,Council,3148.0,https://ompnetwork.s3-us-west-2.amazonaws.com/sites/199/granicus_files/1486_calendar_1433829600.pdf,"[{u'livestream': u'1', u'position': u'0', u'user_id': u'199', u'id': u'69', u'label': u'Council'}]","[{u'user_id': u'199', u'type_id': u'3', u'url': u'https://ompnetwork.s3-us-west-2.amazonaws.com/sites/199/granicus_files/1486_calendar_1433829600.pdf', u'storage': u'external', u'session_id': u'9524', u'label': None, u'file_id': None, u'provider': u'generic', u'agenda_provider_agenda_id': None, u'session_title': u'City Council - 6/9/2015', u'type': u'Calendar', u'id': u'3148', u'agenda_provider_id': None}]"
394,262,"[2, 9, 11, 18, 19]",City Council Work Session 09-16-2015,City Council Work Session 09-16-2015,,0,shows/city-council-work-session-09-16-2015,134.0,2015-09-16,2015-09-16,2017-03-20,a1AuWyZ3DuQ,https://www.youtube.com/watch?v=a1AuWyZ3DuQ,20.0,City Council,173.0,https://ompnetwork.s3-us-west-2.amazonaws.com/sites/134/documents/agenda_packet_63.pdf,"[{u'livestream': u'1', u'position': u'-10', u'user_id': u'134', u'id': u'20', u'label': u'City Council'}]","[{u'user_id': u'134', u'type_id': u'1', u'url': u'https://ompnetwork.s3-us-west-2.amazonaws.com/sites/134/documents/agenda_packet_63.pdf', u'storage': u'attachment', u'session_id': u'262', u'label': None, u'file_id': u'243', u'provider': u'generic', u'agenda_provider_agenda_id': None, u'session_title': u'City Council Work Session 09-16-2015', u'type': u'Agenda', u'id': u'173', u'agenda_provider_id': None}, {u'user_id': u'134', u'type_id': u'4', u'url': u'https://ompnetwork.s3-us-west-2.amazonaws.com/sites/134/documents/minutes_43.pdf', u'storage': u'attachment', u'session_id': u'262', u'label': None, u'file_id': u'244', u'provider': u'generic', u'agenda_provider_agenda_id': None, u'session_title': u'City Council Work Session 09-16-2015', u'type': u'Minutes', u'id': u'174', u'agenda_provider_id': None}]"
395,818,"[13, 14, 16]",City Council Work Session 12-13-2010,City Council Work Session 12-13-2010,,0,shows/city-council-work-session-12-13-2010,134.0,2010-12-13,2010-12-13,2017-03-20,nTxSfoTGkxs,https://www.youtube.com/watch?v=nTxSfoTGkxs,20.0,City Council,1088.0,https://ompnetwork.s3-us-west-2.amazonaws.com/sites/134/documents/agenda_191.pdf,"[{u'livestream': u'1', u'position': u'-10', u'user_id': u'134', u'id': u'20', u'label': u'City Council'}]","[{u'user_id': u'134', u'type_id': u'1', u'url': u'https://ompnetwork.s3-us-west-2.amazonaws.com/sites/134/documents/agenda_191.pdf', u'storage': u'attachment', u'session_id': u'818', u'label': None, u'file_id': u'1159', u'provider': u'generic', u'agenda_provider_agenda_id': None, u'session_title': u'City Council Work Session 12-13-2010', u'type': u'Agenda', u'id': u'1088', u'agenda_provider_id': None}, {u'user_id': u'134', u'type_id': u'4', u'url': u'https://ompnetwork.s3-us-west-2.amazonaws.com/sites/134/documents/minutes_249.pdf', u'storage': u'attachment', u'session_id': u'818', u'label': None, u'file_id': u'1160', u'provider': u'generic', u'agenda_provider_agenda_id': None, u'session_title': u'City Council Work Session 12-13-2010', u'type': u'Minutes', u'id': u'1089', u'agenda_provider_id': None}]"
396,15691,[3],"Thornton City Council Meeting - October 24, 2017","Thornton City Council Meeting - October 24, 2017","To access the closed caption information associated with this video, click the CC icon in the lower right corner of the video player.

View more information on Thornton's City Council&nbsp;<a href=""http://www.cityofthornton.net/government/city-council/Pages/default.aspx"">here.</a>
",0,,186.0,2017-10-24,2017-10-24,2017-10-25,soWRgDdfRZE,https://www.youtube.com/watch?v=soWRgDdfRZE,58.0,City Council Meeting,4220.0,https://docs.google.com/document/d/e/2PACX-1vQAgbWOrulvUnI7kGkcN-7oPBr4gEFCOvbrSzvpOpZrtEDAU9DMuem5mpE4s-n0v4Ot_4Rl1x0k99qr/pub,"[{u'livestream': u'1', u'position': u'-10', u'user_id': u'186', u'id': u'58', u'label': u'City Council Meeting'}]","[{u'user_id': u'186', u'type_id': u'1', u'url': u'https://docs.google.com/document/d/e/2PACX-1vQAgbWOrulvUnI7kGkcN-7oPBr4gEFCOvbrSzvpOpZrtEDAU9DMuem5mpE4s-n0v4Ot_4Rl1x0k99qr/pub', u'storage': u'external', u'session_id': u'15691', u'label': None, u'file_id': None, u'provider': u'om_googledrive', u'agenda_provider_agenda_id': None, u'session_title': u'Thornton City Council Meeting - October 24, 2017', u'type': u'Agenda', u'id': u'4220', u'agenda_provider_id': None}]"
397,20141,"[0, 1, 12, 13, 18]",USD 345 November Board Meeting,USD 345 November Board Meeting,,0,,244.0,2017-11-09,2017-11-09,2017-11-09,EWpK8Pc3J24,https://youtu.be/EWpK8Pc3J24,99.0,Board Meetings,,,"[{u'livestream': u'1', u'position': u'0', u'user_id': u'244', u'id': u'99', u'label': u'Board Meetings'}]",
398,464,"[0, 1, 9, 13, 19]",City Council Meeting 04-08-2013,City Council Meeting 04-08-2013,,0,shows/city-council-meeting-04-08-2013,134.0,2013-04-08,2013-04-08,2017-03-20,vrquZrCp-3k,https://www.youtube.com/watch?v=vrquZrCp-3k,20.0,City Council,553.0,https://ompnetwork.s3-us-west-2.amazonaws.com/sites/134/documents/agenda_25.pdf,"[{u'livestream': u'1', u'position': u'-10', u'user_id': u'134', u'id': u'20', u'label': u'City Council'}]","[{u'user_id': u'134', u'type_id': u'1', u'url': u'https://ompnetwork.s3-us-west-2.amazonaws.com/sites/134/documents/agenda_25.pdf', u'storage': u'attachment', u'session_id': u'464', u'label': None, u'file_id': u'623', u'provider': u'generic', u'agenda_provider_agenda_id': None, u'session_title': u'City Council Meeting 04-08-2013', u'type': u'Agenda', u'id': u'553', u'agenda_provider_id': None}, {u'user_id': u'134', u'type_id': u'4', u'url': u'https://ompnetwork.s3-us-west-2.amazonaws.com/sites/134/documents/minutes_24_0.pdf', u'storage': u'attachment', u'session_id': u'464', u'label': None, u'file_id': u'624', u'provider': u'generic', u'agenda_provider_agenda_id': None, u'session_title': u'City Council Meeting 04-08-2013', u'type': u'Minutes', u'id': u'554', u'agenda_provider_id': None}]"
399,860,"[11, 16, 18]",City Council Work Session 06-16-2010,City Council Work Session 06-16-2010,,0,shows/city-council-work-session-06-16-2010,134.0,2010-06-16,2010-06-16,2017-03-20,JAIYyV9Hu1k,https://www.youtube.com/watch?v=JAIYyV9Hu1k,20.0,City Council,1166.0,https://ompnetwork.s3-us-west-2.amazonaws.com/sites/134/documents/agenda_228.pdf,"[{u'livestream': u'1', u'position': u'-10', u'user_id': u'134', u'id': u'20', u'label': u'City Council'}]","[{u'user_id': u'134', u'type_id': u'1', u'url': u'https://ompnetwork.s3-us-west-2.amazonaws.com/sites/134/documents/agenda_228.pdf', u'storage': u'attachment', u'session_id': u'860', u'label': None, u'file_id': u'1237', u'provider': u'generic', u'agenda_provider_agenda_id': None, u'session_title': u'City Council Work Session 06-16-2010', u'type': u'Agenda', u'id': u'1166', u'agenda_provider_id': None}, {u'user_id': u'134', u'type_id': u'4', u'url': u'https://ompnetwork.s3-us-west-2.amazonaws.com/sites/134/documents/minutes_286.pdf', u'storage': u'attachment', u'session_id': u'860', u'label': None, u'file_id': u'1238', u'provider': u'generic', u'agenda_provider_agenda_id': None, u'session_title': u'City Council Work Session 06-16-2010', u'type': u'Minutes', u'id': u'1167', u'agenda_provider_id': None}]"
400,2517,"[12, 19]","Board of Commissioners Morning Meeting: January 27, 2015","Board of Commissioners Morning Meeting: January 27, 2015",,0,,143.0,2017-05-10,2015-01-27,2017-05-10,_0Ja6IXmDtY,https://www.youtube.com/watch?v=_0Ja6IXmDtY,25.0,Board of County Commissioners,,,"[{u'livestream': u'1', u'position': u'0', u'user_id': u'143', u'id': u'25', u'label': u'Board of County Commissioners'}]",
401,3418,"[1, 2, 17]","Thornton360 - June 15, 2016","Thornton360 - June 15, 2016","<p>Thornton360 is produced by the city of Thornton after each city council meeting, recapping the latest meeting and keeping residents informed about important news, issues and events happening in our community.</p>

<p><a href=""http://www.cityofthornton.tv/"" style=""color: rgb(51, 149, 210);"">www.cityofthornton.tv</a></p>
",0,,186.0,2016-06-15,2016-06-15,2017-07-11,U32Xd61sHN8,https://youtu.be/U32Xd61sHN8,59.0,Thornton360,,,"[{u'livestream': u'0', u'position': u'-9', u'user_id': u'186', u'id': u'59', u'label': u'Thornton360'}]",
402,2530,"[12, 13, 18]","Board of Commissioners Morning Meeting: March 3, 2015","Board of Commissioners Morning Meeting: March 3, 2015",,0,,143.0,2017-05-10,2015-03-03,2017-05-10,WC2MWlEyywg,https://www.youtube.com/watch?v=WC2MWlEyywg,25.0,Board of County Commissioners,,,"[{u'livestream': u'1', u'position': u'0', u'user_id': u'143', u'id': u'25', u'label': u'Board of County Commissioners'}]",
403,620,"[5, 15, 17]",City Council Work Session 02-27-2012,City Council Work Session 02-27-2012,,0,shows/city-council-work-session-02-27-2012,134.0,2012-02-27,2012-02-27,2017-03-20,_YuCGPEPi1Q,https://www.youtube.com/watch?v=_YuCGPEPi1Q,20.0,City Council,795.0,https://ompnetwork.s3-us-west-2.amazonaws.com/sites/134/documents/agenda_127.pdf,"[{u'livestream': u'1', u'position': u'-10', u'user_id': u'134', u'id': u'20', u'label': u'City Council'}]","[{u'user_id': u'134', u'type_id': u'1', u'url': u'https://ompnetwork.s3-us-west-2.amazonaws.com/sites/134/documents/agenda_127.pdf', u'storage': u'attachment', u'session_id': u'620', u'label': None, u'file_id': u'866', u'provider': u'generic', u'agenda_provider_agenda_id': None, u'session_title': u'City Council Work Session 02-27-2012', u'type': u'Agenda', u'id': u'795', u'agenda_provider_id': None}, {u'user_id': u'134', u'type_id': u'4', u'url': u'https://ompnetwork.s3-us-west-2.amazonaws.com/sites/134/documents/minutes_109_0.pdf', u'storage': u'attachment', u'session_id': u'620', u'label': None, u'file_id': u'867', u'provider': u'generic', u'agenda_provider_agenda_id': None, u'session_title': u'City Council Work Session 02-27-2012', u'type': u'Minutes', u'id': u'796', u'agenda_provider_id': None}]"
404,3252,"[11, 12]",Thornton Medical Edge - June 2013,Thornton Medical Edge - June 2013,"<p>Thornton Medical Edge June 13</p>

<p>Medical Edge from Mayo Clinic is a collection of television segments covering medical advances and compelling general health topics. &nbsp;</p>

<p>This months stories are: Alzheimers 101, Lynch Syndrome, Shopping For Childrens Shoes and Coated Asprin.</p>

<p>More information on these and other health topics can be found at <a href=""http://www.medicaledge.org"" style=""text-decoration:none;"">www.medicaledge.org</a>.</p>

<p>&nbsp;</p>
",0,,186.0,2013-06-06,2013-06-06,2017-07-11,nKjJt8b9xSI,http://www.youtube.com/watch?feature=player_detailpage&v=nKjJt8b9xSI,61.0,Health and Safety,,,"[{u'livestream': u'0', u'position': u'-7', u'user_id': u'186', u'id': u'61', u'label': u'Health and Safety'}]",
405,900,"[13, 16, 18]",City Council Work Session 01-27-2010,City Council Work Session 01-27-2010,,0,shows/city-council-work-session-01-27-2010,134.0,2010-01-27,2010-01-27,2017-03-20,xhk4FRaTBh0,https://www.youtube.com/watch?v=xhk4FRaTBh0,20.0,City Council,1245.0,https://ompnetwork.s3-us-west-2.amazonaws.com/sites/134/documents/agenda_257.pdf,"[{u'livestream': u'1', u'position': u'-10', u'user_id': u'134', u'id': u'20', u'label': u'City Council'}]","[{u'user_id': u'134', u'type_id': u'1', u'url': u'https://ompnetwork.s3-us-west-2.amazonaws.com/sites/134/documents/agenda_257.pdf', u'storage': u'attachment', u'session_id': u'900', u'label': None, u'file_id': u'1316', u'provider': u'generic', u'agenda_provider_agenda_id': None, u'session_title': u'City Council Work Session 01-27-2010', u'type': u'Agenda', u'id': u'1245', u'agenda_provider_id': None}, {u'user_id': u'134', u'type_id': u'4', u'url': u'https://ompnetwork.s3-us-west-2.amazonaws.com/sites/134/documents/minutes_316.pdf', u'storage': u'attachment', u'session_id': u'900', u'label': None, u'file_id': u'1317', u'provider': u'generic', u'agenda_provider_agenda_id': None, u'session_title': u'City Council Work Session 01-27-2010', u'type': u'Minutes', u'id': u'1246', u'agenda_provider_id': None}]"
406,302,"[0, 8]",City Council Work Session 02-09-2015,City Council Work Session 02-09-2015,,0,shows/city-council-work-session-02-09-2015,134.0,2015-02-09,2015-02-09,2017-03-20,8N3S6NTKUqI,https://www.youtube.com/watch?v=8N3S6NTKUqI,20.0,City Council,247.0,https://ompnetwork.s3-us-west-2.amazonaws.com/sites/134/documents/agenda_packet_129.pdf,"[{u'livestream': u'1', u'position': u'-10', u'user_id': u'134', u'id': u'20', u'label': u'City Council'}]","[{u'user_id': u'134', u'type_id': u'1', u'url': u'https://ompnetwork.s3-us-west-2.amazonaws.com/sites/134/documents/agenda_packet_129.pdf', u'storage': u'attachment', u'session_id': u'302', u'label': None, u'file_id': u'317', u'provider': u'generic', u'agenda_provider_agenda_id': None, u'session_title': u'City Council Work Session 02-09-2015', u'type': u'Agenda', u'id': u'247', u'agenda_provider_id': None}, {u'user_id': u'134', u'type_id': u'4', u'url': u'https://ompnetwork.s3-us-west-2.amazonaws.com/sites/134/documents/minutes_79.pdf', u'storage': u'attachment', u'session_id': u'302', u'label': None, u'file_id': u'318', u'provider': u'generic', u'agenda_provider_agenda_id': None, u'session_title': u'City Council Work Session 02-09-2015', u'type': u'Minutes', u'id': u'248', u'agenda_provider_id': None}]"
407,16346,"[0, 11, 18]",Pitkin County BOCC Work Session - 02/24/15,Pitkin County BOCC Work Session - 02/24/15,,0,,273.0,2015-02-24,2015-02-24,2017-10-30,BQnOJthJkSM,https://www.youtube.com/watch?v=BQnOJthJkSM,148.0,2015,4291.0,https://ompnetwork.s3-us-west-2.amazonaws.com/sites/273/granicus_files/614_calendar_1424761200.html,"[{u'livestream': u'0', u'position': u'-7', u'user_id': u'273', u'id': u'148', u'label': u'2015'}]","[{u'user_id': u'273', u'type_id': u'3', u'url': u'https://ompnetwork.s3-us-west-2.amazonaws.com/sites/273/granicus_files/614_calendar_1424761200.html', u'storage': u'external', u'session_id': u'16346', u'label': None, u'file_id': None, u'provider': u'generic', u'agenda_provider_agenda_id': None, u'session_title': u'Pitkin County BOCC Work Session - 02/24/15', u'type': u'Calendar', u'id': u'4291', u'agenda_provider_id': None}]"
408,801,"[6, 7]",Planning Commission  10-03-2011,Planning Commission  10-03-2011,,0,shows/planning-commission-10-03-2011,134.0,2011-10-03,2011-10-03,2017-03-20,uo5nEIJEQlU,https://www.youtube.com/watch?v=uo5nEIJEQlU,22.0,Planning Commission,1065.0,https://ompnetwork.s3-us-west-2.amazonaws.com/sites/134/documents/agenda_28_0.pdf,"[{u'livestream': u'1', u'position': u'-9', u'user_id': u'134', u'id': u'22', u'label': u'Planning Commission'}]","[{u'user_id': u'134', u'type_id': u'1', u'url': u'https://ompnetwork.s3-us-west-2.amazonaws.com/sites/134/documents/agenda_28_0.pdf', u'storage': u'attachment', u'session_id': u'801', u'label': None, u'file_id': u'1136', u'provider': u'generic', u'agenda_provider_agenda_id': None, u'session_title': u'Planning Commission  10-03-2011', u'type': u'Agenda', u'id': u'1065', u'agenda_provider_id': None}]"
409,352,"[14, 18, 19]",City Council Work Session 06-09-2014,City Council Work Session 06-09-2014,,0,shows/city-council-work-session-06-09-2014,134.0,2014-06-09,2014-06-09,2017-03-20,o3HOfKYndNY,https://www.youtube.com/watch?v=o3HOfKYndNY,20.0,City Council,343.0,https://ompnetwork.s3-us-west-2.amazonaws.com/sites/134/documents/agenda_packet_108.pdf,"[{u'livestream': u'1', u'position': u'-10', u'user_id': u'134', u'id': u'20', u'label': u'City Council'}]","[{u'user_id': u'134', u'type_id': u'1', u'url': u'https://ompnetwork.s3-us-west-2.amazonaws.com/sites/134/documents/agenda_packet_108.pdf', u'storage': u'attachment', u'session_id': u'352', u'label': None, u'file_id': u'413', u'provider': u'generic', u'agenda_provider_agenda_id': None, u'session_title': u'City Council Work Session 06-09-2014', u'type': u'Agenda', u'id': u'343', u'agenda_provider_id': None}, {u'user_id': u'134', u'type_id': u'4', u'url': u'https://ompnetwork.s3-us-west-2.amazonaws.com/sites/134/documents/minutes_128.pdf', u'storage': u'attachment', u'session_id': u'352', u'label': None, u'file_id': u'414', u'provider': u'generic', u'agenda_provider_agenda_id': None, u'session_title': u'City Council Work Session 06-09-2014', u'type': u'Minutes', u'id': u'344', u'agenda_provider_id': None}]"
410,188,[10],City Council Meeting 07-25-2016,City Council Meeting 07-25-2016,,0,shows/city-council-meeting-07-25-2016,134.0,2016-07-25,2016-07-25,2017-04-24,D5JWPNLpkRU,https://www.youtube.com/watch?v=D5JWPNLpkRU,20.0,City Council,35.0,https://ompnetwork.s3-us-west-2.amazonaws.com/sites/134/documents/agenda_0_0.pdf,"[{u'livestream': u'1', u'position': u'-10', u'user_id': u'134', u'id': u'20', u'label': u'City Council'}]","[{u'user_id': u'134', u'type_id': u'1', u'url': u'https://ompnetwork.s3-us-west-2.amazonaws.com/sites/134/documents/agenda_0_0.pdf', u'storage': u'attachment', u'session_id': u'188', u'label': None, u'file_id': u'105', u'provider': u'generic', u'agenda_provider_agenda_id': None, u'session_title': u'City Council Meeting 07-25-2016', u'type': u'Agenda', u'id': u'35', u'agenda_provider_id': None}, {u'user_id': u'134', u'type_id': u'4', u'url': u'https://ompnetwork.s3-us-west-2.amazonaws.com/sites/134/documents/160725.wsandmeeting.sire_.pdf', u'storage': u'attachment', u'session_id': u'188', u'label': None, u'file_id': u'1628', u'provider': u'generic', u'agenda_provider_agenda_id': None, u'session_title': u'City Council Meeting 07-25-2016', u'type': u'Minutes', u'id': u'1490', u'agenda_provider_id': None}]"
411,322,"[3, 14, 18]",City Council Work Session 10-22-2014,City Council Work Session 10-22-2014,,0,shows/city-council-work-session-10-22-2014,134.0,2014-10-22,2014-10-22,2017-03-20,XAZzxzmJzHw,https://www.youtube.com/watch?v=XAZzxzmJzHw,20.0,City Council,287.0,https://ompnetwork.s3-us-west-2.amazonaws.com/sites/134/documents/agenda_packet_164.pdf,"[{u'livestream': u'1', u'position': u'-10', u'user_id': u'134', u'id': u'20', u'label': u'City Council'}]","[{u'user_id': u'134', u'type_id': u'1', u'url': u'https://ompnetwork.s3-us-west-2.amazonaws.com/sites/134/documents/agenda_packet_164.pdf', u'storage': u'attachment', u'session_id': u'322', u'label': None, u'file_id': u'357', u'provider': u'generic', u'agenda_provider_agenda_id': None, u'session_title': u'City Council Work Session 10-22-2014', u'type': u'Agenda', u'id': u'287', u'agenda_provider_id': None}, {u'user_id': u'134', u'type_id': u'4', u'url': u'https://ompnetwork.s3-us-west-2.amazonaws.com/sites/134/documents/minutes_96.pdf', u'storage': u'attachment', u'session_id': u'322', u'label': None, u'file_id': u'358', u'provider': u'generic', u'agenda_provider_agenda_id': None, u'session_title': u'City Council Work Session 10-22-2014', u'type': u'Minutes', u'id': u'288', u'agenda_provider_id': None}]"
412,259,"[3, 6, 7]",City Council Public Hearing 09-21-2015,City Council Public Hearing 09-21-2015,,0,shows/city-council-public-hearing-09-21-2015,134.0,2015-09-21,2015-09-21,2017-03-20,v1ZRfaoASVE,https://www.youtube.com/watch?v=v1ZRfaoASVE,20.0,City Council,,,"[{u'livestream': u'1', u'position': u'-10', u'user_id': u'134', u'id': u'20', u'label': u'City Council'}]",
413,3449,"[0, 1, 2, 3, 8, 10, 13]","Thornton360 - July 27, 2016","Thornton360 - July 27, 2016","<p>Thornton360 is produced by the city of Thornton after each city council meeting, recapping the latest meeting and keeping residents informed about important news, issues and events happening in our community.</p>

<p><a href=""http://www.cityofthornton.tv/"" style=""color: rgb(51, 149, 210);"">www.cityofthornton.tv</a></p>
",0,,186.0,2016-07-27,2016-07-27,2017-07-11,AbN6wFLclx4,https://www.youtube.com/watch?v=AbN6wFLclx4&feature=youtu.be,59.0,Thornton360,,,"[{u'livestream': u'0', u'position': u'-9', u'user_id': u'186', u'id': u'59', u'label': u'Thornton360'}]",
414,3356,"[2, 12]","Thornton360 Water Special - April 15, 2015","Thornton360 Water Special - April 15, 2015","<p>Thornton360 is produced by the city of Thornton after each city council meeting, recapping the latest meeting and keeping residents informed about important news, issues and events happening in our community.</p>

<p><a href=""http://www.cityofthornton.tv/"" style=""color: rgb(51, 149, 210);"">www.cityofthornton.tv</a></p>
",0,,186.0,2015-04-15,2015-04-15,2017-07-11,Nh8atJgD9hc,https://www.youtube.com/watch?v=Nh8atJgD9hc,59.0,Thornton360,,,"[{u'livestream': u'0', u'position': u'-9', u'user_id': u'186', u'id': u'59', u'label': u'Thornton360'}]",
415,8575,[0],Licensing Authority  - 04/09/14,Licensing Authority  - 04/09/14,,0,,199.0,2014-04-09,2014-04-09,2017-08-01,jXE6s8i8250,https://www.youtube.com/watch?v=jXE6s8i8250,71.0,Licensing,2802.0,https://ompnetwork.s3-us-west-2.amazonaws.com/sites/199/granicus_files/1242_calendar_1397023200.html,"[{u'livestream': u'1', u'position': u'0', u'user_id': u'199', u'id': u'71', u'label': u'Licensing'}]","[{u'user_id': u'199', u'type_id': u'3', u'url': u'https://ompnetwork.s3-us-west-2.amazonaws.com/sites/199/granicus_files/1242_calendar_1397023200.html', u'storage': u'external', u'session_id': u'8575', u'label': None, u'file_id': None, u'provider': u'generic', u'agenda_provider_agenda_id': None, u'session_title': u'Licensing Authority  - 04/09/14', u'type': u'Calendar', u'id': u'2802', u'agenda_provider_id': None}]"
416,13050,"[6, 7, 18]",Building Board of Appeals Regular Meeting - 04/19/2017,Building Board of Appeals Regular Meeting - 04/19/2017,,0,,199.0,2017-04-19,2017-04-19,2017-08-02,x-iDjQB0378,https://www.youtube.com/watch?v=x-iDjQB0378,75.0,Appeals,3667.0,https://ompnetwork.s3-us-west-2.amazonaws.com/sites/199/documents/bboa_agenda_041917_0.pdf?cRZ_QDUdB7P4zt1.Yip0_uyP.xyeeJpw,"[{u'livestream': u'0', u'position': u'0', u'user_id': u'199', u'id': u'75', u'label': u'Appeals'}]","[{u'user_id': u'199', u'type_id': u'1', u'url': u'https://ompnetwork.s3-us-west-2.amazonaws.com/sites/199/documents/bboa_agenda_041917_0.pdf?cRZ_QDUdB7P4zt1.Yip0_uyP.xyeeJpw', u'storage': u'attachment', u'session_id': u'13050', u'label': None, u'file_id': u'3322', u'provider': u'generic', u'agenda_provider_agenda_id': None, u'session_title': u'Building Board of Appeals Regular Meeting - 04/19/2017', u'type': u'Agenda', u'id': u'3667', u'agenda_provider_id': None}, {u'user_id': u'199', u'type_id': u'4', u'url': u'https://ompnetwork.s3-us-west-2.amazonaws.com/sites/199/documents/bboa_minutes_041917.pdf?ErZwl41wMoW6nJfGntdsb.7YzA0oBgZ7', u'storage': u'attachment', u'session_id': u'13050', u'label': None, u'file_id': u'3323', u'provider': u'generic', u'agenda_provider_agenda_id': None, u'session_title': u'Building Board of Appeals Regular Meeting - 04/19/2017', u'type': u'Minutes', u'id': u'3668', u'agenda_provider_id': None}, {u'user_id': u'199', u'type_id': u'5', u'url': u'https://ompnetwork.s3-us-west-2.amazonaws.com/sites/199/documents/bboa_packet_041917.pdf?4mR3TIV5bLYMlRJLMhQXjgg9sGv1pjfX', u'storage': u'attachment', u'session_id': u'13050', u'label': None, u'file_id': u'3324', u'provider': u'generic', u'agenda_provider_agenda_id': None, u'session_title': u'Building Board of Appeals Regular Meeting - 04/19/2017', u'type': u'Packet', u'id': u'3669', u'agenda_provider_id': None}]"
417,496,[16],City Council Meeting 01-07-2013,City Council Meeting 01-07-2013,,0,shows/city-council-meeting-01-07-2013,134.0,2013-01-07,2013-01-07,2017-03-20,LW5k8dq08uA,https://www.youtube.com/watch?v=LW5k8dq08uA,20.0,City Council,607.0,https://ompnetwork.s3-us-west-2.amazonaws.com/sites/134/documents/agenda_48.pdf,"[{u'livestream': u'1', u'position': u'-10', u'user_id': u'134', u'id': u'20', u'label': u'City Council'}]","[{u'user_id': u'134', u'type_id': u'1', u'url': u'https://ompnetwork.s3-us-west-2.amazonaws.com/sites/134/documents/agenda_48.pdf', u'storage': u'attachment', u'session_id': u'496', u'label': None, u'file_id': u'677', u'provider': u'generic', u'agenda_provider_agenda_id': None, u'session_title': u'City Council Meeting 01-07-2013', u'type': u'Agenda', u'id': u'607', u'agenda_provider_id': None}, {u'user_id': u'134', u'type_id': u'4', u'url': u'https://ompnetwork.s3-us-west-2.amazonaws.com/sites/134/documents/minutes_45_0.pdf', u'storage': u'attachment', u'session_id': u'496', u'label': None, u'file_id': u'678', u'provider': u'generic', u'agenda_provider_agenda_id': None, u'session_title': u'City Council Meeting 01-07-2013', u'type': u'Minutes', u'id': u'608', u'agenda_provider_id': None}]"
418,3890,"[7, 13, 16]","Eugene Police Commission Meeting April 14, 2016","Eugene Police Commission Meeting April 14, 2016",,0,,134.0,2017-07-17,2016-04-14,2017-07-18,0lwZDUXZsFU,https://youtu.be/0lwZDUXZsFU,45.0,Police Commission,1733.0,https://ompnetwork.s3-us-west-2.amazonaws.com/sites/134/documents/eugene_police_commission_agenda_packet_april_14_2016.pdf?ToCKFRfdeKtHH82MMscDmUAbWSOZxHBd,"[{u'livestream': u'0', u'position': u'0', u'user_id': u'134', u'id': u'45', u'label': u'Police Commission'}]","[{u'user_id': u'134', u'type_id': u'1', u'url': u'https://ompnetwork.s3-us-west-2.amazonaws.com/sites/134/documents/eugene_police_commission_agenda_packet_april_14_2016.pdf?ToCKFRfdeKtHH82MMscDmUAbWSOZxHBd', u'storage': u'attachment', u'session_id': u'3890', u'label': None, u'file_id': u'1887', u'provider': u'generic', u'agenda_provider_agenda_id': None, u'session_title': u'Eugene Police Commission Meeting April 14, 2016', u'type': u'Agenda', u'id': u'1733', u'agenda_provider_id': None}]"
419,3338,"[0, 1, 5, 13, 15, 16]",Off the Page - December 2014,Off the Page - December 2014,"<p>Colorado authors talking about the stories behind the stories, and their new book releases.</p>
",0,,186.0,2014-12-01,2014-12-01,2017-07-11,V0j1VFpAmco,https://www.youtube.com/watch?feature=player_detailpage&v=V0j1VFpAmco,60.0,Local Interest,,,"[{u'livestream': u'0', u'position': u'-8', u'user_id': u'186', u'id': u'60', u'label': u'Local Interest'}]",
420,327,"[9, 11, 15, 16, 18]",City Council Work Session 10-13-2014,City Council Work Session 10-13-2014,,0,shows/city-council-work-session-10-13-2014,134.0,2014-10-13,2014-10-13,2017-03-20,QVO9C0EQGzQ,https://www.youtube.com/watch?v=QVO9C0EQGzQ,20.0,City Council,297.0,https://ompnetwork.s3-us-west-2.amazonaws.com/sites/134/documents/agenda_packet_172.pdf,"[{u'livestream': u'1', u'position': u'-10', u'user_id': u'134', u'id': u'20', u'label': u'City Council'}]","[{u'user_id': u'134', u'type_id': u'1', u'url': u'https://ompnetwork.s3-us-west-2.amazonaws.com/sites/134/documents/agenda_packet_172.pdf', u'storage': u'attachment', u'session_id': u'327', u'label': None, u'file_id': u'367', u'provider': u'generic', u'agenda_provider_agenda_id': None, u'session_title': u'City Council Work Session 10-13-2014', u'type': u'Agenda', u'id': u'297', u'agenda_provider_id': None}, {u'user_id': u'134', u'type_id': u'4', u'url': u'https://ompnetwork.s3-us-west-2.amazonaws.com/sites/134/documents/minutes_103.pdf', u'storage': u'attachment', u'session_id': u'327', u'label': None, u'file_id': u'368', u'provider': u'generic', u'agenda_provider_agenda_id': None, u'session_title': u'City Council Work Session 10-13-2014', u'type': u'Minutes', u'id': u'298', u'agenda_provider_id': None}]"
421,554,"[8, 12, 13, 16]",City Council Work Session 07-11-2012,City Council Work Session 07-11-2012,,0,shows/city-council-work-session-07-11-2012,134.0,2012-07-11,2012-07-11,2017-03-20,i8Qn9gpSaGk,https://www.youtube.com/watch?v=i8Qn9gpSaGk,20.0,City Council,693.0,https://ompnetwork.s3-us-west-2.amazonaws.com/sites/134/documents/agenda_92.pdf,"[{u'livestream': u'1', u'position': u'-10', u'user_id': u'134', u'id': u'20', u'label': u'City Council'}]","[{u'user_id': u'134', u'type_id': u'1', u'url': u'https://ompnetwork.s3-us-west-2.amazonaws.com/sites/134/documents/agenda_92.pdf', u'storage': u'attachment', u'session_id': u'554', u'label': None, u'file_id': u'764', u'provider': u'generic', u'agenda_provider_agenda_id': None, u'session_title': u'City Council Work Session 07-11-2012', u'type': u'Agenda', u'id': u'693', u'agenda_provider_id': None}]"
422,543,"[13, 18]",City Council Work Session 09-10-2012,City Council Work Session 09-10-2012,,0,shows/city-council-work-session-09-10-2012,134.0,2012-09-10,2012-09-10,2017-03-20,v7zkM30IMIM,https://www.youtube.com/watch?v=v7zkM30IMIM,20.0,City Council,677.0,https://ompnetwork.s3-us-west-2.amazonaws.com/sites/134/documents/agenda_84.pdf,"[{u'livestream': u'1', u'position': u'-10', u'user_id': u'134', u'id': u'20', u'label': u'City Council'}]","[{u'user_id': u'134', u'type_id': u'1', u'url': u'https://ompnetwork.s3-us-west-2.amazonaws.com/sites/134/documents/agenda_84.pdf', u'storage': u'attachment', u'session_id': u'543', u'label': None, u'file_id': u'748', u'provider': u'generic', u'agenda_provider_agenda_id': None, u'session_title': u'City Council Work Session 09-10-2012', u'type': u'Agenda', u'id': u'677', u'agenda_provider_id': None}, {u'user_id': u'134', u'type_id': u'4', u'url': u'https://ompnetwork.s3-us-west-2.amazonaws.com/sites/134/documents/minutes_73_0.pdf', u'storage': u'attachment', u'session_id': u'543', u'label': None, u'file_id': u'749', u'provider': u'generic', u'agenda_provider_agenda_id': None, u'session_title': u'City Council Work Session 09-10-2012', u'type': u'Minutes', u'id': u'678', u'agenda_provider_id': None}]"
423,563,"[0, 13, 16]",City Council Work Session 06-25-2012,City Council Work Session 06-25-2012,,0,shows/city-council-work-session-06-25-2012,134.0,2012-06-25,2012-06-25,2017-03-20,WLsTdBs5V7c,https://www.youtube.com/watch?v=WLsTdBs5V7c,20.0,City Council,706.0,https://ompnetwork.s3-us-west-2.amazonaws.com/sites/134/documents/agenda_97.pdf,"[{u'livestream': u'1', u'position': u'-10', u'user_id': u'134', u'id': u'20', u'label': u'City Council'}]","[{u'user_id': u'134', u'type_id': u'1', u'url': u'https://ompnetwork.s3-us-west-2.amazonaws.com/sites/134/documents/agenda_97.pdf', u'storage': u'attachment', u'session_id': u'563', u'label': None, u'file_id': u'777', u'provider': u'generic', u'agenda_provider_agenda_id': None, u'session_title': u'City Council Work Session 06-25-2012', u'type': u'Agenda', u'id': u'706', u'agenda_provider_id': None}, {u'user_id': u'134', u'type_id': u'4', u'url': u'https://ompnetwork.s3-us-west-2.amazonaws.com/sites/134/documents/minutes_82_0.pdf', u'storage': u'attachment', u'session_id': u'563', u'label': None, u'file_id': u'778', u'provider': u'generic', u'agenda_provider_agenda_id': None, u'session_title': u'City Council Work Session 06-25-2012', u'type': u'Minutes', u'id': u'707', u'agenda_provider_id': None}]"
424,10922,[6],Licensing Authority Regular Meeting - 06/08/2016,Licensing Authority Regular Meeting - 06/08/2016,,0,,199.0,2016-06-08,2016-06-08,2017-08-02,jFJPjsQjN_I,https://www.youtube.com/watch?v=jFJPjsQjN_I,71.0,Licensing,3453.0,https://ompnetwork.s3-us-west-2.amazonaws.com/sites/199/documents/06-08-2016_licensing_authority_agenda.pdf?VxJiJJ3X4M4EymyDCwpA932UYdpASvFh,"[{u'livestream': u'1', u'position': u'0', u'user_id': u'199', u'id': u'71', u'label': u'Licensing'}]","[{u'user_id': u'199', u'type_id': u'1', u'url': u'https://ompnetwork.s3-us-west-2.amazonaws.com/sites/199/documents/06-08-2016_licensing_authority_agenda.pdf?VxJiJJ3X4M4EymyDCwpA932UYdpASvFh', u'storage': u'attachment', u'session_id': u'10922', u'label': None, u'file_id': u'3108', u'provider': u'generic', u'agenda_provider_agenda_id': None, u'session_title': u'Licensing Authority Regular Meeting - 06/08/2016', u'type': u'Agenda', u'id': u'3453', u'agenda_provider_id': None}, {u'user_id': u'199', u'type_id': u'5', u'url': u'https://ompnetwork.s3-us-west-2.amazonaws.com/sites/199/documents/06-08-2016_licensing_authority_meeting_documents.pdf?qfpa5NBkscq4HpRO3i3RtUcu2waK56oY', u'storage': u'attachment', u'session_id': u'10922', u'label': None, u'file_id': u'3109', u'provider': u'generic', u'agenda_provider_agenda_id': None, u'session_title': u'Licensing Authority Regular Meeting - 06/08/2016', u'type': u'Packet', u'id': u'3454', u'agenda_provider_id': None}]"
425,2803,"[0, 11, 12, 18]","Lane County Budget Committee Meeting: May 25, 2017","Lane County Budget Committee Meeting: May 25, 2017",,0,,143.0,2017-05-24,2017-05-24,2017-05-26,je3LXBkRE8g,https://www.youtube.com/watch?v=je3LXBkRE8g,28.0,Budget Committee,1549.0,https://ompnetwork.s3-us-west-2.amazonaws.com/sites/143/documents/05_23-24_17agenda_1.pdf,"[{u'livestream': u'1', u'position': u'0', u'user_id': u'143', u'id': u'28', u'label': u'Budget Committee'}]","[{u'user_id': u'143', u'type_id': u'1', u'url': u'https://ompnetwork.s3-us-west-2.amazonaws.com/sites/143/documents/05_23-24_17agenda_1.pdf', u'storage': u'attachment', u'session_id': u'2803', u'label': None, u'file_id': u'1706', u'provider': u'generic', u'agenda_provider_agenda_id': None, u'session_title': u'Lane County Budget Committee Meeting: May 25, 2017', u'type': u'Agenda', u'id': u'1549', u'agenda_provider_id': None}]"
426,901,"[0, 3, 7, 13, 15, 16]",City Council Meeting and Meeting of the Eugene URA 01-25-2010,City Council Meeting and Meeting of the Eugene URA 01-25-2010,,0,shows/city-council-meeting-and-meeting-eugene-ura-01-25-2010,134.0,2010-01-25,2010-01-25,2017-03-20,PLmDB4w8wTc,https://www.youtube.com/watch?v=PLmDB4w8wTc,20.0,City Council,1247.0,https://ompnetwork.s3-us-west-2.amazonaws.com/sites/134/documents/agenda_258.pdf,"[{u'livestream': u'1', u'position': u'-10', u'user_id': u'134', u'id': u'20', u'label': u'City Council'}]","[{u'user_id': u'134', u'type_id': u'1', u'url': u'https://ompnetwork.s3-us-west-2.amazonaws.com/sites/134/documents/agenda_258.pdf', u'storage': u'attachment', u'session_id': u'901', u'label': None, u'file_id': u'1318', u'provider': u'generic', u'agenda_provider_agenda_id': None, u'session_title': u'City Council Meeting and Meeting of the Eugene URA 01-25-2010', u'type': u'Agenda', u'id': u'1247', u'agenda_provider_id': None}]"
427,231,"[7, 18]",City Council Work Session 01-25-2016,City Council Work Session 01-25-2016,,0,shows/city-council-work-session-01-25-2016,134.0,2016-01-25,2016-01-25,2017-03-20,Ow3Fkd8JN5w,https://www.youtube.com/watch?v=Ow3Fkd8JN5w,20.0,City Council,117.0,https://ompnetwork.s3-us-west-2.amazonaws.com/sites/134/documents/agenda_10.pdf,"[{u'livestream': u'1', u'position': u'-10', u'user_id': u'134', u'id': u'20', u'label': u'City Council'}]","[{u'user_id': u'134', u'type_id': u'1', u'url': u'https://ompnetwork.s3-us-west-2.amazonaws.com/sites/134/documents/agenda_10.pdf', u'storage': u'attachment', u'session_id': u'231', u'label': None, u'file_id': u'187', u'provider': u'generic', u'agenda_provider_agenda_id': None, u'session_title': u'City Council Work Session 01-25-2016', u'type': u'Agenda', u'id': u'117', u'agenda_provider_id': None}, {u'user_id': u'134', u'type_id': u'4', u'url': u'https://ompnetwork.s3-us-west-2.amazonaws.com/sites/134/documents/minutes_18_0.pdf', u'storage': u'attachment', u'session_id': u'231', u'label': None, u'file_id': u'188', u'provider': u'generic', u'agenda_provider_agenda_id': None, u'session_title': u'City Council Work Session 01-25-2016', u'type': u'Minutes', u'id': u'118', u'agenda_provider_id': None}]"
428,21674,"[2, 16]",Town Board of New Castle Work Session & Meeting 12/19/17,Town Board of New Castle Work Session & Meeting 12/19/17,,0,,281.0,2017-12-20,2017-12-19,2017-12-21,Gr9dpQKpjtg,https://youtu.be/Gr9dpQKpjtg,158.0,Town of New Castle Board Meetings,4883.0,https://ompnetwork.s3-us-west-2.amazonaws.com/sites/281/documents/newtown_board_work_session_12.19.17.pdf?Nlob8y21tCpIhec3USoon2yurMTBxlD0,"[{u'livestream': u'0', u'position': u'-10', u'user_id': u'281', u'id': u'158', u'label': u'Town of New Castle Board Meetings'}]","[{u'user_id': u'281', u'type_id': u'1', u'url': u'https://ompnetwork.s3-us-west-2.amazonaws.com/sites/281/documents/newtown_board_work_session_12.19.17.pdf?Nlob8y21tCpIhec3USoon2yurMTBxlD0', u'storage': u'attachment', u'session_id': u'21674', u'label': None, u'file_id': u'4262', u'provider': u'generic', u'agenda_provider_agenda_id': None, u'session_title': u'Town Board of New Castle Work Session & Meeting 12/19/17', u'type': u'Agenda', u'id': u'4883', u'agenda_provider_id': None}]"
429,398,"[12, 16, 17, 19]",City Council Work Session 11-27-2013,City Council Work Session 11-27-2013,,0,shows/city-council-work-session-11-27-2013,134.0,2013-11-27,2013-11-27,2017-03-20,swZFVJUHP5o,https://www.youtube.com/watch?v=swZFVJUHP5o,20.0,City Council,427.0,https://ompnetwork.s3-us-west-2.amazonaws.com/sites/134/documents/agenda_packet_210.pdf,"[{u'livestream': u'1', u'position': u'-10', u'user_id': u'134', u'id': u'20', u'label': u'City Council'}]","[{u'user_id': u'134', u'type_id': u'1', u'url': u'https://ompnetwork.s3-us-west-2.amazonaws.com/sites/134/documents/agenda_packet_210.pdf', u'storage': u'attachment', u'session_id': u'398', u'label': None, u'file_id': u'497', u'provider': u'generic', u'agenda_provider_agenda_id': None, u'session_title': u'City Council Work Session 11-27-2013', u'type': u'Agenda', u'id': u'427', u'agenda_provider_id': None}, {u'user_id': u'134', u'type_id': u'4', u'url': u'https://ompnetwork.s3-us-west-2.amazonaws.com/sites/134/documents/minutes_166.pdf', u'storage': u'attachment', u'session_id': u'398', u'label': None, u'file_id': u'498', u'provider': u'generic', u'agenda_provider_agenda_id': None, u'session_title': u'City Council Work Session 11-27-2013', u'type': u'Minutes', u'id': u'428', u'agenda_provider_id': None}]"
430,639,"[16, 17, 18]",City Council Work Session 01-18-2012,City Council Work Session 01-18-2012,,0,shows/city-council-work-session-01-18-2012,134.0,2012-01-18,2012-01-18,2017-03-20,p5VCEoZS1LI,https://www.youtube.com/watch?v=p5VCEoZS1LI,20.0,City Council,823.0,https://ompnetwork.s3-us-west-2.amazonaws.com/sites/134/documents/agenda_139.pdf,"[{u'livestream': u'1', u'position': u'-10', u'user_id': u'134', u'id': u'20', u'label': u'City Council'}]","[{u'user_id': u'134', u'type_id': u'1', u'url': u'https://ompnetwork.s3-us-west-2.amazonaws.com/sites/134/documents/agenda_139.pdf', u'storage': u'attachment', u'session_id': u'639', u'label': None, u'file_id': u'894', u'provider': u'generic', u'agenda_provider_agenda_id': None, u'session_title': u'City Council Work Session 01-18-2012', u'type': u'Agenda', u'id': u'823', u'agenda_provider_id': None}, {u'user_id': u'134', u'type_id': u'4', u'url': u'https://ompnetwork.s3-us-west-2.amazonaws.com/sites/134/documents/minutes_119_0.pdf', u'storage': u'attachment', u'session_id': u'639', u'label': None, u'file_id': u'895', u'provider': u'generic', u'agenda_provider_agenda_id': None, u'session_title': u'City Council Work Session 01-18-2012', u'type': u'Minutes', u'id': u'824', u'agenda_provider_id': None}]"
431,871,"[1, 2, 4, 17]",City Council Work Session 05-19-2010,City Council Work Session 05-19-2010,,0,shows/city-council-work-session-05-19-2010,134.0,2010-05-19,2010-05-19,2017-03-20,g3_1hJTwEoU,https://www.youtube.com/watch?v=g3_1hJTwEoU,20.0,City Council,1188.0,https://ompnetwork.s3-us-west-2.amazonaws.com/sites/134/documents/agenda_235.pdf,"[{u'livestream': u'1', u'position': u'-10', u'user_id': u'134', u'id': u'20', u'label': u'City Council'}]","[{u'user_id': u'134', u'type_id': u'1', u'url': u'https://ompnetwork.s3-us-west-2.amazonaws.com/sites/134/documents/agenda_235.pdf', u'storage': u'attachment', u'session_id': u'871', u'label': None, u'file_id': u'1259', u'provider': u'generic', u'agenda_provider_agenda_id': None, u'session_title': u'City Council Work Session 05-19-2010', u'type': u'Agenda', u'id': u'1188', u'agenda_provider_id': None}, {u'user_id': u'134', u'type_id': u'4', u'url': u'https://ompnetwork.s3-us-west-2.amazonaws.com/sites/134/documents/minutes_293.pdf', u'storage': u'attachment', u'session_id': u'871', u'label': None, u'file_id': u'1260', u'provider': u'generic', u'agenda_provider_agenda_id': None, u'session_title': u'City Council Work Session 05-19-2010', u'type': u'Minutes', u'id': u'1189', u'agenda_provider_id': None}]"
432,239,"[1, 5, 8, 10, 11, 13, 17]",City Council Work Session 12-14-2015,City Council Work Session 12-14-2015,,0,shows/city-council-work-session-12-14-2015,134.0,2015-12-14,2015-12-14,2017-03-20,R5VFJ2GGEss,https://www.youtube.com/watch?v=R5VFJ2GGEss,20.0,City Council,131.0,https://ompnetwork.s3-us-west-2.amazonaws.com/sites/134/documents/agenda_packet_9_0.pdf,"[{u'livestream': u'1', u'position': u'-10', u'user_id': u'134', u'id': u'20', u'label': u'City Council'}]","[{u'user_id': u'134', u'type_id': u'1', u'url': u'https://ompnetwork.s3-us-west-2.amazonaws.com/sites/134/documents/agenda_packet_9_0.pdf', u'storage': u'attachment', u'session_id': u'239', u'label': None, u'file_id': u'201', u'provider': u'generic', u'agenda_provider_agenda_id': None, u'session_title': u'City Council Work Session 12-14-2015', u'type': u'Agenda', u'id': u'131', u'agenda_provider_id': None}, {u'user_id': u'134', u'type_id': u'4', u'url': u'https://ompnetwork.s3-us-west-2.amazonaws.com/sites/134/documents/minutes_26.pdf', u'storage': u'attachment', u'session_id': u'239', u'label': None, u'file_id': u'202', u'provider': u'generic', u'agenda_provider_agenda_id': None, u'session_title': u'City Council Work Session 12-14-2015', u'type': u'Minutes', u'id': u'132', u'agenda_provider_id': None}]"
433,893,"[13, 16, 17, 19]",City Council Work Session 02-22-2010,City Council Work Session 02-22-2010,,0,shows/city-council-work-session-02-22-2010,134.0,2010-02-22,2010-02-22,2017-03-20,dQwOIumc1h8,https://www.youtube.com/watch?v=dQwOIumc1h8,20.0,City Council,1231.0,https://ompnetwork.s3-us-west-2.amazonaws.com/sites/134/documents/agenda_251.pdf,"[{u'livestream': u'1', u'position': u'-10', u'user_id': u'134', u'id': u'20', u'label': u'City Council'}]","[{u'user_id': u'134', u'type_id': u'1', u'url': u'https://ompnetwork.s3-us-west-2.amazonaws.com/sites/134/documents/agenda_251.pdf', u'storage': u'attachment', u'session_id': u'893', u'label': None, u'file_id': u'1302', u'provider': u'generic', u'agenda_provider_agenda_id': None, u'session_title': u'City Council Work Session 02-22-2010', u'type': u'Agenda', u'id': u'1231', u'agenda_provider_id': None}, {u'user_id': u'134', u'type_id': u'4', u'url': u'https://ompnetwork.s3-us-west-2.amazonaws.com/sites/134/documents/minutes_310.pdf', u'storage': u'attachment', u'session_id': u'893', u'label': None, u'file_id': u'1303', u'provider': u'generic', u'agenda_provider_agenda_id': None, u'session_title': u'City Council Work Session 02-22-2010', u'type': u'Minutes', u'id': u'1232', u'agenda_provider_id': None}]"
434,19827,"[1, 2, 5, 12, 15, 16, 17, 19]",Town Board of New Castle Work Session 10/24/17,Town Board of New Castle Work Session 10/24/17,,0,,281.0,2017-11-01,2017-10-24,2017-11-03,M-oWj-lU1OA,https://youtu.be/M-oWj-lU1OA,159.0,Town Board of New Castle Work Sessions,4684.0,https://ompnetwork.s3-us-west-2.amazonaws.com/sites/281/documents/10.24.17_town_boardwork_session.pdf?cmrQo5r91NtMoJeO6BAxq8.AqM4HDyMa,"[{u'livestream': u'0', u'position': u'-9', u'user_id': u'281', u'id': u'159', u'label': u'Town Board of New Castle Work Sessions'}]","[{u'user_id': u'281', u'type_id': u'1', u'url': u'https://ompnetwork.s3-us-west-2.amazonaws.com/sites/281/documents/10.24.17_town_boardwork_session.pdf?cmrQo5r91NtMoJeO6BAxq8.AqM4HDyMa', u'storage': u'attachment', u'session_id': u'19827', u'label': None, u'file_id': u'3982', u'provider': u'generic', u'agenda_provider_agenda_id': None, u'session_title': u'Town Board of New Castle Work Session 10/24/17', u'type': u'Agenda', u'id': u'4684', u'agenda_provider_id': None}]"
435,3888,"[13, 16]","Eugene Police Commission Meeting April 9, 2015","Eugene Police Commission Meeting April 9, 2015",,0,,134.0,2017-07-17,2015-04-09,2017-07-17,_fb4lhGeSLE,https://youtu.be/_fb4lhGeSLE,45.0,Police Commission,1664.0,https://ompnetwork.s3-us-west-2.amazonaws.com/sites/134/documents/police_commission_packet_apr_rn3638.pdf,"[{u'livestream': u'0', u'position': u'0', u'user_id': u'134', u'id': u'45', u'label': u'Police Commission'}]","[{u'user_id': u'134', u'type_id': u'1', u'url': u'https://ompnetwork.s3-us-west-2.amazonaws.com/sites/134/documents/police_commission_packet_apr_rn3638.pdf', u'storage': u'attachment', u'session_id': u'3888', u'label': None, u'file_id': u'1824', u'provider': u'generic', u'agenda_provider_agenda_id': None, u'session_title': u'Eugene Police Commission Meeting April 9, 2015', u'type': u'Agenda', u'id': u'1664', u'agenda_provider_id': None}]"
436,8730,"[2, 6, 13, 16]",Licensing Authority - 03/09/11,Licensing Authority - 03/09/11,,0,,199.0,2011-03-09,2011-03-09,2017-08-01,Y9IfLk0vjMI,https://www.youtube.com/watch?v=Y9IfLk0vjMI,71.0,Licensing,2910.0,https://ompnetwork.s3-us-west-2.amazonaws.com/sites/199/documents/lla_agenda_03-09-2011.pdf?AA2KCUS9XKasll7KrEHx2bAF_xwE1Cdv,"[{u'livestream': u'1', u'position': u'0', u'user_id': u'199', u'id': u'71', u'label': u'Licensing'}]","[{u'user_id': u'199', u'type_id': u'1', u'url': u'https://ompnetwork.s3-us-west-2.amazonaws.com/sites/199/documents/lla_agenda_03-09-2011.pdf?AA2KCUS9XKasll7KrEHx2bAF_xwE1Cdv', u'storage': u'attachment', u'session_id': u'8730', u'label': None, u'file_id': u'2707', u'provider': u'generic', u'agenda_provider_agenda_id': None, u'session_title': u'Licensing Authority - 03/09/11', u'type': u'Agenda', u'id': u'2910', u'agenda_provider_id': None}, {u'user_id': u'199', u'type_id': u'3', u'url': u'https://ompnetwork.s3-us-west-2.amazonaws.com/sites/199/granicus_files/620_calendar_1299654000.html', u'storage': u'external', u'session_id': u'8730', u'label': None, u'file_id': None, u'provider': u'generic', u'agenda_provider_agenda_id': None, u'session_title': u'Licensing Authority - 03/09/11', u'type': u'Calendar', u'id': u'2911', u'agenda_provider_id': None}, {u'user_id': u'199', u'type_id': u'2', u'url': u'https://ompnetwork.s3-us-west-2.amazonaws.com/sites/199/documents/lla_journal_03-09-2011.pdf?LniU7fY5nS5P8GoaDd7gxPH7e9cPMWJ1', u'storage': u'attachment', u'session_id': u'8730', u'label': None, u'file_id': u'2708', u'provider': u'generic', u'agenda_provider_agenda_id': None, u'session_title': u'Licensing Authority - 03/09/11', u'type': u'Journal', u'id': u'2912', u'agenda_provider_id': None}, {u'user_id': u'199', u'type_id': u'5', u'url': u'https://ompnetwork.s3-us-west-2.amazonaws.com/sites/199/documents/lla_packet_03-09-2011.pdf?JYenmpAMHunFov6S5ZfkpWmNS5YEyM0u', u'storage': u'attachment', u'session_id': u'8730', u'label': None, u'file_id': u'2709', u'provider': u'generic', u'agenda_provider_agenda_id': None, u'session_title': u'Licensing Authority - 03/09/11', u'type': u'Packet', u'id': u'2913', u'agenda_provider_id': None}]"
437,3322,"[2, 8, 13, 14, 18, 19]","Thornton360 - July 23, 2014","Thornton360 - July 23, 2014","<p>Thornton360 is produced by the city of Thornton after each city council meeting, recapping the latest meeting and keeping residents informed about important news, issues and events happening in our community.</p>

<p><a href=""http://www.cityofthornton.tv/"" style=""color: rgb(51, 149, 210);"">www.cityofthornton.tv</a></p>

<p>&nbsp;</p>
",0,,186.0,2014-07-23,2014-07-23,2017-07-11,YO7HvAINGf8,https://www.youtube.com/watch?feature=player_detailpage&v=YO7HvAINGf8,59.0,Thornton360,,,"[{u'livestream': u'0', u'position': u'-9', u'user_id': u'186', u'id': u'59', u'label': u'Thornton360'}]",
438,20101,"[0, 12, 13]",Town Board of New Castle Work Session 11/8/17,Town Board of New Castle Work Session 11/8/17,,0,,281.0,2017-11-08,2017-11-08,2017-11-10,ZHrC-iGVcKQ,https://youtu.be/ZHrC-iGVcKQ,159.0,Town Board of New Castle Work Sessions,4725.0,https://ompnetwork.s3-us-west-2.amazonaws.com/sites/281/documents/town_board_work_session_11.08.172.pdf?XXr0fhgNiefMBB1CMKT0zq49S4NxtJfN,"[{u'livestream': u'0', u'position': u'-9', u'user_id': u'281', u'id': u'159', u'label': u'Town Board of New Castle Work Sessions'}]","[{u'user_id': u'281', u'type_id': u'1', u'url': u'https://ompnetwork.s3-us-west-2.amazonaws.com/sites/281/documents/town_board_work_session_11.08.172.pdf?XXr0fhgNiefMBB1CMKT0zq49S4NxtJfN', u'storage': u'attachment', u'session_id': u'20101', u'label': None, u'file_id': u'4057', u'provider': u'generic', u'agenda_provider_agenda_id': None, u'session_title': u'Town Board of New Castle Work Session 11/8/17', u'type': u'Agenda', u'id': u'4725', u'agenda_provider_id': None}]"
439,651,"[7, 13, 16, 17]",City Council Work Session 12-12-2011,City Council Work Session 12-12-2011,,0,shows/city-council-work-session-12-12-2011,134.0,2011-12-12,2011-12-12,2017-03-20,GelGtOtqb_0,https://www.youtube.com/watch?v=GelGtOtqb_0,20.0,City Council,841.0,https://ompnetwork.s3-us-west-2.amazonaws.com/sites/134/documents/agenda_42.pdf,"[{u'livestream': u'1', u'position': u'-10', u'user_id': u'134', u'id': u'20', u'label': u'City Council'}]","[{u'user_id': u'134', u'type_id': u'1', u'url': u'https://ompnetwork.s3-us-west-2.amazonaws.com/sites/134/documents/agenda_42.pdf', u'storage': u'attachment', u'session_id': u'651', u'label': None, u'file_id': u'912', u'provider': u'generic', u'agenda_provider_agenda_id': None, u'session_title': u'City Council Work Session 12-12-2011', u'type': u'Agenda', u'id': u'841', u'agenda_provider_id': None}, {u'user_id': u'134', u'type_id': u'4', u'url': u'https://ompnetwork.s3-us-west-2.amazonaws.com/sites/134/documents/minutes_174_0.pdf', u'storage': u'attachment', u'session_id': u'651', u'label': None, u'file_id': u'913', u'provider': u'generic', u'agenda_provider_agenda_id': None, u'session_title': u'City Council Work Session 12-12-2011', u'type': u'Minutes', u'id': u'842', u'agenda_provider_id': None}]"
440,2518,"[11, 19]","Board of Commissioners Afternoon Meeting: January 27, 2015","Board of Commissioners Afternoon Meeting: January 27, 2015",,0,,143.0,2017-05-10,2015-01-27,2017-05-10,0Schqh8wA_Q,https://www.youtube.com/watch?v=0Schqh8wA_Q,25.0,Board of County Commissioners,,,"[{u'livestream': u'1', u'position': u'0', u'user_id': u'143', u'id': u'25', u'label': u'Board of County Commissioners'}]",
441,845,"[5, 16, 19]",City Council Work Session 08-11-2010,City Council Work Session 08-11-2010,,0,shows/city-council-work-session-08-11-2010,134.0,2010-08-11,2010-08-11,2017-03-20,UZGJJgJdOU4,https://www.youtube.com/watch?v=UZGJJgJdOU4,20.0,City Council,1138.0,https://ompnetwork.s3-us-west-2.amazonaws.com/sites/134/documents/agenda_214.pdf,"[{u'livestream': u'1', u'position': u'-10', u'user_id': u'134', u'id': u'20', u'label': u'City Council'}]","[{u'user_id': u'134', u'type_id': u'1', u'url': u'https://ompnetwork.s3-us-west-2.amazonaws.com/sites/134/documents/agenda_214.pdf', u'storage': u'attachment', u'session_id': u'845', u'label': None, u'file_id': u'1209', u'provider': u'generic', u'agenda_provider_agenda_id': None, u'session_title': u'City Council Work Session 08-11-2010', u'type': u'Agenda', u'id': u'1138', u'agenda_provider_id': None}, {u'user_id': u'134', u'type_id': u'4', u'url': u'https://ompnetwork.s3-us-west-2.amazonaws.com/sites/134/documents/minutes_272.pdf', u'storage': u'attachment', u'session_id': u'845', u'label': None, u'file_id': u'1210', u'provider': u'generic', u'agenda_provider_agenda_id': None, u'session_title': u'City Council Work Session 08-11-2010', u'type': u'Minutes', u'id': u'1139', u'agenda_provider_id': None}]"
442,10533,"[3, 6, 11, 17, 19]",LIFT - Special Meeting - 03/30/16,LIFT - Special Meeting - 03/30/16,,0,,199.0,2016-03-30,2016-03-30,2017-08-02,JcyenIfwagI,https://youtu.be/JcyenIfwagI,73.0,LIFT,3423.0,https://ompnetwork.s3-us-west-2.amazonaws.com/sites/199/documents/03-30-2016_agenda.pdf?jLhAMNbEdDIaeDl50_rOdCWmlgXnbEZz,"[{u'livestream': u'0', u'position': u'0', u'user_id': u'199', u'id': u'73', u'label': u'LIFT'}]","[{u'user_id': u'199', u'type_id': u'1', u'url': u'https://ompnetwork.s3-us-west-2.amazonaws.com/sites/199/documents/03-30-2016_agenda.pdf?jLhAMNbEdDIaeDl50_rOdCWmlgXnbEZz', u'storage': u'attachment', u'session_id': u'10533', u'label': None, u'file_id': u'3078', u'provider': u'generic', u'agenda_provider_agenda_id': None, u'session_title': u'LIFT - Special Meeting - 03/30/16', u'type': u'Agenda', u'id': u'3423', u'agenda_provider_id': None}, {u'user_id': u'199', u'type_id': u'5', u'url': u'https://ompnetwork.s3-us-west-2.amazonaws.com/sites/199/documents/03-30-2016_lift_packet_0.pdf?sgEtrPDYuezhudw6QZXJuEq4QP7Ubl4R', u'storage': u'attachment', u'session_id': u'10533', u'label': None, u'file_id': u'3079', u'provider': u'generic', u'agenda_provider_agenda_id': None, u'session_title': u'LIFT - Special Meeting - 03/30/16', u'type': u'Packet', u'id': u'3424', u'agenda_provider_id': None}]"
443,300,"[16, 17, 18, 19]",City Council Work Session 02-11-2015,City Council Work Session 02-11-2015,,0,shows/city-council-work-session-02-11-2015,134.0,2015-02-11,2015-02-11,2017-03-20,uOoNAOnBnCg,https://www.youtube.com/watch?v=uOoNAOnBnCg,20.0,City Council,243.0,https://ompnetwork.s3-us-west-2.amazonaws.com/sites/134/documents/agenda_packet_125.pdf,"[{u'livestream': u'1', u'position': u'-10', u'user_id': u'134', u'id': u'20', u'label': u'City Council'}]","[{u'user_id': u'134', u'type_id': u'1', u'url': u'https://ompnetwork.s3-us-west-2.amazonaws.com/sites/134/documents/agenda_packet_125.pdf', u'storage': u'attachment', u'session_id': u'300', u'label': None, u'file_id': u'313', u'provider': u'generic', u'agenda_provider_agenda_id': None, u'session_title': u'City Council Work Session 02-11-2015', u'type': u'Agenda', u'id': u'243', u'agenda_provider_id': None}, {u'user_id': u'134', u'type_id': u'4', u'url': u'https://ompnetwork.s3-us-west-2.amazonaws.com/sites/134/documents/minutes_77.pdf', u'storage': u'attachment', u'session_id': u'300', u'label': None, u'file_id': u'314', u'provider': u'generic', u'agenda_provider_agenda_id': None, u'session_title': u'City Council Work Session 02-11-2015', u'type': u'Minutes', u'id': u'244', u'agenda_provider_id': None}]"
444,666,"[3, 5, 8, 14, 18]",City Council Work Session 11-14-2011,City Council Work Session 11-14-2011,,0,shows/city-council-work-session-11-14-2011,134.0,2011-11-14,2011-11-14,2017-03-20,61Getuqott8,https://www.youtube.com/watch?v=61Getuqott8,20.0,City Council,864.0,https://ompnetwork.s3-us-west-2.amazonaws.com/sites/134/documents/agenda_60.pdf,"[{u'livestream': u'1', u'position': u'-10', u'user_id': u'134', u'id': u'20', u'label': u'City Council'}]","[{u'user_id': u'134', u'type_id': u'1', u'url': u'https://ompnetwork.s3-us-west-2.amazonaws.com/sites/134/documents/agenda_60.pdf', u'storage': u'attachment', u'session_id': u'666', u'label': None, u'file_id': u'935', u'provider': u'generic', u'agenda_provider_agenda_id': None, u'session_title': u'City Council Work Session 11-14-2011', u'type': u'Agenda', u'id': u'864', u'agenda_provider_id': None}, {u'user_id': u'134', u'type_id': u'4', u'url': u'https://ompnetwork.s3-us-west-2.amazonaws.com/sites/134/documents/minutes_181_0.pdf', u'storage': u'attachment', u'session_id': u'666', u'label': None, u'file_id': u'936', u'provider': u'generic', u'agenda_provider_agenda_id': None, u'session_title': u'City Council Work Session 11-14-2011', u'type': u'Minutes', u'id': u'865', u'agenda_provider_id': None}]"
445,208,"[0, 8, 9, 11, 18]",City Council Meeting 05-09-2016,City Council Meeting 05-09-2016,,0,shows/city-council-meeting-05-09-2016,134.0,2016-05-09,2016-05-09,2017-03-20,--BQ2L9npxo,https://www.youtube.com/watch?v=--BQ2L9npxo,20.0,City Council,74.0,https://ompnetwork.s3-us-west-2.amazonaws.com/sites/134/documents/agenda_6.pdf,"[{u'livestream': u'1', u'position': u'-10', u'user_id': u'134', u'id': u'20', u'label': u'City Council'}]","[{u'user_id': u'134', u'type_id': u'1', u'url': u'https://ompnetwork.s3-us-west-2.amazonaws.com/sites/134/documents/agenda_6.pdf', u'storage': u'attachment', u'session_id': u'208', u'label': None, u'file_id': u'144', u'provider': u'generic', u'agenda_provider_agenda_id': None, u'session_title': u'City Council Meeting 05-09-2016', u'type': u'Agenda', u'id': u'74', u'agenda_provider_id': None}, {u'user_id': u'134', u'type_id': u'4', u'url': u'https://ompnetwork.s3-us-west-2.amazonaws.com/sites/134/documents/minutes_10.pdf', u'storage': u'attachment', u'session_id': u'208', u'label': None, u'file_id': u'145', u'provider': u'generic', u'agenda_provider_agenda_id': None, u'session_title': u'City Council Meeting 05-09-2016', u'type': u'Minutes', u'id': u'75', u'agenda_provider_id': None}]"
446,741,"[2, 14, 17]",City Council Work Session 05-11-2011,City Council Work Session 05-11-2011,,0,shows/city-council-work-session-05-11-2011,134.0,2011-05-11,2011-05-11,2017-03-20,7aDWf5SXOKw,https://www.youtube.com/watch?v=7aDWf5SXOKw,20.0,City Council,980.0,https://ompnetwork.s3-us-west-2.amazonaws.com/sites/134/documents/agenda_164.pdf,"[{u'livestream': u'1', u'position': u'-10', u'user_id': u'134', u'id': u'20', u'label': u'City Council'}]","[{u'user_id': u'134', u'type_id': u'1', u'url': u'https://ompnetwork.s3-us-west-2.amazonaws.com/sites/134/documents/agenda_164.pdf', u'storage': u'attachment', u'session_id': u'741', u'label': None, u'file_id': u'1051', u'provider': u'generic', u'agenda_provider_agenda_id': None, u'session_title': u'City Council Work Session 05-11-2011', u'type': u'Agenda', u'id': u'980', u'agenda_provider_id': None}, {u'user_id': u'134', u'type_id': u'4', u'url': u'https://ompnetwork.s3-us-west-2.amazonaws.com/sites/134/documents/minutes_222.pdf', u'storage': u'attachment', u'session_id': u'741', u'label': None, u'file_id': u'1052', u'provider': u'generic', u'agenda_provider_agenda_id': None, u'session_title': u'City Council Work Session 05-11-2011', u'type': u'Minutes', u'id': u'981', u'agenda_provider_id': None}]"
447,19476,[11],BOCC Work Session  07/18/17,BOCC Work Session  07/18/17,,0,,273.0,2017-07-18,2017-07-18,2017-10-31,jhVgjcXj_ts,https://www.youtube.com/watch?v=jhVgjcXj_ts,150.0,2017,4653.0,https://ompnetwork.s3-us-west-2.amazonaws.com/sites/273/documents/cgtv_7_18_17_.pdf?4lZgX7jGLkHdhn_D6DM1wrlhHsiclXxr,"[{u'livestream': u'0', u'position': u'-9', u'user_id': u'273', u'id': u'150', u'label': u'2017'}]","[{u'user_id': u'273', u'type_id': u'1', u'url': u'https://ompnetwork.s3-us-west-2.amazonaws.com/sites/273/documents/cgtv_7_18_17_.pdf?4lZgX7jGLkHdhn_D6DM1wrlhHsiclXxr', u'storage': u'attachment', u'session_id': u'19476', u'label': None, u'file_id': u'3934', u'provider': u'generic', u'agenda_provider_agenda_id': None, u'session_title': u'BOCC Work Session  07/18/17', u'type': u'Agenda', u'id': u'4653', u'agenda_provider_id': None}]"
448,22913,"[0, 1, 14, 16, 18, 19]",Basalt Council Meeting 03/08/16,Basalt Council Meeting 03/08/16,,0,,296.0,2016-03-08,2016-03-08,2018-01-17,QA4jAkSTd6k,https://www.youtube.com/watch?v=QA4jAkSTd6k,197.0,Town Council,4985.0,https://ompnetwork.s3-us-west-2.amazonaws.com/sites/296/documents/council_agenda_03-08-16.pdf?4JWGWR5l5Ls6GtrALZqocqf6WGsOga50,"[{u'livestream': u'1', u'position': u'0', u'user_id': u'296', u'id': u'197', u'label': u'Town Council'}]","[{u'user_id': u'296', u'type_id': u'1', u'url': u'https://ompnetwork.s3-us-west-2.amazonaws.com/sites/296/documents/council_agenda_03-08-16.pdf?4JWGWR5l5Ls6GtrALZqocqf6WGsOga50', u'storage': u'attachment', u'session_id': u'22913', u'label': None, u'file_id': u'4399', u'provider': u'generic', u'agenda_provider_agenda_id': None, u'session_title': u'Basalt Council Meeting 03/08/16', u'type': u'Agenda', u'id': u'4985', u'agenda_provider_id': None}]"
449,15788,[17],Absolutely Adams - Spring 2017,Absolutely Adams - Spring 2017,"<p>Learn how the county is using an innovative approach and materials to improve conditions on gravel roads. Also, details on Commissioners' Town Hall meetings, a hidden gem on our trail system, new art at Rotella Park and a preview of the 2017 Adams County Fair.</p>
",0,,272.0,2017-10-30,2017-06-09,2017-10-30,TRwpBWgJINI,https://www.youtube.com/watch?v=TRwpBWgJINI,139.0,Absolutely Adams ,,,"[{u'livestream': u'0', u'position': u'0', u'user_id': u'272', u'id': u'139', u'label': u'Absolutely Adams '}]",
450,3847,[],"Toxics Board Meeting October 19, 2011","Toxics Board Meeting October 19, 2011",,0,,134.0,2017-07-15,2011-10-19,2017-07-20,hFGy_uyxzZc,https://youtu.be/hFGy_uyxzZc,46.0,Toxics Board,1802.0,https://ompnetwork.s3-us-west-2.amazonaws.com/sites/134/documents/archive.aspxadid1601?FqQ8RdkcYzO4X4zTqYTQPb0Zto654SW2,"[{u'livestream': u'0', u'position': u'0', u'user_id': u'134', u'id': u'46', u'label': u'Toxics Board'}]","[{u'user_id': u'134', u'type_id': u'1', u'url': u'https://ompnetwork.s3-us-west-2.amazonaws.com/sites/134/documents/archive.aspxadid1601?FqQ8RdkcYzO4X4zTqYTQPb0Zto654SW2', u'storage': u'attachment', u'session_id': u'3847', u'label': None, u'file_id': u'1939', u'provider': u'generic', u'agenda_provider_agenda_id': None, u'session_title': u'Toxics Board Meeting October 19, 2011', u'type': u'Agenda', u'id': u'1802', u'agenda_provider_id': None}]"
451,23687,"[4, 7, 10, 12, 16, 19]",Basalt Council 06/13/17 - Audio is over-modulated,Basalt Council 06/13/17 - Audio is over-modulated,,0,,296.0,2017-06-13,2017-06-13,2018-01-17,fZRHI0teleo,https://www.youtube.com/watch?v=fZRHI0teleo&feature=youtu.be,197.0,Town Council,5029.0,https://ompnetwork.s3-us-west-2.amazonaws.com/sites/296/documents/btc_06-13-17_council_agenda.pdf?FXqxKv2ZCizLz_mZQmw2dBqG2Su43Olg,"[{u'livestream': u'1', u'position': u'0', u'user_id': u'296', u'id': u'197', u'label': u'Town Council'}]","[{u'user_id': u'296', u'type_id': u'1', u'url': u'https://ompnetwork.s3-us-west-2.amazonaws.com/sites/296/documents/btc_06-13-17_council_agenda.pdf?FXqxKv2ZCizLz_mZQmw2dBqG2Su43Olg', u'storage': u'attachment', u'session_id': u'23687', u'label': None, u'file_id': u'4443', u'provider': u'generic', u'agenda_provider_agenda_id': None, u'session_title': u'Basalt Council 06/13/17 - Audio is over-modulated', u'type': u'Agenda', u'id': u'5029', u'agenda_provider_id': None}]"
452,3861,"[13, 15, 16]","Eugene Police Commission Meeting July 10, 2014","Eugene Police Commission Meeting July 10, 2014",,0,,134.0,2017-07-16,2014-07-10,2017-07-18,vlNx8TX45eU,https://youtu.be/vlNx8TX45eU,45.0,Police Commission,1678.0,https://ompnetwork.s3-us-west-2.amazonaws.com/sites/134/documents/meeting_packet_july.pdf,"[{u'livestream': u'0', u'position': u'0', u'user_id': u'134', u'id': u'45', u'label': u'Police Commission'}]","[{u'user_id': u'134', u'type_id': u'1', u'url': u'https://ompnetwork.s3-us-west-2.amazonaws.com/sites/134/documents/meeting_packet_july.pdf', u'storage': u'attachment', u'session_id': u'3861', u'label': None, u'file_id': u'1837', u'provider': u'generic', u'agenda_provider_agenda_id': None, u'session_title': u'Eugene Police Commission Meeting July 10, 2014', u'type': u'Agenda', u'id': u'1678', u'agenda_provider_id': None}]"
453,631,"[3, 5, 17, 19]",City Council Work Session 02-13-2012,City Council Work Session 02-13-2012,,0,shows/city-council-work-session-02-13-2012,134.0,2012-02-13,2012-02-13,2017-03-20,t1iJaDbxZ8o,https://www.youtube.com/watch?v=t1iJaDbxZ8o,20.0,City Council,812.0,https://ompnetwork.s3-us-west-2.amazonaws.com/sites/134/documents/agenda_133.pdf,"[{u'livestream': u'1', u'position': u'-10', u'user_id': u'134', u'id': u'20', u'label': u'City Council'}]","[{u'user_id': u'134', u'type_id': u'1', u'url': u'https://ompnetwork.s3-us-west-2.amazonaws.com/sites/134/documents/agenda_133.pdf', u'storage': u'attachment', u'session_id': u'631', u'label': None, u'file_id': u'883', u'provider': u'generic', u'agenda_provider_agenda_id': None, u'session_title': u'City Council Work Session 02-13-2012', u'type': u'Agenda', u'id': u'812', u'agenda_provider_id': None}, {u'user_id': u'134', u'type_id': u'4', u'url': u'https://ompnetwork.s3-us-west-2.amazonaws.com/sites/134/documents/minutes_115_0.pdf', u'storage': u'attachment', u'session_id': u'631', u'label': None, u'file_id': u'884', u'provider': u'generic', u'agenda_provider_agenda_id': None, u'session_title': u'City Council Work Session 02-13-2012', u'type': u'Minutes', u'id': u'813', u'agenda_provider_id': None}]"
454,780,"[3, 5, 17]",Planning Commission  02-06-2012,Planning Commission  02-06-2012,,0,shows/planning-commission-02-06-2012,134.0,2012-02-06,2012-02-06,2017-03-20,g0VGjkpcbd8,https://www.youtube.com/watch?v=g0VGjkpcbd8,22.0,Planning Commission,1037.0,https://ompnetwork.s3-us-west-2.amazonaws.com/sites/134/documents/agenda_12_0.pdf,"[{u'livestream': u'1', u'position': u'-9', u'user_id': u'134', u'id': u'22', u'label': u'Planning Commission'}]","[{u'user_id': u'134', u'type_id': u'1', u'url': u'https://ompnetwork.s3-us-west-2.amazonaws.com/sites/134/documents/agenda_12_0.pdf', u'storage': u'attachment', u'session_id': u'780', u'label': None, u'file_id': u'1108', u'provider': u'generic', u'agenda_provider_agenda_id': None, u'session_title': u'Planning Commission  02-06-2012', u'type': u'Agenda', u'id': u'1037', u'agenda_provider_id': None}]"
455,451,"[12, 19]",Budget Committee 05-28-2013,Budget Committee 05-28-2013,,0,shows/budget-committee-05-28-2013,134.0,2013-05-28,2013-05-28,2017-03-20,faNkEHsEIe0,https://www.youtube.com/watch?v=faNkEHsEIe0,21.0,Budget Committee,529.0,https://ompnetwork.s3-us-west-2.amazonaws.com/sites/134/documents/agenda_packet_56_0.pdf,"[{u'livestream': u'1', u'position': u'-8', u'user_id': u'134', u'id': u'21', u'label': u'Budget Committee'}]","[{u'user_id': u'134', u'type_id': u'1', u'url': u'https://ompnetwork.s3-us-west-2.amazonaws.com/sites/134/documents/agenda_packet_56_0.pdf', u'storage': u'attachment', u'session_id': u'451', u'label': None, u'file_id': u'599', u'provider': u'generic', u'agenda_provider_agenda_id': None, u'session_title': u'Budget Committee 05-28-2013', u'type': u'Agenda', u'id': u'529', u'agenda_provider_id': None}, {u'user_id': u'134', u'type_id': u'4', u'url': u'https://ompnetwork.s3-us-west-2.amazonaws.com/sites/134/documents/minutes_141.pdf', u'storage': u'attachment', u'session_id': u'451', u'label': None, u'file_id': u'600', u'provider': u'generic', u'agenda_provider_agenda_id': None, u'session_title': u'Budget Committee 05-28-2013', u'type': u'Minutes', u'id': u'530', u'agenda_provider_id': None}]"
456,21881,"[4, 12, 13]","21st century policing solutions: November 28, 2017","21st century policing solutions: November 28, 2017",,0,,134.0,2018-01-05,2017-11-28,2018-01-05,IEFhUBfTr2Q,https://www.youtube.com/watch?v=IEFhUBfTr2Q&feature=youtu.be,45.0,Police Commission,,,"[{u'livestream': u'0', u'position': u'0', u'user_id': u'134', u'id': u'45', u'label': u'Police Commission'}]",
457,2524,"[0, 17, 18, 19]","Board of Commissioners Afternoon Meeting: February 10, 2015","Board of Commissioners Afternoon Meeting: February 10, 2015",,0,,143.0,2017-05-10,2015-02-10,2017-05-10,TbXOsvOtp68,https://www.youtube.com/watch?v=TbXOsvOtp68,25.0,Board of County Commissioners,,,"[{u'livestream': u'1', u'position': u'0', u'user_id': u'143', u'id': u'25', u'label': u'Board of County Commissioners'}]",
458,700,"[3, 8, 19]",Planning Commission  05-13-2013,Planning Commission  05-13-2013,,0,shows/planning-commission-05-13-2013,134.0,2013-05-13,2013-05-13,2017-03-20,s4VIWo_RIFw,https://www.youtube.com/watch?v=s4VIWo_RIFw,22.0,Planning Commission,918.0,https://ompnetwork.s3-us-west-2.amazonaws.com/sites/134/documents/agenda_packet_157_0.pdf,"[{u'livestream': u'1', u'position': u'-9', u'user_id': u'134', u'id': u'22', u'label': u'Planning Commission'}]","[{u'user_id': u'134', u'type_id': u'1', u'url': u'https://ompnetwork.s3-us-west-2.amazonaws.com/sites/134/documents/agenda_packet_157_0.pdf', u'storage': u'attachment', u'session_id': u'700', u'label': None, u'file_id': u'989', u'provider': u'generic', u'agenda_provider_agenda_id': None, u'session_title': u'Planning Commission  05-13-2013', u'type': u'Agenda', u'id': u'918', u'agenda_provider_id': None}]"
459,722,"[4, 12, 13, 14, 16]",City Council Meeting 06-13-2011,City Council Meeting 06-13-2011,,0,shows/city-council-meeting-06-13-2011,134.0,2011-06-13,2011-06-13,2017-03-20,W5bOmayHa4s,https://www.youtube.com/watch?v=W5bOmayHa4s,20.0,City Council,951.0,https://ompnetwork.s3-us-west-2.amazonaws.com/sites/134/documents/agenda_156.pdf,"[{u'livestream': u'1', u'position': u'-10', u'user_id': u'134', u'id': u'20', u'label': u'City Council'}]","[{u'user_id': u'134', u'type_id': u'1', u'url': u'https://ompnetwork.s3-us-west-2.amazonaws.com/sites/134/documents/agenda_156.pdf', u'storage': u'attachment', u'session_id': u'722', u'label': None, u'file_id': u'1022', u'provider': u'generic', u'agenda_provider_agenda_id': None, u'session_title': u'City Council Meeting 06-13-2011', u'type': u'Agenda', u'id': u'951', u'agenda_provider_id': None}, {u'user_id': u'134', u'type_id': u'4', u'url': u'https://ompnetwork.s3-us-west-2.amazonaws.com/sites/134/documents/minutes_214.pdf', u'storage': u'attachment', u'session_id': u'722', u'label': None, u'file_id': u'1023', u'provider': u'generic', u'agenda_provider_agenda_id': None, u'session_title': u'City Council Meeting 06-13-2011', u'type': u'Minutes', u'id': u'952', u'agenda_provider_id': None}]"
460,9901,"[6, 16, 19]",Licensing Authority - 7/8/2015,Licensing Authority - 7/8/2015,,0,,199.0,2015-07-08,2015-07-08,2017-08-02,PnfxR7pWj8k,https://www.youtube.com/watch?v=PnfxR7pWj8k,71.0,Licensing,3263.0,https://ompnetwork.s3-us-west-2.amazonaws.com/sites/199/documents/lla_agenda_07-08-2015.pdf?hXp6GJjyQiU0.K_4_F43pz7AqteoKAOc,"[{u'livestream': u'1', u'position': u'0', u'user_id': u'199', u'id': u'71', u'label': u'Licensing'}]","[{u'user_id': u'199', u'type_id': u'1', u'url': u'https://ompnetwork.s3-us-west-2.amazonaws.com/sites/199/documents/lla_agenda_07-08-2015.pdf?hXp6GJjyQiU0.K_4_F43pz7AqteoKAOc', u'storage': u'attachment', u'session_id': u'9901', u'label': None, u'file_id': u'2955', u'provider': u'generic', u'agenda_provider_agenda_id': None, u'session_title': u'Licensing Authority - 7/8/2015', u'type': u'Agenda', u'id': u'3263', u'agenda_provider_id': None}, {u'user_id': u'199', u'type_id': u'3', u'url': u'https://ompnetwork.s3-us-west-2.amazonaws.com/sites/199/granicus_files/1496_calendar_1436335200.pdf', u'storage': u'external', u'session_id': u'9901', u'label': None, u'file_id': None, u'provider': u'generic', u'agenda_provider_agenda_id': None, u'session_title': u'Licensing Authority - 7/8/2015', u'type': u'Calendar', u'id': u'3264', u'agenda_provider_id': None}, {u'user_id': u'199', u'type_id': u'2', u'url': u'https://ompnetwork.s3-us-west-2.amazonaws.com/sites/199/documents/lla_journal_07-08-2015.pdf?EGqXM6a1sl.kQeNg.Zz2_fSH_.e.VXso', u'storage': u'attachment', u'session_id': u'9901', u'label': None, u'file_id': u'2956', u'provider': u'generic', u'agenda_provider_agenda_id': None, u'session_title': u'Licensing Authority - 7/8/2015', u'type': u'Journal', u'id': u'3265', u'agenda_provider_id': None}, {u'user_id': u'199', u'type_id': u'5', u'url': u'https://ompnetwork.s3-us-west-2.amazonaws.com/sites/199/documents/lla_packet_07-08-2015.pdf?wmQRKKRhJSv4_llZEzu9jsnlxtKpOYRj', u'storage': u'attachment', u'session_id': u'9901', u'label': None, u'file_id': u'2957', u'provider': u'generic', u'agenda_provider_agenda_id': None, u'session_title': u'Licensing Authority - 7/8/2015', u'type': u'Packet', u'id': u'3266', u'agenda_provider_id': None}]"
461,15735,"[3, 5, 8]","BOCC Public Hearing, 10/17/2017","BOCC Public Hearing, 10/17/2017","<p>Apologies, only one camera available for this hearing.</p>
",0,,272.0,2017-10-26,2017-10-17,2017-10-30,ANZPGLBvWWc,https://www.youtube.com/watch?v=ANZPGLBvWWc,137.0,BOCC - Public Hearing,4226.0,https://ompnetwork.s3-us-west-2.amazonaws.com/sites/272/documents/10-17-17_study_session_agenda_with_supplemental_documents.pdf?wqmpMW9rMiRd6wVpDeO9RVpGMjLiPirq,"[{u'livestream': u'1', u'position': u'0', u'user_id': u'272', u'id': u'137', u'label': u'BOCC - Public Hearing'}]","[{u'user_id': u'272', u'type_id': u'1', u'url': u'https://ompnetwork.s3-us-west-2.amazonaws.com/sites/272/documents/10-17-17_study_session_agenda_with_supplemental_documents.pdf?wqmpMW9rMiRd6wVpDeO9RVpGMjLiPirq', u'storage': u'attachment', u'session_id': u'15735', u'label': None, u'file_id': u'3762', u'provider': u'generic', u'agenda_provider_agenda_id': None, u'session_title': u'BOCC Public Hearing, 10/17/2017', u'type': u'Agenda', u'id': u'4226', u'agenda_provider_id': None}]"
462,682,"[3, 5, 8]",City Council Work Session 09-28-2011,City Council Work Session 09-28-2011,,0,shows/city-council-work-session-09-28-2011,134.0,2011-09-28,2011-09-28,2017-03-20,ku8yhHKDMx4,https://www.youtube.com/watch?v=ku8yhHKDMx4,20.0,City Council,890.0,https://ompnetwork.s3-us-west-2.amazonaws.com/sites/134/documents/agenda_99.pdf,"[{u'livestream': u'1', u'position': u'-10', u'user_id': u'134', u'id': u'20', u'label': u'City Council'}]","[{u'user_id': u'134', u'type_id': u'1', u'url': u'https://ompnetwork.s3-us-west-2.amazonaws.com/sites/134/documents/agenda_99.pdf', u'storage': u'attachment', u'session_id': u'682', u'label': None, u'file_id': u'961', u'provider': u'generic', u'agenda_provider_agenda_id': None, u'session_title': u'City Council Work Session 09-28-2011', u'type': u'Agenda', u'id': u'890', u'agenda_provider_id': None}, {u'user_id': u'134', u'type_id': u'4', u'url': u'https://ompnetwork.s3-us-west-2.amazonaws.com/sites/134/documents/minutes_192_0.pdf', u'storage': u'attachment', u'session_id': u'682', u'label': None, u'file_id': u'962', u'provider': u'generic', u'agenda_provider_agenda_id': None, u'session_title': u'City Council Work Session 09-28-2011', u'type': u'Minutes', u'id': u'891', u'agenda_provider_id': None}]"
463,898,"[3, 16, 19]",City Council Work Session 02-08-2010,City Council Work Session 02-08-2010,,0,shows/city-council-work-session-02-08-2010,134.0,2010-02-08,2010-02-08,2017-03-20,KWfE77DZAX0,https://www.youtube.com/watch?v=KWfE77DZAX0,20.0,City Council,1241.0,https://ompnetwork.s3-us-west-2.amazonaws.com/sites/134/documents/agenda_256.pdf,"[{u'livestream': u'1', u'position': u'-10', u'user_id': u'134', u'id': u'20', u'label': u'City Council'}]","[{u'user_id': u'134', u'type_id': u'1', u'url': u'https://ompnetwork.s3-us-west-2.amazonaws.com/sites/134/documents/agenda_256.pdf', u'storage': u'attachment', u'session_id': u'898', u'label': None, u'file_id': u'1312', u'provider': u'generic', u'agenda_provider_agenda_id': None, u'session_title': u'City Council Work Session 02-08-2010', u'type': u'Agenda', u'id': u'1241', u'agenda_provider_id': None}, {u'user_id': u'134', u'type_id': u'4', u'url': u'https://ompnetwork.s3-us-west-2.amazonaws.com/sites/134/documents/minutes_315.pdf', u'storage': u'attachment', u'session_id': u'898', u'label': None, u'file_id': u'1313', u'provider': u'generic', u'agenda_provider_agenda_id': None, u'session_title': u'City Council Work Session 02-08-2010', u'type': u'Minutes', u'id': u'1242', u'agenda_provider_id': None}]"
464,3913,"[12, 13]","Eugene Police Commission Meeting December 13, 2012","Eugene Police Commission Meeting December 13, 2012",,0,,134.0,2017-07-17,2012-12-13,2017-07-20,87-IKznAwVo,https://youtu.be/87-IKznAwVo,45.0,Police Commission,1703.0,https://ompnetwork.s3-us-west-2.amazonaws.com/sites/134/documents/2012_12_13_pc_packet.pdf,"[{u'livestream': u'0', u'position': u'0', u'user_id': u'134', u'id': u'45', u'label': u'Police Commission'}]","[{u'user_id': u'134', u'type_id': u'1', u'url': u'https://ompnetwork.s3-us-west-2.amazonaws.com/sites/134/documents/2012_12_13_pc_packet.pdf', u'storage': u'attachment', u'session_id': u'3913', u'label': None, u'file_id': u'1864', u'provider': u'generic', u'agenda_provider_agenda_id': None, u'session_title': u'Eugene Police Commission Meeting December 13, 2012', u'type': u'Agenda', u'id': u'1703', u'agenda_provider_id': None}]"
465,2792,"[3, 5, 6, 7, 8, 10, 12, 13, 18]","Board of Commissioners Afternoon Meeting: March 14, 2017","Board of Commissioners Afternoon Meeting: March 14, 2017",,0,,143.0,2017-05-24,2017-03-14,2017-05-25,UlGG3SiJwzE,https://www.youtube.com/watch?v=UlGG3SiJwzE,25.0,Board of County Commissioners,1548.0,https://ompnetwork.s3-us-west-2.amazonaws.com/sites/143/documents/03_14-15_17agenda_0.pdf,"[{u'livestream': u'1', u'position': u'0', u'user_id': u'143', u'id': u'25', u'label': u'Board of County Commissioners'}]","[{u'user_id': u'143', u'type_id': u'1', u'url': u'https://ompnetwork.s3-us-west-2.amazonaws.com/sites/143/documents/03_14-15_17agenda_0.pdf', u'storage': u'attachment', u'session_id': u'2792', u'label': None, u'file_id': u'1705', u'provider': u'generic', u'agenda_provider_agenda_id': None, u'session_title': u'Board of Commissioners Afternoon Meeting: March 14, 2017', u'type': u'Agenda', u'id': u'1548', u'agenda_provider_id': None}]"
466,365,"[11, 19]",Budget Committee 04-29-2014,Budget Committee 04-29-2014,,0,shows/budget-committee-04-29-2014,134.0,2014-04-29,2014-04-29,2017-03-20,MumjxTaGdMM,https://www.youtube.com/watch?v=MumjxTaGdMM,21.0,Budget Committee,367.0,https://ompnetwork.s3-us-west-2.amazonaws.com/sites/134/documents/agenda_packet_29_0.pdf,"[{u'livestream': u'1', u'position': u'-8', u'user_id': u'134', u'id': u'21', u'label': u'Budget Committee'}]","[{u'user_id': u'134', u'type_id': u'1', u'url': u'https://ompnetwork.s3-us-west-2.amazonaws.com/sites/134/documents/agenda_packet_29_0.pdf', u'storage': u'attachment', u'session_id': u'365', u'label': None, u'file_id': u'437', u'provider': u'generic', u'agenda_provider_agenda_id': None, u'session_title': u'Budget Committee 04-29-2014', u'type': u'Agenda', u'id': u'367', u'agenda_provider_id': None}, {u'user_id': u'134', u'type_id': u'4', u'url': u'https://ompnetwork.s3-us-west-2.amazonaws.com/sites/134/documents/minutes_123_0.pdf', u'storage': u'attachment', u'session_id': u'365', u'label': None, u'file_id': u'438', u'provider': u'generic', u'agenda_provider_agenda_id': None, u'session_title': u'Budget Committee 04-29-2014', u'type': u'Minutes', u'id': u'368', u'agenda_provider_id': None}]"
467,532,"[3, 18]",City Council Meeting 09-24-2012,City Council Meeting 09-24-2012,,0,shows/city-council-meeting-09-24-2012,134.0,2012-09-24,2012-09-24,2017-03-20,5zAnambIpsw,https://www.youtube.com/watch?v=5zAnambIpsw,20.0,City Council,662.0,https://ompnetwork.s3-us-west-2.amazonaws.com/sites/134/documents/agenda_76.pdf,"[{u'livestream': u'1', u'position': u'-10', u'user_id': u'134', u'id': u'20', u'label': u'City Council'}]","[{u'user_id': u'134', u'type_id': u'1', u'url': u'https://ompnetwork.s3-us-west-2.amazonaws.com/sites/134/documents/agenda_76.pdf', u'storage': u'attachment', u'session_id': u'532', u'label': None, u'file_id': u'732', u'provider': u'generic', u'agenda_provider_agenda_id': None, u'session_title': u'City Council Meeting 09-24-2012', u'type': u'Agenda', u'id': u'662', u'agenda_provider_id': None}, {u'user_id': u'134', u'type_id': u'4', u'url': u'https://ompnetwork.s3-us-west-2.amazonaws.com/sites/134/documents/minutes_68_0.pdf', u'storage': u'attachment', u'session_id': u'532', u'label': None, u'file_id': u'733', u'provider': u'generic', u'agenda_provider_agenda_id': None, u'session_title': u'City Council Meeting 09-24-2012', u'type': u'Minutes', u'id': u'663', u'agenda_provider_id': None}]"
468,221,"[0, 9, 12, 18]",City Council Work Session 02-24-2016,City Council Work Session 02-24-2016,,0,shows/city-council-work-session-02-24-2016,134.0,2016-02-24,2016-02-24,2017-03-20,-wj7TMSYW4k,https://www.youtube.com/watch?v=-wj7TMSYW4k,20.0,City Council,99.0,https://ompnetwork.s3-us-west-2.amazonaws.com/sites/134/documents/agenda_packet_25.pdf,"[{u'livestream': u'1', u'position': u'-10', u'user_id': u'134', u'id': u'20', u'label': u'City Council'}]","[{u'user_id': u'134', u'type_id': u'1', u'url': u'https://ompnetwork.s3-us-west-2.amazonaws.com/sites/134/documents/agenda_packet_25.pdf', u'storage': u'attachment', u'session_id': u'221', u'label': None, u'file_id': u'169', u'provider': u'generic', u'agenda_provider_agenda_id': None, u'session_title': u'City Council Work Session 02-24-2016', u'type': u'Agenda', u'id': u'99', u'agenda_provider_id': None}, {u'user_id': u'134', u'type_id': u'4', u'url': u'https://ompnetwork.s3-us-west-2.amazonaws.com/sites/134/documents/minutes_11_0.pdf', u'storage': u'attachment', u'session_id': u'221', u'label': None, u'file_id': u'170', u'provider': u'generic', u'agenda_provider_agenda_id': None, u'session_title': u'City Council Work Session 02-24-2016', u'type': u'Minutes', u'id': u'100', u'agenda_provider_id': None}]"
469,479,"[4, 9, 11, 19]",City Council Work Session 02-04-2013,City Council Work Session 02-04-2013,,0,shows/city-council-work-session-02-04-2013,134.0,2013-02-04,2013-02-04,2017-03-20,9jkNoGbt-hI,https://www.youtube.com/watch?v=9jkNoGbt-hI,20.0,City Council,581.0,https://ompnetwork.s3-us-west-2.amazonaws.com/sites/134/documents/amended_agenda_0.pdf,"[{u'livestream': u'1', u'position': u'-10', u'user_id': u'134', u'id': u'20', u'label': u'City Council'}]","[{u'user_id': u'134', u'type_id': u'1', u'url': u'https://ompnetwork.s3-us-west-2.amazonaws.com/sites/134/documents/amended_agenda_0.pdf', u'storage': u'attachment', u'session_id': u'479', u'label': None, u'file_id': u'651', u'provider': u'generic', u'agenda_provider_agenda_id': None, u'session_title': u'City Council Work Session 02-04-2013', u'type': u'Agenda', u'id': u'581', u'agenda_provider_id': None}, {u'user_id': u'134', u'type_id': u'4', u'url': u'https://ompnetwork.s3-us-west-2.amazonaws.com/sites/134/documents/minutes_36_0.pdf', u'storage': u'attachment', u'session_id': u'479', u'label': None, u'file_id': u'652', u'provider': u'generic', u'agenda_provider_agenda_id': None, u'session_title': u'City Council Work Session 02-04-2013', u'type': u'Minutes', u'id': u'582', u'agenda_provider_id': None}]"
470,608,"[2, 3, 9, 13, 18]",City Council Meeting 03-12-2012,City Council Meeting 03-12-2012,,0,shows/city-council-meeting-03-12-2012,134.0,2012-03-12,2012-03-12,2017-03-20,D6YbU2CXxM4,https://www.youtube.com/watch?v=D6YbU2CXxM4,20.0,City Council,776.0,https://ompnetwork.s3-us-west-2.amazonaws.com/sites/134/documents/agenda_123.pdf,"[{u'livestream': u'1', u'position': u'-10', u'user_id': u'134', u'id': u'20', u'label': u'City Council'}]","[{u'user_id': u'134', u'type_id': u'1', u'url': u'https://ompnetwork.s3-us-west-2.amazonaws.com/sites/134/documents/agenda_123.pdf', u'storage': u'attachment', u'session_id': u'608', u'label': None, u'file_id': u'847', u'provider': u'generic', u'agenda_provider_agenda_id': None, u'session_title': u'City Council Meeting 03-12-2012', u'type': u'Agenda', u'id': u'776', u'agenda_provider_id': None}, {u'user_id': u'134', u'type_id': u'4', u'url': u'https://ompnetwork.s3-us-west-2.amazonaws.com/sites/134/documents/minutes_105_0.pdf', u'storage': u'attachment', u'session_id': u'608', u'label': None, u'file_id': u'848', u'provider': u'generic', u'agenda_provider_agenda_id': None, u'session_title': u'City Council Meeting 03-12-2012', u'type': u'Minutes', u'id': u'777', u'agenda_provider_id': None}]"
471,534,"[3, 8]",City Council Work Session 09-24-2012,City Council Work Session 09-24-2012,,0,shows/city-council-work-session-09-24-2012,134.0,2012-09-24,2012-09-24,2017-03-20,avz8YfHLUmE,https://www.youtube.com/watch?v=avz8YfHLUmE,20.0,City Council,665.0,https://ompnetwork.s3-us-west-2.amazonaws.com/sites/134/documents/agenda_77.pdf,"[{u'livestream': u'1', u'position': u'-10', u'user_id': u'134', u'id': u'20', u'label': u'City Council'}]","[{u'user_id': u'134', u'type_id': u'1', u'url': u'https://ompnetwork.s3-us-west-2.amazonaws.com/sites/134/documents/agenda_77.pdf', u'storage': u'attachment', u'session_id': u'534', u'label': None, u'file_id': u'735', u'provider': u'generic', u'agenda_provider_agenda_id': None, u'session_title': u'City Council Work Session 09-24-2012', u'type': u'Agenda', u'id': u'665', u'agenda_provider_id': None}, {u'user_id': u'134', u'type_id': u'4', u'url': u'https://ompnetwork.s3-us-west-2.amazonaws.com/sites/134/documents/minutes_69_0.pdf', u'storage': u'attachment', u'session_id': u'534', u'label': None, u'file_id': u'736', u'provider': u'generic', u'agenda_provider_agenda_id': None, u'session_title': u'City Council Work Session 09-24-2012', u'type': u'Minutes', u'id': u'666', u'agenda_provider_id': None}]"
472,3395,"[2, 11, 18]","Thornton360 - January 13, 2016","Thornton360 - January 13, 2016","<p>Thornton360 is produced by the city of Thornton after each city council meeting, recapping the latest meeting and keeping residents informed about important news, issues and events happening in our community.</p>

<p>www.cityofthornton.tv</p>
",0,,186.0,2016-01-13,2016-01-13,2017-07-11,XLDHuXhmKSg,https://www.youtube.com/watch?v=XLDHuXhmKSg,59.0,Thornton360,,,"[{u'livestream': u'0', u'position': u'-9', u'user_id': u'186', u'id': u'59', u'label': u'Thornton360'}]",
473,15006,"[0, 12, 18, 19]","Thornton City Council Meeting - September 26, 2017","Thornton City Council Meeting - September 26, 2017","To access the closed caption information associated with this video, click the CC icon in the lower right corner of the video player.

View more information on Thornton's City Council&nbsp;<a href=""http://www.cityofthornton.net/government/city-council/Pages/default.aspx"">here.</a>
",0,,186.0,2017-09-26,2017-09-26,2017-09-27,Jz0ufyNRoKU,https://www.youtube.com/watch?v=Jz0ufyNRoKU,58.0,City Council Meeting,4065.0,https://docs.google.com/document/d/e/2PACX-1vQC1LM1GgX8ZSETYajHlQEmwyePO0vOpv7kUJtsZs9i_qzh2Uao1o1X1AbjTrZw9CtIBx_d6Vyz9j37/pub,"[{u'livestream': u'1', u'position': u'-10', u'user_id': u'186', u'id': u'58', u'label': u'City Council Meeting'}]","[{u'user_id': u'186', u'type_id': u'1', u'url': u'https://docs.google.com/document/d/e/2PACX-1vQC1LM1GgX8ZSETYajHlQEmwyePO0vOpv7kUJtsZs9i_qzh2Uao1o1X1AbjTrZw9CtIBx_d6Vyz9j37/pub', u'storage': u'external', u'session_id': u'15006', u'label': None, u'file_id': None, u'provider': u'om_googledrive', u'agenda_provider_agenda_id': None, u'session_title': u'Thornton City Council Meeting - September 26, 2017', u'type': u'Agenda', u'id': u'4065', u'agenda_provider_id': None}]"
474,864,"[6, 16, 17]",Eugene City Council/EWEB Board JEO 06-07-2010,Eugene City Council/EWEB Board JEO 06-07-2010,,0,shows/eugene-city-councileweb-board-jeo-06-07-2010,134.0,2010-06-07,2010-06-07,2017-03-20,sBLm5cr40UI,https://www.youtube.com/watch?v=sBLm5cr40UI,20.0,City Council,1174.0,https://ompnetwork.s3-us-west-2.amazonaws.com/sites/134/documents/agenda_232.pdf,"[{u'livestream': u'1', u'position': u'-10', u'user_id': u'134', u'id': u'20', u'label': u'City Council'}]","[{u'user_id': u'134', u'type_id': u'1', u'url': u'https://ompnetwork.s3-us-west-2.amazonaws.com/sites/134/documents/agenda_232.pdf', u'storage': u'attachment', u'session_id': u'864', u'label': None, u'file_id': u'1245', u'provider': u'generic', u'agenda_provider_agenda_id': None, u'session_title': u'Eugene City Council/EWEB Board JEO 06-07-2010', u'type': u'Agenda', u'id': u'1174', u'agenda_provider_id': None}, {u'user_id': u'134', u'type_id': u'4', u'url': u'https://ompnetwork.s3-us-west-2.amazonaws.com/sites/134/documents/minutes_290.pdf', u'storage': u'attachment', u'session_id': u'864', u'label': None, u'file_id': u'1246', u'provider': u'generic', u'agenda_provider_agenda_id': None, u'session_title': u'Eugene City Council/EWEB Board JEO 06-07-2010', u'type': u'Minutes', u'id': u'1175', u'agenda_provider_id': None}]"
475,1235,"[13, 14, 16, 18]",Building a foundation for change,Building a foundation for change,,0,,142.0,2017-03-24,2017-03-24,2017-04-05,QzBn2ECOImA,https://youtube.com/watch?v=QzBn2ECOImA,24.0,City Council Meetings,1382.0,https://ompnetwork.s3-us-west-2.amazonaws.com/sites/142/documents/030617_sen_mon.pdf,"[{u'livestream': u'1', u'position': u'-10', u'user_id': u'142', u'id': u'24', u'label': u'City Council Meetings'}]","[{u'user_id': u'142', u'type_id': u'1', u'url': u'https://ompnetwork.s3-us-west-2.amazonaws.com/sites/142/documents/030617_sen_mon.pdf', u'storage': u'attachment', u'session_id': u'1235', u'label': None, u'file_id': u'1459', u'provider': u'generic', u'agenda_provider_agenda_id': None, u'session_title': u'Building a foundation for change', u'type': u'Agenda', u'id': u'1382', u'agenda_provider_id': None}]"
476,3852,[13],"Eugene Police Commission Meeting February 11, 2016","Eugene Police Commission Meeting February 11, 2016",,0,,134.0,2017-07-15,2016-02-11,2017-07-17,UbDKexhYcmA,https://youtu.be/UbDKexhYcmA,45.0,Police Commission,1659.0,https://ompnetwork.s3-us-west-2.amazonaws.com/sites/134/documents/2016_02_11_pc_rn3985.pdf,"[{u'livestream': u'0', u'position': u'0', u'user_id': u'134', u'id': u'45', u'label': u'Police Commission'}]","[{u'user_id': u'134', u'type_id': u'1', u'url': u'https://ompnetwork.s3-us-west-2.amazonaws.com/sites/134/documents/2016_02_11_pc_rn3985.pdf', u'storage': u'attachment', u'session_id': u'3852', u'label': None, u'file_id': u'1818', u'provider': u'generic', u'agenda_provider_agenda_id': None, u'session_title': u'Eugene Police Commission Meeting February 11, 2016', u'type': u'Agenda', u'id': u'1659', u'agenda_provider_id': None}]"
477,361,"[9, 18, 19]",City Council Work Session 04-30-2014,City Council Work Session 04-30-2014,,0,shows/city-council-work-session-04-30-2014,134.0,2014-04-30,2014-04-30,2017-03-20,LOCHT-s3LLY,https://www.youtube.com/watch?v=LOCHT-s3LLY,20.0,City Council,359.0,https://ompnetwork.s3-us-west-2.amazonaws.com/sites/134/documents/agenda_packet_143.pdf,"[{u'livestream': u'1', u'position': u'-10', u'user_id': u'134', u'id': u'20', u'label': u'City Council'}]","[{u'user_id': u'134', u'type_id': u'1', u'url': u'https://ompnetwork.s3-us-west-2.amazonaws.com/sites/134/documents/agenda_packet_143.pdf', u'storage': u'attachment', u'session_id': u'361', u'label': None, u'file_id': u'429', u'provider': u'generic', u'agenda_provider_agenda_id': None, u'session_title': u'City Council Work Session 04-30-2014', u'type': u'Agenda', u'id': u'359', u'agenda_provider_id': None}, {u'user_id': u'134', u'type_id': u'4', u'url': u'https://ompnetwork.s3-us-west-2.amazonaws.com/sites/134/documents/minutes_137.pdf', u'storage': u'attachment', u'session_id': u'361', u'label': None, u'file_id': u'430', u'provider': u'generic', u'agenda_provider_agenda_id': None, u'session_title': u'City Council Work Session 04-30-2014', u'type': u'Minutes', u'id': u'360', u'agenda_provider_id': None}]"
478,17013,"[11, 12, 15, 16, 18, 19]",BOCC Work Session - 01/21/14,BOCC Work Session - 01/21/14,,0,,273.0,2014-01-21,2014-01-21,2017-10-30,X6oAYh9vvs4,https://www.youtube.com/watch?v=X6oAYh9vvs4,147.0,2014,4363.0,https://ompnetwork.s3-us-west-2.amazonaws.com/sites/273/granicus_files/494_calendar_1390287600.html,"[{u'livestream': u'0', u'position': u'-6', u'user_id': u'273', u'id': u'147', u'label': u'2014'}]","[{u'user_id': u'273', u'type_id': u'3', u'url': u'https://ompnetwork.s3-us-west-2.amazonaws.com/sites/273/granicus_files/494_calendar_1390287600.html', u'storage': u'external', u'session_id': u'17013', u'label': None, u'file_id': None, u'provider': u'generic', u'agenda_provider_agenda_id': None, u'session_title': u'BOCC Work Session - 01/21/14', u'type': u'Calendar', u'id': u'4363', u'agenda_provider_id': None}]"
479,510,"[3, 5, 8, 11, 18]",Planning Commission 10-19-2015,Planning Commission 10-19-2015,,0,shows/planning-commission-10-19-2015,134.0,2015-10-19,2015-10-19,2017-03-20,zVWA4aS_Osg,https://www.youtube.com/watch?v=zVWA4aS_Osg,22.0,Planning Commission,627.0,https://ompnetwork.s3-us-west-2.amazonaws.com/sites/134/documents/agenda_packet_55.pdf,"[{u'livestream': u'1', u'position': u'-9', u'user_id': u'134', u'id': u'22', u'label': u'Planning Commission'}]","[{u'user_id': u'134', u'type_id': u'1', u'url': u'https://ompnetwork.s3-us-west-2.amazonaws.com/sites/134/documents/agenda_packet_55.pdf', u'storage': u'attachment', u'session_id': u'510', u'label': None, u'file_id': u'697', u'provider': u'generic', u'agenda_provider_agenda_id': None, u'session_title': u'Planning Commission 10-19-2015', u'type': u'Agenda', u'id': u'627', u'agenda_provider_id': None}]"
480,21718,"[5, 6, 7]",Town of New Castle Planning Board Meeting 12/19/17,Town of New Castle Planning Board Meeting 12/19/17,,0,,281.0,2017-12-20,2017-12-19,2017-12-22,aYFClm26hk4,https://youtu.be/aYFClm26hk4,160.0,Town of New Castle Planning Board Meetings,4879.0,https://ompnetwork.s3-us-west-2.amazonaws.com/sites/281/documents/agendas_-_planning_board_agendas_-_2017_-_12.19.17_pb_agenda.pdf?X_5_i0N71flH8uyRE96vHHc7q1MMV602,"[{u'livestream': u'0', u'position': u'-8', u'user_id': u'281', u'id': u'160', u'label': u'Town of New Castle Planning Board Meetings'}]","[{u'user_id': u'281', u'type_id': u'1', u'url': u'https://ompnetwork.s3-us-west-2.amazonaws.com/sites/281/documents/agendas_-_planning_board_agendas_-_2017_-_12.19.17_pb_agenda.pdf?X_5_i0N71flH8uyRE96vHHc7q1MMV602', u'storage': u'attachment', u'session_id': u'21718', u'label': None, u'file_id': u'4257', u'provider': u'generic', u'agenda_provider_agenda_id': None, u'session_title': u'Town of New Castle Planning Board Meeting 12/19/17', u'type': u'Agenda', u'id': u'4879', u'agenda_provider_id': None}]"
481,202,"[3, 11, 18, 19]",City Council Work Session 05-25-2016,City Council Work Session 05-25-2016,,0,shows/city-council-work-session-05-25-2016,134.0,2016-05-25,2016-05-25,2017-03-20,WJaJuhn_maA,https://www.youtube.com/watch?v=WJaJuhn_maA,20.0,City Council,62.0,https://ompnetwork.s3-us-west-2.amazonaws.com/sites/134/documents/agenda_packet_4.pdf,"[{u'livestream': u'1', u'position': u'-10', u'user_id': u'134', u'id': u'20', u'label': u'City Council'}]","[{u'user_id': u'134', u'type_id': u'1', u'url': u'https://ompnetwork.s3-us-west-2.amazonaws.com/sites/134/documents/agenda_packet_4.pdf', u'storage': u'attachment', u'session_id': u'202', u'label': None, u'file_id': u'132', u'provider': u'generic', u'agenda_provider_agenda_id': None, u'session_title': u'City Council Work Session 05-25-2016', u'type': u'Agenda', u'id': u'62', u'agenda_provider_id': None}, {u'user_id': u'134', u'type_id': u'4', u'url': u'https://ompnetwork.s3-us-west-2.amazonaws.com/sites/134/documents/minutes_0_1.pdf', u'storage': u'attachment', u'session_id': u'202', u'label': None, u'file_id': u'133', u'provider': u'generic', u'agenda_provider_agenda_id': None, u'session_title': u'City Council Work Session 05-25-2016', u'type': u'Minutes', u'id': u'63', u'agenda_provider_id': None}]"
482,8414,"[3, 11, 16]",Planning Board  - 05/13/13,Planning Board  - 05/13/13,,0,,199.0,2013-05-13,2013-05-13,2017-08-01,3edjv8eFY5k,https://www.youtube.com/watch?v=3edjv8eFY5k,70.0,Planning,2711.0,https://ompnetwork.s3-us-west-2.amazonaws.com/sites/199/granicus_files/1056_calendar_1368424800.html,"[{u'livestream': u'1', u'position': u'0', u'user_id': u'199', u'id': u'70', u'label': u'Planning'}]","[{u'user_id': u'199', u'type_id': u'3', u'url': u'https://ompnetwork.s3-us-west-2.amazonaws.com/sites/199/granicus_files/1056_calendar_1368424800.html', u'storage': u'external', u'session_id': u'8414', u'label': None, u'file_id': None, u'provider': u'generic', u'agenda_provider_agenda_id': None, u'session_title': u'Planning Board  - 05/13/13', u'type': u'Calendar', u'id': u'2711', u'agenda_provider_id': None}]"
483,517,"[3, 6, 7, 17]",Planning Commission 07-27-2015,Planning Commission 07-27-2015,,0,shows/planning-commission-07-27-2015,134.0,2015-07-27,2015-07-27,2017-03-20,SbRQdO09KN0,https://www.youtube.com/watch?v=SbRQdO09KN0,22.0,Planning Commission,637.0,https://ompnetwork.s3-us-west-2.amazonaws.com/sites/134/documents/agenda_packet_85_0.pdf,"[{u'livestream': u'1', u'position': u'-9', u'user_id': u'134', u'id': u'22', u'label': u'Planning Commission'}]","[{u'user_id': u'134', u'type_id': u'1', u'url': u'https://ompnetwork.s3-us-west-2.amazonaws.com/sites/134/documents/agenda_packet_85_0.pdf', u'storage': u'attachment', u'session_id': u'517', u'label': None, u'file_id': u'707', u'provider': u'generic', u'agenda_provider_agenda_id': None, u'session_title': u'Planning Commission 07-27-2015', u'type': u'Agenda', u'id': u'637', u'agenda_provider_id': None}]"
484,3413,"[2, 3, 5, 8, 11, 14]",Mayor Heidi Williams Comprehensive Report on the City of Thornton,Mayor Heidi Williams Comprehensive Report on the City of Thornton,"<p>At the 2016 Business Appreciation Awards and Recognition Event held on April 21, 2016 by the city of Thornton and our Economic Development Department, Mayor Heidi Williams gave a comprehensive report on the city of Thornton.</p>

<p>To see the entire 2016 Business Appreciation Awards and Recognition Event <a href=""http://thornton.ompnetwork.org/shows/business-appreciation-awards-and-recognition-event-2016"">click here.</a></p>
",0,,186.0,2016-04-21,2016-04-21,2017-07-11,LZA8O0rEieY,https://www.youtube.com/watch?v=LZA8O0rEieY,60.0,Local Interest,,,"[{u'livestream': u'0', u'position': u'-8', u'user_id': u'186', u'id': u'60', u'label': u'Local Interest'}]",
485,218,"[9, 11, 12, 15]",City Council and URA Meeting 03-14-2016,City Council and URA Meeting 03-14-2016,,0,shows/city-council-and-ura-meeting-03-14-2016,134.0,2016-03-14,2016-03-14,2017-03-20,OsoVmQQe7Sc,https://www.youtube.com/watch?v=OsoVmQQe7Sc,20.0,City Council,93.0,https://ompnetwork.s3-us-west-2.amazonaws.com/sites/134/documents/agenda_packet_19.pdf,"[{u'livestream': u'1', u'position': u'-10', u'user_id': u'134', u'id': u'20', u'label': u'City Council'}]","[{u'user_id': u'134', u'type_id': u'1', u'url': u'https://ompnetwork.s3-us-west-2.amazonaws.com/sites/134/documents/agenda_packet_19.pdf', u'storage': u'attachment', u'session_id': u'218', u'label': None, u'file_id': u'163', u'provider': u'generic', u'agenda_provider_agenda_id': None, u'session_title': u'City Council and URA Meeting 03-14-2016', u'type': u'Agenda', u'id': u'93', u'agenda_provider_id': None}, {u'user_id': u'134', u'type_id': u'4', u'url': u'https://ompnetwork.s3-us-west-2.amazonaws.com/sites/134/documents/minutes_8_0.pdf', u'storage': u'attachment', u'session_id': u'218', u'label': None, u'file_id': u'164', u'provider': u'generic', u'agenda_provider_agenda_id': None, u'session_title': u'City Council and URA Meeting 03-14-2016', u'type': u'Minutes', u'id': u'94', u'agenda_provider_id': None}]"
486,19397,"[0, 17]",BOCC Work Session 6/13/17,BOCC Work Session 6/13/17,,0,,273.0,2017-06-12,2017-06-12,2017-10-31,7Us_pxLKaLM,https://www.youtube.com/watch?v=7Us_pxLKaLM,150.0,2017,4646.0,https://ompnetwork.s3-us-west-2.amazonaws.com/sites/273/documents/open_media_june_13_0.pdf?FOCLh9dFI7jfSvTy_Peso9pPCyBRAb4j,"[{u'livestream': u'0', u'position': u'-9', u'user_id': u'273', u'id': u'150', u'label': u'2017'}]","[{u'user_id': u'273', u'type_id': u'1', u'url': u'https://ompnetwork.s3-us-west-2.amazonaws.com/sites/273/documents/open_media_june_13_0.pdf?FOCLh9dFI7jfSvTy_Peso9pPCyBRAb4j', u'storage': u'attachment', u'session_id': u'19397', u'label': None, u'file_id': u'3927', u'provider': u'generic', u'agenda_provider_agenda_id': None, u'session_title': u'BOCC Work Session 6/13/17', u'type': u'Agenda', u'id': u'4646', u'agenda_provider_id': None}]"
487,242,"[1, 12, 16, 18]",City Council Work Session 11-23-2015,City Council Work Session 11-23-2015,,0,shows/city-council-work-session-11-23-2015,134.0,2015-11-23,2015-11-23,2017-03-20,U2sY2xOvk3w,https://www.youtube.com/watch?v=U2sY2xOvk3w,20.0,City Council,137.0,https://ompnetwork.s3-us-west-2.amazonaws.com/sites/134/documents/agenda_packet_7.pdf,"[{u'livestream': u'1', u'position': u'-10', u'user_id': u'134', u'id': u'20', u'label': u'City Council'}]","[{u'user_id': u'134', u'type_id': u'1', u'url': u'https://ompnetwork.s3-us-west-2.amazonaws.com/sites/134/documents/agenda_packet_7.pdf', u'storage': u'attachment', u'session_id': u'242', u'label': None, u'file_id': u'207', u'provider': u'generic', u'agenda_provider_agenda_id': None, u'session_title': u'City Council Work Session 11-23-2015', u'type': u'Agenda', u'id': u'137', u'agenda_provider_id': None}, {u'user_id': u'134', u'type_id': u'4', u'url': u'https://ompnetwork.s3-us-west-2.amazonaws.com/sites/134/documents/minutes_25.pdf', u'storage': u'attachment', u'session_id': u'242', u'label': None, u'file_id': u'208', u'provider': u'generic', u'agenda_provider_agenda_id': None, u'session_title': u'City Council Work Session 11-23-2015', u'type': u'Minutes', u'id': u'138', u'agenda_provider_id': None}]"
488,724,"[2, 7, 13]",City Council Work Session 06-13-2011,City Council Work Session 06-13-2011,,0,shows/city-council-work-session-06-13-2011,134.0,2011-06-13,2011-06-13,2017-03-20,nqcoBoB--bQ,https://www.youtube.com/watch?v=nqcoBoB--bQ,20.0,City Council,954.0,https://ompnetwork.s3-us-west-2.amazonaws.com/sites/134/documents/agenda_157.pdf,"[{u'livestream': u'1', u'position': u'-10', u'user_id': u'134', u'id': u'20', u'label': u'City Council'}]","[{u'user_id': u'134', u'type_id': u'1', u'url': u'https://ompnetwork.s3-us-west-2.amazonaws.com/sites/134/documents/agenda_157.pdf', u'storage': u'attachment', u'session_id': u'724', u'label': None, u'file_id': u'1025', u'provider': u'generic', u'agenda_provider_agenda_id': None, u'session_title': u'City Council Work Session 06-13-2011', u'type': u'Agenda', u'id': u'954', u'agenda_provider_id': None}, {u'user_id': u'134', u'type_id': u'4', u'url': u'https://ompnetwork.s3-us-west-2.amazonaws.com/sites/134/documents/minutes_215.pdf', u'storage': u'attachment', u'session_id': u'724', u'label': None, u'file_id': u'1026', u'provider': u'generic', u'agenda_provider_agenda_id': None, u'session_title': u'City Council Work Session 06-13-2011', u'type': u'Minutes', u'id': u'955', u'agenda_provider_id': None}]"
